{"dept": "교육학과", "detail": "대학원", "title": "◈ 대학원 지도교수 교체 신청서(서식)", "date": "2025-12-22", "url": "https://home.knu.ac.kr/HOME/edu/sub.htm?mode=view&mv_data=aWR4PTE0NTkmc3RhcnRQYWdlPTAmbGlzdE5vPTgyMSZ0YWJsZT1leF9iYnNfZGF0YV9lZHUmbmF2X2NvZGU9ZWR1MTYyMjE4MTUyMSZjb2RlPVp3S0pYZk5pZW96byZzZWFyY2hfaXRlbT0mc2VhcmNoX29yZGVyPSZvcmRlcl9saXN0PSZsaXN0X3NjYWxlPSZ2aWV3X2xldmVsPSZ2aWV3X2NhdGU9JnZpZXdfY2F0ZTI9", "content": "◈ 대학원 지도교수 교체 신청서(서식)\n등록일\n2025-12-22\n작성자\n교육학과\n조회수\n90\n- 신청방법: 변경 전, 후 지도교수 날인 후 학과 사무실로 제출\n- 신청기한: 상시\n대학원 지도교수 교체 신청서(서식).hwp", "images": [], "attachments": [{"name": "대학원 지도교수 교체 신청서(서식).hwp", "url": "https://home.knu.ac.kr/HOME/bbs/bbs_download.php?mv_data=aWR4PTE0NTkmc3RhcnRQYWdlPTAmbGlzdE5vPTgyMSZ0YWJsZT1leF9iYnNfZGF0YV9lZHUmbmF2X2NvZGU9ZWR1MTYyMjE4MTUyMSZzaXRlX2NvZGU9ZWR1JmNvZGU9WndLSlhmTmllb3pvJnNlYXJjaF9pdGVtPSZzZWFyY2hfb3JkZXI9Jm9yZGVyX2xpc3Q9Jmxpc3Rfc2NhbGU9&download=h&seq=0"}]}
{"dept": "교육학과", "detail": "대학원", "title": "◈ 2026학년도 학사력 안내", "date": "2025-12-18", "url": "https://home.knu.ac.kr/HOME/edu/sub.htm?mode=view&mv_data=aWR4PTE0NTMmc3RhcnRQYWdlPTAmbGlzdE5vPTgyMSZ0YWJsZT1leF9iYnNfZGF0YV9lZHUmbmF2X2NvZGU9ZWR1MTYyMjE4MTUyMSZjb2RlPVp3S0pYZk5pZW96byZzZWFyY2hfaXRlbT0mc2VhcmNoX29yZGVyPSZvcmRlcl9saXN0PSZsaXN0X3NjYWxlPSZ2aWV3X2xldmVsPSZ2aWV3X2NhdGU9JnZpZXdfY2F0ZTI9", "content": "◈ 2026학년도 학사력 안내\n등록일\n2025-12-18\n작성자\n교육학과\n조회수\n185\n대학원 관련은 우측칸 확인\n첨부파일중 PDF미리보기\n파일 열람을 위해서는 아크로뱃 리더 설치가 필요합니다. 아래 링크를 클릭하여 리더를 다운로드 받으세요.\n2026학년도 학사력.pdf", "images": ["http://www.adobe.com/images/shared/download_buttons/get_adobe_reader.png"], "attachments": [{"name": "2026학년도 학사력.pdf", "url": "https://home.knu.ac.kr/HOME/bbs/bbs_download.php?mv_data=aWR4PTE0NTMmc3RhcnRQYWdlPTAmbGlzdE5vPTgyMSZ0YWJsZT1leF9iYnNfZGF0YV9lZHUmbmF2X2NvZGU9ZWR1MTYyMjE4MTUyMSZzaXRlX2NvZGU9ZWR1JmNvZGU9WndLSlhmTmllb3pvJnNlYXJjaF9pdGVtPSZzZWFyY2hfb3JkZXI9Jm9yZGVyX2xpc3Q9Jmxpc3Rfc2NhbGU9&download=h&seq=0"}]}
{"dept": "교육학과", "detail": "대학원", "title": "◈ 청강생 신청 및 등록 방법 안내", "date": "2025-09-02", "url": "https://home.knu.ac.kr/HOME/edu/sub.htm?mode=view&mv_data=aWR4PTEzOTQmc3RhcnRQYWdlPTAmbGlzdE5vPTgyMSZ0YWJsZT1leF9iYnNfZGF0YV9lZHUmbmF2X2NvZGU9ZWR1MTYyMjE4MTUyMSZjb2RlPVp3S0pYZk5pZW96byZzZWFyY2hfaXRlbT0mc2VhcmNoX29yZGVyPSZvcmRlcl9saXN0PSZsaXN0X3NjYWxlPSZ2aWV3X2xldmVsPSZ2aWV3X2NhdGU9JnZpZXdfY2F0ZTI9", "content": "◈ 청강생 신청 및 등록 방법 안내\n등록일\n2025-09-02\n작성자\n교육학과\n조회수\n257\n청강을 희망하시는 경우 해당 과목 교수님께 연락하셔서 승인을 받으시면 교수님이 담당 과목에 직접 수강생 추가\n(학번 입력 필요)가 가능합니다.\n이 경우\n별도의 수강신청 절차가 필요하지 않습니다.\n첨부파일중 PDF미리보기\n파일 열람을 위해서는 아크로뱃 리더 설치가 필요합니다. 아래 링크를 클릭하여 리더를 다운로드 받으세요.\n청강생 등록 매뉴얼.pdf", "images": ["http://www.adobe.com/images/shared/download_buttons/get_adobe_reader.png"], "attachments": [{"name": "청강생 등록 매뉴얼.pdf", "url": "https://home.knu.ac.kr/HOME/bbs/bbs_download.php?mv_data=aWR4PTEzOTQmc3RhcnRQYWdlPTAmbGlzdE5vPTgyMSZ0YWJsZT1leF9iYnNfZGF0YV9lZHUmbmF2X2NvZGU9ZWR1MTYyMjE4MTUyMSZzaXRlX2NvZGU9ZWR1JmNvZGU9WndLSlhmTmllb3pvJnNlYXJjaF9pdGVtPSZzZWFyY2hfb3JkZXI9Jm9yZGVyX2xpc3Q9Jmxpc3Rfc2NhbGU9&download=h&seq=0"}]}
{"dept": "교육학과", "detail": "대학원", "title": "◈ 교직과목(교직소양) 세부 이수 기준 변경 안내", "date": "2024-07-15", "url": "https://home.knu.ac.kr/HOME/edu/sub.htm?mode=view&mv_data=aWR4PTExNzcmc3RhcnRQYWdlPTAmbGlzdE5vPTgyMSZ0YWJsZT1leF9iYnNfZGF0YV9lZHUmbmF2X2NvZGU9ZWR1MTYyMjE4MTUyMSZjb2RlPVp3S0pYZk5pZW96byZzZWFyY2hfaXRlbT0mc2VhcmNoX29yZGVyPSZvcmRlcl9saXN0PSZsaXN0X3NjYWxlPSZ2aWV3X2xldmVsPSZ2aWV3X2NhdGU9JnZpZXdfY2F0ZTI9", "content": "◈ 교직과목(교직소양) 세부 이수 기준 변경 안내\n등록일\n2024-07-15\n작성자\n교육학과\n조회수\n777\n교원자격 취득(양성과정)을 위한 교직과목(교직소양) 세부 이수 기준이 붙임과 같이 변경\n되었으니\n아래의 내용을 반드시 인지하여 수강 신청하여 주시기 바랍니다.\n가. 변경 내용\n1) 교직과목 중 교직소양 영역에 '디지털 교육', '교직실무 1'(1학점) 과목을 추가\n2) 기존 '교직실무'(2학점) 강좌명을 '교직실무 2'(2학점)로 변경\n나. 교직소양 이수 세부 기준\n1)\n기준연도 2023년도 이전(23학번 이전)\n: 특수교육학개론(2학점) + 생활지도및상담(2학점) + 교직실무 2(2학점)\n-> 총 6학점 이수 필수 (** '교직실무 1'(1학점) 이수 시, 이수 인정되지 않으니 반드시 '교직실무 2'(2학점) 이수할 것)\n2)\n기준연도 2024년도 이후(24학번 이후)\n: 특수교육학개론(2학점) + 생활지도및상담(2학점) + 교직실무 1(1학점) + 디지털 교육(1학점)\n-> 총 6학점 이수 필수\n* 본인의 기준연도 확인: 차세대 통합정보시스템(knuin.knu.ac.kr) - 학사행정 - 학적 - 학정정보관리 - 학적기본사항관리 - 학적변동 - 교직선발 정보 - '기준년도'\n* '교직실무 1'은 기준연도 2024년도 이후 교직이수예정자부터 이수 가능하며, 이전 기준연도 이수예정자의 경우 이수 불가능\n* 문의: 교육학과 사무실(053-950-5806)\n첨부파일중 PDF미리보기\n파일 열람을 위해서는 아크로뱃 리더 설치가 필요합니다. 아래 링크를 클릭하여 리더를 다운로드 받으세요.\n교직과목 세부 이수 기준 변경 안내(240429).pdf", "images": ["http://www.adobe.com/images/shared/download_buttons/get_adobe_reader.png"], "attachments": [{"name": "교직과목 세부 이수 기준 변경 안내(240429).pdf", "url": "https://home.knu.ac.kr/HOME/bbs/bbs_download.php?mv_data=aWR4PTExNzcmc3RhcnRQYWdlPTAmbGlzdE5vPTgyMSZ0YWJsZT1leF9iYnNfZGF0YV9lZHUmbmF2X2NvZGU9ZWR1MTYyMjE4MTUyMSZzaXRlX2NvZGU9ZWR1JmNvZGU9WndLSlhmTmllb3pvJnNlYXJjaF9pdGVtPSZzZWFyY2hfb3JkZXI9Jm9yZGVyX2xpc3Q9Jmxpc3Rfc2NhbGU9&download=h&seq=0"}]}
{"dept": "교육학과", "detail": "대학원", "title": "◈ 정기주차권 등록 신청 안내", "date": "2022-08-22", "url": "https://home.knu.ac.kr/HOME/edu/sub.htm?mode=view&mv_data=aWR4PTk0MyZzdGFydFBhZ2U9MCZsaXN0Tm89ODIxJnRhYmxlPWV4X2Jic19kYXRhX2VkdSZuYXZfY29kZT1lZHUxNjIyMTgxNTIxJmNvZGU9WndLSlhmTmllb3pvJnNlYXJjaF9pdGVtPSZzZWFyY2hfb3JkZXI9Jm9yZGVyX2xpc3Q9Jmxpc3Rfc2NhbGU9JnZpZXdfbGV2ZWw9JnZpZXdfY2F0ZT0mdmlld19jYXRlMj0=", "content": "◈ 정기주차권 등록 신청 안내\n등록일\n2022-08-22\n작성자\n교육학과\n조회수\n2378\n가\n.\n신규 신청방법\n(\n온라인신청\n)\n1)\n학생\n(\n대학원생\n):\n차세대통합정보시스템\n(\nhttp\ns://knuin.knu.ac.kr\n)\n로그인\n:\n일반행정\n→\n주차\n⟶\n정기주차권\n(\n사용자\n)\n→\n정기주차권신청\n(\n신규\n)\n→\n신규신청\n→\n신청정보입력\n→\n파일추가\n(\n증빙파일 업로드\n)\n→\n전송\n→\n저장\n→\n진행상태\n:\n대기\n→\n승인\n→\n결제\n→\n카드결제\n※\n카드결제 후 반영됨\n.\n2)\n증빙서류\n(\n증빙파일 업로드\n)\n(1)\n자동차등록증 사본\n1\n부\n(\n공통\n)\n(2)\n공적 증빙서류\n(\n본인 명의차량 이외 등록자에 한함\n) 1\n부\n※\n주민등록등본\n,\n가족관계증명서 등\n나\n.\n기간연장 신청방법\n1)\n학생\n(\n대학원생\n):\n차세대통합정보시스템\n(\nhttp\ns://knuin.knu.ac.kr\n)\n로그인\n:\n일반행정\n→\n주차\n→\n정기주차권\n(\n사용자\n)\n⟶\n정기주차권신청\n(\n연장\n)\n⟶\n조회\n⟶\n하단의 연장탭에서 연장신청\n→\n선택\n(\n신청개월수\n)\n→\n카드결제\n※\n카드결제 후 반영됨\n.\n다.\n홈페이지\n→「\n대학소개\n」→「\n캠퍼스안내\n」→「\n주차안내\n」\n에 탑재되어 있으니 참고하시기 바랍니다\n.", "images": [], "attachments": []}
{"dept": "교육학과", "detail": "대학원", "title": "◈ 상담실습실 예약 방법 안내", "date": "2022-03-04", "url": "https://home.knu.ac.kr/HOME/edu/sub.htm?mode=view&mv_data=aWR4PTg0MyZzdGFydFBhZ2U9MCZsaXN0Tm89ODIxJnRhYmxlPWV4X2Jic19kYXRhX2VkdSZuYXZfY29kZT1lZHUxNjIyMTgxNTIxJmNvZGU9WndLSlhmTmllb3pvJnNlYXJjaF9pdGVtPSZzZWFyY2hfb3JkZXI9Jm9yZGVyX2xpc3Q9Jmxpc3Rfc2NhbGU9JnZpZXdfbGV2ZWw9JnZpZXdfY2F0ZT0mdmlld19jYXRlMj0=", "content": "◈ 상담실습실 예약 방법 안내\n등록일\n2022-03-04\n작성자\n교육학과\n조회수\n3695\n<상담실습실 사용 예약 안내>\n1. 사용 대상자: 일반대학원 및 교육대학원 상담심리전공 대학원생\n2. 사용방법:\n아래\n구글시트 주소\n를 통해\n예약 내용 작성\n(※\n반드시\n이름\n,\n사용 일자\n기입)\n<\n예약 링크\n>\n※크롬으로 접속 바랍니다.\nhttps://docs.google.com/spreadsheets/d/1hKZpwJx1T5tmhlGHOyVIlPU9yOX_uUQoDtJ5oDMT7VA/edit?usp=sharing\n3. 사용 규칙\n**최근 사용 후 사용내역 삭제를 안 하시는 분이 너무 많습니다.\n반드시 사용 규칙을 지켜주세요**\n1)\n사용 후\n반드시 구글시트에서 본인의\n예약 내용 삭제\n(※ 예약 내용 미삭제 등 규칙 미준수 시\n상담실습실 사용에 제한\n을 받을 수 있음)\n2)\n사용 후\n반드시\n뒷정리\n후 퇴실\n3)\n퇴실 시\n반드시\n도어락 잠금 확인\n4. 상담실습실 현황:\n교육대학원 212호,\n우당교육관 111호(집단상담실),\n우당교육관 113호\n(※ 전 상담실습실 도어락 번호: 5806*) -\n도어락 번호 변경 및 조작\n절대금지\n※\n예약 예시\n(3\n월\n4\n일\n,\n월\n9\n시\n~10\n시\n,\n우당교육관\n113\n호 예약을 원하는 경우\n)\n문의: 교육학과 사무실 (053-950-5806)\n강의실 내부 사진002.jpg\n예약방법.jpg\n강의실 내부 사진001.jpg", "images": ["https://home.knu.ac.kr/HOME/edu/data/bbsData/d69064k35wr8ibbkk513642a3a69a4f9b.0", "https://home.knu.ac.kr/HOME/edu/data/bbsData/883u94vubk93qi178w986323d4bd9d2b2.0", "https://home.knu.ac.kr/HOME/edu/data/bbsData/4ni50t855620n2razuym6323d53112c33.0"], "attachments": [{"name": "강의실 내부 사진002.jpg", "url": "https://home.knu.ac.kr/HOME/bbs/bbs_download.php?mv_data=aWR4PTg0MyZzdGFydFBhZ2U9MCZsaXN0Tm89ODIxJnRhYmxlPWV4X2Jic19kYXRhX2VkdSZuYXZfY29kZT1lZHUxNjIyMTgxNTIxJnNpdGVfY29kZT1lZHUmY29kZT1ad0tKWGZOaWVvem8mc2VhcmNoX2l0ZW09JnNlYXJjaF9vcmRlcj0mb3JkZXJfbGlzdD0mbGlzdF9zY2FsZT0=&download=h&seq=0"}, {"name": "예약방법.jpg", "url": "https://home.knu.ac.kr/HOME/bbs/bbs_download.php?mv_data=aWR4PTg0MyZzdGFydFBhZ2U9MCZsaXN0Tm89ODIxJnRhYmxlPWV4X2Jic19kYXRhX2VkdSZuYXZfY29kZT1lZHUxNjIyMTgxNTIxJnNpdGVfY29kZT1lZHUmY29kZT1ad0tKWGZOaWVvem8mc2VhcmNoX2l0ZW09JnNlYXJjaF9vcmRlcj0mb3JkZXJfbGlzdD0mbGlzdF9zY2FsZT0=&download=h&seq=1"}, {"name": "강의실 내부 사진001.jpg", "url": "https://home.knu.ac.kr/HOME/bbs/bbs_download.php?mv_data=aWR4PTg0MyZzdGFydFBhZ2U9MCZsaXN0Tm89ODIxJnRhYmxlPWV4X2Jic19kYXRhX2VkdSZuYXZfY29kZT1lZHUxNjIyMTgxNTIxJnNpdGVfY29kZT1lZHUmY29kZT1ad0tKWGZOaWVvem8mc2VhcmNoX2l0ZW09JnNlYXJjaF9vcmRlcj0mb3JkZXJfbGlzdD0mbGlzdF9zY2FsZT0=&download=h&seq=2"}]}
{"dept": "교육학과", "detail": "대학원", "title": "◈ 대학원 연구실 사용 및 졸업생/수료생/휴학생 건물 출입 신청 안내", "date": "2022-03-03", "url": "https://home.knu.ac.kr/HOME/edu/sub.htm?mode=view&mv_data=aWR4PTg0MCZzdGFydFBhZ2U9MCZsaXN0Tm89ODIxJnRhYmxlPWV4X2Jic19kYXRhX2VkdSZuYXZfY29kZT1lZHUxNjIyMTgxNTIxJmNvZGU9WndLSlhmTmllb3pvJnNlYXJjaF9pdGVtPSZzZWFyY2hfb3JkZXI9Jm9yZGVyX2xpc3Q9Jmxpc3Rfc2NhbGU9JnZpZXdfbGV2ZWw9JnZpZXdfY2F0ZT0mdmlld19jYXRlMj0=", "content": "◈ 대학원 연구실 사용 및 졸업생/수료생/휴학생 건물 출입 신청 안내\n등록일\n2022-03-03\n작성자\n교육학과\n조회수\n3392\n가. 일반대학원 및 교육대학원 대학원 연구실(대학원생 지원실) 호실\n건물명\n호실\n호실명\n비고\n교육대학원\n202\n대학원연구실\nⅠ\n상담심리\n교육대학원\n204\n대학원연구실\nⅡ\n교육행정\n교육대학원\n205\n대학원연구실\nⅢ\n교육사회및평생교육\n교육대학원\n207\n대학원연구실\nⅣ\n교육심리및교육평가\n교육대학원\n209\n대학원연구실\nⅤ\n교육철학\n교육대학원\n210\n대학원연구실\nⅥ\n교육과정및공학\n1) 반드시 세부전공별 호실을 확인하여\n본인의 세부전공 연구실만을 사용\n하시길 바랍니다.\n2) 연구실 내 책걸상 배치는 연구실 사용하시는 분들끼리 상의하여 변경하시면 됩니다.\n나. 신청 방법\n1) 대학원 연구실 사용 신청\n: [붙임1] 작성 후 학과 사무실로 제출\n​(신청 후 당일 사용 불가)\n2) (졸업생, 수료생, 휴학생만 해당) 건물 출입 허용 신청: [붙임2] 작성 후 학과 사무실로 제출\n※ 수료생은 학교 제반시설 이용을 위해\n수료생 등록\n을 한 수료생이어야 함\n[붙임1] 대학원 연구실 무인전자경비시스템 출입 허용 신청서(서식).hwp\n[붙임2] 건물 무인전자경비시스템 출입 허용 신청서(서식)_졸업생;; 수료생;; 휴학생용.hwp", "images": [], "attachments": [{"name": "[붙임1] 대학원 연구실 무인전자경비시스템 출입 허용 신청서(서식).hwp", "url": "https://home.knu.ac.kr/HOME/bbs/bbs_download.php?mv_data=aWR4PTg0MCZzdGFydFBhZ2U9MCZsaXN0Tm89ODIxJnRhYmxlPWV4X2Jic19kYXRhX2VkdSZuYXZfY29kZT1lZHUxNjIyMTgxNTIxJnNpdGVfY29kZT1lZHUmY29kZT1ad0tKWGZOaWVvem8mc2VhcmNoX2l0ZW09JnNlYXJjaF9vcmRlcj0mb3JkZXJfbGlzdD0mbGlzdF9zY2FsZT0=&download=h&seq=0"}, {"name": "[붙임2] 건물 무인전자경비시스템 출입 허용 신청서(서식)_졸업생;; 수료생;; 휴학생용.hwp", "url": "https://home.knu.ac.kr/HOME/bbs/bbs_download.php?mv_data=aWR4PTg0MCZzdGFydFBhZ2U9MCZsaXN0Tm89ODIxJnRhYmxlPWV4X2Jic19kYXRhX2VkdSZuYXZfY29kZT1lZHUxNjIyMTgxNTIxJnNpdGVfY29kZT1lZHUmY29kZT1ad0tKWGZOaWVvem8mc2VhcmNoX2l0ZW09JnNlYXJjaF9vcmRlcj0mb3JkZXJfbGlzdD0mbGlzdF9zY2FsZT0=&download=h&seq=1"}]}
{"dept": "교육학과", "detail": "대학원", "title": "◈ 타대학 및 타대학원 이수학점 인정을 위한 '수강신청초안지' 작성 안내", "date": "2014-03-04", "url": "https://home.knu.ac.kr/HOME/edu/sub.htm?mode=view&mv_data=aWR4PTM4MyZzdGFydFBhZ2U9MCZsaXN0Tm89ODIxJnRhYmxlPWV4X2Jic19kYXRhX2VkdSZuYXZfY29kZT1lZHUxNjIyMTgxNTIxJmNvZGU9WndLSlhmTmllb3pvJnNlYXJjaF9pdGVtPSZzZWFyY2hfb3JkZXI9Jm9yZGVyX2xpc3Q9Jmxpc3Rfc2NhbGU9JnZpZXdfbGV2ZWw9JnZpZXdfY2F0ZT0mdmlld19jYXRlMj0=", "content": "◈ 타대학 및 타대학원 이수학점 인정을 위한 '수강신청초안지' 작성 안내\n등록일\n2014-03-04\n작성자\n교육학과\n조회수\n18257\n타학과 또는 타대학원 이수학점을 인정받으시려는 선생님들께서는 참고 부탁드립니다.\n지도교수의 지도를 받아 이수한 타학과 및 타대학원의 교과목도 전공으로 이수가 가능합니다.\n단,\n2008학년도 이후 입학생부터는 학과의 교육과정에서 정한 과목 이외에 본교 타학과(전공), 타대학원 전공과목은 소정의 학점 내에\n서 소속학과 전공과목으로 인정\n받을 수 있습니다.\n가.\n수료 학점의\n1/2까지 인정 가능\n* 석사 수료학점 24학점일 경우, 12학점까지 인정 가능 / 30학점(무논문)일 경우, 15학점까지 인정 가능\n*\n박사과정은 석박사 전공 불일치 여부에 따라 수료 학점이 다르니 개별 확인 필요 (* 전공일치자: 수료학점 36학점이므로 18학점까지 인정 가능)\n나.\n단,\n석사과정 중 2024학년도 이전 입학생은 15학점까지 인정 가능\n다.\n반드시 지도교수님과 상의\n하시고 수강지도를 받으신 후,\n학과 사무실로 수강신청초안지를 작성해서 제출\n해주세요.\n* 지도교수님의 서명(도장)을 반드시 받아서 제출\n* 제출시기: 수강신청 후 ~ 해당 학기 종료 전\n나중에\n졸업하실 때 불이익이 없도록 꼭 작성해서 제출 부탁드립니다.\n수강신청초안지(대학원).hwp", "images": [], "attachments": [{"name": "수강신청초안지(대학원).hwp", "url": "https://home.knu.ac.kr/HOME/bbs/bbs_download.php?mv_data=aWR4PTM4MyZzdGFydFBhZ2U9MCZsaXN0Tm89ODIxJnRhYmxlPWV4X2Jic19kYXRhX2VkdSZuYXZfY29kZT1lZHUxNjIyMTgxNTIxJnNpdGVfY29kZT1lZHUmY29kZT1ad0tKWGZOaWVvem8mc2VhcmNoX2l0ZW09JnNlYXJjaF9vcmRlcj0mb3JkZXJfbGlzdD0mbGlzdF9zY2FsZT0=&download=h&seq=0"}]}
{"dept": "교육학과", "detail": "대학원", "title": "◈ 대학원 교육학과 박사학위 논문발표 자격 요건 안내([내규]19학번 개정)", "date": "2012-05-31", "url": "https://home.knu.ac.kr/HOME/edu/sub.htm?mode=view&mv_data=aWR4PTM4MSZzdGFydFBhZ2U9MCZsaXN0Tm89ODIxJnRhYmxlPWV4X2Jic19kYXRhX2VkdSZuYXZfY29kZT1lZHUxNjIyMTgxNTIxJmNvZGU9WndLSlhmTmllb3pvJnNlYXJjaF9pdGVtPSZzZWFyY2hfb3JkZXI9Jm9yZGVyX2xpc3Q9Jmxpc3Rfc2NhbGU9JnZpZXdfbGV2ZWw9JnZpZXdfY2F0ZT0mdmlld19jYXRlMj0=", "content": "◈ 대학원 교육학과 박사학위 논문발표 자격 요건 안내([내규]19학번 개정)\n등록일\n2012-05-31\n작성자\n교육학과\n조회수\n33619\n박사과정 대학원생\n은\n학위논문 제출예정자 신청기간(3월, 9월)\n에\n<\n① 논문계획서 발표 증빙자료,\n② 학회 발표 증빙자료,\n③ 학술지 게재 증빙자료>를 함께 제출\n하시기 바랍니다.\n첨부파일중 PDF미리보기\n파일 열람을 위해서는 아크로뱃 리더 설치가 필요합니다. 아래 링크를 클릭하여 리더를 다운로드 받으세요.\n(박사과정)논문 계획서 발표 신청서.hwp\n(박사과정)논문 계획서 발표 결과 보고서(서식).hwp\n교육학과 박사 내규.pdf", "images": ["./data/images/45c3e072-af1a-435a-ad32-05b7c339dea9.png", "./data/images/b073b598-2d2f-4edb-8329-ee07cd12935f.png", "./data/images/3488c66d-a19f-4811-98e5-69335a526991.png", "./data/images/bccd787b-4be2-4aa8-9585-e1c06a957798.png", "http://www.adobe.com/images/shared/download_buttons/get_adobe_reader.png"], "attachments": [{"name": "(박사과정)논문 계획서 발표 신청서.hwp", "url": "https://home.knu.ac.kr/HOME/bbs/bbs_download.php?mv_data=aWR4PTM4MSZzdGFydFBhZ2U9MCZsaXN0Tm89ODIxJnRhYmxlPWV4X2Jic19kYXRhX2VkdSZuYXZfY29kZT1lZHUxNjIyMTgxNTIxJnNpdGVfY29kZT1lZHUmY29kZT1ad0tKWGZOaWVvem8mc2VhcmNoX2l0ZW09JnNlYXJjaF9vcmRlcj0mb3JkZXJfbGlzdD0mbGlzdF9zY2FsZT0=&download=h&seq=0"}, {"name": "(박사과정)논문 계획서 발표 결과 보고서(서식).hwp", "url": "https://home.knu.ac.kr/HOME/bbs/bbs_download.php?mv_data=aWR4PTM4MSZzdGFydFBhZ2U9MCZsaXN0Tm89ODIxJnRhYmxlPWV4X2Jic19kYXRhX2VkdSZuYXZfY29kZT1lZHUxNjIyMTgxNTIxJnNpdGVfY29kZT1lZHUmY29kZT1ad0tKWGZOaWVvem8mc2VhcmNoX2l0ZW09JnNlYXJjaF9vcmRlcj0mb3JkZXJfbGlzdD0mbGlzdF9zY2FsZT0=&download=h&seq=1"}, {"name": "교육학과 박사 내규.pdf", "url": "https://home.knu.ac.kr/HOME/bbs/bbs_download.php?mv_data=aWR4PTM4MSZzdGFydFBhZ2U9MCZsaXN0Tm89ODIxJnRhYmxlPWV4X2Jic19kYXRhX2VkdSZuYXZfY29kZT1lZHUxNjIyMTgxNTIxJnNpdGVfY29kZT1lZHUmY29kZT1ad0tKWGZOaWVvem8mc2VhcmNoX2l0ZW09JnNlYXJjaF9vcmRlcj0mb3JkZXJfbGlzdD0mbGlzdF9zY2FsZT0=&download=h&seq=2"}]}
{"dept": "교육학과", "detail": "대학원", "title": "* 2025-2학기 박사 논문계획서 발표 (*대상자: 2026학년도 1학기 박사학위 청구논문 공개발표자)", "date": "2026-01-13", "url": "https://home.knu.ac.kr/HOME/edu/sub.htm?mode=view&mv_data=aWR4PTE0Njkmc3RhcnRQYWdlPTAmbGlzdE5vPTgyMSZ0YWJsZT1leF9iYnNfZGF0YV9lZHUmbmF2X2NvZGU9ZWR1MTYyMjE4MTUyMSZjb2RlPVp3S0pYZk5pZW96byZzZWFyY2hfaXRlbT0mc2VhcmNoX29yZGVyPSZvcmRlcl9saXN0PSZsaXN0X3NjYWxlPSZ2aWV3X2xldmVsPSZ2aWV3X2NhdGU9JnZpZXdfY2F0ZTI9", "content": "* 2025-2학기 박사 논문계획서 발표 (*대상자: 2026학년도 1학기 박사학위 청구논문 공개발표자)\n등록일\n2026-01-13\n작성자\n교육학과\n조회수\n38\n교육학과 내규\n에 따라\n교육학과\n박사\n과정\n학생들 가운데 2026학년도 1\n학기에 박사학위 청구논문 공개발표를 할 학생은\n2025\n년도 2\n학기 종료일 이전까지(~26. 2. 28.까지) 반드시\n논문계획서를 발표\n해야 합니다\n.\n이에 해당 학생은\n논문계획서 발표신청서\n를 작성하여\n​기한 내\n학과사무실에 제출\n하시기 바랍니다\n.\n가. 신청 및 발표 기간\n: 2026. 1. 12.(월) ~ 2026. 2. 28.(금\n) (*전공별 진행)\n나. 참고사항\n1) 발표 일정은 전공별 별도 운영되므로\n구체적 일정은 반드시 지도교수님과 상의\n하시길 바랍니다.\n2) 발표 직후,\n지도교수님께 확인 받은 결과보고서를 제출\n할 것\n대학원_(박사)논문계획서 발표 신청서.hwp\n대학원_(박사)논문계획서 발표 결과보고서.hwp", "images": [], "attachments": [{"name": "대학원_(박사)논문계획서 발표 신청서.hwp", "url": "https://home.knu.ac.kr/HOME/bbs/bbs_download.php?mv_data=aWR4PTE0Njkmc3RhcnRQYWdlPTAmbGlzdE5vPTgyMSZ0YWJsZT1leF9iYnNfZGF0YV9lZHUmbmF2X2NvZGU9ZWR1MTYyMjE4MTUyMSZzaXRlX2NvZGU9ZWR1JmNvZGU9WndLSlhmTmllb3pvJnNlYXJjaF9pdGVtPSZzZWFyY2hfb3JkZXI9Jm9yZGVyX2xpc3Q9Jmxpc3Rfc2NhbGU9&download=h&seq=0"}, {"name": "대학원_(박사)논문계획서 발표 결과보고서.hwp", "url": "https://home.knu.ac.kr/HOME/bbs/bbs_download.php?mv_data=aWR4PTE0Njkmc3RhcnRQYWdlPTAmbGlzdE5vPTgyMSZ0YWJsZT1leF9iYnNfZGF0YV9lZHUmbmF2X2NvZGU9ZWR1MTYyMjE4MTUyMSZzaXRlX2NvZGU9ZWR1JmNvZGU9WndLSlhmTmllb3pvJnNlYXJjaF9pdGVtPSZzZWFyY2hfb3JkZXI9Jm9yZGVyX2xpc3Q9Jmxpc3Rfc2NhbGU9&download=h&seq=1"}]}
{"dept": "교육학과", "detail": "대학원", "title": "「2025학년도 학술연구지원사업」지원 신청 조기마감에 따른 협조 요청(대학원생)", "date": "2026-01-12", "url": "https://home.knu.ac.kr/HOME/edu/sub.htm?mode=view&mv_data=aWR4PTE0Njgmc3RhcnRQYWdlPTAmbGlzdE5vPTgyMCZ0YWJsZT1leF9iYnNfZGF0YV9lZHUmbmF2X2NvZGU9ZWR1MTYyMjE4MTUyMSZjb2RlPVp3S0pYZk5pZW96byZzZWFyY2hfaXRlbT0mc2VhcmNoX29yZGVyPSZvcmRlcl9saXN0PSZsaXN0X3NjYWxlPSZ2aWV3X2xldmVsPSZ2aWV3X2NhdGU9JnZpZXdfY2F0ZTI9", "content": "「2025학년도 학술연구지원사업」지원 신청 조기마감에 따른 협조 요청(대학원생)\n등록일\n2026-01-12\n작성자\n교육학과\n조회수\n15\n2025\n회계연도 대학회계 마감 일정\n에 따라\n「\n2025\n학년도 학술연구지원사업\n」\n중\n대학원생\n대상\n지원 사업\n신청\n을 다음과 같이\n조기 마감\n하고자 하오니\n,\n대상자\n들은\n신청기한\n(\n2. 8.(일)까지)\n내에\n신청\n하여 주시기 바랍니다.\n○\n안내사항\n사업명\n신청기한\n(\n문서 도착일\n)\n협조사항\n비고\n담당자\n대학원생\n국내학술대회 참가 교통비 지원\n2. 8.(일)까지\n신청기한\n~\n회계마감일\n(2\n월말\n)\n까지 지원 신청 건의 경우\n신청기한 내에 미리\n(\n사전\n)\n신청\n(\n관련 증빙서류는 추후 제출 가능\n)\n신청기한\n(\n문서 도착일\n)\n이후 지원 신청건\n추후 지원 불가\n연구진흥과\n정재경\n(950-2238)\n대학원생\n국제학술대회 참가 교통비 지원\n끝\n.", "images": [], "attachments": []}
{"dept": "교육학과", "detail": "대학원", "title": "2026년도 제1차 평생교육사 자격증 발급 신청 안내", "date": "2026-01-09", "url": "https://home.knu.ac.kr/HOME/edu/sub.htm?mode=view&mv_data=aWR4PTE0Njcmc3RhcnRQYWdlPTAmbGlzdE5vPTgxOSZ0YWJsZT1leF9iYnNfZGF0YV9lZHUmbmF2X2NvZGU9ZWR1MTYyMjE4MTUyMSZjb2RlPVp3S0pYZk5pZW96byZzZWFyY2hfaXRlbT0mc2VhcmNoX29yZGVyPSZvcmRlcl9saXN0PSZsaXN0X3NjYWxlPSZ2aWV3X2xldmVsPSZ2aWV3X2NhdGU9JnZpZXdfY2F0ZTI9", "content": "2026년도 제1차 평생교육사 자격증 발급 신청 안내\n등록일\n2026-01-09\n작성자\n교육학과\n조회수\n11\n2026\n년도 제\n1\n차 평생교육사 자격증 발급 신청기간\n을 다음과 같이\n공지하오니\n,\n자격증\n신청 대상자들은 기한 내에 자격증을 신청하여 주시기 바랍니다\n.\n가\n.\n접수일정\n구 분\n서류 접수 기간\n자격증 교부\n제\n1\n차\n2026. 1. 14.(\n수\n) ~ 1. 30.(\n금\n)\n2025. 3. 31.(\n화\n)\n나\n.\n제출서류\n: [\n붙임\n]\n참고\n다\n.\n신청방법\n1)\n신청서 및 제출 서류를 구비하여\n학사과에 직접 방문하여 제출\n2)\n관련 내용 공지\n:\n학교 홈페이지\n[\n교육\n]-[\n학사행정\n]-[\n학사공지\n]\n에 공지\n3)\n문의처\n:\n국가평생교육진흥원 자격\n·\n연수 센터\n(\n☎\n1577-3867)\n매뉴얼.hwp\n발급 서식.hwp\n공고문.hwp", "images": [], "attachments": [{"name": "매뉴얼.hwp", "url": "https://home.knu.ac.kr/HOME/bbs/bbs_download.php?mv_data=aWR4PTE0Njcmc3RhcnRQYWdlPTAmbGlzdE5vPTgxOSZ0YWJsZT1leF9iYnNfZGF0YV9lZHUmbmF2X2NvZGU9ZWR1MTYyMjE4MTUyMSZzaXRlX2NvZGU9ZWR1JmNvZGU9WndLSlhmTmllb3pvJnNlYXJjaF9pdGVtPSZzZWFyY2hfb3JkZXI9Jm9yZGVyX2xpc3Q9Jmxpc3Rfc2NhbGU9&download=h&seq=0"}, {"name": "발급 서식.hwp", "url": "https://home.knu.ac.kr/HOME/bbs/bbs_download.php?mv_data=aWR4PTE0Njcmc3RhcnRQYWdlPTAmbGlzdE5vPTgxOSZ0YWJsZT1leF9iYnNfZGF0YV9lZHUmbmF2X2NvZGU9ZWR1MTYyMjE4MTUyMSZzaXRlX2NvZGU9ZWR1JmNvZGU9WndLSlhmTmllb3pvJnNlYXJjaF9pdGVtPSZzZWFyY2hfb3JkZXI9Jm9yZGVyX2xpc3Q9Jmxpc3Rfc2NhbGU9&download=h&seq=1"}, {"name": "공고문.hwp", "url": "https://home.knu.ac.kr/HOME/bbs/bbs_download.php?mv_data=aWR4PTE0Njcmc3RhcnRQYWdlPTAmbGlzdE5vPTgxOSZ0YWJsZT1leF9iYnNfZGF0YV9lZHUmbmF2X2NvZGU9ZWR1MTYyMjE4MTUyMSZzaXRlX2NvZGU9ZWR1JmNvZGU9WndLSlhmTmllb3pvJnNlYXJjaF9pdGVtPSZzZWFyY2hfb3JkZXI9Jm9yZGVyX2xpc3Q9Jmxpc3Rfc2NhbGU9&download=h&seq=2"}]}
{"dept": "교육학과", "detail": "대학원", "title": "2026년 2월(2025학년도 전기) 대학원 수업연한단축[조기수료 또는 졸업] 신청 안내", "date": "2026-01-05", "url": "https://home.knu.ac.kr/HOME/edu/sub.htm?mode=view&mv_data=aWR4PTE0NjUmc3RhcnRQYWdlPTAmbGlzdE5vPTgxOCZ0YWJsZT1leF9iYnNfZGF0YV9lZHUmbmF2X2NvZGU9ZWR1MTYyMjE4MTUyMSZjb2RlPVp3S0pYZk5pZW96byZzZWFyY2hfaXRlbT0mc2VhcmNoX29yZGVyPSZvcmRlcl9saXN0PSZsaXN0X3NjYWxlPSZ2aWV3X2xldmVsPSZ2aWV3X2NhdGU9JnZpZXdfY2F0ZTI9", "content": "2026년 2월(2025학년도 전기) 대학원 수업연한단축[조기수료 또는 졸업] 신청 안내\n등록일\n2026-01-05\n작성자\n교육학과\n조회수\n43\n일반\n·\n전문\n·\n특수대학원 재학생 중\n2026\n년\n2\n월\n(2025\n학년도 전기\n)\n에 수업연한단축\n[\n조기수료 또는 졸업\n]\n을 신청\n하고자 하는 학생은\n기한 내에 신청\n하여 주시기 바랍니다\n.\n가\n.\n조기수료 및 졸업 요건\n: [\n붙임\n1]\n참고\n나\n.\n신청기한\n:\n2026. 1. 15.(목\n) 17:30까지\n다\n.\n신청절차\n:\n신청서\n[\n붙임\n2] 및 성적증명서 첨부하여 교육학과 사무\n실 제출 (지도교수 날인 必)\n라\n.\n조기수료 후속조치\n※\n2026.1\n학기부터 본등록 하지 않음\n- (\n논문\n)\n수료생등록\n,\n종합시험\n,\n논문심사 등 학과별 요건 충족 시 졸업\n- (\n무논문\n)\n종합시험 등 학과별 요건 충족 시 졸업\n붙임\n1.\n각 대학원 조기수료 및 졸업 요건\n1\n부\n.\n2.\n신청서\n1\n부\n.\n끝\n.\n수업연한단축 신청서.hwp\n각 대학원 조기수료 및 졸업 요건.hwp", "images": [], "attachments": [{"name": "수업연한단축 신청서.hwp", "url": "https://home.knu.ac.kr/HOME/bbs/bbs_download.php?mv_data=aWR4PTE0NjUmc3RhcnRQYWdlPTAmbGlzdE5vPTgxOCZ0YWJsZT1leF9iYnNfZGF0YV9lZHUmbmF2X2NvZGU9ZWR1MTYyMjE4MTUyMSZzaXRlX2NvZGU9ZWR1JmNvZGU9WndLSlhmTmllb3pvJnNlYXJjaF9pdGVtPSZzZWFyY2hfb3JkZXI9Jm9yZGVyX2xpc3Q9Jmxpc3Rfc2NhbGU9&download=h&seq=0"}, {"name": "각 대학원 조기수료 및 졸업 요건.hwp", "url": "https://home.knu.ac.kr/HOME/bbs/bbs_download.php?mv_data=aWR4PTE0NjUmc3RhcnRQYWdlPTAmbGlzdE5vPTgxOCZ0YWJsZT1leF9iYnNfZGF0YV9lZHUmbmF2X2NvZGU9ZWR1MTYyMjE4MTUyMSZzaXRlX2NvZGU9ZWR1JmNvZGU9WndLSlhmTmllb3pvJnNlYXJjaF9pdGVtPSZzZWFyY2hfb3JkZXI9Jm9yZGVyX2xpc3Q9Jmxpc3Rfc2NhbGU9&download=h&seq=1"}]}
{"dept": "교육학과", "detail": "대학원", "title": "◈ 대학원 지도교수 교체 신청서(서식)", "date": "2025-12-22", "url": "https://home.knu.ac.kr/HOME/edu/sub.htm?mode=view&mv_data=aWR4PTE0NTkmc3RhcnRQYWdlPTAmbGlzdE5vPTgxNyZ0YWJsZT1leF9iYnNfZGF0YV9lZHUmbmF2X2NvZGU9ZWR1MTYyMjE4MTUyMSZjb2RlPVp3S0pYZk5pZW96byZzZWFyY2hfaXRlbT0mc2VhcmNoX29yZGVyPSZvcmRlcl9saXN0PSZsaXN0X3NjYWxlPSZ2aWV3X2xldmVsPSZ2aWV3X2NhdGU9JnZpZXdfY2F0ZTI9", "content": "◈ 대학원 지도교수 교체 신청서(서식)\n등록일\n2025-12-22\n작성자\n교육학과\n조회수\n91\n- 신청방법: 변경 전, 후 지도교수 날인 후 학과 사무실로 제출\n- 신청기한: 상시\n대학원 지도교수 교체 신청서(서식).hwp", "images": [], "attachments": [{"name": "대학원 지도교수 교체 신청서(서식).hwp", "url": "https://home.knu.ac.kr/HOME/bbs/bbs_download.php?mv_data=aWR4PTE0NTkmc3RhcnRQYWdlPTAmbGlzdE5vPTgxNyZ0YWJsZT1leF9iYnNfZGF0YV9lZHUmbmF2X2NvZGU9ZWR1MTYyMjE4MTUyMSZzaXRlX2NvZGU9ZWR1JmNvZGU9WndLSlhmTmllb3pvJnNlYXJjaF9pdGVtPSZzZWFyY2hfb3JkZXI9Jm9yZGVyX2xpc3Q9Jmxpc3Rfc2NhbGU9&download=h&seq=0"}]}
{"dept": "교육학과", "detail": "대학원", "title": "2026학년도 1학기 특수대학원 수료생 대상 무논문 석사학위 신청 계획 안내", "date": "2025-12-22", "url": "https://home.knu.ac.kr/HOME/edu/sub.htm?mode=view&mv_data=aWR4PTE0NTgmc3RhcnRQYWdlPTAmbGlzdE5vPTgxNiZ0YWJsZT1leF9iYnNfZGF0YV9lZHUmbmF2X2NvZGU9ZWR1MTYyMjE4MTUyMSZjb2RlPVp3S0pYZk5pZW96byZzZWFyY2hfaXRlbT0mc2VhcmNoX29yZGVyPSZvcmRlcl9saXN0PSZsaXN0X3NjYWxlPSZ2aWV3X2xldmVsPSZ2aWV3X2NhdGU9JnZpZXdfY2F0ZTI9", "content": "2026학년도 1학기 특수대학원 수료생 대상 무논문 석사학위 신청 계획 안내\n등록일\n2025-12-22\n작성자\n교육학과\n조회수\n61\n가. 신청 대상:\n특수대학원 무논문 승인을 받은 학과(부) 및 전공 소속의 수료생 중 수료 후 2년 이상 경과된 자(2024년 2월 이전 수료생)\n나. 신청 기간 및 장소:\n2026. 1. 2.(금) 9:00 ~ 1. 12.(월) 17:30 (기한 엄수)\n,\n교육학과 사무실(사범대학 823호)\n다.\n제출 서류\n① 신청원 (붙임파일 확인) (지도교수 날인 必)\n② 성적증명서\n(최근 3개월 이내 발급본)\n라. 안내사항\n1) 수강신청: 2026. 2. 10.(화) ~ 2. 12.(목) ※ 수강변경, 수강정정 이용 가능\n2) 등록: 2026년 3월 말 ~ 4월 중[추후 공지] ※ 수강신청 학점에 따라 차등 납부\n3)\n해당 기간에 별도 개별 안내하지 않으니, 경북대학교 홈페이지 학사공지를 수시 확인할 것\n4) 무논문 석사학위 선발자는\n30학점 이상을 이수하여야 함 (논문연구 제외)\n마.\n교육대학원 무논문 승인 학과\n교육대학원\n교육철학전공\n가능\n2015학년도 이전 입학생 신청 불가\n교육대학원\n교육행정전공\n가능\n2011학년도 이전 입학생 신청 불가\n교육대학원\n상담심리전공\n가능\n-\n바. 관련 안내 확인\n1) 학사 공지 확인(수강신청 일정 및 방법, 등록 일정 등): 경북대학교 홈페이지(knu.ac.kr) > 교육 > 학사행정 > 학사공지\n2) 등록금 관련 확인(등록금 납부 일정, 등록금액, 차등 납부 등): 경북대학교 홈페이지(knu.ac.kr) > 교육 > 학사행정 > 학사안내 > 등록 (※ 재무과: 053-950-2623)\n3) 기타 문의: 교육학과 사무실(053-950-5806)\n신청원.hwp", "images": [], "attachments": [{"name": "신청원.hwp", "url": "https://home.knu.ac.kr/HOME/bbs/bbs_download.php?mv_data=aWR4PTE0NTgmc3RhcnRQYWdlPTAmbGlzdE5vPTgxNiZ0YWJsZT1leF9iYnNfZGF0YV9lZHUmbmF2X2NvZGU9ZWR1MTYyMjE4MTUyMSZzaXRlX2NvZGU9ZWR1JmNvZGU9WndLSlhmTmllb3pvJnNlYXJjaF9pdGVtPSZzZWFyY2hfb3JkZXI9Jm9yZGVyX2xpc3Q9Jmxpc3Rfc2NhbGU9&download=h&seq=0"}]}
{"dept": "교육학과", "detail": "대학원", "title": "[교육대학원 상담심리전공 양성과정] 2026학년도 2월(2025학년도 전기) 졸업예정자에 대한 교원자격무시험검정 신청 안내", "date": "2025-12-19", "url": "https://home.knu.ac.kr/HOME/edu/sub.htm?mode=view&mv_data=aWR4PTE0NTYmc3RhcnRQYWdlPTAmbGlzdE5vPTgxNSZ0YWJsZT1leF9iYnNfZGF0YV9lZHUmbmF2X2NvZGU9ZWR1MTYyMjE4MTUyMSZjb2RlPVp3S0pYZk5pZW96byZzZWFyY2hfaXRlbT0mc2VhcmNoX29yZGVyPSZvcmRlcl9saXN0PSZsaXN0X3NjYWxlPSZ2aWV3X2xldmVsPSZ2aWV3X2NhdGU9JnZpZXdfY2F0ZTI9", "content": "[교육대학원 상담심리전공 양성과정] 2026학년도 2월(2025학년도 전기) 졸업예정자에 대한 교원자격무시험검정 신청 안내\n등록일\n2025-12-19\n작성자\n교육학과\n조회수\n84\n가. 신청 대상: 2026년 2월 졸업예정자 중 교직과정 이수예정자 (사범대학, 일반대학 교직과정, 교육대학원)\n나. 신청 방법: 온라인 신청 후, 학과사무실로 서류 제출\n1) 통합정보시스템(\nhttps://knuin.ac.kr/)에\n로그인 후 신청 (*신청 기간: 1. 12.(월) 10:00 ~ 1. 14.(수) 17:00)\n- 차세대 통합정보시스템 - 교직 - 교원자격무시험검정 - 교원자격무시험검정신청\n2)\n전문상담교사(2급)\n제출 서류\n① 교원자격무시험검정원서(통합정보시스템 출력물) 1부\n② 학사과정 성적증명서\n(원본)\n1부\n(지원 시 제출한 학사과정)\n③ 교육대학원 석사과정 성적증명서(7. 14.(월) 오전 10시 이후 발급본-최종 성적 반영)\n(원본)\n1부 (※ '전공필수' 등 교과구분 변경이 필요한 경우 변경 완료 후 제출)\n④ 의사진단서(또는 건강검진 결과통보서)(원본) [붙임 참조]\n⑤\n(해당자만 제출)\n교원자격증 사본 (원본대조필) 1부\n⑥\n(해당자만 제출)\n자격증 사본(원본대조필) 및 경력증명서\n(원본)\n1부\n3)\n전문상담교사(1급)\n① 석사과정 성적증명서(원본) 1부만 제출 (\n※\n통합정보시스템 신청 불요)\n다.\n신청 기간:\n2026. 1. 14.(수) 17시 30분까지 학과 사무실로 대면으로 서류 제출\n※ 교원자격증 발급일: 2026. 2. 20.(학위수여일) (전문상담교사(1급)은 교육청으로 별도 신청)", "images": [], "attachments": []}
{"dept": "교육학과", "detail": "대학원", "title": "[글로컬대학사업] 2025학년도 2학기 G-KNU Scholarship 전일제 유지 확인 및 등록 요청", "date": "2025-12-19", "url": "https://home.knu.ac.kr/HOME/edu/sub.htm?mode=view&mv_data=aWR4PTE0NTQmc3RhcnRQYWdlPTAmbGlzdE5vPTgxNCZ0YWJsZT1leF9iYnNfZGF0YV9lZHUmbmF2X2NvZGU9ZWR1MTYyMjE4MTUyMSZjb2RlPVp3S0pYZk5pZW96byZzZWFyY2hfaXRlbT0mc2VhcmNoX29yZGVyPSZvcmRlcl9saXN0PSZsaXN0X3NjYWxlPSZ2aWV3X2xldmVsPSZ2aWV3X2NhdGU9JnZpZXdfY2F0ZTI9", "content": "[글로컬대학사업] 2025학년도 2학기 G-KNU Scholarship 전일제 유지 확인 및 등록 요청\n등록일\n2025-12-19\n작성자\n교육학과\n조회수\n86\n2025년 2학기 G-KNU Scholarship(전일제 박사과정) 장학금의 부정수급 방지 및 2026학년도 1학기 장학금 대상자 확정을 위하여 전일제 신분 유지를 확인하고자 하오니,\n등록대상자(학생)는 기한 내 통합정보시스템에 등록하여 주시기 바랍니다.\n1.\n등록 대상: 2025학년도 2학기 G-KNU Scholarship(전일제 박사과정) 장학금 수혜생\n※ D-2 비자 소지 외국인의 경우, 국제교류과를 통해 별도 확인 예정\n※ 2026.1학기 신입생 및 복학생 등은 2026. 3월 중 별도 공지 후 추가 신청 및 지급 예정\n2.\n등록 기간:\n2025. 12. 22.(월) 9:00 ~ 12. 29.(월) 18:00\n3.\n등록 방법:\n통합정보시스템을 통한 전일제 대학원생 등록 및 증빙서류 업로드 (붙임4 참고)\n4.\n제출 자료(업로드 자료)\n대상\n제출 필수서류\n비고\n2026\n학년도\n1\n학기\n장학 미대상자\n(2025.2\n학기가 마지막학기 인 경우\n)\n① 4대 사회보험 가입내역 확인서\n② 건강보험 자격득실 확인서\n2025.2\n학기\n전일제 신분 유지 최종 확인\n2026.1\n학기\n장학 대상자\n① 4대 사회보험 가입내역 확인서\n② 건강보험 자격득실 확인서\n③\n전일제 확인서\n(\n붙임\n2)\n④\n예외사항에 따른 추가 제출서류\n(\n해당자만\n,\n붙임\n3 참고)\n2026.1\n학기\n장학생 선발을 위한 사전 등록\n※ 장학제외자: 수료생, 초과학기자, 휴학생, 직전학기 성적이 3.3미만, 비전일제\n6. 유의 사항: 전일제 신분을 유지하지 못할 경우, 기 수혜 장학금 전액 환수 조치 예정\n7. 추진 일정\n가. 2025.2학기 장학생 자격유지 및 2026.1학기 장학생 자격 검토: ‘26. 1월\n나. 2026.1학기 장학생 선발: ’26. 2월 ※ 등록시 감면 처리 예정\n(붙임 2) 전일제 확인서.hwp\n(붙임 3) 전일제(Full-Time) 박사과정생 인정 기준.hwp\n(붙임 4-1) [국문] 2025학년도 2학기 G-KNU Scholarship 전일제 정보 등록 매뉴얼.hwp\n(붙임 4-2) [영문] 2025학년도 2학기 G-KNU Scholarship 전일제 정보 등록 매뉴얼.hwp", "images": [], "attachments": [{"name": "(붙임 2) 전일제 확인서.hwp", "url": "https://home.knu.ac.kr/HOME/bbs/bbs_download.php?mv_data=aWR4PTE0NTQmc3RhcnRQYWdlPTAmbGlzdE5vPTgxNCZ0YWJsZT1leF9iYnNfZGF0YV9lZHUmbmF2X2NvZGU9ZWR1MTYyMjE4MTUyMSZzaXRlX2NvZGU9ZWR1JmNvZGU9WndLSlhmTmllb3pvJnNlYXJjaF9pdGVtPSZzZWFyY2hfb3JkZXI9Jm9yZGVyX2xpc3Q9Jmxpc3Rfc2NhbGU9&download=h&seq=0"}, {"name": "(붙임 3) 전일제(Full-Time) 박사과정생 인정 기준.hwp", "url": "https://home.knu.ac.kr/HOME/bbs/bbs_download.php?mv_data=aWR4PTE0NTQmc3RhcnRQYWdlPTAmbGlzdE5vPTgxNCZ0YWJsZT1leF9iYnNfZGF0YV9lZHUmbmF2X2NvZGU9ZWR1MTYyMjE4MTUyMSZzaXRlX2NvZGU9ZWR1JmNvZGU9WndLSlhmTmllb3pvJnNlYXJjaF9pdGVtPSZzZWFyY2hfb3JkZXI9Jm9yZGVyX2xpc3Q9Jmxpc3Rfc2NhbGU9&download=h&seq=1"}, {"name": "(붙임 4-1) [국문] 2025학년도 2학기 G-KNU Scholarship 전일제 정보 등록 매뉴얼.hwp", "url": "https://home.knu.ac.kr/HOME/bbs/bbs_download.php?mv_data=aWR4PTE0NTQmc3RhcnRQYWdlPTAmbGlzdE5vPTgxNCZ0YWJsZT1leF9iYnNfZGF0YV9lZHUmbmF2X2NvZGU9ZWR1MTYyMjE4MTUyMSZzaXRlX2NvZGU9ZWR1JmNvZGU9WndLSlhmTmllb3pvJnNlYXJjaF9pdGVtPSZzZWFyY2hfb3JkZXI9Jm9yZGVyX2xpc3Q9Jmxpc3Rfc2NhbGU9&download=h&seq=2"}, {"name": "(붙임 4-2) [영문] 2025학년도 2학기 G-KNU Scholarship 전일제 정보 등록 매뉴얼.hwp", "url": "https://home.knu.ac.kr/HOME/bbs/bbs_download.php?mv_data=aWR4PTE0NTQmc3RhcnRQYWdlPTAmbGlzdE5vPTgxNCZ0YWJsZT1leF9iYnNfZGF0YV9lZHUmbmF2X2NvZGU9ZWR1MTYyMjE4MTUyMSZzaXRlX2NvZGU9ZWR1JmNvZGU9WndLSlhmTmllb3pvJnNlYXJjaF9pdGVtPSZzZWFyY2hfb3JkZXI9Jm9yZGVyX2xpc3Q9Jmxpc3Rfc2NhbGU9&download=h&seq=3"}]}
{"dept": "교육학과", "detail": "대학원", "title": "◈ 2026학년도 학사력 안내", "date": "2025-12-18", "url": "https://home.knu.ac.kr/HOME/edu/sub.htm?mode=view&mv_data=aWR4PTE0NTMmc3RhcnRQYWdlPTAmbGlzdE5vPTgxMyZ0YWJsZT1leF9iYnNfZGF0YV9lZHUmbmF2X2NvZGU9ZWR1MTYyMjE4MTUyMSZjb2RlPVp3S0pYZk5pZW96byZzZWFyY2hfaXRlbT0mc2VhcmNoX29yZGVyPSZvcmRlcl9saXN0PSZsaXN0X3NjYWxlPSZ2aWV3X2xldmVsPSZ2aWV3X2NhdGU9JnZpZXdfY2F0ZTI9", "content": "◈ 2026학년도 학사력 안내\n등록일\n2025-12-18\n작성자\n교육학과\n조회수\n186\n대학원 관련은 우측칸 확인\n첨부파일중 PDF미리보기\n파일 열람을 위해서는 아크로뱃 리더 설치가 필요합니다. 아래 링크를 클릭하여 리더를 다운로드 받으세요.\n2026학년도 학사력.pdf", "images": ["http://www.adobe.com/images/shared/download_buttons/get_adobe_reader.png"], "attachments": [{"name": "2026학년도 학사력.pdf", "url": "https://home.knu.ac.kr/HOME/bbs/bbs_download.php?mv_data=aWR4PTE0NTMmc3RhcnRQYWdlPTAmbGlzdE5vPTgxMyZ0YWJsZT1leF9iYnNfZGF0YV9lZHUmbmF2X2NvZGU9ZWR1MTYyMjE4MTUyMSZzaXRlX2NvZGU9ZWR1JmNvZGU9WndLSlhmTmllb3pvJnNlYXJjaF9pdGVtPSZzZWFyY2hfb3JkZXI9Jm9yZGVyX2xpc3Q9Jmxpc3Rfc2NhbGU9&download=h&seq=0"}]}
{"dept": "교육학과", "detail": "대학원", "title": "「제10회 경북대학교 대학원동창회 학술상」공모 안내", "date": "2025-12-16", "url": "https://home.knu.ac.kr/HOME/edu/sub.htm?mode=view&mv_data=aWR4PTE0NTImc3RhcnRQYWdlPTAmbGlzdE5vPTgxMiZ0YWJsZT1leF9iYnNfZGF0YV9lZHUmbmF2X2NvZGU9ZWR1MTYyMjE4MTUyMSZjb2RlPVp3S0pYZk5pZW96byZzZWFyY2hfaXRlbT0mc2VhcmNoX29yZGVyPSZvcmRlcl9saXN0PSZsaXN0X3NjYWxlPSZ2aWV3X2xldmVsPSZ2aWV3X2NhdGU9JnZpZXdfY2F0ZTI9", "content": "「제10회 경북대학교 대학원동창회 학술상」공모 안내\n등록일\n2025-12-16\n작성자\n교육학과\n조회수\n73\n경북대학교 대학원동창회에서 대학원생들의 학문적 관심과 논의를 진작시키고 학문적 열의를 장려하고자\n다음과 같이\n「\n제\n10\n회 경북대학교 대학원동창회 학술상\n」\n을 공모하오니\n재적기간\n중 창의적인 학술연구와 성과를 이룬 논문을 기대하며 관심있는 분들이 많이 신청하여 주시기 바랍니다\n.\n가\n.\n신청자격\n○\n2025\n년\n8\n월 및\n2026\n년\n2\n월 본교 일반대학원 석\n·\n박사 학위수여\n(\n예정\n)\n자\n(\n※\n내\n·\n외국인 학생 모두 지원 가능\n)\n○\n지도교수의 추천을 받은 자\n○\n대학원 동창회비를 납부한 자\n○\n본교 연구산학처 주관\n2025.\n첨성인 대학원생 논문 경진대회 수상자는 제외\n나\n.\n모집분야 및 상금\n○\n경북대학교 일반대학원에 개설된 모든 학문분야\n○\n상금\n:\n박사\n3\n인 각\n3\n백만원\n,\n석사\n3\n인 각\n1\n백만원\n다\n.\n신청기간\n: 2026\n년\n1\n월\n6\n일\n(\n화\n)~1\n월\n9\n일\n(\n금\n)\n라\n.\n문의처\n:\n경북대학교 대학원동창회 실무 김민지\n(053-943-6992)\n마.\n구비서류 및 신청방법 등 자세한 사항은 붙임\n1\n공고문을 참조하기 바랍니다\n.\n붙임\n1.\n제\n10\n회 경북대학교 대학원동창회 학술상 공고문\n(\n국문\n,\n영문\n)\n각\n1\n부\n.\n2.\n경북대학교 대학원동창회 학술상 신청서\n(\n국문\n,\n영문\n)\n등 각\n1\n부\n.\n끝\n.\n경북대학교 대학원동창회 학술상 신청서(국문).hwp\n경북대학교 대학원동창회 학술상 신청서(영문).hwp\n제10회 경북대학교 대학원동창회 학술상 공고문(국문).hwp\n제10회 경북대학교 대학원동창회 학술상 공고문(영문).hwp", "images": [], "attachments": [{"name": "경북대학교 대학원동창회 학술상 신청서(국문).hwp", "url": "https://home.knu.ac.kr/HOME/bbs/bbs_download.php?mv_data=aWR4PTE0NTImc3RhcnRQYWdlPTAmbGlzdE5vPTgxMiZ0YWJsZT1leF9iYnNfZGF0YV9lZHUmbmF2X2NvZGU9ZWR1MTYyMjE4MTUyMSZzaXRlX2NvZGU9ZWR1JmNvZGU9WndLSlhmTmllb3pvJnNlYXJjaF9pdGVtPSZzZWFyY2hfb3JkZXI9Jm9yZGVyX2xpc3Q9Jmxpc3Rfc2NhbGU9&download=h&seq=0"}, {"name": "경북대학교 대학원동창회 학술상 신청서(영문).hwp", "url": "https://home.knu.ac.kr/HOME/bbs/bbs_download.php?mv_data=aWR4PTE0NTImc3RhcnRQYWdlPTAmbGlzdE5vPTgxMiZ0YWJsZT1leF9iYnNfZGF0YV9lZHUmbmF2X2NvZGU9ZWR1MTYyMjE4MTUyMSZzaXRlX2NvZGU9ZWR1JmNvZGU9WndLSlhmTmllb3pvJnNlYXJjaF9pdGVtPSZzZWFyY2hfb3JkZXI9Jm9yZGVyX2xpc3Q9Jmxpc3Rfc2NhbGU9&download=h&seq=1"}, {"name": "제10회 경북대학교 대학원동창회 학술상 공고문(국문).hwp", "url": "https://home.knu.ac.kr/HOME/bbs/bbs_download.php?mv_data=aWR4PTE0NTImc3RhcnRQYWdlPTAmbGlzdE5vPTgxMiZ0YWJsZT1leF9iYnNfZGF0YV9lZHUmbmF2X2NvZGU9ZWR1MTYyMjE4MTUyMSZzaXRlX2NvZGU9ZWR1JmNvZGU9WndLSlhmTmllb3pvJnNlYXJjaF9pdGVtPSZzZWFyY2hfb3JkZXI9Jm9yZGVyX2xpc3Q9Jmxpc3Rfc2NhbGU9&download=h&seq=2"}, {"name": "제10회 경북대학교 대학원동창회 학술상 공고문(영문).hwp", "url": "https://home.knu.ac.kr/HOME/bbs/bbs_download.php?mv_data=aWR4PTE0NTImc3RhcnRQYWdlPTAmbGlzdE5vPTgxMiZ0YWJsZT1leF9iYnNfZGF0YV9lZHUmbmF2X2NvZGU9ZWR1MTYyMjE4MTUyMSZzaXRlX2NvZGU9ZWR1JmNvZGU9WndLSlhmTmllb3pvJnNlYXJjaF9pdGVtPSZzZWFyY2hfb3JkZXI9Jm9yZGVyX2xpc3Q9Jmxpc3Rfc2NhbGU9&download=h&seq=3"}]}
{"dept": "교육학과", "detail": "대학원", "title": "2025학년도 2학기 졸업(수료) 예정자 도서관 대출중지 안내", "date": "2025-12-11", "url": "https://home.knu.ac.kr/HOME/edu/sub.htm?mode=view&mv_data=aWR4PTE0NTAmc3RhcnRQYWdlPTEwJmxpc3RObz04MTEmdGFibGU9ZXhfYmJzX2RhdGFfZWR1Jm5hdl9jb2RlPWVkdTE2MjIxODE1MjEmY29kZT1ad0tKWGZOaWVvem8mc2VhcmNoX2l0ZW09JnNlYXJjaF9vcmRlcj0mb3JkZXJfbGlzdD0mbGlzdF9zY2FsZT0mdmlld19sZXZlbD0mdmlld19jYXRlPSZ2aWV3X2NhdGUyPQ==", "content": "2025학년도 2학기 졸업(수료) 예정자 도서관 대출중지 안내\n등록일\n2025-12-11\n작성자\n교육학과\n조회수\n56\n도서관규정 제\n24\n조\n,\n제\n31\n조에 따라 졸업\n(\n수료\n)\n예정자는\n대출도서\n를\n반드시 반납\n하여야 하며\n,\n미 반납시 졸업\n(\n수료\n)\n에\n제재\n가 부여됩니다\n.\n이와 관련하여\n2025\n학년도\n2\n학기 졸업\n(\n수료\n)\n예정자에 대한 서비스를 다음과 같이 안내하오니\n적극 협조하여 주시기 바랍니다\n.\n가\n.\n대    상\n: 2025\n학년도\n2\n학기 학부 및 대학원 졸업\n(\n수료\n)\n예정자\n※\n대학원\n(\n석사\n,\n박사과정\n)\n입학 예정자\n:\n신규학번 부여 전\n,\n대출내역 미연동으로\n반납 필수\n나\n.\n반납기한\n: 2026. 2. 5.(\n목\n)\n까지\n※\n2026. 2. 6.(\n금\n)\n이후 대출 중지\n다\n.\n대출 중지 후 이용가능 서비스\n구분\n이용기한\n이용가능 서비스\n학부생\n수료\n한 학기\n∙\n신관 열람실 이용가능\n,\n대출불가\n졸업\n3\n년\n대학원생\n수료\n(\n미등록\n)\n2\n년\n∙\n신관 열람실 이용가능\n,\n학술\nDB\n이용가능\n,\n대출불가\n수료\n(\n등록예정\n)\n*\n한 학기\n∙\n(\n수료생등록 후\n)\n재학생과 동일한 서비스\n이용 가능\n졸업\n3\n년\n∙\n신관 열람실 이용가능\n,\n대출불가\n※\n2026\n년\n1\n학기 대학원 수료생 등록예정자\n:\n수료생 등록 전 도서대출을 원할 경우\n, [\n붙임\n1]\n「\n수료생 등록예정자 대출신청서\n」\n를 작성하여 도서관\n1\n층 대출데스크 또는\nlibdesk@knu.ac.kr\n로 제출\n라\n.\n기    타\n-\n동문회원 가입 시\n,\n대출 및 좌석\n·\n시설물 등 이용가능\n-\n문의사항\n:\n도서관 정보서비스팀\n(libdesk@knu.ac.kr\n☏\n4672~6)\n수료생 등록 예정자 대출신청서.hwp\n동문회원가입신청서.hwp", "images": [], "attachments": [{"name": "수료생 등록 예정자 대출신청서.hwp", "url": "https://home.knu.ac.kr/HOME/bbs/bbs_download.php?mv_data=aWR4PTE0NTAmc3RhcnRQYWdlPTEwJmxpc3RObz04MTEmdGFibGU9ZXhfYmJzX2RhdGFfZWR1Jm5hdl9jb2RlPWVkdTE2MjIxODE1MjEmc2l0ZV9jb2RlPWVkdSZjb2RlPVp3S0pYZk5pZW96byZzZWFyY2hfaXRlbT0mc2VhcmNoX29yZGVyPSZvcmRlcl9saXN0PSZsaXN0X3NjYWxlPQ==&download=h&seq=0"}, {"name": "동문회원가입신청서.hwp", "url": "https://home.knu.ac.kr/HOME/bbs/bbs_download.php?mv_data=aWR4PTE0NTAmc3RhcnRQYWdlPTEwJmxpc3RObz04MTEmdGFibGU9ZXhfYmJzX2RhdGFfZWR1Jm5hdl9jb2RlPWVkdTE2MjIxODE1MjEmc2l0ZV9jb2RlPWVkdSZjb2RlPVp3S0pYZk5pZW96byZzZWFyY2hfaXRlbT0mc2VhcmNoX29yZGVyPSZvcmRlcl9saXN0PSZsaXN0X3NjYWxlPQ==&download=h&seq=1"}]}
{"dept": "교육학과", "detail": "대학원", "title": "[2025학년도 국립대학육성사업] 대학원생, 박사후연수연구원 등 우수논문 장려금 지원 사업 시행 알림(~12.30.(화) 13..", "date": "2025-12-10", "url": "https://home.knu.ac.kr/HOME/edu/sub.htm?mode=view&mv_data=aWR4PTE0NDkmc3RhcnRQYWdlPTEwJmxpc3RObz04MTAmdGFibGU9ZXhfYmJzX2RhdGFfZWR1Jm5hdl9jb2RlPWVkdTE2MjIxODE1MjEmY29kZT1ad0tKWGZOaWVvem8mc2VhcmNoX2l0ZW09JnNlYXJjaF9vcmRlcj0mb3JkZXJfbGlzdD0mbGlzdF9zY2FsZT0mdmlld19sZXZlbD0mdmlld19jYXRlPSZ2aWV3X2NhdGUyPQ==", "content": "[2025학년도 국립대학육성사업] 대학원생, 박사후연수연구원 등 우수논문 장려금 지원 사업 시행 알림(~12.30.(화) 13시까지 신청)\n등록일\n2025-12-10\n작성자\n교육학과\n조회수\n105\n신진연구인력\n의\n연구 동기 부여\n및\n역량 강화\n를 위해\n‘2025\n학년도 국립대학육성사업\n’\n의 세부사업인\n「\n대학원생\n,\n박사후연수연구원 등 우수논문 장려금 지원\n」\n사업 계획을\n다음과 같이\n시행\n하오니\n해당\n연구자는\n기한 내 신청하여\n주시기 바랍니다\n.\n가\n.\n총 사업비\n: 247,000,000\n원\n(\n대학원생\n,\n박사후연수연구원 장려금 예산 합산\n)\n※\n추후 국립대학육성사업 중 추진내용 일부에서 추가 예산 확보 시 총 사업비 증액 예정\n나\n.\n장려금 신청대상\n: ‘\n붙임\n1, 2’\n참조\n1) 2025\n학년도 대학원 재학생\n(’25\n년\n8\n월 졸업생\n,\n수료후등록생 포함\n)\n2)\n총장의 발령을 받은 박사후연수연구원 및 전임연구원\n다\n.\n대상논문\n: 2025. 1. 1. ~ 2025. 12. 31.\n기간 동안 출판된 논문으로 저자\n(\n신청자\n)\n소속이 경북대학교\n(Kyungpook National University)\n로 표기되어 있는 논문\n※\n대학원생 재학\n(\n등록\n) /\n박사후연수연구원 등 재직 시기별 대상논문 발행 기간\n재학\n(\n등록\n) /\n재직 시기\n논문 발행 기간\n2025-1\n2025-2\n○\n○\n2025. 1. 1. ~ 2025. 12. 31.\n○\n2025. 1. 1. ~ 2025. 8. 31.\n○\n2025. 9. 1. ~ 2025. 12. 31.\n라\n.\n지원내용\n:\n최대\n5\n편\n/1\n인\n,\n신청 금액이 예산을 초과하는 경우 비례감액하여 지원\n마\n.\n제출서류\n:\n우수논문 장려금 지원 신청서 및 동의서\n[\n붙임\n5]\n,\n지급 신청서 총괄표\n[\n붙임\n6\n또는\n7]\n,\n증빙서류\n(\n대상 논문\n,\n학술지 등급 발췌 자료 등\n)\n*\n공문 제출\n*\n저자\n,\n소속\n,\n발행일\n,\n학술지명\n,\n사사\n,\n학술지 등급\n등을\n형광펜으로 표기\n하여\n제출\n(‘\n붙임\n3, 4’\n참조\n)\n*\n수료후등록생\n의 경우\n,\n등록금납입증명서\n추가 제출\n바\n.\n추진 일정\n1)\n신청기간 및 방법:\n2025. 12. 30.(화) 13:00까지 교육학과 이메일(edu5806@knu.ac.kr) 혹은 사무실(사범대학 823호)로 제출 (※기한 엄수)\n2)\n확인 및 장려금 지급\n: 2026. 2\n월 말 예정\n사\n.\n기타사항\n:\n’25\n년\n8\n월 졸업 후\n2\n학기 박사후연수연구원으로 재직 경우\n,\n각각 신청 가능\n붙임1. 2025학년도 대학원생 우수논문 장려금 지원 사업계획(안).hwp\n붙임2. 2025학년도 박사후연수연구원 및 전임연구원 우수논문 장려금 지원 사업계획(안).hwp\n붙임3. 2025학년도 대학원생 우수논문 장려금 관련 안내문(신청인용).hwp\n붙임4. 2025학년도 박사후연수연구원 등 우수논문 장려금 관련 안내문(신청인용).hwp\n붙임5. 2025학년도 우수논문 장려금 지원 신청서 및 동의서(개인작성용).hwp\n붙임6. 2025학년도 대학원생 우수논문 장려금 지급신청서 총괄표(수합용).xlsx\n붙임7. 2025학년도 박사후연수연구원 및 전임연구원 우수논문 장려금 지급신청서 총괄표(수합용)_수정.xlsx", "images": [], "attachments": [{"name": "붙임1. 2025학년도 대학원생 우수논문 장려금 지원 사업계획(안).hwp", "url": "https://home.knu.ac.kr/HOME/bbs/bbs_download.php?mv_data=aWR4PTE0NDkmc3RhcnRQYWdlPTEwJmxpc3RObz04MTAmdGFibGU9ZXhfYmJzX2RhdGFfZWR1Jm5hdl9jb2RlPWVkdTE2MjIxODE1MjEmc2l0ZV9jb2RlPWVkdSZjb2RlPVp3S0pYZk5pZW96byZzZWFyY2hfaXRlbT0mc2VhcmNoX29yZGVyPSZvcmRlcl9saXN0PSZsaXN0X3NjYWxlPQ==&download=h&seq=0"}, {"name": "붙임2. 2025학년도 박사후연수연구원 및 전임연구원 우수논문 장려금 지원 사업계획(안).hwp", "url": "https://home.knu.ac.kr/HOME/bbs/bbs_download.php?mv_data=aWR4PTE0NDkmc3RhcnRQYWdlPTEwJmxpc3RObz04MTAmdGFibGU9ZXhfYmJzX2RhdGFfZWR1Jm5hdl9jb2RlPWVkdTE2MjIxODE1MjEmc2l0ZV9jb2RlPWVkdSZjb2RlPVp3S0pYZk5pZW96byZzZWFyY2hfaXRlbT0mc2VhcmNoX29yZGVyPSZvcmRlcl9saXN0PSZsaXN0X3NjYWxlPQ==&download=h&seq=1"}, {"name": "붙임3. 2025학년도 대학원생 우수논문 장려금 관련 안내문(신청인용).hwp", "url": "https://home.knu.ac.kr/HOME/bbs/bbs_download.php?mv_data=aWR4PTE0NDkmc3RhcnRQYWdlPTEwJmxpc3RObz04MTAmdGFibGU9ZXhfYmJzX2RhdGFfZWR1Jm5hdl9jb2RlPWVkdTE2MjIxODE1MjEmc2l0ZV9jb2RlPWVkdSZjb2RlPVp3S0pYZk5pZW96byZzZWFyY2hfaXRlbT0mc2VhcmNoX29yZGVyPSZvcmRlcl9saXN0PSZsaXN0X3NjYWxlPQ==&download=h&seq=2"}, {"name": "붙임4. 2025학년도 박사후연수연구원 등 우수논문 장려금 관련 안내문(신청인용).hwp", "url": "https://home.knu.ac.kr/HOME/bbs/bbs_download.php?mv_data=aWR4PTE0NDkmc3RhcnRQYWdlPTEwJmxpc3RObz04MTAmdGFibGU9ZXhfYmJzX2RhdGFfZWR1Jm5hdl9jb2RlPWVkdTE2MjIxODE1MjEmc2l0ZV9jb2RlPWVkdSZjb2RlPVp3S0pYZk5pZW96byZzZWFyY2hfaXRlbT0mc2VhcmNoX29yZGVyPSZvcmRlcl9saXN0PSZsaXN0X3NjYWxlPQ==&download=h&seq=3"}, {"name": "붙임5. 2025학년도 우수논문 장려금 지원 신청서 및 동의서(개인작성용).hwp", "url": "https://home.knu.ac.kr/HOME/bbs/bbs_download.php?mv_data=aWR4PTE0NDkmc3RhcnRQYWdlPTEwJmxpc3RObz04MTAmdGFibGU9ZXhfYmJzX2RhdGFfZWR1Jm5hdl9jb2RlPWVkdTE2MjIxODE1MjEmc2l0ZV9jb2RlPWVkdSZjb2RlPVp3S0pYZk5pZW96byZzZWFyY2hfaXRlbT0mc2VhcmNoX29yZGVyPSZvcmRlcl9saXN0PSZsaXN0X3NjYWxlPQ==&download=h&seq=4"}, {"name": "붙임6. 2025학년도 대학원생 우수논문 장려금 지급신청서 총괄표(수합용).xlsx", "url": "https://home.knu.ac.kr/HOME/bbs/bbs_download.php?mv_data=aWR4PTE0NDkmc3RhcnRQYWdlPTEwJmxpc3RObz04MTAmdGFibGU9ZXhfYmJzX2RhdGFfZWR1Jm5hdl9jb2RlPWVkdTE2MjIxODE1MjEmc2l0ZV9jb2RlPWVkdSZjb2RlPVp3S0pYZk5pZW96byZzZWFyY2hfaXRlbT0mc2VhcmNoX29yZGVyPSZvcmRlcl9saXN0PSZsaXN0X3NjYWxlPQ==&download=h&seq=5"}, {"name": "붙임7. 2025학년도 박사후연수연구원 및 전임연구원 우수논문 장려금 지급신청서 총괄표(수합용)_수정.xlsx", "url": "https://home.knu.ac.kr/HOME/bbs/bbs_download.php?mv_data=aWR4PTE0NDkmc3RhcnRQYWdlPTEwJmxpc3RObz04MTAmdGFibGU9ZXhfYmJzX2RhdGFfZWR1Jm5hdl9jb2RlPWVkdTE2MjIxODE1MjEmc2l0ZV9jb2RlPWVkdSZjb2RlPVp3S0pYZk5pZW96byZzZWFyY2hfaXRlbT0mc2VhcmNoX29yZGVyPSZvcmRlcl9saXN0PSZsaXN0X3NjYWxlPQ==&download=h&seq=6"}]}
{"dept": "교육학과", "detail": "대학원", "title": "2026학년도 1학기 대학원 재학생 나눔장학금(장애학생) 신청 안내", "date": "2025-12-09", "url": "https://home.knu.ac.kr/HOME/edu/sub.htm?mode=view&mv_data=aWR4PTE0NDUmc3RhcnRQYWdlPTEwJmxpc3RObz04MDkmdGFibGU9ZXhfYmJzX2RhdGFfZWR1Jm5hdl9jb2RlPWVkdTE2MjIxODE1MjEmY29kZT1ad0tKWGZOaWVvem8mc2VhcmNoX2l0ZW09JnNlYXJjaF9vcmRlcj0mb3JkZXJfbGlzdD0mbGlzdF9zY2FsZT0mdmlld19sZXZlbD0mdmlld19jYXRlPSZ2aWV3X2NhdGUyPQ==", "content": "2026학년도 1학기 대학원 재학생 나눔장학금(장애학생) 신청 안내\n등록일\n2025-12-09\n작성자\n교육학과\n조회수\n51\n2026\n학년도\n1\n학기 대학원 재학생 나눔장학금\n(\n장애학생\n)\n신청\n을 아래와 같이 안내드립니다.\n가\n.\n신청대상\n:\n대학원\n(\n일반\n,\n전문\n,\n특수\n)\n재학생\n(\n복학예정자 포함\n)\n중\n장애학생 본인\n※\n등록금 이월자\n,\n수업연한초과자\n,\n수료생 제외\n나\n.\n신청기간\n:\n2025. 12. 8.(\n월\n) ~ 2026. 1. 7.(\n수\n)\n다\n.\n신청방법\n:\n통합정보시스템\n(knuin.knu.ac.kr)\n온라인 신청\n※\n통합정보시스템\n→\n장학\n→\n학생신청장학\n→\n장학금신청서\n→\n해당 장학 신청\n(\n나눔장학금\nIII\n)\n라\n.\n신청자격\n:\n붙임파일 참고\n붙임\n2026\n학년도\n1\n학기 대학원 재학생 나눔장학금 신청 안내\n1\n부\n.\n끝\n.\n(붙임) 2026학년도 1학기 대학원 재학생 나눔장학금 신청 안내.hwp", "images": [], "attachments": [{"name": "(붙임) 2026학년도 1학기 대학원 재학생 나눔장학금 신청 안내.hwp", "url": "https://home.knu.ac.kr/HOME/bbs/bbs_download.php?mv_data=aWR4PTE0NDUmc3RhcnRQYWdlPTEwJmxpc3RObz04MDkmdGFibGU9ZXhfYmJzX2RhdGFfZWR1Jm5hdl9jb2RlPWVkdTE2MjIxODE1MjEmc2l0ZV9jb2RlPWVkdSZjb2RlPVp3S0pYZk5pZW96byZzZWFyY2hfaXRlbT0mc2VhcmNoX29yZGVyPSZvcmRlcl9saXN0PSZsaXN0X3NjYWxlPQ==&download=h&seq=0"}]}
{"dept": "교육학과", "detail": "대학원", "title": "2026학년도 1학기 대학원 재학생 비전장학금(가계곤란) 신청 안내", "date": "2025-12-09", "url": "https://home.knu.ac.kr/HOME/edu/sub.htm?mode=view&mv_data=aWR4PTE0NDQmc3RhcnRQYWdlPTEwJmxpc3RObz04MDgmdGFibGU9ZXhfYmJzX2RhdGFfZWR1Jm5hdl9jb2RlPWVkdTE2MjIxODE1MjEmY29kZT1ad0tKWGZOaWVvem8mc2VhcmNoX2l0ZW09JnNlYXJjaF9vcmRlcj0mb3JkZXJfbGlzdD0mbGlzdF9zY2FsZT0mdmlld19sZXZlbD0mdmlld19jYXRlPSZ2aWV3X2NhdGUyPQ==", "content": "2026학년도 1학기 대학원 재학생 비전장학금(가계곤란) 신청 안내\n등록일\n2025-12-09\n작성자\n교육학과\n조회수\n61\n2026\n학년도\n1\n학기 대학원 재학생 비전장학금\n(\n가계곤란\n)\n신청\n을 아래와 같이 안내드립니다.\n가\n.\n신청대상\n:\n대학원 재학생\n(\n복학예정자 포함\n)\n중 가계곤란 학생\n(\n등록금 이월자\n,\n수업연한\n초과자\n,\n수료생 및 법학전문대학원생\n*\n제외\n)\n*\n법학전문대학원은 자체기준\n(\n학자금 지원구간 등\n)\n에 따라 별도 선발\n나\n.\n신청기간\n:\n2025. 12. 8.(\n월\n) ~ 2026. 1. 7.(\n수\n)\n다\n.\n신청방법\n:\n신청기간 내 관련서류를 구비\n,\n소속 학과 사무실에 제출\n※\n관련서류는\n【\n붙임\n】\n신청 안내문 참고\n라\n.\n행정사항:\n2026\n학년도\n1\n학기\n장학생 배정인원\n(\n추후 통보\n)\n에 포함하여 학과 추천 선발\n붙임\n2026\n학년도\n1\n학기 대학원 재학생 비전장학금 신청 안내\n1\n부\n.\n끝\n.\n(붙임) 2026학년도 1학기 대학원 재학생 비전장학금 신청 안내.hwp", "images": [], "attachments": [{"name": "(붙임) 2026학년도 1학기 대학원 재학생 비전장학금 신청 안내.hwp", "url": "https://home.knu.ac.kr/HOME/bbs/bbs_download.php?mv_data=aWR4PTE0NDQmc3RhcnRQYWdlPTEwJmxpc3RObz04MDgmdGFibGU9ZXhfYmJzX2RhdGFfZWR1Jm5hdl9jb2RlPWVkdTE2MjIxODE1MjEmc2l0ZV9jb2RlPWVkdSZjb2RlPVp3S0pYZk5pZW96byZzZWFyY2hfaXRlbT0mc2VhcmNoX29yZGVyPSZvcmRlcl9saXN0PSZsaXN0X3NjYWxlPQ==&download=h&seq=0"}]}
{"dept": "교육학과", "detail": "대학원", "title": "「2025학년도 대학원생 국제 학술대회 참가 경비 지원」사업 추가 예산 확보에 따른 사업 재개 안내", "date": "2025-12-08", "url": "https://home.knu.ac.kr/HOME/edu/sub.htm?mode=view&mv_data=aWR4PTE0NDMmc3RhcnRQYWdlPTEwJmxpc3RObz04MDcmdGFibGU9ZXhfYmJzX2RhdGFfZWR1Jm5hdl9jb2RlPWVkdTE2MjIxODE1MjEmY29kZT1ad0tKWGZOaWVvem8mc2VhcmNoX2l0ZW09JnNlYXJjaF9vcmRlcj0mb3JkZXJfbGlzdD0mbGlzdF9zY2FsZT0mdmlld19sZXZlbD0mdmlld19jYXRlPSZ2aWV3X2NhdGUyPQ==", "content": "「2025학년도 대학원생 국제 학술대회 참가 경비 지원」사업 추가 예산 확보에 따른 사업 재개 안내\n등록일\n2025-12-08\n작성자\n교육학과\n조회수\n22\n2025\n학년도 학술연구지원 사업 중\n「\n대학원생 국제 학술대회 참가 경비 지원\n」\n사업의 추가예산이 확보 됨에 따라\n,\n공문 및 원본 접수 순서대로\n경비 지급이 재개됨을 안내드립니다\n.\n끝\n.", "images": [], "attachments": []}
{"dept": "교육학과", "detail": "대학원", "title": "[교육대학원] 2025학년도 2학기 교육대학원 완성논문 제출 안내", "date": "2025-12-08", "url": "https://home.knu.ac.kr/HOME/edu/sub.htm?mode=view&mv_data=aWR4PTE0NDImc3RhcnRQYWdlPTEwJmxpc3RObz04MDYmdGFibGU9ZXhfYmJzX2RhdGFfZWR1Jm5hdl9jb2RlPWVkdTE2MjIxODE1MjEmY29kZT1ad0tKWGZOaWVvem8mc2VhcmNoX2l0ZW09JnNlYXJjaF9vcmRlcj0mb3JkZXJfbGlzdD0mbGlzdF9zY2FsZT0mdmlld19sZXZlbD0mdmlld19jYXRlPSZ2aWV3X2NhdGUyPQ==", "content": "[교육대학원] 2025학년도 2학기 교육대학원 완성논문 제출 안내\n등록일\n2025-12-08\n작성자\n교육학과\n조회수\n30\n※ 붙임파일 전체 필독 ※\n「\n2025\n학년도\n2\n학기 교육대학원 학위논문 심사 합격자에 대한 완성논문 접수\n」\n일정을 아래와 같이 알려드리니\n반드시\n제출일자를 엄수하여 제출\n하여 주시기 바랍니다\n.\n가\n.\n접수기간\n:\n2026. 1. 7.(\n수\n) ~ 1. 8.(\n목\n) 09:30~17:30 [2\n일간\n]\n※\n점심시간\n(12:00~13:00)\n제외\n나\n.\n접수장소\n: 교육대학원 행정실(사범대학 315호)\n※ 학과 사무실 제출 아닙니다!!!\n다.\n논문 제출부수\n:\n3\n부\n※\n심사위원이 직접 서명\n(\n날인\n)\n한 논문 제출 부수임\n(\n칼라 복사 또는 스캔 제출 시 접수 불가)\n※ 학과에서 서명(날인)해 주지 않음. 본인이 직접 서명(날인) 받은 후 제출하여야 함.\n라.\n첨부 제출서류\n:\n학위논문 저작권 동의서\n1\n부\n(\n완성논문 원문파일 제출 후 출력 가능\n,\n붙임\n2\n참조\n)\n마.\n완성논문 원문파일 접수\n(\n붙임\n2~5\n참조\n):\n2025. 12. 22.(월)~12. 30.(화)\n바.\n논문 인쇄와 제본 형식\n(\n붙임\n3\n참조\n)\n※\n교육대학원 논문 표지가 일반대학원 표지와 동일한 색상\n(\n레자크\n#64)\n임\n사. 특히\n,\n아래와 같은 경우에는 사전에 충분히 지도하시기 바랍니다\n.\n1)\n원문파일을 접수하고\n제출내역 조회에서\n처리완료 단계임을 확인한 후 인쇄\n할 것\n(\n제출 파일과 인쇄본이 동일하여야 함\n,\n승인은\n3-4\n일 정도 소요)\n2)\n논문심사 합격자 중\n완성논문 제출 연기 신청\n:\n「\n본교 학위수여규정\n」\n제\n25\n조\n2\n항에 따라 다음학기에 심사과정을 따로 거치지 않고 완성논문 제출 가능\n(\n반드시 붙임\n6\n신청서 첨부하여 공문으로 신청할 것\n)\n붙임\n1.\n학위청구논문 작성방법\n1\n부\n.\n2.\n학위논문 원문파일 제출 안내문\n1\n부\n.\n3. 교육\n대학원 학위논문 규격 예시\n1\n부\n.\n4.\n학위논문 원문제출방법 교육자료\n(\n국문\n) 1\n부\n.\n5.\n학위논문 원문제출방법 교육자료\n(\n영문\n) 1\n부\n.\n6.\n완성논문 제출연기 신청서\n1\n부\n.\n끝\n.\n첨부파일중 PDF미리보기\n파일 열람을 위해서는 아크로뱃 리더 설치가 필요합니다. 아래 링크를 클릭하여 리더를 다운로드 받으세요.\n첨부파일중 PDF미리보기\n파일 열람을 위해서는 아크로뱃 리더 설치가 필요합니다. 아래 링크를 클릭하여 리더를 다운로드 받으세요.\n1. 학위청구논문 작성 방법.hwp\n2. 원문파일 제출안내.hwp\n3. 학위논문 규격예시(2025.2학기).Zip\n4. (국문)학위논문 원문제출방법 교육자료(2025.2학기).pdf\n5. (Eng)Guide to Thesis and Dissertation Submission(2025.2학기).pdf\n6. 완성논문 제출연기 신청서.hwp", "images": ["http://www.adobe.com/images/shared/download_buttons/get_adobe_reader.png"], "attachments": [{"name": "1. 학위청구논문 작성 방법.hwp", "url": "https://home.knu.ac.kr/HOME/bbs/bbs_download.php?mv_data=aWR4PTE0NDImc3RhcnRQYWdlPTEwJmxpc3RObz04MDYmdGFibGU9ZXhfYmJzX2RhdGFfZWR1Jm5hdl9jb2RlPWVkdTE2MjIxODE1MjEmc2l0ZV9jb2RlPWVkdSZjb2RlPVp3S0pYZk5pZW96byZzZWFyY2hfaXRlbT0mc2VhcmNoX29yZGVyPSZvcmRlcl9saXN0PSZsaXN0X3NjYWxlPQ==&download=h&seq=0"}, {"name": "2. 원문파일 제출안내.hwp", "url": "https://home.knu.ac.kr/HOME/bbs/bbs_download.php?mv_data=aWR4PTE0NDImc3RhcnRQYWdlPTEwJmxpc3RObz04MDYmdGFibGU9ZXhfYmJzX2RhdGFfZWR1Jm5hdl9jb2RlPWVkdTE2MjIxODE1MjEmc2l0ZV9jb2RlPWVkdSZjb2RlPVp3S0pYZk5pZW96byZzZWFyY2hfaXRlbT0mc2VhcmNoX29yZGVyPSZvcmRlcl9saXN0PSZsaXN0X3NjYWxlPQ==&download=h&seq=1"}, {"name": "3. 학위논문 규격예시(2025.2학기).Zip", "url": "https://home.knu.ac.kr/HOME/bbs/bbs_download.php?mv_data=aWR4PTE0NDImc3RhcnRQYWdlPTEwJmxpc3RObz04MDYmdGFibGU9ZXhfYmJzX2RhdGFfZWR1Jm5hdl9jb2RlPWVkdTE2MjIxODE1MjEmc2l0ZV9jb2RlPWVkdSZjb2RlPVp3S0pYZk5pZW96byZzZWFyY2hfaXRlbT0mc2VhcmNoX29yZGVyPSZvcmRlcl9saXN0PSZsaXN0X3NjYWxlPQ==&download=h&seq=2"}, {"name": "4. (국문)학위논문 원문제출방법 교육자료(2025.2학기).pdf", "url": "https://home.knu.ac.kr/HOME/bbs/bbs_download.php?mv_data=aWR4PTE0NDImc3RhcnRQYWdlPTEwJmxpc3RObz04MDYmdGFibGU9ZXhfYmJzX2RhdGFfZWR1Jm5hdl9jb2RlPWVkdTE2MjIxODE1MjEmc2l0ZV9jb2RlPWVkdSZjb2RlPVp3S0pYZk5pZW96byZzZWFyY2hfaXRlbT0mc2VhcmNoX29yZGVyPSZvcmRlcl9saXN0PSZsaXN0X3NjYWxlPQ==&download=h&seq=3"}, {"name": "5. (Eng)Guide to Thesis and Dissertation Submission(2025.2학기).pdf", "url": "https://home.knu.ac.kr/HOME/bbs/bbs_download.php?mv_data=aWR4PTE0NDImc3RhcnRQYWdlPTEwJmxpc3RObz04MDYmdGFibGU9ZXhfYmJzX2RhdGFfZWR1Jm5hdl9jb2RlPWVkdTE2MjIxODE1MjEmc2l0ZV9jb2RlPWVkdSZjb2RlPVp3S0pYZk5pZW96byZzZWFyY2hfaXRlbT0mc2VhcmNoX29yZGVyPSZvcmRlcl9saXN0PSZsaXN0X3NjYWxlPQ==&download=h&seq=4"}, {"name": "6. 완성논문 제출연기 신청서.hwp", "url": "https://home.knu.ac.kr/HOME/bbs/bbs_download.php?mv_data=aWR4PTE0NDImc3RhcnRQYWdlPTEwJmxpc3RObz04MDYmdGFibGU9ZXhfYmJzX2RhdGFfZWR1Jm5hdl9jb2RlPWVkdTE2MjIxODE1MjEmc2l0ZV9jb2RlPWVkdSZjb2RlPVp3S0pYZk5pZW96byZzZWFyY2hfaXRlbT0mc2VhcmNoX29yZGVyPSZvcmRlcl9saXN0PSZsaXN0X3NjYWxlPQ==&download=h&seq=5"}]}
{"dept": "교육학과", "detail": "대학원", "title": "[일반대학원] 2025학년도 2학기 대학원 완성논문 제출 안내", "date": "2025-12-04", "url": "https://home.knu.ac.kr/HOME/edu/sub.htm?mode=view&mv_data=aWR4PTE0NDAmc3RhcnRQYWdlPTEwJmxpc3RObz04MDUmdGFibGU9ZXhfYmJzX2RhdGFfZWR1Jm5hdl9jb2RlPWVkdTE2MjIxODE1MjEmY29kZT1ad0tKWGZOaWVvem8mc2VhcmNoX2l0ZW09JnNlYXJjaF9vcmRlcj0mb3JkZXJfbGlzdD0mbGlzdF9zY2FsZT0mdmlld19sZXZlbD0mdmlld19jYXRlPSZ2aWV3X2NhdGUyPQ==", "content": "[일반대학원] 2025학년도 2학기 대학원 완성논문 제출 안내\n등록일\n2025-12-04\n작성자\n교육학과\n조회수\n50\n※ 붙임파일 전체 필독 ※\n「\n2025\n학년도\n2\n학기 일반대학원 및 전문대학원 학위논문 심사 합격자에 대한 완성논문 접수\n」\n일정을 아래와 같이 알려드리니\n,\n반드시\n계열별 제출일자를 엄수하여 제출\n하여 주시기 바랍니다\n.\n가\n.\n접수기간\n: 아래 참고\n※\n점심시간\n(12:00~13:00)\n제외\n일 자\n제출시간\n계열별 접수대상 논문\n비고\n1. 8.(목)\n오후\n13:00~17:30\n사범계열\n,\n공학\n2(IT\n계열\n,\n융합계열\n),\n의학\n/\n치의학\n/\n수의학\n/\n간호학\n/\n약학\n,\n이학논문\n이학논문\n(\n의과학과\n,\n치의과학과\n)\n1. 9.(금)\n오전\n09:30~12:00\n1. 8.(목) 미제출자\n나\n.\n접수장소\n:\n본교\n중앙도서관\n1\n층 다목적실\n(\n주출입문\n:\n중앙도서관 구관 입구)\n※ 학과 사무실 제출 아닙니다!!!\n다\n.\n논문 제출부수\n:\n석사\n3\n부\n,\n박사\n3\n부\n※\n심사위원이 직접 서명\n(\n날인\n)\n한 논문 제출 부수임\n(\n칼라 복사 또는 스캔 제출 시 접수 불가)\n※ 본인이 직접 심사위원에게 서명(날인) 받은 후 제출하여야 함\n라\n.\n첨부 제출서류\n:\n학위논문 저작권 동의서\n1\n부\n(\n완성논문 원문파일 제출 후 출력 가능\n,\n붙임\n2\n참조\n)\n마.\n완성논문 원문파일 접수\n(\n붙임\n2~5\n참조\n): 2025. 12. 22.(월) ~ 12. 30.(화)\n바.\n논문 인쇄와 제본 형식\n(\n붙임\n3\n참조\n): 각 전공별로 상이할 수 있으니 지도교수에게 문의\n사. 특히\n,\n아래 내용은 반드시 확인하여 주시기 바랍니다.\n1)\n2025. 1\n학기 완성논문 제출 연기 학생\n(\n붙임\n6):\n반드시 완성논문 제출\n(\n미제출시 불합격)\n2)\n원문파일을 접수하고\n최종 승인을 받은 후 인쇄\n할 것\n(\n제출 파일과 인쇄본이 동일하여야 함\n)\n3)\n논문심사 합격자 중\n완성논문 제출 연기 신청\n:\n「\n본교 학위수여규정\n」\n제\n25\n조\n2\n항에 따라 다음학기에 심사과정을 따로 거치지 않고 완성논문 제출 가능\n(\n반드시 붙임\n7\n신청서 첨부하여 공문으로 신청할 것\n)\n​아.\n특수대학원(교육대학원) 완성논문\n은 완성논문 제출기간에\n교육대학원 행정실(사범대학 315호)에 직접 제출\n붙임\n1.\n학위청구논문 작성방법\n1\n부\n.\n2.\n학위논문 원문파일 제출 안내문\n1\n부\n.\n3.\n일반대학원 학위논문 규격 예시\n1\n부\n.\n4. 학위논문 원문제출방법 교육자료\n(\n국문\n) 1\n부\n.\n5.\n학위논문 원문제출방법 교육자료\n(\n영문\n) 1\n부\n.\n6.\n완성논문 제출연기 신청서\n1\n부\n.\n끝\n.\n첨부파일중 PDF미리보기\n파일 열람을 위해서는 아크로뱃 리더 설치가 필요합니다. 아래 링크를 클릭하여 리더를 다운로드 받으세요.\n첨부파일중 PDF미리보기\n파일 열람을 위해서는 아크로뱃 리더 설치가 필요합니다. 아래 링크를 클릭하여 리더를 다운로드 받으세요.\n1. 학위청구논문 작성 방법.hwp\n2. 원문파일 제출안내.hwp\n3. 학위논문 규격예시(2025.2학기).zip\n4. (국문)학위논문 원문제출방법 교육자료(2025.2학기).pdf\n5. (Eng)Guide to Thesis and Dissertation Submission(2025.2학기).pdf\n6. 완성논문 제출연기 신청서.hwp", "images": ["http://www.adobe.com/images/shared/download_buttons/get_adobe_reader.png"], "attachments": [{"name": "1. 학위청구논문 작성 방법.hwp", "url": "https://home.knu.ac.kr/HOME/bbs/bbs_download.php?mv_data=aWR4PTE0NDAmc3RhcnRQYWdlPTEwJmxpc3RObz04MDUmdGFibGU9ZXhfYmJzX2RhdGFfZWR1Jm5hdl9jb2RlPWVkdTE2MjIxODE1MjEmc2l0ZV9jb2RlPWVkdSZjb2RlPVp3S0pYZk5pZW96byZzZWFyY2hfaXRlbT0mc2VhcmNoX29yZGVyPSZvcmRlcl9saXN0PSZsaXN0X3NjYWxlPQ==&download=h&seq=0"}, {"name": "2. 원문파일 제출안내.hwp", "url": "https://home.knu.ac.kr/HOME/bbs/bbs_download.php?mv_data=aWR4PTE0NDAmc3RhcnRQYWdlPTEwJmxpc3RObz04MDUmdGFibGU9ZXhfYmJzX2RhdGFfZWR1Jm5hdl9jb2RlPWVkdTE2MjIxODE1MjEmc2l0ZV9jb2RlPWVkdSZjb2RlPVp3S0pYZk5pZW96byZzZWFyY2hfaXRlbT0mc2VhcmNoX29yZGVyPSZvcmRlcl9saXN0PSZsaXN0X3NjYWxlPQ==&download=h&seq=1"}, {"name": "3. 학위논문 규격예시(2025.2학기).zip", "url": "https://home.knu.ac.kr/HOME/bbs/bbs_download.php?mv_data=aWR4PTE0NDAmc3RhcnRQYWdlPTEwJmxpc3RObz04MDUmdGFibGU9ZXhfYmJzX2RhdGFfZWR1Jm5hdl9jb2RlPWVkdTE2MjIxODE1MjEmc2l0ZV9jb2RlPWVkdSZjb2RlPVp3S0pYZk5pZW96byZzZWFyY2hfaXRlbT0mc2VhcmNoX29yZGVyPSZvcmRlcl9saXN0PSZsaXN0X3NjYWxlPQ==&download=h&seq=2"}, {"name": "4. (국문)학위논문 원문제출방법 교육자료(2025.2학기).pdf", "url": "https://home.knu.ac.kr/HOME/bbs/bbs_download.php?mv_data=aWR4PTE0NDAmc3RhcnRQYWdlPTEwJmxpc3RObz04MDUmdGFibGU9ZXhfYmJzX2RhdGFfZWR1Jm5hdl9jb2RlPWVkdTE2MjIxODE1MjEmc2l0ZV9jb2RlPWVkdSZjb2RlPVp3S0pYZk5pZW96byZzZWFyY2hfaXRlbT0mc2VhcmNoX29yZGVyPSZvcmRlcl9saXN0PSZsaXN0X3NjYWxlPQ==&download=h&seq=3"}, {"name": "5. (Eng)Guide to Thesis and Dissertation Submission(2025.2학기).pdf", "url": "https://home.knu.ac.kr/HOME/bbs/bbs_download.php?mv_data=aWR4PTE0NDAmc3RhcnRQYWdlPTEwJmxpc3RObz04MDUmdGFibGU9ZXhfYmJzX2RhdGFfZWR1Jm5hdl9jb2RlPWVkdTE2MjIxODE1MjEmc2l0ZV9jb2RlPWVkdSZjb2RlPVp3S0pYZk5pZW96byZzZWFyY2hfaXRlbT0mc2VhcmNoX29yZGVyPSZvcmRlcl9saXN0PSZsaXN0X3NjYWxlPQ==&download=h&seq=4"}, {"name": "6. 완성논문 제출연기 신청서.hwp", "url": "https://home.knu.ac.kr/HOME/bbs/bbs_download.php?mv_data=aWR4PTE0NDAmc3RhcnRQYWdlPTEwJmxpc3RObz04MDUmdGFibGU9ZXhfYmJzX2RhdGFfZWR1Jm5hdl9jb2RlPWVkdTE2MjIxODE1MjEmc2l0ZV9jb2RlPWVkdSZjb2RlPVp3S0pYZk5pZW96byZzZWFyY2hfaXRlbT0mc2VhcmNoX29yZGVyPSZvcmRlcl9saXN0PSZsaXN0X3NjYWxlPQ==&download=h&seq=5"}]}
{"dept": "교육학과", "detail": "대학원", "title": "[교육대학원 상담심리전공 양성과정] 2025학년도 2학기 교직 적성 및 인성검사(3차) 대상자 확정 및 시행 안내", "date": "2025-11-27", "url": "https://home.knu.ac.kr/HOME/edu/sub.htm?mode=view&mv_data=aWR4PTE0Mzgmc3RhcnRQYWdlPTEwJmxpc3RObz04MDQmdGFibGU9ZXhfYmJzX2RhdGFfZWR1Jm5hdl9jb2RlPWVkdTE2MjIxODE1MjEmY29kZT1ad0tKWGZOaWVvem8mc2VhcmNoX2l0ZW09JnNlYXJjaF9vcmRlcj0mb3JkZXJfbGlzdD0mbGlzdF9zY2FsZT0mdmlld19sZXZlbD0mdmlld19jYXRlPSZ2aWV3X2NhdGUyPQ==", "content": "[교육대학원 상담심리전공 양성과정] 2025학년도 2학기 교직 적성 및 인성검사(3차) 대상자 확정 및 시행 안내\n등록일\n2025-11-27\n작성자\n교육학과\n조회수\n32\n2025학년도 2학기 교직 적성 및 인성검사(3차) 대상자를 다음과 같이 송부하오니 해당 학생들은 검사에 반드시 참석하여 주시기 바랍니다.\n가. 신청 대상: 교직과정 이수 예정자(사범대학, 교육대학원 포함) ※ 휴학 및 수료생 포함\n나. 신청 인원: 총 131명(학부 116명, 교육대학원 15명)\n다.\n검사 일시: 2025. 12. 2.(화) 19:00 ~ 19:50(50분)\n라. 검사 장소: 2개 검사장(글로벌플라자 경하홀Ⅰ‧Ⅱ)\n마. 고사장, 입실시간 등 확인: [통합정보시스템-교직-교직적성및인성검사관리-고사장유의사항확인]\n바.\n응시자 유의사항[붙임]\n1) 18시 50분까지 해당 고사장 입실 완료\n2) 응시자 준비물: 컴퓨터용사인펜, 신분증[주민등록증, 여권, 운전면허증, (모바일)학생증], 수정테이프(수정액 사용 불가)\n사. 결과 확정: 2025. 12. 5.(금)[예정]\n유의사항(응시자)) 수정001.jpg", "images": ["./data/images/df6e2f83-1db7-41ab-99fd-b050dbb29dd3.png"], "attachments": [{"name": "유의사항(응시자)) 수정001.jpg", "url": "https://home.knu.ac.kr/HOME/bbs/bbs_download.php?mv_data=aWR4PTE0Mzgmc3RhcnRQYWdlPTEwJmxpc3RObz04MDQmdGFibGU9ZXhfYmJzX2RhdGFfZWR1Jm5hdl9jb2RlPWVkdTE2MjIxODE1MjEmc2l0ZV9jb2RlPWVkdSZjb2RlPVp3S0pYZk5pZW96byZzZWFyY2hfaXRlbT0mc2VhcmNoX29yZGVyPSZvcmRlcl9saXN0PSZsaXN0X3NjYWxlPQ==&download=h&seq=0"}]}
{"dept": "교육학과", "detail": "대학원", "title": "[교육대학원 상담심리전공 양성과정] 2026년 2월 교원자격증 취득예정자에 대한 마약·대마·향정신성의약품 중독여부 검사 안내", "date": "2025-11-24", "url": "https://home.knu.ac.kr/HOME/edu/sub.htm?mode=view&mv_data=aWR4PTE0MzQmc3RhcnRQYWdlPTEwJmxpc3RObz04MDMmdGFibGU9ZXhfYmJzX2RhdGFfZWR1Jm5hdl9jb2RlPWVkdTE2MjIxODE1MjEmY29kZT1ad0tKWGZOaWVvem8mc2VhcmNoX2l0ZW09JnNlYXJjaF9vcmRlcj0mb3JkZXJfbGlzdD0mbGlzdF9zY2FsZT0mdmlld19sZXZlbD0mdmlld19jYXRlPSZ2aWV3X2NhdGUyPQ==", "content": "[교육대학원 상담심리전공 양성과정] 2026년 2월 교원자격증 취득예정자에 대한 마약·대마·향정신성의약품 중독여부 검사 안내\n등록일\n2025-11-24\n작성자\n교육학과\n조회수\n47\n2026년 2월 교원자격증 취득예정자 중 마약‧대마‧향정신성의약품 중독자 여부 판별과 관련하여 다음과 같이 안내드립니다.\n해당 학생들은 교원자격무시험검정 신청 전에 검사를 완료할 수 있도록 사전에 준비하여 주시기 바랍니다. (관련:「유아교육법」제22조의2 및「초‧중등교육법」제21조의2)\n가. 대상: 2026년 2월 졸업예정자 중 교직과정 이수자(사범대학, 교육대학원 포함)\n나. 마약‧대마‧향정신성의약품 중독여부 검사:\nTBPE검사, 4대 마약 시약 검사 등\n다. 제출서류:\n검사결과통보서 또는 의사진단서\n라. 제출기간: 교원자격무시험검정 신청 시 제출  (※ ’26년 2월 교원자격무시험검정 신청 기간은 추후 안내)\n마. 안내사항\n- 검사 후 결과(검사결과통보서 또는 진단서) 확인에 일정 기한(3~15일)이 소요되니\n사전에 준비\n- 무시험검정 신청일 기준 1년 이내에 검진 발급한 서류 인정\n※ ’25. 2월∼ ’26. 2월 교원자격무시험검정 신청 시까지 검사 결과 인정\n붙임  마약 등 중독자 여부 판별 서류 안내 1부.  끝.\n* 대구/경북 외 의료기관 현황은 학과 사무실로 문의(붙임의 참고 3)\n마약 등 중독자 여부 판별 서류 안내(251118).hwp", "images": [], "attachments": [{"name": "마약 등 중독자 여부 판별 서류 안내(251118).hwp", "url": "https://home.knu.ac.kr/HOME/bbs/bbs_download.php?mv_data=aWR4PTE0MzQmc3RhcnRQYWdlPTEwJmxpc3RObz04MDMmdGFibGU9ZXhfYmJzX2RhdGFfZWR1Jm5hdl9jb2RlPWVkdTE2MjIxODE1MjEmc2l0ZV9jb2RlPWVkdSZjb2RlPVp3S0pYZk5pZW96byZzZWFyY2hfaXRlbT0mc2VhcmNoX29yZGVyPSZvcmRlcl9saXN0PSZsaXN0X3NjYWxlPQ==&download=h&seq=0"}]}
{"dept": "교육학과", "detail": "대학원", "title": "[교육대학원 상담심리전공 양성과정] 2025학년도 2학기 교직 적성 및 인성검사(3차) 시행 안내", "date": "2025-11-17", "url": "https://home.knu.ac.kr/HOME/edu/sub.htm?mode=view&mv_data=aWR4PTE0MzImc3RhcnRQYWdlPTEwJmxpc3RObz04MDImdGFibGU9ZXhfYmJzX2RhdGFfZWR1Jm5hdl9jb2RlPWVkdTE2MjIxODE1MjEmY29kZT1ad0tKWGZOaWVvem8mc2VhcmNoX2l0ZW09JnNlYXJjaF9vcmRlcj0mb3JkZXJfbGlzdD0mbGlzdF9zY2FsZT0mdmlld19sZXZlbD0mdmlld19jYXRlPSZ2aWV3X2NhdGUyPQ==", "content": "[교육대학원 상담심리전공 양성과정] 2025학년도 2학기 교직 적성 및 인성검사(3차) 시행 안내\n등록일\n2025-11-17\n작성자\n교육학과\n조회수\n42\n2025학년도 2학기 교직 적성 및 인성검사(3차)를 다음과 같이 시행하오니 해당 학생들은 기간 내 신청하여 검사를 받을 수 있도록 하여 주시기 바랍니다.\n가. 검사 개요\n1) 검사 인원 및 대상: 교직과정 이수자(사범대학, 교육대학원 포함)\n※ 휴학 및 수료생 포함\n2) 검사 방법: 정량평가\n3)\n검사 일시: 2025. 12. 2.(화) 19:00~19:50 (검사 시작 후 입실 불가)\n4) 검사 장소: 5개 검사장(글로벌플라자 경하홀Ⅰ·Ⅱ, 201, 203, 301호)\n5) 결과 확정: 2025. 12. 5.(금)[예정]\n- 부적격자의 경우, 별도의 온라인 교육을 이수해야 함 ※ 추후 별도 안내 예정\n나. 신청 방법\n1)\n신청 기간: 2025. 11. 24.(월) ~ 11. 26.(수) 매일 10:00 ~ 17:00\n※ 등록 학기별 신청 가능 기간 상이\n신청 기간\n대상\n(\n등록횟수\n)\n비고\n11. 24.(\n월\n)\n∼\n11. 26.(\n수\n)\n매일\n10:00-17:00\n교육대학원\n:\n4\n학기 이상\n11. 25.(\n화\n)\n～\n11. 26.(\n수\n)\n매일\n10:00-17:00\n교육대학원\n:\n3\n학기 이상\n11. 26.(\n수\n)  10:00-17:00\n모두 가능\n2) 신청 방법: 온라인으로만 신청 가능 > 통합정보시스템(\nhttp://knuin.knu.ac.kr)\n로그인 -\n교직 - 교직적성및인성검사관리 - 교직적성및인성검사신청\n다. 교원자격증 발급을 위한 교직 적성 및 인성검사 충족 요건\n구 분\n충족 요건\n참고사항\n기준연도\n2012\n년 이전 학생\n적격 판정\n1\n회\n-\n평가\n(\n정량\n,\n정성\n)\n종류 구별없음\n기준연도\n2013\n년 이후 학생\n적격 판정\n2\n회\n라. 아울러\n2026년 2월(기 수료자 포함) 또는 8월 졸업예정자 중 교직 적성 및 인성검사 기준을 충족하지 못한 학생은 반드시 신청 및 참여\n하여 주시기 바랍니다.\n첨부파일중 PDF미리보기\n파일 열람을 위해서는 아크로뱃 리더 설치가 필요합니다. 아래 링크를 클릭하여 리더를 다운로드 받으세요.\n교직 적성 및 인성검사 학생 신청.pdf\n2025학년도 2학기 교직 적성 및 인성검사(3차) 시행 계획.hwp", "images": ["http://www.adobe.com/images/shared/download_buttons/get_adobe_reader.png"], "attachments": [{"name": "교직 적성 및 인성검사 학생 신청.pdf", "url": "https://home.knu.ac.kr/HOME/bbs/bbs_download.php?mv_data=aWR4PTE0MzImc3RhcnRQYWdlPTEwJmxpc3RObz04MDImdGFibGU9ZXhfYmJzX2RhdGFfZWR1Jm5hdl9jb2RlPWVkdTE2MjIxODE1MjEmc2l0ZV9jb2RlPWVkdSZjb2RlPVp3S0pYZk5pZW96byZzZWFyY2hfaXRlbT0mc2VhcmNoX29yZGVyPSZvcmRlcl9saXN0PSZsaXN0X3NjYWxlPQ==&download=h&seq=0"}, {"name": "2025학년도 2학기 교직 적성 및 인성검사(3차) 시행 계획.hwp", "url": "https://home.knu.ac.kr/HOME/bbs/bbs_download.php?mv_data=aWR4PTE0MzImc3RhcnRQYWdlPTEwJmxpc3RObz04MDImdGFibGU9ZXhfYmJzX2RhdGFfZWR1Jm5hdl9jb2RlPWVkdTE2MjIxODE1MjEmc2l0ZV9jb2RlPWVkdSZjb2RlPVp3S0pYZk5pZW96byZzZWFyY2hfaXRlbT0mc2VhcmNoX29yZGVyPSZvcmRlcl9saXN0PSZsaXN0X3NjYWxlPQ==&download=h&seq=1"}]}
{"dept": "교육학과", "detail": "대학원", "title": "[상담심리전공] 2025년 2학기 논문공개 발표회", "date": "2025-10-30", "url": "https://home.knu.ac.kr/HOME/edu/sub.htm?mode=view&mv_data=aWR4PTE0MjUmc3RhcnRQYWdlPTIwJmxpc3RObz04MDEmdGFibGU9ZXhfYmJzX2RhdGFfZWR1Jm5hdl9jb2RlPWVkdTE2MjIxODE1MjEmY29kZT1ad0tKWGZOaWVvem8mc2VhcmNoX2l0ZW09JnNlYXJjaF9vcmRlcj0mb3JkZXJfbGlzdD0mbGlzdF9zY2FsZT0mdmlld19sZXZlbD0mdmlld19jYXRlPSZ2aWV3X2NhdGUyPQ==", "content": "[상담심리전공] 2025년 2학기 논문공개 발표회\n등록일\n2025-10-30\n작성자\n교육학과\n조회수\n93\n2025\n년\n2\n학기 논문공개 발표회 일정 및 참가 신청 안내드립니다\n.\n1.\n일 시\n: 2025\n년\n11\n월\n7\n일\n(\n금\n) 10 : 30 ~ 11 : 50\n2.\n장 소\n:\n온라인\n(Zoom)\n3.\n발표인원\n: 2\n명\n(\n석사\n1\n명\n,\n박사\n1\n명\n)\n4.\n참가희망\n:\n구글폼 링크 신청\nhttps://forms.gle/CLzx2mEr3qSo5Y2MA\n*\n참가 신청은\n11\n월\n3\n일\n(\n월\n)\n까지 부탁드립니다\n.\n5.\n발표회 세부일정\n시 간\n진 행\n발표자\n소요시간\n(\n피드백 시간\n)\n연구방법\n비 고\n10:30\n~11:30\n개식사\n사회자\n10:30 ~ 10:35\n-\n*\n발표방법\n: PPT\n준비\n발표는\n1\n인당\n석사\n15\n분\n,\n박사\n20\n분\n발표\n이후\n주제별\n피드백\n예정\n발표\n1\n전진영\n(\n일\n24)\n10:35 ~ 10:50\n(10:50 ~ 11:00)\n질적연구\n발표\n2\n변소연\n(\n일\n20)\n11:00 ~ 11:20\n(11:20 ~ 11:30)\n질적연구\n11:30\n~11:50\n마무리\n김은영\n교수님\n백성은\n교수님\n11:30 ~ 11:50\n전체 총평\n*\n사정에 따라 진행 시간이 변동될 수 있습니다\n.\n5.\n발표자 정보\n구분\n발표자\n제목\n연구방법\n석사\n전진영\n(\n일\n24)\n경계선 지적 기능 위험군 자녀를 둔 부모의 양육경험\n:\n포\n.\n커스 그룹 인터뷰 연구\n질적연구\n박사\n변소연\n(\n일\n20)\n자살위기 상담에서 상담자 경험의 근거이론연구\n-\n정신화과정을 중심으로\n질적연구", "images": [], "attachments": []}
{"dept": "교육학과", "detail": "대학원", "title": "[교육대학원 상담심리전공 양성과정] 2025학년도 2학기 응급처치 및 심폐소생술 실습 신청자 명단 및 일정/장소 안내", "date": "2025-10-21", "url": "https://home.knu.ac.kr/HOME/edu/sub.htm?mode=view&mv_data=aWR4PTE0MjAmc3RhcnRQYWdlPTIwJmxpc3RObz04MDAmdGFibGU9ZXhfYmJzX2RhdGFfZWR1Jm5hdl9jb2RlPWVkdTE2MjIxODE1MjEmY29kZT1ad0tKWGZOaWVvem8mc2VhcmNoX2l0ZW09JnNlYXJjaF9vcmRlcj0mb3JkZXJfbGlzdD0mbGlzdF9zY2FsZT0mdmlld19sZXZlbD0mdmlld19jYXRlPSZ2aWV3X2NhdGUyPQ==", "content": "[교육대학원 상담심리전공 양성과정] 2025학년도 2학기 응급처치 및 심폐소생술 실습 신청자 명단 및 일정/장소 안내\n등록일\n2025-10-21\n작성자\n교육학과\n조회수\n44\n가. 신청 현황 확인: 통합정보시스템-교직-응급처치및심폐소생술실습-응급처치및심폐소생술실습결과조회-신청실습결과목록\n나. 실습 기간 및 장소:\n2025. 11. 3.(월) ~ 11. 4.(화), 글로벌플라자 경하홀Ⅰ․Ⅱ\n(개별 상이하니 필수 확인)\n다. 소요 시간: 3시간\n라. 준비물: 운동화 착용, 신분증 지참[주민등록증, 운전면허증, (모바일)학생증 등]\n마. 유의사항: 불참할 경우 다음 회차 응급처치 및 심폐소생술 실습 신청 시 패널티 부여\n2025학년도 2학기 응급처치 및 심폐소생술 실습 신청자 명단\n대학\n(\n원\n)\n전공\n학번\n자격종별\n기준연도\n실습차수\n실습일자\n시작시간\n종료시간\n실습장소\n교육대학원\n상담심리전공\n2024001381\n전문상담교사(2급)\n2024\n10\n2025-11-04\n18:30\n21:30\n글로벌플라자 경하홀Ⅱ\n교육대학원\n상담심리전공\n2024001404\n전문상담교사(2급)\n2024\n3\n2025-11-03\n18:30\n21:30\n글로벌플라자 경하홀Ⅰ\n교육대학원\n상담심리전공\n2024001438\n전문상담교사(2급)\n2024\n1\n2025-11-03\n13:30\n16:30\n글로벌플라자 경하홀Ⅰ\n교육대학원\n상담심리전공\n2024001467\n전문상담교사(2급)\n2024\n9\n2025-11-04\n18:30\n21:30\n글로벌플라자 경하홀Ⅰ\n교육대학원\n상담심리전공\n2024001515\n전문상담교사(2급)\n2024\n9\n2025-11-04\n18:30\n21:30\n글로벌플라자 경하홀Ⅰ\n교육대학원\n상담심리전공\n2024001565\n전문상담교사(2급)\n2024\n10\n2025-11-04\n18:30\n21:30\n글로벌플라자 경하홀Ⅱ\n교육대학원\n상담심리전공\n2024001570\n전문상담교사(2급)\n2024\n10\n2025-11-04\n18:30\n21:30\n글로벌플라자 경하홀Ⅱ", "images": [], "attachments": []}
{"dept": "교육학과", "detail": "대학원", "title": "「2025학년도 대학원생 국제 학술대회 참가 경비 지원」사업 예산 소진 안내", "date": "2025-10-20", "url": "https://home.knu.ac.kr/HOME/edu/sub.htm?mode=view&mv_data=aWR4PTE0MTgmc3RhcnRQYWdlPTIwJmxpc3RObz03OTkmdGFibGU9ZXhfYmJzX2RhdGFfZWR1Jm5hdl9jb2RlPWVkdTE2MjIxODE1MjEmY29kZT1ad0tKWGZOaWVvem8mc2VhcmNoX2l0ZW09JnNlYXJjaF9vcmRlcj0mb3JkZXJfbGlzdD0mbGlzdF9zY2FsZT0mdmlld19sZXZlbD0mdmlld19jYXRlPSZ2aWV3X2NhdGUyPQ==", "content": "「2025학년도 대학원생 국제 학술대회 참가 경비 지원」사업 예산 소진 안내\n등록일\n2025-10-20\n작성자\n교육학과\n조회수\n50\n1. 관련: 2025학년도 학술연구지원사업 계획 알림\n2. 2025학년도 학술연구지원 사업 중「대학원생 국제 학술대회 참가 경비 지원」사업의 예산이 소진되어, 2025. 10. 1. 공문 접수분까지만 경비 지급됨을 알려드립니다.\n3. 아울러, 추가 예산 확보 되는 경우 사업 재개 안내 예정이며, 공문 및 원본 접수 순대로 처리 될 예정임을 알려드립니다.  끝.", "images": [], "attachments": []}
{"dept": "교육학과", "detail": "대학원", "title": "2025학년도 2학기 대학원 학위논문 심사료 납부 안내", "date": "2025-10-14", "url": "https://home.knu.ac.kr/HOME/edu/sub.htm?mode=view&mv_data=aWR4PTE0MTcmc3RhcnRQYWdlPTIwJmxpc3RObz03OTgmdGFibGU9ZXhfYmJzX2RhdGFfZWR1Jm5hdl9jb2RlPWVkdTE2MjIxODE1MjEmY29kZT1ad0tKWGZOaWVvem8mc2VhcmNoX2l0ZW09JnNlYXJjaF9vcmRlcj0mb3JkZXJfbGlzdD0mbGlzdF9zY2FsZT0mdmlld19sZXZlbD0mdmlld19jYXRlPSZ2aWV3X2NhdGUyPQ==", "content": "2025학년도 2학기 대학원 학위논문 심사료 납부 안내\n등록일\n2025-10-14\n작성자\n교육학과\n조회수\n53\n2025학년도 2학기 대학원 학위논문 심사료 납부 대상자는 빠짐없이 납부하여 주시기 바랍니다.\n가. 납부기간:\n2025. 10. 20.(월) 09:00~10. 21.(화)\n16:00\n[2일]\n(고지서는 납부기간 중 본교 홈페이지 공지사항에서 출력 가능함)\n나. 납부방법: 개인별 가상계좌 입금\n다. 심 사 료: 석사 100,000원, 박사 및 석·박사통합과정 300,000원\n라. 납부인원: 1,042명〔기준일시: 10. 13.(월) 10시〕\n2020년 12월 신소라\n또한, 논문 제출예정자 중 기준일 이후 학위논문 제출 취소자는 납부하지 않아 주시고, 학위논문 제출예정자가 논문심사료 미납으로 인해 불이익을 받는 사례가 없도록 하여 주시기 바랍니다.", "images": [], "attachments": []}
{"dept": "교육학과", "detail": "대학원", "title": "[대구RISE사업] 청년 연구자 다자녀 가구 지원사업 신청기간 연장 안내", "date": "2025-10-14", "url": "https://home.knu.ac.kr/HOME/edu/sub.htm?mode=view&mv_data=aWR4PTE0MTUmc3RhcnRQYWdlPTIwJmxpc3RObz03OTcmdGFibGU9ZXhfYmJzX2RhdGFfZWR1Jm5hdl9jb2RlPWVkdTE2MjIxODE1MjEmY29kZT1ad0tKWGZOaWVvem8mc2VhcmNoX2l0ZW09JnNlYXJjaF9vcmRlcj0mb3JkZXJfbGlzdD0mbGlzdF9zY2FsZT0mdmlld19sZXZlbD0mdmlld19jYXRlPSZ2aWV3X2NhdGUyPQ==", "content": "[대구RISE사업] 청년 연구자 다자녀 가구 지원사업 신청기간 연장 안내\n등록일\n2025-10-14\n작성자\n교육학과\n조회수\n23\n가\n.\n신청기간 연장\n당  초\n변  경\n비  고\n2025. 10. 10.(\n금\n) 18:00\n까지\n2025. 10. 20.(\n월\n) 18:00\n까지\n[대구RISE사업] 청년 연구자 다자녀 가구 지원계획과 신청방법에 대해 다음과 같이 안내드리오니 대상자들의 많은 신청 바랍니다.\n가. (목    적) 청년연구자에 대한 생활비 지원을 통해 청년연구자의 대구광역시 정착유도 및 지역유입 촉진\n나.\n(신청자격) 대구광역시 거주 만 39세 이하 청년 연구자*로서, 자녀 2명 이상을 둔 기혼자\n* 청년연구자: 석사과정생 이상(사업 목적상 특수대학원생, 전문대학원생은 제외)\n다. (지원인원) 50명 내외\n※ 선발 기준과 형평성 등을 고려하여 지원자 선발 예정\n라.\n(지원금액 및 방법) 대구로페이 월 50만원 충전\n마. (지원기간)\n 1차년도: ΄25. 11월∼΄26. 2월(4개월)\n 총 사업기간: 5년(∼΄30. 2월)\n※ 2차년도는 별도의 사업계획 수립 후 시행 예정\n※ 총 사업기간은 5년이나, 상황에 따라 조기 종료될 수 있음\n바. 문의사항(이메일 문의만 가능): tjrgus2218@knu.ac.kr\n사. 기타 세부사항: [붙임] 참고\n붙임  청년연구자 다자녀 가구 지원 계획 1부.  끝.\n(붙임) 청년연구자 다자녀 가구 지원계획(신청기간 연장).hwp", "images": [], "attachments": [{"name": "(붙임) 청년연구자 다자녀 가구 지원계획(신청기간 연장).hwp", "url": "https://home.knu.ac.kr/HOME/bbs/bbs_download.php?mv_data=aWR4PTE0MTUmc3RhcnRQYWdlPTIwJmxpc3RObz03OTcmdGFibGU9ZXhfYmJzX2RhdGFfZWR1Jm5hdl9jb2RlPWVkdTE2MjIxODE1MjEmc2l0ZV9jb2RlPWVkdSZjb2RlPVp3S0pYZk5pZW96byZzZWFyY2hfaXRlbT0mc2VhcmNoX29yZGVyPSZvcmRlcl9saXN0PSZsaXN0X3NjYWxlPQ==&download=h&seq=0"}]}
{"dept": "교육학과", "detail": "대학원", "title": "[상담심리전공] 2025년 2학기 프로포절 및 야유회 일정 및 참가 신청 안내", "date": "2025-10-02", "url": "https://home.knu.ac.kr/HOME/edu/sub.htm?mode=view&mv_data=aWR4PTE0MTQmc3RhcnRQYWdlPTIwJmxpc3RObz03OTYmdGFibGU9ZXhfYmJzX2RhdGFfZWR1Jm5hdl9jb2RlPWVkdTE2MjIxODE1MjEmY29kZT1ad0tKWGZOaWVvem8mc2VhcmNoX2l0ZW09JnNlYXJjaF9vcmRlcj0mb3JkZXJfbGlzdD0mbGlzdF9zY2FsZT0mdmlld19sZXZlbD0mdmlld19jYXRlPSZ2aWV3X2NhdGUyPQ==", "content": "[상담심리전공] 2025년 2학기 프로포절 및 야유회 일정 및 참가 신청 안내\n등록일\n2025-10-02\n작성자\n교육학과\n조회수\n81\n2025\n년\n2\n학기 논문 프로포절 일정 및 참가 신청 안내드립니다\n.\n1.\n일시\n: 2025\n년\n10\n월\n18\n일\n(\n토\n), 10:00~15:00\n2.\n장소\n:\n사범대학\n216\n호\n3.\n발표인원\n: 5\n명\n(\n석사\n5\n명\n)\n4.\n참가희망\n:\n구글폼 링크 신청\nhttps://forms.gle/15YE4FD2VuVEL8w59\n*\n참가 신청은\n10\n월\n5\n일\n(\n일\n)\n까지 부탁드립니다\n.\n5.\n발표회 세부일정\n시 간\n진 행\n발표자\n소요시간\n(\n피드백 시간\n)\n연구방법\n비 고\n10:00~\n11:35\n개식사\n사회자\n10:00 ~ 10:05\n-\n*\n발표방법\n: PPT\n준비\n발표는\n1\n인당\n석사\n15\n분\n,\n박사\n20\n분\n.\n이후\n주제별\n피드백\n예정\n발표\n1\n김나연\n(\n일\n24)\n김소정\n(\n교\n24)\n10:05 ~ 10:35\n(10:35 ~ 10:55)\n양적연구\n메타분석\n쉬는\n시간\n10:55~11:05\n발표\n2\n김영민\n(\n교\n24)\n임현빈\n(\n교\n24)\n11:05 ~ 11:35\n(11:35 ~ 11:55)\n메타분석\n메타분석\n발표\n3\n정다연\n(\n일\n24)\n11:55 ~ 12:10\n(12:10 ~ 12:20)\n질적연구\n12:20~\n12:30\n마무리\n김은영\n교수님\n백성은\n교수님\n12:20 ~ 12:30\n전체 총평\n12:30~\n15:00\n야유회\n(\n점심식사 및 레크리에이션\n)\n※\n사정에 따라 진행 시간은 변동 될 수 있습니다\n.\n6.\n발표자 정보\n구분\n발표자\n제목\n연구방법\n석사\n김나연\n(\n일\n24)\n상담자의 일 관련 반추가 직무만족에 미치는 영향\n:\n고립감의 매개와 도움추구행동의 조절된 매개효과\n양적연구\n김소정\n(\n교\n24)\n청소년 대상 집단상담 프로그램이 자아정체감 증진에 미치는 효과에 대한 메타분석\n메타분석\n김영민\n(\n교\n24)\n청소년의 마음챙김 기반 프로그램 효과에 관한 메타분석\n메타분석\n임현빈\n(\n교\n24)\n사회정서학습\n(SEL)\n프로그램 및 사회정서역량 증진 개입의 효과에 대한 메타분석\n메타분석\n정다연\n(\n일\n24)\nAI\n챗봇과의 상담 경험에 관한 질적 연구\n질적연구\n문의사항 있으시면 아래 번호로 연락주십시오\n.\n감사합니다\n.\n문의\n:", "images": ["./data/images/68dd884a-3b59-4361-bb13-d7fe373bfd61.png"], "attachments": []}
{"dept": "교육학과", "detail": "대학원", "title": "2025년 사이버 장애인식개선 교육 미이수자 이수 독려 요청", "date": "2025-09-30", "url": "https://home.knu.ac.kr/HOME/edu/sub.htm?mode=view&mv_data=aWR4PTE0MTMmc3RhcnRQYWdlPTIwJmxpc3RObz03OTUmdGFibGU9ZXhfYmJzX2RhdGFfZWR1Jm5hdl9jb2RlPWVkdTE2MjIxODE1MjEmY29kZT1ad0tKWGZOaWVvem8mc2VhcmNoX2l0ZW09JnNlYXJjaF9vcmRlcj0mb3JkZXJfbGlzdD0mbGlzdF9zY2FsZT0mdmlld19sZXZlbD0mdmlld19jYXRlPSZ2aWV3X2NhdGUyPQ==", "content": "2025년 사이버 장애인식개선 교육 미이수자 이수 독려 요청\n등록일\n2025-09-30\n작성자\n교육학과\n조회수\n25\n1. 관련\n가. 「장애인복지법」제25조(사회적 인식개선 등)\n나. 「장애인고용촉진 및 직업재활법」제5조의2(직장 내 장애인 인식개선 교육)\n2. 장애인식개선 교육은 위 법령에 근거하여 법령에서 정한 이수율을 충족하지 못하면 교육 부진기관으로 지정되어, 관리자 특별교육, 기관명 공포, 각종 평가 및 보조금 지원사업 선정 시 불이익을 받게 됩니다.\n3. 이에\n​\n2025년 사이버 장애인식개선 교육 미이수자\n​는 첨부파일을 참고하여\n반드시 2025. 12. 30.까지 이수\n하여 주시기 바랍니다.\n2025학년도 기관별 이수율(학생)\n기준일자: 2025.9.16.\n정렬기준: 기관 이수율 오름차순\n기관\n이수율(%)\n부진기관 여부\n교육대학원 교육사회및평생교육전공\n25\n부진예정\n교육대학원 글로벌미래교육전공\n37.5\n부진예정\n사범대학 교육학과\n39.39\n부진예정\n대학원 교육학과\n43.88\n부진예정\n교육대학원 교육과정및교육공학전공\n44.44\n부진예정\n교육대학원 상담심리전공\n68.09\n적정\n교육대학원 교육행정전공\n75\n적정\n교육대학원 교육심리및교육평가전공\n100\n적정\n교육대학원 교육철학전공\n100\n적정\n첨부파일중 PDF미리보기\n파일 열람을 위해서는 아크로뱃 리더 설치가 필요합니다. 아래 링크를 클릭하여 리더를 다운로드 받으세요.\n첨부파일중 PDF미리보기\n파일 열람을 위해서는 아크로뱃 리더 설치가 필요합니다. 아래 링크를 클릭하여 리더를 다운로드 받으세요.\n첨부파일중 PDF미리보기\n파일 열람을 위해서는 아크로뱃 리더 설치가 필요합니다. 아래 링크를 클릭하여 리더를 다운로드 받으세요.\n수강 방법(IOS).pdf\n수강 방법(PC).pdf\n수강 방법(안드로이드).pdf", "images": ["http://www.adobe.com/images/shared/download_buttons/get_adobe_reader.png"], "attachments": [{"name": "수강 방법(IOS).pdf", "url": "https://home.knu.ac.kr/HOME/bbs/bbs_download.php?mv_data=aWR4PTE0MTMmc3RhcnRQYWdlPTIwJmxpc3RObz03OTUmdGFibGU9ZXhfYmJzX2RhdGFfZWR1Jm5hdl9jb2RlPWVkdTE2MjIxODE1MjEmc2l0ZV9jb2RlPWVkdSZjb2RlPVp3S0pYZk5pZW96byZzZWFyY2hfaXRlbT0mc2VhcmNoX29yZGVyPSZvcmRlcl9saXN0PSZsaXN0X3NjYWxlPQ==&download=h&seq=0"}, {"name": "수강 방법(PC).pdf", "url": "https://home.knu.ac.kr/HOME/bbs/bbs_download.php?mv_data=aWR4PTE0MTMmc3RhcnRQYWdlPTIwJmxpc3RObz03OTUmdGFibGU9ZXhfYmJzX2RhdGFfZWR1Jm5hdl9jb2RlPWVkdTE2MjIxODE1MjEmc2l0ZV9jb2RlPWVkdSZjb2RlPVp3S0pYZk5pZW96byZzZWFyY2hfaXRlbT0mc2VhcmNoX29yZGVyPSZvcmRlcl9saXN0PSZsaXN0X3NjYWxlPQ==&download=h&seq=1"}, {"name": "수강 방법(안드로이드).pdf", "url": "https://home.knu.ac.kr/HOME/bbs/bbs_download.php?mv_data=aWR4PTE0MTMmc3RhcnRQYWdlPTIwJmxpc3RObz03OTUmdGFibGU9ZXhfYmJzX2RhdGFfZWR1Jm5hdl9jb2RlPWVkdTE2MjIxODE1MjEmc2l0ZV9jb2RlPWVkdSZjb2RlPVp3S0pYZk5pZW96byZzZWFyY2hfaXRlbT0mc2VhcmNoX29yZGVyPSZvcmRlcl9saXN0PSZsaXN0X3NjYWxlPQ==&download=h&seq=2"}]}
{"dept": "교육학과", "detail": "대학원", "title": "[교육대학원 상담심리전공 양성과정] 2025학년도 2학기 교직 적성 및 인성검사(2차) 시행 안내", "date": "2025-09-26", "url": "https://home.knu.ac.kr/HOME/edu/sub.htm?mode=view&mv_data=aWR4PTE0MTEmc3RhcnRQYWdlPTIwJmxpc3RObz03OTQmdGFibGU9ZXhfYmJzX2RhdGFfZWR1Jm5hdl9jb2RlPWVkdTE2MjIxODE1MjEmY29kZT1ad0tKWGZOaWVvem8mc2VhcmNoX2l0ZW09JnNlYXJjaF9vcmRlcj0mb3JkZXJfbGlzdD0mbGlzdF9zY2FsZT0mdmlld19sZXZlbD0mdmlld19jYXRlPSZ2aWV3X2NhdGUyPQ==", "content": "[교육대학원 상담심리전공 양성과정] 2025학년도 2학기 교직 적성 및 인성검사(2차) 시행 안내\n등록일\n2025-09-26\n작성자\n교육학과\n조회수\n54\n2025학년도 2학기 교직 적성 및 인성검사(1차)를 다음과 같이 시행하오니 해당 학생들은 기간 내 신청하여 검사를 받을 수 있도록 하여 주시기 바랍니다.\n가. 검사 개요\n1) 검사 인원 및 대상: 270명, 교직과정 이수자(사범대학, 교육대학원 포함)\n※ 휴학 및 수료생 포함\n2) 검사 방법: 정량평가\n3)\n검사 일시: 2025. 11. 6.(목) 19:00 ~ 19:50\n4) 검사 장소: 5개 검사장(글로벌플라자 경하홀Ⅰ·Ⅱ, 201, 203, 301호)\n5) 결과 확정: 2025. 11. 12.(수)[예정]\n- 부적격자의 경우, 별도의 온라인 교육을 이수해야 함 ※ 추후 별도 안내 예정\n나. 신청 방법\n1)\n신청 기간: 2025. 10. 20.(월) ∼ 10. 22.(수) 매일 10:00 ~ 17:00\n※ 등록 학기별 신청 가능 기간 상이\n신청 기간\n대상\n(\n등록횟수\n)\n비고\n10. 20.(월) ∼ 10. 22.(수)\n매일 10:00-17:00\n교육대학원\n:\n4\n학기 이상\n10. 21.(화) ～ 10. 22.(수)\n매일 10:00-17:00\n교육대학원\n:\n3\n학기 이상\n10. 22.(수) 10:00-17:00\n모두 가능\n2)\n신청 방법: 온라인으로만 신청 가능 > 통합정보시스템(\nhttp://knuin.knu.ac.kr)\n로그인 -\n교직 - 교직적성및인성검사관리 - 교직적성및인성검사신청\n다. 교원자격증 발급을 위한 교직 적성 및 인성검사 충족 요건\n구 분\n충족 요건\n참고사항\n기준연도\n2012\n년 이전 학생\n적격 판정\n1\n회\n-\n평가\n(\n정량\n,\n정성\n)\n종류 구별없음\n기준연도\n2013\n년 이후 학생\n적격 판정\n2\n회\n라. 아울러\n2026년 2월(기 수료자 포함) 또는 8월 졸업예정자 중 교직 적성 및 인성검사 기준을 충족하지 못한 학생은 반드시 신청 및 참여\n하여 주시기 바랍니다.\n첨부파일중 PDF미리보기\n파일 열람을 위해서는 아크로뱃 리더 설치가 필요합니다. 아래 링크를 클릭하여 리더를 다운로드 받으세요.\n교직 적성 및 인성검사 학생 신청.pdf\n2025학년도 2학기 교직 적성 및 인성검사(2차) 시행 계획.hwp", "images": ["http://www.adobe.com/images/shared/download_buttons/get_adobe_reader.png"], "attachments": [{"name": "교직 적성 및 인성검사 학생 신청.pdf", "url": "https://home.knu.ac.kr/HOME/bbs/bbs_download.php?mv_data=aWR4PTE0MTEmc3RhcnRQYWdlPTIwJmxpc3RObz03OTQmdGFibGU9ZXhfYmJzX2RhdGFfZWR1Jm5hdl9jb2RlPWVkdTE2MjIxODE1MjEmc2l0ZV9jb2RlPWVkdSZjb2RlPVp3S0pYZk5pZW96byZzZWFyY2hfaXRlbT0mc2VhcmNoX29yZGVyPSZvcmRlcl9saXN0PSZsaXN0X3NjYWxlPQ==&download=h&seq=0"}, {"name": "2025학년도 2학기 교직 적성 및 인성검사(2차) 시행 계획.hwp", "url": "https://home.knu.ac.kr/HOME/bbs/bbs_download.php?mv_data=aWR4PTE0MTEmc3RhcnRQYWdlPTIwJmxpc3RObz03OTQmdGFibGU9ZXhfYmJzX2RhdGFfZWR1Jm5hdl9jb2RlPWVkdTE2MjIxODE1MjEmc2l0ZV9jb2RlPWVkdSZjb2RlPVp3S0pYZk5pZW96byZzZWFyY2hfaXRlbT0mc2VhcmNoX29yZGVyPSZvcmRlcl9saXN0PSZsaXN0X3NjYWxlPQ==&download=h&seq=1"}]}
{"dept": "교육학과", "detail": "대학원", "title": "[대구RISE사업] 청년 연구자 다자녀 가구 지원계획 알림 및 신청 안내", "date": "2025-09-24", "url": "https://home.knu.ac.kr/HOME/edu/sub.htm?mode=view&mv_data=aWR4PTE0MTAmc3RhcnRQYWdlPTIwJmxpc3RObz03OTMmdGFibGU9ZXhfYmJzX2RhdGFfZWR1Jm5hdl9jb2RlPWVkdTE2MjIxODE1MjEmY29kZT1ad0tKWGZOaWVvem8mc2VhcmNoX2l0ZW09JnNlYXJjaF9vcmRlcj0mb3JkZXJfbGlzdD0mbGlzdF9zY2FsZT0mdmlld19sZXZlbD0mdmlld19jYXRlPSZ2aWV3X2NhdGUyPQ==", "content": "[대구RISE사업] 청년 연구자 다자녀 가구 지원계획 알림 및 신청 안내\n등록일\n2025-09-24\n작성자\n교육학과\n조회수\n40\n[대구RISE사업] 청년 연구자 다자녀 가구 지원계획과 신청방법에 대해 다음과 같이 안내드리오니 대상자들의 많은 신청 바랍니다.\n가. (목    적) 청년연구자에 대한 생활비 지원을 통해 청년연구자의 대구광역시 정착유도 및 지역유입 촉진\n나.\n(신청자격) 대구광역시 거주 만 39세 이하 청년 연구자*로서, 자녀 2명 이상을 둔 기혼자\n* 청년연구자: 석사과정생 이상(사업 목적상 특수대학원생, 전문대학원생은 제외)\n다. (지원인원) 50명 내외\n※ 선발 기준과 형평성 등을 고려하여 지원자 선발 예정\n라.\n(지원금액 및 방법) 대구로페이 월 50만원 충전\n마. (지원기간)\n 1차년도: ΄25. 11월∼΄26. 2월(4개월)\n 총 사업기간: 5년(∼΄30. 2월)\n※ 2차년도는 별도의 사업계획 수립 후 시행 예정\n※ 총 사업기간은 5년이나, 상황에 따라 조기 종료될 수 있음\n바. 문의사항(이메일 문의만 가능): tjrgus2218@knu.ac.kr\n사. 기타 세부사항: [붙임] 참고\n붙임  청년연구자 다자녀 가구 지원 계획 1부.  끝.\n(붙임) 청년연구자 다자녀 가구 지원계획.hwp", "images": [], "attachments": [{"name": "(붙임) 청년연구자 다자녀 가구 지원계획.hwp", "url": "https://home.knu.ac.kr/HOME/bbs/bbs_download.php?mv_data=aWR4PTE0MTAmc3RhcnRQYWdlPTIwJmxpc3RObz03OTMmdGFibGU9ZXhfYmJzX2RhdGFfZWR1Jm5hdl9jb2RlPWVkdTE2MjIxODE1MjEmc2l0ZV9jb2RlPWVkdSZjb2RlPVp3S0pYZk5pZW96byZzZWFyY2hfaXRlbT0mc2VhcmNoX29yZGVyPSZvcmRlcl9saXN0PSZsaXN0X3NjYWxlPQ==&download=h&seq=0"}]}
{"dept": "교육학과", "detail": "대학원", "title": "「2025년도 연구윤리 상담 FAQ」안내", "date": "2025-09-24", "url": "https://home.knu.ac.kr/HOME/edu/sub.htm?mode=view&mv_data=aWR4PTE0MDkmc3RhcnRQYWdlPTIwJmxpc3RObz03OTImdGFibGU9ZXhfYmJzX2RhdGFfZWR1Jm5hdl9jb2RlPWVkdTE2MjIxODE1MjEmY29kZT1ad0tKWGZOaWVvem8mc2VhcmNoX2l0ZW09JnNlYXJjaF9vcmRlcj0mb3JkZXJfbGlzdD0mbGlzdF9zY2FsZT0mdmlld19sZXZlbD0mdmlld19jYXRlPSZ2aWV3X2NhdGUyPQ==", "content": "「2025년도 연구윤리 상담 FAQ」안내\n등록일\n2025-09-24\n작성자\n교육학과\n조회수\n26\n1. 우리 대학의 연구 윤리에 관심을 가져주셔서 감사합니다.\n2. 연구자들의 올바른 연구 윤리 확립과 연구부정행위 방지를 위하여 한국연구재단에서 발간한 「2025년도 연구 윤리 상담 사례집」을 안내하오니 참고하여 주시기 바랍니다.\n첨부파일중 PDF미리보기\n파일 열람을 위해서는 아크로뱃 리더 설치가 필요합니다. 아래 링크를 클릭하여 리더를 다운로드 받으세요.\n2025년 연구윤리정보포털(CRE) 연구윤리 상담 FAQ.pdf", "images": ["http://www.adobe.com/images/shared/download_buttons/get_adobe_reader.png"], "attachments": [{"name": "2025년 연구윤리정보포털(CRE) 연구윤리 상담 FAQ.pdf", "url": "https://home.knu.ac.kr/HOME/bbs/bbs_download.php?mv_data=aWR4PTE0MDkmc3RhcnRQYWdlPTIwJmxpc3RObz03OTImdGFibGU9ZXhfYmJzX2RhdGFfZWR1Jm5hdl9jb2RlPWVkdTE2MjIxODE1MjEmc2l0ZV9jb2RlPWVkdSZjb2RlPVp3S0pYZk5pZW96byZzZWFyY2hfaXRlbT0mc2VhcmNoX29yZGVyPSZvcmRlcl9saXN0PSZsaXN0X3NjYWxlPQ==&download=h&seq=0"}]}
{"dept": "교육학과", "detail": "대학원", "title": "* 2025학년도 2학기 G-KNU Scholarship 장학 대상자(박사과정) 전일제 등록 기간 안내", "date": "2025-09-22", "url": "https://home.knu.ac.kr/HOME/edu/sub.htm?mode=view&mv_data=aWR4PTE0MDcmc3RhcnRQYWdlPTMwJmxpc3RObz03OTEmdGFibGU9ZXhfYmJzX2RhdGFfZWR1Jm5hdl9jb2RlPWVkdTE2MjIxODE1MjEmY29kZT1ad0tKWGZOaWVvem8mc2VhcmNoX2l0ZW09JnNlYXJjaF9vcmRlcj0mb3JkZXJfbGlzdD0mbGlzdF9zY2FsZT0mdmlld19sZXZlbD0mdmlld19jYXRlPSZ2aWV3X2NhdGUyPQ==", "content": "* 2025학년도 2학기 G-KNU Scholarship 장학 대상자(박사과정) 전일제 등록 기간 안내\n등록일\n2025-09-22\n작성자\n교육학과\n조회수\n73\n2025년 2학기 G-KNU Scholarship(전일제 박사과정) 장학금 지급을 위한 전일제 등록\n을 아래와 같이 실시하오니\n대상 학생들은 기간 내 전일제 등록을 하여 주시기 바랍니다.\n(기간 내 미등록 시, 비전일제로 간주)\n가. 등록대상: 대학원(전문대학원 포함) 박사(석·박사통합)과정 전일제 재학생(2025. 9. 18.기준)\n나.\n전일제 등록기간: 2025. 9. 22.(월) ~ 10. 2.(목)\n다.\n등록방법: 통합정보시스템에서 전일제대학원생 신청 및 증빙서류 업로드\n1) 통합정보시스템 → 학적 → 학적정보관리 → 전일제대학원생신청 (붙임2 매뉴얼 참조)\n2)\n학적 세부 상태가\n재학, 복학예정\n인 학생만 신청 가능. 단,\n학기초과자 신청 불가\n.\n3)\n발급일로부터 7일 이내 증빙서류(4대 사회보험 가입내역 확인서, 건강보험자격득실확인서)를 첨부하여 신청\n4)\n기신청자도 재신청하여야 함\n5) 외국인 학생의 시스템 등록 및 증빙서류 제출 등 관련 사항은 국제교류과 담당자 최명수(053-950-2438)에게 문의 요망\n6)\n장학금 지급 받을 계좌 입력: 통합정보시스템 - 학사행정 - 장학 - 계좌관리 - 계좌입력\n라.\n유의사항\n1) 학기 종료일 이후 장학생 전일제 신분 유지 점검 예정(증빙서류 추가 제출 필요)\n2)\nG-KNU Scholarship 장학 수혜 후, 당해 학기를 이수하지 않고 자퇴할 경우 전액 반납해야 함\n3)\n지원 제외 대상: 등록금 전액 감면자, 초과학기자, 수료자, 제적자, 휴학자\n2-1. [국문] 2025학년도 2학기 G-KNU Scholarship 전일제 정보 등록 매뉴얼.hwp\n2-2. [영문] 2025학년도 2학기 G-KNU Scholarship 전일제 정보 등록 매뉴얼.hwp", "images": [], "attachments": [{"name": "2-1. [국문] 2025학년도 2학기 G-KNU Scholarship 전일제 정보 등록 매뉴얼.hwp", "url": "https://home.knu.ac.kr/HOME/bbs/bbs_download.php?mv_data=aWR4PTE0MDcmc3RhcnRQYWdlPTMwJmxpc3RObz03OTEmdGFibGU9ZXhfYmJzX2RhdGFfZWR1Jm5hdl9jb2RlPWVkdTE2MjIxODE1MjEmc2l0ZV9jb2RlPWVkdSZjb2RlPVp3S0pYZk5pZW96byZzZWFyY2hfaXRlbT0mc2VhcmNoX29yZGVyPSZvcmRlcl9saXN0PSZsaXN0X3NjYWxlPQ==&download=h&seq=0"}, {"name": "2-2. [영문] 2025학년도 2학기 G-KNU Scholarship 전일제 정보 등록 매뉴얼.hwp", "url": "https://home.knu.ac.kr/HOME/bbs/bbs_download.php?mv_data=aWR4PTE0MDcmc3RhcnRQYWdlPTMwJmxpc3RObz03OTEmdGFibGU9ZXhfYmJzX2RhdGFfZWR1Jm5hdl9jb2RlPWVkdTE2MjIxODE1MjEmc2l0ZV9jb2RlPWVkdSZjb2RlPVp3S0pYZk5pZW96byZzZWFyY2hfaXRlbT0mc2VhcmNoX29yZGVyPSZvcmRlcl9saXN0PSZsaXN0X3NjYWxlPQ==&download=h&seq=1"}]}
{"dept": "교육학과", "detail": "대학원", "title": "대학원 교육과정및방법전공 석사 및 박사 학위논문 공개 발표 개최 안내(수정)", "date": "2025-09-16", "url": "https://home.knu.ac.kr/HOME/edu/sub.htm?mode=view&mv_data=aWR4PTE0MDUmc3RhcnRQYWdlPTMwJmxpc3RObz03OTAmdGFibGU9ZXhfYmJzX2RhdGFfZWR1Jm5hdl9jb2RlPWVkdTE2MjIxODE1MjEmY29kZT1ad0tKWGZOaWVvem8mc2VhcmNoX2l0ZW09JnNlYXJjaF9vcmRlcj0mb3JkZXJfbGlzdD0mbGlzdF9zY2FsZT0mdmlld19sZXZlbD0mdmlld19jYXRlPSZ2aWV3X2NhdGUyPQ==", "content": "대학원 교육과정및방법전공 석사 및 박사 학위논문 공개 발표 개최 안내(수정)\n등록일\n2025-09-16\n작성자\n교육학과\n조회수\n133\n* 수정사항: 석사 및 발표시간 수정 (석사: 15분 → 20분, 박사: 20분 → 30분)\n대학원 교육학과 교육과정및방법전공 박사 학위논문 공개발표를 다음과 같이 개최하고자 합니다.\n◆ 다 음 ◆\n가. 발표일시 : 2025. 11. 7.(금) 14:00~\n나. 발표장소 : 사범대학 812호\n다. 발표순서\n(1) 석사\n0. 없음\n(2) 박사\n1. 이소영(학습방법에 따른 단·장기 파지 차이와 유아의 회상에 미치는 영향: 산문자료를 활용한 혼합연구)\n2. 리윈윈(A Study on the Internationalization of China's National Curriculum Based on Future Education\n)\n※ 발표하시는 분들께\n- 발표시간은 석사 20분, 박사 30분 이내로 하시기 바랍니다.\n- 석사, 박사 모두 참석하시는 교수님들께는 논문을 드릴 수 있도록 준비하여 주시기 바랍니다.\n- 발표를 들으러 오는 다른 학생들을 위한 논문자료도 준비해주시면 좋을 것 같습니다.", "images": [], "attachments": []}
{"dept": "교육학과", "detail": "대학원", "title": "[교육대학원 상담심리전공 양성과정] 2025학년도 2학기 응급처치 및 심폐소생술 실습 시행 안내", "date": "2025-09-16", "url": "https://home.knu.ac.kr/HOME/edu/sub.htm?mode=view&mv_data=aWR4PTE0MDMmc3RhcnRQYWdlPTMwJmxpc3RObz03ODkmdGFibGU9ZXhfYmJzX2RhdGFfZWR1Jm5hdl9jb2RlPWVkdTE2MjIxODE1MjEmY29kZT1ad0tKWGZOaWVvem8mc2VhcmNoX2l0ZW09JnNlYXJjaF9vcmRlcj0mb3JkZXJfbGlzdD0mbGlzdF9zY2FsZT0mdmlld19sZXZlbD0mdmlld19jYXRlPSZ2aWV3X2NhdGUyPQ==", "content": "[교육대학원 상담심리전공 양성과정] 2025학년도 2학기 응급처치 및 심폐소생술 실습 시행 안내\n등록일\n2025-09-16\n작성자\n교육학과\n조회수\n49\n「2025년도 2학기 응급처치 및 심폐소생술 실습 계획」을 다음과 같이 시행하고자 하오니 해당 학생들은 기간 내 신청하여 실습에 참여하여 주시기 바랍니다.\n※ [붙임1]의 실습 계획 안내문을 반드시 확인할 것\n가. 신청대상: 교직과정 이수예정자(사범대학, 교육대학원 포함)\n※ 휴학 및 수료생도 신청 가능\n나.\n신청\n기간:\n2025. 9. 22.(\n월\n) ~ 9. 26.(\n금\n)\n※ 대상자\n별\n신청 일시가 상이 [(붙임 1) 참조]\n신청 기간\n대상\n(\n등록횟수\n)\n비고\n2025. 9. 23.(\n화\n)\n～\n9\n. 26.(\n금\n)\n매일\n10:00\n～\n17:00\n-\n교육대학원\n: 4\n학기 이상\n2025. 9. 24.(\n수\n)\n～\n9\n. 26.(\n금\n)\n매일\n10:00\n～\n17:00\n-\n교육대학원\n: 3\n학기 이상\n2025. 9. 25.(\n목\n) 10:00\n～\n17:00\n모두 가능\n25. 5\n월 실습\n신청 후 무단 불참자 신청 불가\n2025. 9. 26.(\n금\n) 10:00\n～\n17:00\n모두 가능\n※\n2026. 2\n월\n, 2026. 8\n월 졸업예정자 중 충족 기준을 만족하지 못한 학생\n들은 반드시\n신청 및 참여\n다.\n신청방법: 통합정보시스템(\nhttps://knuin.knu.ac.kr)\n로그인 후 신청 >\n[통합정보시스템-교직-응급처치및심폐소생술실습-응급처치및심폐소생술실습신청]\n※ 출석 및 실습 이수 여부를 위해 반드시 개인정보활용 동의 필요 -  제공되는 개인정보 : 이름, 학번, 휴대폰번호, 생년월일, 성별, 학교명\n라. 실습내용 및 이수기준: 총 3시간 이수[응급처치 및 심폐소생술 이론 + 실습]\n※ 교원자격증 발급 기준: 졸업 전 2회 이수(학기 당 1회 이수 가능)\n마.\n실습일시 및 장소:\n2025. 11. 3.(월) ~ 11. 4.(화), 글로벌플라자 경하홀Ⅰ․Ⅱ\n바. 협조기관: 대구광역시 응급의료지원단\n사. 실습시간, 대상자 별 신청 일시, 유의사항 등 세부계획: [붙임 1]\n아. 추가 인정(대체실습) 방법\n❍\n외부기관(대구광역시 응급의료지원단, 대한적십자사, 대한심폐소생협회, 한국응급처치교육원 등)의 실습 내용을 검토한 후 이수기준에 적합한지 판단하여 인정 요청 ※ [붙임 2] 참조\n- 교육내용: 심폐소생술(성인‧소아‧영아), 기도폐쇄, AED(자동제세동기) 사용법 반드시 포함, 3시간 이상 이론 및 실습\n- 이수자 명단, 이수증 등을 첨부하여 교육학과 사무실로 제출(이수증 발급 즉시)\n❍ 근무 중인 학교에서 실시한 경우: <①시행 공문, ②참석자 명단(본인 이외 블라인드 가능), ③이수증>을 교육학과 사무실로 제출(이수증 발급 즉시)\n※ 2025. 8월, 2026. 2월 졸업예정자(기 수료자 포함) 중 응급처치 및 심폐소생술 실습을 충족하지 못한 학생들은 반드시 신청 및 참여\n하여 주시기 바랍니다.\n2025학년도 2학기 응급처치 및 심폐소생술 실습 계획.hwp\n외부기관 대체 실습 프로그램.zip", "images": [], "attachments": [{"name": "2025학년도 2학기 응급처치 및 심폐소생술 실습 계획.hwp", "url": "https://home.knu.ac.kr/HOME/bbs/bbs_download.php?mv_data=aWR4PTE0MDMmc3RhcnRQYWdlPTMwJmxpc3RObz03ODkmdGFibGU9ZXhfYmJzX2RhdGFfZWR1Jm5hdl9jb2RlPWVkdTE2MjIxODE1MjEmc2l0ZV9jb2RlPWVkdSZjb2RlPVp3S0pYZk5pZW96byZzZWFyY2hfaXRlbT0mc2VhcmNoX29yZGVyPSZvcmRlcl9saXN0PSZsaXN0X3NjYWxlPQ==&download=h&seq=0"}, {"name": "외부기관 대체 실습 프로그램.zip", "url": "https://home.knu.ac.kr/HOME/bbs/bbs_download.php?mv_data=aWR4PTE0MDMmc3RhcnRQYWdlPTMwJmxpc3RObz03ODkmdGFibGU9ZXhfYmJzX2RhdGFfZWR1Jm5hdl9jb2RlPWVkdTE2MjIxODE1MjEmc2l0ZV9jb2RlPWVkdSZjb2RlPVp3S0pYZk5pZW96byZzZWFyY2hfaXRlbT0mc2VhcmNoX29yZGVyPSZvcmRlcl9saXN0PSZsaXN0X3NjYWxlPQ==&download=h&seq=1"}]}
{"dept": "교육학과", "detail": "대학원", "title": "* 2025학년도 2학기 대학원 논문 공개발표 일정 안내", "date": "2025-09-15", "url": "https://home.knu.ac.kr/HOME/edu/sub.htm?mode=view&mv_data=aWR4PTE0MDImc3RhcnRQYWdlPTMwJmxpc3RObz03ODgmdGFibGU9ZXhfYmJzX2RhdGFfZWR1Jm5hdl9jb2RlPWVkdTE2MjIxODE1MjEmY29kZT1ad0tKWGZOaWVvem8mc2VhcmNoX2l0ZW09JnNlYXJjaF9vcmRlcj0mb3JkZXJfbGlzdD0mbGlzdF9zY2FsZT0mdmlld19sZXZlbD0mdmlld19jYXRlPSZ2aWV3X2NhdGUyPQ==", "content": "* 2025학년도 2학기 대학원 논문 공개발표 일정 안내\n등록일\n2025-09-15\n작성자\n교육학과\n조회수\n122\n2025학년도 2학기 일반대학원 및 교육대학원 학위논문 공개발표를 다음과 같이 개최하고자 합니다\n.\n1. 일시 :\n2025. 11. 7.(금)\n,\n전공별 진행\n2. 안내사항\n:\n전공에 따라 일정이 변경\n될 수 있으니 반드시\n지도교수님과 상의\n하셔서 공개발표 진행하시기 바랍니다.\n3.\n발표자 및 논문 제목\n※\n발표하시는 분들께\n-\n발표시간은 석사\n15\n분\n,\n박사\n20\n분 이내로 하시기 바랍니다\n.\n-\n석사\n,\n박사 모두 참석하시는 교수님들께는 논문을 드릴 수 있도록 준비하여 주시기 바랍니다\n.\n-\n발표를 들으러 오는 다른 학생들을 위한 논문자료도 준비해주시면 좋을 것 같습니다\n.", "images": ["./data/images/5e85b213-9f58-4dcb-b18a-3c5658fb7309.png"], "attachments": []}
{"dept": "교육학과", "detail": "대학원", "title": "* 2025학년도 2학기 일대원 및 교대원 심사용 학위논문 접수 및 논문 심사료 납부 안내", "date": "2025-09-15", "url": "https://home.knu.ac.kr/HOME/edu/sub.htm?mode=view&mv_data=aWR4PTE0MDEmc3RhcnRQYWdlPTMwJmxpc3RObz03ODcmdGFibGU9ZXhfYmJzX2RhdGFfZWR1Jm5hdl9jb2RlPWVkdTE2MjIxODE1MjEmY29kZT1ad0tKWGZOaWVvem8mc2VhcmNoX2l0ZW09JnNlYXJjaF9vcmRlcj0mb3JkZXJfbGlzdD0mbGlzdF9zY2FsZT0mdmlld19sZXZlbD0mdmlld19jYXRlPSZ2aWV3X2NhdGUyPQ==", "content": "* 2025학년도 2학기 일대원 및 교대원 심사용 학위논문 접수 및 논문 심사료 납부 안내\n등록일\n2025-09-15\n작성자\n교육학과\n조회수\n103\n1.\n심사용 학위논문 제출\n가\n.\n제출기간: 2025. 9. 30.(화) 9:00 ~ 10. 2.(목) 17:50 까지 (※기간 엄수)\n(\n※\n12:00~13:00\n점심시간 제외\n)\n※ 특히, 금번학기는 추석\n연휴로 인하여 예년보다 학사일정이\n앞당겨 졌음에 유의할 것\n나\n.\n제출장소\n:\n교육학과 사무실\n(\n사범대학\n823\n호\n)\n다\n.\n제출서류\n(\n아래\n(1)~(4)\n의 서류 모두 제출\n)\n※\n일반대학원과 교육대학원 서식이 다르니 유의하여 작성\n(1)\n연구윤리준수확인서\n1\n부\n(2)\n지도교수추천서\n1\n부\n(3)\n심사용 학위논문\n:\n​석사 3부\n​,\n​박사 5부\n​\n(4)\n논문표절예방프로그램(Turnitin) 결과물\n(\n전문\n(全文)\n제출\n):\n​석사 3부\n​,\n​박사 5부\n라\n.\n유의사항\n(1)\n심사용 학위논문\n(서식, 규격 등)\n및 논문표절예방프로그램 결과물(표절률 등)은 반드시\n지도교수의 지도를 받은 후 제출\n(2)\n심사용 학위논문\n은 심사하기에 적합한 형태로\n제본하여 제출\n(떡제본, 스프링 등 무관)\n(3)\n​논문표절예방프로그램(Turnitin) 결과물\n은 요약이 아닌\n전문(全文)을 출력\n하여 제출\n(제본 불필요)\n2.\n논문심사료 납부\n가\n.\n심 사 료\n:\n석사\n10\n만원\n,\n박사\n30\n만원\n나\n. 납부기간:\n2025. 10. 20.(월) ~ 10. 21.(화) 16:00까지 [\n※\n은행 업무시간 준수]\n다\n.\n납부방법\n:\n납부기간 중\n통합정보시스템에서\n본인의 납부고지서 출력 후 지정된 가상계좌로 납부\n※\n2025\n학년도\n1\n학기 논문판정유보자 및 완성논문제출연기자는 납부하지 않아도 됨\n3. 유의사항\n가.\n2025\n학년도\n1\n학기\n판정유보\n(\n심사연기\n)\n자\n1) 지도교수의 지도를 받아 수정 및 보완한 논문을\n심사위원에게 직접 제출\n한 후 심사를 받을 것\n2)\n학과 사무실 제출 서류:\n논문표절예방프로그램 결과물 1부\n나.\n2016~2024\n학년도 입학생 중 금번학기 논문제출 예정자는\n2025. 10. 2.(목)까지 연구윤리교육을 이수\n하여야 논문제출 자격이 있는 것으로 인정함\n(※ 2015\n학년도 이전 입학생\n:\n연구윤리교육 이수 의무 아니며\n'\n권장'임\n)\n4.\n「\n논문표절예방프로그램 검증 결과물 제출 및 심사 의무화\n」\n관련\n1)\n표절예방 검증 프로그램\n:\n도서관 홈페이지에 게재된\nTurnitin(\n턴잇인\n)\n에 검증\n2)\n제출대상\n:\n석\n·\n박사 학위논문 제\n출예정자 전체\n(\n일반\n,\n전문\n,\n특수대학원 포함\n)\n3)\n제출자료\n:\n논문표절예방프로그램 결과물\n(\nTurnitin\n보고서 \"전체\"를 출력\n할 것\n) (\n석사\n3\n부\n,\n박사\n5\n부\n)\n(\n제본 불필요\n)\n4)\n제출시기\n:\n2025학년도 2학기 심사용 논문 접수기간(9. 30.~10. 2.)\n5)\n2025학년도 1학기 판정유보자: 학과 사무실로 1부 제출\n▶ Turnitin 프로그램은 표절을 판가름 해주는 것이 아니며 본문과의 유사한 문장으로 체크된 객관적인 출처 및 데이터를 제시하여\n표절이 의심되는지의 여부를 알려주기 때문에\n체크된 부분은 반드시 심사위원의 심사를 통해 표절 여부 판단\n▶ Turnitin 이용방법\n□ 경북대학교 도서관 홈페이지 접속\n(상단메뉴에서 연구학습지원→표절예방/연구윤리 선택)\n- 논문 및 과제에 대한 표절여부를 확인하고 관리하는 서비스\n- 전세계 Web Page, 학술저널 Article, turnitin에 저장된 논문과 과제와 실시간 비교\n- 반드시 1인 1계정으로 이용, 1인 2계정으로 이용시 유사율 높아짐\n- 이메일 변경은 새로운 계정 생성하지 말고 기존 이메일로 로그인 후 사용자정보에서 변경\n- 제출파일 유형: HWP, DOC, Text PDF, HTML, TXT, WordPerfect 등 일반Text\n□ 문의: 중앙도서관 5층 자료수집팀 ☎ 053-950-4624\n첨부파일중 PDF미리보기\n파일 열람을 위해서는 아크로뱃 리더 설치가 필요합니다. 아래 링크를 클릭하여 리더를 다운로드 받으세요.\n첨부파일중 PDF미리보기\n파일 열람을 위해서는 아크로뱃 리더 설치가 필요합니다. 아래 링크를 클릭하여 리더를 다운로드 받으세요.\n1-1. (일반대학원) 연구윤리준수확인서 및 지도교수추천서(서식).hwp\n1-2. (교육대학원) 연구윤리준수확인서 및 지도교수추천서(서식).hwp\n2-1. 논문표절예방프로그램(Turnitin)이용매뉴얼(국문).pdf\n2-2. (For Student) Turnitin Manual(Eng).pdf\n3-1. (일반대학원)학위논문 규격예시(2025.2학기).zip\n3-2. (교육대학원) 학위논문 규격예시(2025.2학기).zip", "images": ["http://www.adobe.com/images/shared/download_buttons/get_adobe_reader.png"], "attachments": [{"name": "1-1. (일반대학원) 연구윤리준수확인서 및 지도교수추천서(서식).hwp", "url": "https://home.knu.ac.kr/HOME/bbs/bbs_download.php?mv_data=aWR4PTE0MDEmc3RhcnRQYWdlPTMwJmxpc3RObz03ODcmdGFibGU9ZXhfYmJzX2RhdGFfZWR1Jm5hdl9jb2RlPWVkdTE2MjIxODE1MjEmc2l0ZV9jb2RlPWVkdSZjb2RlPVp3S0pYZk5pZW96byZzZWFyY2hfaXRlbT0mc2VhcmNoX29yZGVyPSZvcmRlcl9saXN0PSZsaXN0X3NjYWxlPQ==&download=h&seq=0"}, {"name": "1-2. (교육대학원) 연구윤리준수확인서 및 지도교수추천서(서식).hwp", "url": "https://home.knu.ac.kr/HOME/bbs/bbs_download.php?mv_data=aWR4PTE0MDEmc3RhcnRQYWdlPTMwJmxpc3RObz03ODcmdGFibGU9ZXhfYmJzX2RhdGFfZWR1Jm5hdl9jb2RlPWVkdTE2MjIxODE1MjEmc2l0ZV9jb2RlPWVkdSZjb2RlPVp3S0pYZk5pZW96byZzZWFyY2hfaXRlbT0mc2VhcmNoX29yZGVyPSZvcmRlcl9saXN0PSZsaXN0X3NjYWxlPQ==&download=h&seq=1"}, {"name": "2-1. 논문표절예방프로그램(Turnitin)이용매뉴얼(국문).pdf", "url": "https://home.knu.ac.kr/HOME/bbs/bbs_download.php?mv_data=aWR4PTE0MDEmc3RhcnRQYWdlPTMwJmxpc3RObz03ODcmdGFibGU9ZXhfYmJzX2RhdGFfZWR1Jm5hdl9jb2RlPWVkdTE2MjIxODE1MjEmc2l0ZV9jb2RlPWVkdSZjb2RlPVp3S0pYZk5pZW96byZzZWFyY2hfaXRlbT0mc2VhcmNoX29yZGVyPSZvcmRlcl9saXN0PSZsaXN0X3NjYWxlPQ==&download=h&seq=2"}, {"name": "2-2. (For Student) Turnitin Manual(Eng).pdf", "url": "https://home.knu.ac.kr/HOME/bbs/bbs_download.php?mv_data=aWR4PTE0MDEmc3RhcnRQYWdlPTMwJmxpc3RObz03ODcmdGFibGU9ZXhfYmJzX2RhdGFfZWR1Jm5hdl9jb2RlPWVkdTE2MjIxODE1MjEmc2l0ZV9jb2RlPWVkdSZjb2RlPVp3S0pYZk5pZW96byZzZWFyY2hfaXRlbT0mc2VhcmNoX29yZGVyPSZvcmRlcl9saXN0PSZsaXN0X3NjYWxlPQ==&download=h&seq=3"}, {"name": "3-1. (일반대학원)학위논문 규격예시(2025.2학기).zip", "url": "https://home.knu.ac.kr/HOME/bbs/bbs_download.php?mv_data=aWR4PTE0MDEmc3RhcnRQYWdlPTMwJmxpc3RObz03ODcmdGFibGU9ZXhfYmJzX2RhdGFfZWR1Jm5hdl9jb2RlPWVkdTE2MjIxODE1MjEmc2l0ZV9jb2RlPWVkdSZjb2RlPVp3S0pYZk5pZW96byZzZWFyY2hfaXRlbT0mc2VhcmNoX29yZGVyPSZvcmRlcl9saXN0PSZsaXN0X3NjYWxlPQ==&download=h&seq=4"}, {"name": "3-2. (교육대학원) 학위논문 규격예시(2025.2학기).zip", "url": "https://home.knu.ac.kr/HOME/bbs/bbs_download.php?mv_data=aWR4PTE0MDEmc3RhcnRQYWdlPTMwJmxpc3RObz03ODcmdGFibGU9ZXhfYmJzX2RhdGFfZWR1Jm5hdl9jb2RlPWVkdTE2MjIxODE1MjEmc2l0ZV9jb2RlPWVkdSZjb2RlPVp3S0pYZk5pZW96byZzZWFyY2hfaXRlbT0mc2VhcmNoX29yZGVyPSZvcmRlcl9saXN0PSZsaXN0X3NjYWxlPQ==&download=h&seq=5"}]}
{"dept": "교육학과", "detail": "대학원", "title": "2025학년도 2학기 대학원 수료생 등록(2차) 계획 안내", "date": "2025-09-08", "url": "https://home.knu.ac.kr/HOME/edu/sub.htm?mode=view&mv_data=aWR4PTEzOTkmc3RhcnRQYWdlPTMwJmxpc3RObz03ODYmdGFibGU9ZXhfYmJzX2RhdGFfZWR1Jm5hdl9jb2RlPWVkdTE2MjIxODE1MjEmY29kZT1ad0tKWGZOaWVvem8mc2VhcmNoX2l0ZW09JnNlYXJjaF9vcmRlcj0mb3JkZXJfbGlzdD0mbGlzdF9zY2FsZT0mdmlld19sZXZlbD0mdmlld19jYXRlPSZ2aWV3X2NhdGUyPQ==", "content": "2025학년도 2학기 대학원 수료생 등록(2차) 계획 안내\n등록일\n2025-09-08\n작성자\n교육학과\n조회수\n66\n「2025학년도 2학기 대학원 수료생 등록 계획」을 다음과 같이 알려드리니, 수료생 등록이 필요한 학생은 기한 내 신청 바랍니다.\n가. 신청 대상: 각 대학원 수료생\n※ 1. 2025학년도 2학기에 학위취득을 위한 논문을 제출하고자 하는 자 또는 논문 지도를 받고자 하는 자\n2. 연구 과제 참여로 산학협력단을 통해 인건비를 받고자 하는 자(과제에 따라 수료생 등록 필요 여부 확인 요망)\n◆\n연구 과제 참여로\n산학협력단을 통해 인건비를 받고자 하는 자\n는 과제에 따라 수료생\n등록 여부가 중요함으로\n반드시\n과제 담당자에게 확인 후 수료생 등록 여부 판단\n◆\n2025\n년도\n1\n학기\n수료생\n중\n학위논문심사에서\n“\n판정유보\n”\n및\n“\n완성논문 제출연기\n”\n로 결정된\n자는 수료생 등록을 하지 않아도 논문심사 및 완성논문 제출을 할 수 있음\n⤷\n대학원에서는 수료생 등록을 한 학기 면제해 주지만\n산학협력단을 통해 인건비를 받고자 하는 자\n는 수료생 등록을 해야하는 경우가 있으므로\n반드시 확인 요망\n◆\n2025\n년도\n1\n학기\n재학생\n중\n학위논문심사에서\n“\n판정유보\n”\n및\n“\n완성논문 제출연기\n”\n로 결정된\n자는\n이번 학기 수료생 등록을 하여야 함\n나. 신청 방법:\n신청기간 내에 아래의 ①~③을 모두 완료하여야 함\n①\n차세대 통합정보시스템\n에서 직접 전산 신청 후 신청서 출력\n(차세대 통합정보시스템 > 학사행정 > 졸업 > 졸업요건(대학원) > 수료생 등록신청 에서 신청)\n② 신청서에 지도교수님 날인을 받은 후 학과 사무실로\n대면 제출\n(※이메일/우편 제출 불가)\n​③ 신청자의 자격을 심사ㆍ확인 후 학과에서 승인\n다. 신청 및 등록 기간\n1) 신청 및 제출 기간: 2025. 9. 11.(목) ~ 9. 12.(금) 17:00\n(※ 점심시간 1\n2:00~13:00 제외)\n2) 등록기간: 2025. 9. 22.(월) ~\n9. 23.(화) 16시까지\n​\n※\n1\n차 신청자 중 미납자\n(\n붙임\n4)\n는\n2\n차 신청기간에 재신청하지 않아도\n2\n차 등록기간 중 납부 가능\n라. 유의사항\n○ 수료생 등록을 한 후 심사용 논문을 제출하지 않는 경우라도\n등록금을 환불하지 않으니\n등록금을 납부하기 전에 신중히 검토하여 등록\n* 이번 학기 논문심사 여부가 확정되지 않은 경우 추가 납부기간에 납부하기 바람\n○ 1차 신청자 중 미납자는 2차 신청기간 중 재신청하지 않아도 2차 납부기간 중 납부 가능\n○ 납부기간 중 학교 홈페이지 공지사항을 통해 출력 가능,\n등록금 환불은 없음에 유의\n(통합정보시스템)대학원 수료생 등록 신청안내(게시용).hwp", "images": [], "attachments": [{"name": "(통합정보시스템)대학원 수료생 등록 신청안내(게시용).hwp", "url": "https://home.knu.ac.kr/HOME/bbs/bbs_download.php?mv_data=aWR4PTEzOTkmc3RhcnRQYWdlPTMwJmxpc3RObz03ODYmdGFibGU9ZXhfYmJzX2RhdGFfZWR1Jm5hdl9jb2RlPWVkdTE2MjIxODE1MjEmc2l0ZV9jb2RlPWVkdSZjb2RlPVp3S0pYZk5pZW96byZzZWFyY2hfaXRlbT0mc2VhcmNoX29yZGVyPSZvcmRlcl9saXN0PSZsaXN0X3NjYWxlPQ==&download=h&seq=0"}]}
{"dept": "교육학과", "detail": "대학원", "title": "2025학년도 2학기 대학원 종합시험 결과 안내", "date": "2025-09-04", "url": "https://home.knu.ac.kr/HOME/edu/sub.htm?mode=view&mv_data=aWR4PTEzOTgmc3RhcnRQYWdlPTMwJmxpc3RObz03ODUmdGFibGU9ZXhfYmJzX2RhdGFfZWR1Jm5hdl9jb2RlPWVkdTE2MjIxODE1MjEmY29kZT1ad0tKWGZOaWVvem8mc2VhcmNoX2l0ZW09JnNlYXJjaF9vcmRlcj0mb3JkZXJfbGlzdD0mbGlzdF9zY2FsZT0mdmlld19sZXZlbD0mdmlld19jYXRlPSZ2aWV3X2NhdGUyPQ==", "content": "2025학년도 2학기 대학원 종합시험 결과 안내\n등록일\n2025-09-04\n작성자\n교육학과\n조회수\n129\n2025학년도 2학기 대학원 종합시험 결과를 붙임과 같이 안내해 드립니다.\n시트가 2개로 나뉘어 있으니 확인 시 유의 바랍니다.\n점수는 공개하지 않습니다.\n※ 불합격하신 과목은 반드시\n동일 과목으로 재응시\n하셔야 합니다.\n2025-2 교육대학원 종합시험 결과(게시용).xls\n2025-2 일반대학원 종합시험 결과(게시용).xls", "images": [], "attachments": [{"name": "2025-2 교육대학원 종합시험 결과(게시용).xls", "url": "https://home.knu.ac.kr/HOME/bbs/bbs_download.php?mv_data=aWR4PTEzOTgmc3RhcnRQYWdlPTMwJmxpc3RObz03ODUmdGFibGU9ZXhfYmJzX2RhdGFfZWR1Jm5hdl9jb2RlPWVkdTE2MjIxODE1MjEmc2l0ZV9jb2RlPWVkdSZjb2RlPVp3S0pYZk5pZW96byZzZWFyY2hfaXRlbT0mc2VhcmNoX29yZGVyPSZvcmRlcl9saXN0PSZsaXN0X3NjYWxlPQ==&download=h&seq=0"}, {"name": "2025-2 일반대학원 종합시험 결과(게시용).xls", "url": "https://home.knu.ac.kr/HOME/bbs/bbs_download.php?mv_data=aWR4PTEzOTgmc3RhcnRQYWdlPTMwJmxpc3RObz03ODUmdGFibGU9ZXhfYmJzX2RhdGFfZWR1Jm5hdl9jb2RlPWVkdTE2MjIxODE1MjEmc2l0ZV9jb2RlPWVkdSZjb2RlPVp3S0pYZk5pZW96byZzZWFyY2hfaXRlbT0mc2VhcmNoX29yZGVyPSZvcmRlcl9saXN0PSZsaXN0X3NjYWxlPQ==&download=h&seq=1"}]}
{"dept": "교육학과", "detail": "대학원", "title": "[교육대학원 상담심리전공 양성과정] 2025학년도 2학기 교직 적성 및 인성검사(1차) 시행 안내", "date": "2025-09-04", "url": "https://home.knu.ac.kr/HOME/edu/sub.htm?mode=view&mv_data=aWR4PTEzOTYmc3RhcnRQYWdlPTMwJmxpc3RObz03ODQmdGFibGU9ZXhfYmJzX2RhdGFfZWR1Jm5hdl9jb2RlPWVkdTE2MjIxODE1MjEmY29kZT1ad0tKWGZOaWVvem8mc2VhcmNoX2l0ZW09JnNlYXJjaF9vcmRlcj0mb3JkZXJfbGlzdD0mbGlzdF9zY2FsZT0mdmlld19sZXZlbD0mdmlld19jYXRlPSZ2aWV3X2NhdGUyPQ==", "content": "[교육대학원 상담심리전공 양성과정] 2025학년도 2학기 교직 적성 및 인성검사(1차) 시행 안내\n등록일\n2025-09-04\n작성자\n교육학과\n조회수\n72\n2025학년도 2학기 교직 적성 및 인성검사(1차)를 다음과 같이 시행하오니 해당 학생들이 기간 내 신청하여 검사를 받을 수 있도록 하여 주시기 바랍니다.\n가. 검사 개요\n1) 검사 인원 및 대상: 270명, 교직과정 이수자(사범대학, 교육대학원 포함)\n※ 휴학 및 수료생 포함\n2) 검사 방법: 정량평가\n3)\n검사 일시: 2025. 9. 22.(월) 19:00 ~ 19:50\n4) 검사 장소: 5개 검사장(글로벌플라자 경하홀Ⅰ·Ⅱ, 201, 203, 301호)\n5) 결과 확정: 2025. 9. 25.(목)[예정]\n-\n부적격자의 경우, 별도의 온라인 교육을 이수해야 함 ※ 추후 별도 안내 예정\n나. 신청 방법\n1)\n신청 기간: 2025. 9. 10.(수) ∼ 9. 12.(금) 매일 10:00 ~ 17:00\n※ 등록 학기별 신청 가능 기간 상이\n신청 기간\n대상\n(\n등록횟수\n)\n비고\n9. 10.(\n수\n)\n∼\n9. 12.(\n금\n)\n매일\n10:00-17:00\n교육대학원\n:\n4\n학기 이상\n9. 11.(\n목\n)\n～\n9. 12.(\n금\n)\n매일\n10:00-17:00\n교육대학원\n:\n3\n학기 이상\n9. 12.(\n금\n)\n10:00-17:00\n모두 가능\n2)\n신청 방법: 온라인으로만 신청 가능 > 통합정보시스템(\nhttp://knuin.knu.ac.kr)\n로그인 -\n교직 - 교직적성및인성검사관리 - 교직적성및인성검사신청\n다. 교원자격증 발급을 위한 교직 적성 및 인성검사 충족 요건\n구 분\n충족 요건\n참고사항\n기준연도\n2012\n년 이전 학생\n적격 판정\n1\n회\n-\n평가\n(\n정량\n,\n정성\n)\n종류 구별없음\n기준연도\n2013\n년 이후 학생\n적격 판정\n2\n회\n라. 아울러\n2026년 2월(기 수료자 포함) 또는 8월 졸업예정자 중 교직 적성 및 인성검사 기준을 충족하지 못한 학생은 반드시 신청 및 참여\n하여 주시기 바랍니다.\n첨부파일중 PDF미리보기\n파일 열람을 위해서는 아크로뱃 리더 설치가 필요합니다. 아래 링크를 클릭하여 리더를 다운로드 받으세요.\n교직 적성 및 인성검사 학생 신청.pdf\n2025학년도 2학기 교직 적성 및 인성검사(1차) 시행 계획.hwp", "images": ["http://www.adobe.com/images/shared/download_buttons/get_adobe_reader.png"], "attachments": [{"name": "교직 적성 및 인성검사 학생 신청.pdf", "url": "https://home.knu.ac.kr/HOME/bbs/bbs_download.php?mv_data=aWR4PTEzOTYmc3RhcnRQYWdlPTMwJmxpc3RObz03ODQmdGFibGU9ZXhfYmJzX2RhdGFfZWR1Jm5hdl9jb2RlPWVkdTE2MjIxODE1MjEmc2l0ZV9jb2RlPWVkdSZjb2RlPVp3S0pYZk5pZW96byZzZWFyY2hfaXRlbT0mc2VhcmNoX29yZGVyPSZvcmRlcl9saXN0PSZsaXN0X3NjYWxlPQ==&download=h&seq=0"}, {"name": "2025학년도 2학기 교직 적성 및 인성검사(1차) 시행 계획.hwp", "url": "https://home.knu.ac.kr/HOME/bbs/bbs_download.php?mv_data=aWR4PTEzOTYmc3RhcnRQYWdlPTMwJmxpc3RObz03ODQmdGFibGU9ZXhfYmJzX2RhdGFfZWR1Jm5hdl9jb2RlPWVkdTE2MjIxODE1MjEmc2l0ZV9jb2RlPWVkdSZjb2RlPVp3S0pYZk5pZW96byZzZWFyY2hfaXRlbT0mc2VhcmNoX29yZGVyPSZvcmRlcl9saXN0PSZsaXN0X3NjYWxlPQ==&download=h&seq=1"}]}
{"dept": "교육학과", "detail": "대학원", "title": "(일반·전문·특수)대학원 학점 인정 신청 관련 안내", "date": "2025-09-03", "url": "https://home.knu.ac.kr/HOME/edu/sub.htm?mode=view&mv_data=aWR4PTEzOTUmc3RhcnRQYWdlPTMwJmxpc3RObz03ODMmdGFibGU9ZXhfYmJzX2RhdGFfZWR1Jm5hdl9jb2RlPWVkdTE2MjIxODE1MjEmY29kZT1ad0tKWGZOaWVvem8mc2VhcmNoX2l0ZW09JnNlYXJjaF9vcmRlcj0mb3JkZXJfbGlzdD0mbGlzdF9zY2FsZT0mdmlld19sZXZlbD0mdmlld19jYXRlPSZ2aWV3X2NhdGUyPQ==", "content": "(일반·전문·특수)대학원 학점 인정 신청 관련 안내\n등록일\n2025-09-03\n작성자\n교육학과\n조회수\n59\n(일반‧전문‧특수)대학원 학생의 학점 인정 신청과 관련하여 다음과 같이 안내하니 해당 학생들은 수료(졸업) 사정 전에 신청하여 주시기 바랍니다.\n가. 입학 이전 이수학점 인정 신청[붙임 1]\n1) 본교 학사과정 재학시 대학원에 개설된 교과목을 이수한 경우: 최대 9학점\n※ 학부 졸업 학점을 초과하여 이수한 학점에 대하여 인정\n※ 단, 학‧석사연계과정 및 학‧석박사통합연계과정의 경우 학부 졸업학점과 대학원 수료학점에 각각 인정 : 최대 6학점\n2) 입학 이전\n동일한 과정으로(석-석/박-박)\n국내‧외 대학원에서 개설된 교과목을 이수한 경우: 최대 석사과정 9학점, 박사 및 석‧박사통합과정 12학점\n3) 승인 완료 시 성적증명서에 교과목명, 학점, 평점 등록\n※ 본교 교과목 중 인정 교과목은 대학원에서 이수 불가(재이수 처리됨)\n나. 석사과정 초과 이수학점 인정 신청[붙임 2]\n1) 일반대학원 석사과정 수료학점(24)을 초과하여 이수한 경우: 최대 6학점\n※\n단, 수료학점 중 ‘학위논문 및 연구윤리’ 교과목은 제외하고 24학점을 초과하여야 함\n2) 승인 완료 시 성적증명서에\n‘석사과정 초과 인정학점(교과목명)’으로 학점만 등록, 평점 없음(S로 표기)\n다. 신청 절차:\n신청서 및 성적증명서를 학과 사무실로 대면 제출 (원본 제출)\n라. 신청 시기: 상시 접수\n1) 반드시 수료(졸업)사정 전에 신청 완료\n2) 수료 또는 졸업 결정 후 신청 시 성적 반영이 불가할 수 있음", "images": [], "attachments": []}
{"dept": "교육학과", "detail": "대학원", "title": "◈ 청강생 신청 및 등록 방법 안내", "date": "2025-09-02", "url": "https://home.knu.ac.kr/HOME/edu/sub.htm?mode=view&mv_data=aWR4PTEzOTQmc3RhcnRQYWdlPTMwJmxpc3RObz03ODImdGFibGU9ZXhfYmJzX2RhdGFfZWR1Jm5hdl9jb2RlPWVkdTE2MjIxODE1MjEmY29kZT1ad0tKWGZOaWVvem8mc2VhcmNoX2l0ZW09JnNlYXJjaF9vcmRlcj0mb3JkZXJfbGlzdD0mbGlzdF9zY2FsZT0mdmlld19sZXZlbD0mdmlld19jYXRlPSZ2aWV3X2NhdGUyPQ==", "content": "◈ 청강생 신청 및 등록 방법 안내\n등록일\n2025-09-02\n작성자\n교육학과\n조회수\n258\n청강을 희망하시는 경우 해당 과목 교수님께 연락하셔서 승인을 받으시면 교수님이 담당 과목에 직접 수강생 추가\n(학번 입력 필요)가 가능합니다.\n이 경우\n별도의 수강신청 절차가 필요하지 않습니다.\n첨부파일중 PDF미리보기\n파일 열람을 위해서는 아크로뱃 리더 설치가 필요합니다. 아래 링크를 클릭하여 리더를 다운로드 받으세요.\n청강생 등록 매뉴얼.pdf", "images": ["http://www.adobe.com/images/shared/download_buttons/get_adobe_reader.png"], "attachments": [{"name": "청강생 등록 매뉴얼.pdf", "url": "https://home.knu.ac.kr/HOME/bbs/bbs_download.php?mv_data=aWR4PTEzOTQmc3RhcnRQYWdlPTMwJmxpc3RObz03ODImdGFibGU9ZXhfYmJzX2RhdGFfZWR1Jm5hdl9jb2RlPWVkdTE2MjIxODE1MjEmc2l0ZV9jb2RlPWVkdSZjb2RlPVp3S0pYZk5pZW96byZzZWFyY2hfaXRlbT0mc2VhcmNoX29yZGVyPSZvcmRlcl9saXN0PSZsaXN0X3NjYWxlPQ==&download=h&seq=0"}]}
{"dept": "교육학과", "detail": "대학원", "title": "* 2025학년도 2학기 교육대학원 '재학생' 대상 무논문 석사학위 신청 안내", "date": "2025-08-29", "url": "https://home.knu.ac.kr/HOME/edu/sub.htm?mode=view&mv_data=aWR4PTEzOTImc3RhcnRQYWdlPTQwJmxpc3RObz03ODEmdGFibGU9ZXhfYmJzX2RhdGFfZWR1Jm5hdl9jb2RlPWVkdTE2MjIxODE1MjEmY29kZT1ad0tKWGZOaWVvem8mc2VhcmNoX2l0ZW09JnNlYXJjaF9vcmRlcj0mb3JkZXJfbGlzdD0mbGlzdF9zY2FsZT0mdmlld19sZXZlbD0mdmlld19jYXRlPSZ2aWV3X2NhdGUyPQ==", "content": "* 2025학년도 2학기 교육대학원 '재학생' 대상 무논문 석사학위 신청 안내\n등록일\n2025-08-29\n작성자\n교육학과\n조회수\n104\n2025\n학년도\n2\n학기 특수대학원\n재학생\n무논문 석사학위 신청을 아래와 같이 안내합니다\n.\n가\n.\n신청대상\n:\n학위 수여를 위하여 무논문 승인을 받은 교육대학원 전공 소속 재학생 (1개 학기 이상 이수한 학생)\n대학원\n학과 및 전공\n전공주임\n비고\n교육대학원\n교육철학전공\n박균섭\n2015학년도 이전 입학생 신청 불가\n교육대학원\n교육행정전공\n강호수\n2011학년도 이전 입학생 신청 불가\n교육대학원\n상담심리전공\n김은영\n-\n나\n.\n신청 기한\n:\n2025. 9. 1.(월) 9:00 ~ 9. 10.(수) 17:30\n까지 (\n※\n기한 엄수)\n다\n.\n신청 방법:\n학생이\n①통합정보시스템에서 신청\n후,\n②아래의 제출서류(3부)를 학과 사무실로 직접 제출\n[첨부 파일 참조]\n라. 제출 서류\n(①~③ 모두 제출하여야 함)\n① 무논문 학위 신청원 (통합정보시스템 신청 출력물)  1부.\n② 무논문 석사 학위 수여 신청 사유서 및 지도교수 확인서  1부. (지도교수 서명 必)\n③\n성적증명서  1부.\n※\n신청 기한 내 제출 서류(4부)를\n반드시 과사로 제출\n하여야만 무논문 학위 신청이 완료됨\n(미제출 시 신청 접수되지 않음)\n※ 지도교수 및 전공주임 교수님 날인이 필요한 서류에는 반드시\n직접 날인\n을 받아야 함.\n라\n.\n유의 사항\n:\n신청 기간 종료 후 추가 접수 없음\n(\n다음 학기에 신청 가능\n)\n붙임  1. 통합정보시스템 무논문 석사학위 신청 매뉴얼\n1\n부.\n2. 무논문 석사 학위 수여 신청 사유서 및 지도교수 확인서 1부.\n끝\n.\n1. 교육대학원_무논문 석사 학위 수여 신청 사유서 및 지도교수 확인서.hwp\n2. 통합정보시스템 무논문 학위 신청 매뉴얼.hwp", "images": [], "attachments": [{"name": "1. 교육대학원_무논문 석사 학위 수여 신청 사유서 및 지도교수 확인서.hwp", "url": "https://home.knu.ac.kr/HOME/bbs/bbs_download.php?mv_data=aWR4PTEzOTImc3RhcnRQYWdlPTQwJmxpc3RObz03ODEmdGFibGU9ZXhfYmJzX2RhdGFfZWR1Jm5hdl9jb2RlPWVkdTE2MjIxODE1MjEmc2l0ZV9jb2RlPWVkdSZjb2RlPVp3S0pYZk5pZW96byZzZWFyY2hfaXRlbT0mc2VhcmNoX29yZGVyPSZvcmRlcl9saXN0PSZsaXN0X3NjYWxlPQ==&download=h&seq=0"}, {"name": "2. 통합정보시스템 무논문 학위 신청 매뉴얼.hwp", "url": "https://home.knu.ac.kr/HOME/bbs/bbs_download.php?mv_data=aWR4PTEzOTImc3RhcnRQYWdlPTQwJmxpc3RObz03ODEmdGFibGU9ZXhfYmJzX2RhdGFfZWR1Jm5hdl9jb2RlPWVkdTE2MjIxODE1MjEmc2l0ZV9jb2RlPWVkdSZjb2RlPVp3S0pYZk5pZW96byZzZWFyY2hfaXRlbT0mc2VhcmNoX29yZGVyPSZvcmRlcl9saXN0PSZsaXN0X3NjYWxlPQ==&download=h&seq=1"}]}
{"dept": "교육학과", "detail": "대학원", "title": "* 2025학년도 2학기 대학원 학위논문 제출예정자 신청 안내 (일반대학원/교육대학원 동일)", "date": "2025-08-26", "url": "https://home.knu.ac.kr/HOME/edu/sub.htm?mode=view&mv_data=aWR4PTEzOTAmc3RhcnRQYWdlPTQwJmxpc3RObz03ODAmdGFibGU9ZXhfYmJzX2RhdGFfZWR1Jm5hdl9jb2RlPWVkdTE2MjIxODE1MjEmY29kZT1ad0tKWGZOaWVvem8mc2VhcmNoX2l0ZW09JnNlYXJjaF9vcmRlcj0mb3JkZXJfbGlzdD0mbGlzdF9zY2FsZT0mdmlld19sZXZlbD0mdmlld19jYXRlPSZ2aWV3X2NhdGUyPQ==", "content": "* 2025학년도 2학기 대학원 학위논문 제출예정자 신청 안내 (일반대학원/교육대학원 동일)\n등록일\n2025-08-26\n작성자\n교육학과\n조회수\n139\n** 공지사항 본문 및 첨부파일을 반드시 숙지하신 후에 신청 및 문의하여 주시기 바랍니다.\n**\n박사 신청자\n는 내규에 따라\n1) 논문계획서 발표 결과보고서,\n2) 학회발표 증빙자료, 3) 학술지 게재 증빙자료\n​를\n함께 제출\n하시기 바랍니다.\n(이전에 제출한 경우에는 제출하지 않아도 됨)\n가\n.\n논문 제출자격\n:\n아래의\n5\n가지 요건을 모두 충족해야 함\n① 이번 학기 등록금 납부자(수료생은 수료생 등록금 납부 예정자)\n② 수료학점 이수자 또는 이수예정자\n(평점평균 2.7 이상) (*조기졸업 대상자: 평점평균 4.2 이상)\n③ 종합시험 합격자\n④ 연구윤리를 준수하여 지도교수의 추천을 받은 자\n※ 2016~2024학년도 입학생으로 이번 학기 논문 제출 예정자는\n10. 2.(목)까지 연구윤리교육을 이수\n하여야 함\n※ 통합정보시스템에서 2025. 9. 22.(월)부터 이수 여부 조회 가능\n(통합정보시스템 > 학적정보관리 > 학적기본사항 > 졸업 > 졸업자격인정)\n⑤ 기타 학과(부)에서 정한 졸업자격 요건을 충족한 자\n나. 논문제출 예정자 신청\n○ 신청 기간:\n2025. 9. 10.(수) ~ 9. 12.(금) [3일간]\n(※기한 엄수)\n○ 신청 방법:\n통합정보시스템\n좌측 메뉴 > 학사행정 > 졸업 > 졸업요건(대학원)\n>\n논문제출 예정자 신청\n>\n신청서 출력\n후\n지도교수 서명\n을 받아\n교육학과 사무실로 대면 제출\n﻿\n​ (※반드시 기한 내 제출할 것)\n○ 학과 사무실 근무 시간: 9:00 ~ 18:00 (※점심시간 12:00 ~ 13:00 제외)\n○\n제출 이후 논문제출예정 취소 신청 시 [붙임3]의 취소신청서를 작성하여 학과 사무실로 제출\n○\n신청 제외대상: 2025학년도 1학기 논문판정유보자 및 논문제출연기자\n다. 「논문표절예방프로그램 검증 결과물 제출 및 심사 의무화」와 관련하여 논문제출예정자는 빠짐 없이 [붙임2]의 내용을 확인하여 주시기 바랍니다.\n- 표절예방 검증 프로그램: 도서관 홈페이지에 게재된 Turnitin(턴잇인)에 검증\n-\n제출대상: 석사 및 박사 학위논문제출예정자(일반․전문․특수대학원 포함)\n-\n제출자료: 논문표절예방프로그램 결과물(Turnitin 보고서)\n-\n심사의무: 지도교수 및 심사위원은 턴잇인 보고서 심사 의무\n-\n제출시기: 2025학년도 2학기 심사용 논문 접수기간(9. 30. ~ 10. 2.)\n▶\nTurnitin 프로그램은 표절을 판가름 해주는 것이 아니며\n, 본문과의 유사한 문장으로 체크된 객관적인 출처 및 데이터를 제시하여 표절이 의심되는지의 여부를 알려주기 때문에\n체크된\n부분은 반드시 심사위원의 심사를 통해 표절 여부 판단\n﻿\n​ (※유사도가 몇 % 이하여야 하는지 등 기준이 정해져있지 않으므로, 관련하여 지도교수님께 문의 바랍니다.)\n첨부파일중 PDF미리보기\n파일 열람을 위해서는 아크로뱃 리더 설치가 필요합니다. 아래 링크를 클릭하여 리더를 다운로드 받으세요.\n첨부파일중 PDF미리보기\n파일 열람을 위해서는 아크로뱃 리더 설치가 필요합니다. 아래 링크를 클릭하여 리더를 다운로드 받으세요.\n1. (통합정보시스템) 대학원 학위논문 제출예정자 신청 방법 안내.hwp\n2-1. 논문표절예방프로그램(Turnitin)이용매뉴얼(국문).pdf\n2-2. (For Student) Turnitin Manual(Eng).pdf\n3. 학위논문 제출취소 신청서.hwp", "images": ["http://www.adobe.com/images/shared/download_buttons/get_adobe_reader.png"], "attachments": [{"name": "1. (통합정보시스템) 대학원 학위논문 제출예정자 신청 방법 안내.hwp", "url": "https://home.knu.ac.kr/HOME/bbs/bbs_download.php?mv_data=aWR4PTEzOTAmc3RhcnRQYWdlPTQwJmxpc3RObz03ODAmdGFibGU9ZXhfYmJzX2RhdGFfZWR1Jm5hdl9jb2RlPWVkdTE2MjIxODE1MjEmc2l0ZV9jb2RlPWVkdSZjb2RlPVp3S0pYZk5pZW96byZzZWFyY2hfaXRlbT0mc2VhcmNoX29yZGVyPSZvcmRlcl9saXN0PSZsaXN0X3NjYWxlPQ==&download=h&seq=0"}, {"name": "2-1. 논문표절예방프로그램(Turnitin)이용매뉴얼(국문).pdf", "url": "https://home.knu.ac.kr/HOME/bbs/bbs_download.php?mv_data=aWR4PTEzOTAmc3RhcnRQYWdlPTQwJmxpc3RObz03ODAmdGFibGU9ZXhfYmJzX2RhdGFfZWR1Jm5hdl9jb2RlPWVkdTE2MjIxODE1MjEmc2l0ZV9jb2RlPWVkdSZjb2RlPVp3S0pYZk5pZW96byZzZWFyY2hfaXRlbT0mc2VhcmNoX29yZGVyPSZvcmRlcl9saXN0PSZsaXN0X3NjYWxlPQ==&download=h&seq=1"}, {"name": "2-2. (For Student) Turnitin Manual(Eng).pdf", "url": "https://home.knu.ac.kr/HOME/bbs/bbs_download.php?mv_data=aWR4PTEzOTAmc3RhcnRQYWdlPTQwJmxpc3RObz03ODAmdGFibGU9ZXhfYmJzX2RhdGFfZWR1Jm5hdl9jb2RlPWVkdTE2MjIxODE1MjEmc2l0ZV9jb2RlPWVkdSZjb2RlPVp3S0pYZk5pZW96byZzZWFyY2hfaXRlbT0mc2VhcmNoX29yZGVyPSZvcmRlcl9saXN0PSZsaXN0X3NjYWxlPQ==&download=h&seq=2"}, {"name": "3. 학위논문 제출취소 신청서.hwp", "url": "https://home.knu.ac.kr/HOME/bbs/bbs_download.php?mv_data=aWR4PTEzOTAmc3RhcnRQYWdlPTQwJmxpc3RObz03ODAmdGFibGU9ZXhfYmJzX2RhdGFfZWR1Jm5hdl9jb2RlPWVkdTE2MjIxODE1MjEmc2l0ZV9jb2RlPWVkdSZjb2RlPVp3S0pYZk5pZW96byZzZWFyY2hfaXRlbT0mc2VhcmNoX29yZGVyPSZvcmRlcl9saXN0PSZsaXN0X3NjYWxlPQ==&download=h&seq=3"}]}
{"dept": "교육학과", "detail": "대학원", "title": "청년 연구자 정주비 지원계획 알림 및 신청 안내", "date": "2025-08-19", "url": "https://home.knu.ac.kr/HOME/edu/sub.htm?mode=view&mv_data=aWR4PTEzODcmc3RhcnRQYWdlPTQwJmxpc3RObz03NzkmdGFibGU9ZXhfYmJzX2RhdGFfZWR1Jm5hdl9jb2RlPWVkdTE2MjIxODE1MjEmY29kZT1ad0tKWGZOaWVvem8mc2VhcmNoX2l0ZW09JnNlYXJjaF9vcmRlcj0mb3JkZXJfbGlzdD0mbGlzdF9zY2FsZT0mdmlld19sZXZlbD0mdmlld19jYXRlPSZ2aWV3X2NhdGUyPQ==", "content": "청년 연구자 정주비 지원계획 알림 및 신청 안내\n등록일\n2025-08-19\n작성자\n교육학과\n조회수\n102\n청년 연구자 정주비 지원계획과 신청방법에 대해 다음과 같이 안내드리오니, 대상자들이 많이 신청하여 주시기 바랍니다.\n가. (목    적) 청년연구자의 대구광역시 정착 지원을 위한 주거비 일부 지원으로, 정착유도 및 지역유입 촉진\n나. (신청자격) 대구광역시 거주 만 39세 이하 청년 연구자(석사과정생 이상)\n다. (지원인원) 100명 내외\n※ 선발기준에 따라 지원인원 선발 예정\n라. (지원금액) 월 20만원\n마. (지원기간)\n 1차년도: 2025. 9월∼2026. 2월(6개월)\n 총 사업기간: 5년(∼2030. 2월)\n※ 2차년도는 별도의 사업계획 수립 후 시행 예정\n※ 총 사업기간은 5년이나, 상황에 따라 조기 종료될 수 있음\n바. 문의사항(이메일 문의만 가능): tjrgus2218@knu.ac.kr\n사. 기타 세부사항: [붙임] 참고\n붙임  1. 청년 연구자 정주비 지원계획 1부.\n2. 홍보포스터 1부.  끝.\n(붙임1) 청년연구자 정주비 지원계획.hwp\n(붙임2) 홍보포스터.png", "images": [], "attachments": [{"name": "(붙임1) 청년연구자 정주비 지원계획.hwp", "url": "https://home.knu.ac.kr/HOME/bbs/bbs_download.php?mv_data=aWR4PTEzODcmc3RhcnRQYWdlPTQwJmxpc3RObz03NzkmdGFibGU9ZXhfYmJzX2RhdGFfZWR1Jm5hdl9jb2RlPWVkdTE2MjIxODE1MjEmc2l0ZV9jb2RlPWVkdSZjb2RlPVp3S0pYZk5pZW96byZzZWFyY2hfaXRlbT0mc2VhcmNoX29yZGVyPSZvcmRlcl9saXN0PSZsaXN0X3NjYWxlPQ==&download=h&seq=0"}, {"name": "(붙임2) 홍보포스터.png", "url": "https://home.knu.ac.kr/HOME/bbs/bbs_download.php?mv_data=aWR4PTEzODcmc3RhcnRQYWdlPTQwJmxpc3RObz03NzkmdGFibGU9ZXhfYmJzX2RhdGFfZWR1Jm5hdl9jb2RlPWVkdTE2MjIxODE1MjEmc2l0ZV9jb2RlPWVkdSZjb2RlPVp3S0pYZk5pZW96byZzZWFyY2hfaXRlbT0mc2VhcmNoX29yZGVyPSZvcmRlcl9saXN0PSZsaXN0X3NjYWxlPQ==&download=h&seq=1"}]}
{"dept": "교육학과", "detail": "대학원", "title": "* 2025학년도 2학기 대학원생 연구윤리교육 추가 수강신청 안내", "date": "2025-08-19", "url": "https://home.knu.ac.kr/HOME/edu/sub.htm?mode=view&mv_data=aWR4PTEzODYmc3RhcnRQYWdlPTQwJmxpc3RObz03NzgmdGFibGU9ZXhfYmJzX2RhdGFfZWR1Jm5hdl9jb2RlPWVkdTE2MjIxODE1MjEmY29kZT1ad0tKWGZOaWVvem8mc2VhcmNoX2l0ZW09JnNlYXJjaF9vcmRlcj0mb3JkZXJfbGlzdD0mbGlzdF9zY2FsZT0mdmlld19sZXZlbD0mdmlld19jYXRlPSZ2aWV3X2NhdGUyPQ==", "content": "* 2025학년도 2학기 대학원생 연구윤리교육 추가 수강신청 안내\n등록일\n2025-08-19\n작성자\n교육학과\n조회수\n65\n대학원생 학위논문 제출 자격 요건인 「2025학년도 2학기 대학원생 연구윤리교육」 시행을 위한\n​추가 수강신청\n​ 일정을 알려드립니다.\n이번 학기 학위논문 제출예정자 등 해당 학생들은 빠짐없이 교육을 이수하여 주시기 바랍니다.\n가. 교육내용: 「대학원생을 위한 연구윤리」온라인 강의 수강\n(4과목 중\n택1\n하여 수강)\n○\n대학원생을 위한 연구윤리(인문사회)\n○ 대학원생을 위한 연구윤리(이공)\n○\nResearch ehtics for graduate students(Humanities and Social Sciences)\n○ Research ehtics for graduate students(Science and Engineering)\n나.\n수강신청:\n2025. 9. 2.(화) ~ 9. 5.(금)\n다\n.\n교육대상\n(특수대학원 포함, 무논문 제외)\n1) 2025학년도 대학원 입학생\n2) 2016~2024학년도 입학생 중 미이수자\n3) 2015학년도 이전 입학생은 이수 '권장'\n※ (유의사항)\n연구윤리교육\n미\n이수자 중\n이번 학기 학위논문 제출예정자는 2025. 10. 2.(목)까지 반드시 이수\n하여야 하며,\n​\n이전 연구윤리교육 수강신청 후 미이수자 또한 재수강 신청 필요\n라. 수강신청방법:\n경북대 통합정보시스템(\nhttps://knuin.knu.ac.kr/)에서\n수강 신청\n○ 통합정보시스템 좌측 메뉴의 「학사행정」→「졸업」→「졸업요건(대학원)」→「연구윤리교육신청」메뉴 선택\n○ 연구윤리교육신청 메뉴에서 아래의 4과목 중 한과목을 선택 후 (오른쪽) 「신청」버튼 클릭하여 수강신청 완료\n마. 교육 이수\n가) 학습관리시스템에 탑재된 연구윤리 강의 수강\n○ 경북대학교 포털사이트 접속하여 상단 메뉴 중 학습관리시스템 클릭, 또는 직접 주소(\nhttps://lms1.knu.ac.kr/)를\n입력하여 접속 후 로그인(ID와 PW는 통합정보시스템과 동일)\n○ 마이페이지 → 수강과목 → 강의명 클릭\n나)\n교육기간: 2025. 9. 9.(화) ~ 12. 22.(월)\n다) 수료기준: 진도 100%\n※ 수료기준 충족(전체 교육 이수완료)시 연구윤리교육 이수 인정\n※ 이전에 연구윤리교육 수강 신청 후\n미이수\n하였을 경우, 이번 학기에\n다시 수강신청\n후 이수하여야 함\n라) 이수 확인: 교육기간 종료 후 2025. 12월말 경 확인가능\n※ 교육 이수 후 통합포털시스템 → 통합정보시스템 → 학적정보관리 → 학적기본사항 → 졸업 → 졸업자격인정에서 이수여부 확인\n바. 문의\n- 학위논문 제출자격 관련 연구윤리교육 이수 전반: 학사과 (☏053-950-2058)\n- 통합정보시스템 수강 신청 등 전산 장애:\n정보화본부 (☏053-950-8649)\n- 학습관리시스템(LMS) 강좌 수강 등 전산 장애:\n정보화본부 (☏053-950-8705)\n아울러 본 연구윤리교육은\n2016학년도\n대학원 석․박사(통합)과정 입학생부터 학위논문 제출 자격요건으로\n의무적으로 이수\n해야 함을 알려드립니다.", "images": [], "attachments": []}
{"dept": "교육학과", "detail": "대학원", "title": "[글로컬대학사업] 2025학년도 2학기 G-KNU Scholarship 장학 선발 안내(추가)", "date": "2025-08-12", "url": "https://home.knu.ac.kr/HOME/edu/sub.htm?mode=view&mv_data=aWR4PTEzODMmc3RhcnRQYWdlPTQwJmxpc3RObz03NzcmdGFibGU9ZXhfYmJzX2RhdGFfZWR1Jm5hdl9jb2RlPWVkdTE2MjIxODE1MjEmY29kZT1ad0tKWGZOaWVvem8mc2VhcmNoX2l0ZW09JnNlYXJjaF9vcmRlcj0mb3JkZXJfbGlzdD0mbGlzdF9zY2FsZT0mdmlld19sZXZlbD0mdmlld19jYXRlPSZ2aWV3X2NhdGUyPQ==", "content": "[글로컬대학사업] 2025학년도 2학기 G-KNU Scholarship 장학 선발 안내(추가)\n등록일\n2025-08-12\n작성자\n교육학과\n조회수\n99\n2025\n년\n2\n학기\nG-KNU Scholarship\n장학생 선발 내용\n및\n자주 하는 질문\n(FAQ)\n을 안내드립니다.\n가\n.\n지원대\n상\n:\n대학원\n(\n전문대학원 포함\n)\n전일제 재학생\n으로 전일제 대학원생 학사정보에 등록한\n박사과정\n및\n석\n·\n박사통합과정생\n※\n세부조건\n【\n붙임\n】\n참조\n※\n(\n제외자\n)\n수료생\n,\n휴학생\n,\n초과학기자\n, GKS\n장학생\n,\n타 장학금으로 등록금 전액을 수혜 받은 자\n나\n.\n지원금액\n:\n등록금 전액\n※\n타 장학금으로 등록금을 지원받는 경우\n,\n등록금 차액 지원\n다\n.\n지원방법\n:\n등록금 선납부\n,\n후지원\n(11\n월 말 학생 개인 계좌로 입금 예정\n)\n라\n.\n지원시기\n-\n전일제 대학원생 학사정보 등록\n: 2025. 9 ~ 10\n월\n(\n추후 안내 예정\n)\n-\n장학생 선발 및 지원\n: 2025. 11\n월\n마\n.\n자주하는 질문\n【\n붙임 참조\n】\nQ1.\n등록금의 일부만 장학금으로 지원받은 경우\n,\n차액 보전이 가능한가요\n?\nQ2.\n외국인 유학생도 장학금 지원 대상인가요\n?\n외국인 유학생 인정\n기준은 무엇인가요\n?\nQ3.\n재학 중 파트타임 근로를 해도 전일제 학생으로 인정받을 수 있나요\n?\nQ4.\n대학원혁신지원사업\n(BK21\n+\n)\n장학생인데\n,\n본 장학금과 중복 지원이 가능한가요\n?\nQ5.\n복학생\n,\n등록금 이월자도 지원 대상에 포함되나요\n?\n첨부파일중 PDF미리보기\n파일 열람을 위해서는 아크로뱃 리더 설치가 필요합니다. 아래 링크를 클릭하여 리더를 다운로드 받으세요.\n첨부파일중 PDF미리보기\n파일 열람을 위해서는 아크로뱃 리더 설치가 필요합니다. 아래 링크를 클릭하여 리더를 다운로드 받으세요.\n[글로컬대학사업] G-KNU Scholarship 장학금 선발 안내.hwp\n전일제 대학원생 학사정보 등록 안내.pdf\n4대 사회보험 가입내역 확인서 발급 방법 및 미취업 여부 확인 방법.pdf", "images": ["http://www.adobe.com/images/shared/download_buttons/get_adobe_reader.png"], "attachments": [{"name": "[글로컬대학사업] G-KNU Scholarship 장학금 선발 안내.hwp", "url": "https://home.knu.ac.kr/HOME/bbs/bbs_download.php?mv_data=aWR4PTEzODMmc3RhcnRQYWdlPTQwJmxpc3RObz03NzcmdGFibGU9ZXhfYmJzX2RhdGFfZWR1Jm5hdl9jb2RlPWVkdTE2MjIxODE1MjEmc2l0ZV9jb2RlPWVkdSZjb2RlPVp3S0pYZk5pZW96byZzZWFyY2hfaXRlbT0mc2VhcmNoX29yZGVyPSZvcmRlcl9saXN0PSZsaXN0X3NjYWxlPQ==&download=h&seq=0"}, {"name": "전일제 대학원생 학사정보 등록 안내.pdf", "url": "https://home.knu.ac.kr/HOME/bbs/bbs_download.php?mv_data=aWR4PTEzODMmc3RhcnRQYWdlPTQwJmxpc3RObz03NzcmdGFibGU9ZXhfYmJzX2RhdGFfZWR1Jm5hdl9jb2RlPWVkdTE2MjIxODE1MjEmc2l0ZV9jb2RlPWVkdSZjb2RlPVp3S0pYZk5pZW96byZzZWFyY2hfaXRlbT0mc2VhcmNoX29yZGVyPSZvcmRlcl9saXN0PSZsaXN0X3NjYWxlPQ==&download=h&seq=1"}, {"name": "4대 사회보험 가입내역 확인서 발급 방법 및 미취업 여부 확인 방법.pdf", "url": "https://home.knu.ac.kr/HOME/bbs/bbs_download.php?mv_data=aWR4PTEzODMmc3RhcnRQYWdlPTQwJmxpc3RObz03NzcmdGFibGU9ZXhfYmJzX2RhdGFfZWR1Jm5hdl9jb2RlPWVkdTE2MjIxODE1MjEmc2l0ZV9jb2RlPWVkdSZjb2RlPVp3S0pYZk5pZW96byZzZWFyY2hfaXRlbT0mc2VhcmNoX29yZGVyPSZvcmRlcl9saXN0PSZsaXN0X3NjYWxlPQ==&download=h&seq=2"}]}
{"dept": "교육학과", "detail": "대학원", "title": "2025학년도 2학기 수강신청 안내", "date": "2025-08-11", "url": "https://home.knu.ac.kr/HOME/edu/sub.htm?mode=view&mv_data=aWR4PTEzODAmc3RhcnRQYWdlPTQwJmxpc3RObz03NzYmdGFibGU9ZXhfYmJzX2RhdGFfZWR1Jm5hdl9jb2RlPWVkdTE2MjIxODE1MjEmY29kZT1ad0tKWGZOaWVvem8mc2VhcmNoX2l0ZW09JnNlYXJjaF9vcmRlcj0mb3JkZXJfbGlzdD0mbGlzdF9zY2FsZT0mdmlld19sZXZlbD0mdmlld19jYXRlPSZ2aWV3X2NhdGUyPQ==", "content": "2025학년도 2학기 수강신청 안내\n등록일\n2025-08-11\n작성자\n교육학과\n조회수\n119\n가\n.\n수강신청기간\n:\n2025. 8. 12.(\n화\n) 10:00\n∼\n8. 14.(\n목\n) 18:00\n【\n3\n일간\n】\n나\n.\n참고사항\n:\n국내 타대학 교류 수학생의 경우\n2\n개 대학 이상에서 수학이 가능하므로\n본교 수강신청내역 삭제하지 않음\n.\n수강의사가 없는 과목은 반드시 본인이\n삭제\n(\n미삭제시\nF\n등급 부여됨\n)\n다.\n수강신청 자제\n관련 안내\n:\n교과목 담당교원의 가족이 해당 강의를 수강하는 경우\n교과목\n담당교원은\n수강 내역 및 성적 처리 결과\n에 대해\n신고 의무\n발생\n[\n경북대학교 수업관리지침 제\n16\n조의\n2(\n수강 신고 등\n)]\n구분\n수강 신청 자제 내용\n선택 및 교양 교과목\n-\n부모 및 친인척\n(8\n촌 이내\n)\n의 강의 가급적 수강 자제\n필수 교과목\n-\n분반 구성시 부모 및 친인척\n(8\n촌 이내\n)\n강의를 자제하고 타분반 선택\n라.\n재이수 제도 변경 운영\n구 분\n이전\n변경\n비 고\n재이수 대상과목\nC+\n이하\nB-\n이하\n2024\n학년도\n1\n학기부터 적용\n재이수 취득 성적 상한\n최대\nB+\n최대\nA-\n학기별 재이수 신청학점\n한 학기\n6\n학점 이내\n한 학기\n9\n학점 이내\n마\n. (\n대학원\n)\n학위과정별 수료학점의\n1/2\n범위 내\n에서\n본교 대학원\n타학과 전공교과목 이수학점\n을\n해당 학과 전공과목\n으로\n이수 가능\n(2024\n학년도\n2\n학기부터 적용\n)\n※\n단\n,\n석사과정생\n(2024\n학년도 신입생까지\n)\n은\n15\n학점 이내\n※ 타대학원/타학과 강의 수강신청 후, 학기 초에 수강신청 초안지를 작성하여 학과 사무실로 제출 (지도교수 날인 必)\n바.\n교직 수강자\n: 학부 개설 교직은 '선수과목'으로만 수강 가능하며(수료학점 미인정), 교육대학원 개설 교직의 교과구분을 '교직'으로 수강신청하여야 교직 및 수료학점으로 인정 가능함\n※ 선수과목 수강신청 방법: 수강신청 시 반드시\n​선수과목을 먼저 입력\n​한 후에 타 교과목을 입력하여야 수강신청이 가능함\n※ 수강신청 시 교과구분 반드시 확인\n(추후 '선수과목 → 교직'으로 변경 불가능)\n※ 학부 개설 교직: 사범대학 교육학과, 교육연수원 개설 교직 과목(TCHR~)\n※ 교육대학원 개설 교직: 교육대학원 교육철학전공 개설 교직 과목(TCHR~)\n2025학년도 2학기 수강신청 안내(대학원).hwp\n2025-2 수강신청 초안지(대학원).hwp\n수강신청 프로그램 사용설명서.hwp", "images": [], "attachments": [{"name": "2025학년도 2학기 수강신청 안내(대학원).hwp", "url": "https://home.knu.ac.kr/HOME/bbs/bbs_download.php?mv_data=aWR4PTEzODAmc3RhcnRQYWdlPTQwJmxpc3RObz03NzYmdGFibGU9ZXhfYmJzX2RhdGFfZWR1Jm5hdl9jb2RlPWVkdTE2MjIxODE1MjEmc2l0ZV9jb2RlPWVkdSZjb2RlPVp3S0pYZk5pZW96byZzZWFyY2hfaXRlbT0mc2VhcmNoX29yZGVyPSZvcmRlcl9saXN0PSZsaXN0X3NjYWxlPQ==&download=h&seq=0"}, {"name": "2025-2 수강신청 초안지(대학원).hwp", "url": "https://home.knu.ac.kr/HOME/bbs/bbs_download.php?mv_data=aWR4PTEzODAmc3RhcnRQYWdlPTQwJmxpc3RObz03NzYmdGFibGU9ZXhfYmJzX2RhdGFfZWR1Jm5hdl9jb2RlPWVkdTE2MjIxODE1MjEmc2l0ZV9jb2RlPWVkdSZjb2RlPVp3S0pYZk5pZW96byZzZWFyY2hfaXRlbT0mc2VhcmNoX29yZGVyPSZvcmRlcl9saXN0PSZsaXN0X3NjYWxlPQ==&download=h&seq=1"}, {"name": "수강신청 프로그램 사용설명서.hwp", "url": "https://home.knu.ac.kr/HOME/bbs/bbs_download.php?mv_data=aWR4PTEzODAmc3RhcnRQYWdlPTQwJmxpc3RObz03NzYmdGFibGU9ZXhfYmJzX2RhdGFfZWR1Jm5hdl9jb2RlPWVkdTE2MjIxODE1MjEmc2l0ZV9jb2RlPWVkdSZjb2RlPVp3S0pYZk5pZW96byZzZWFyY2hfaXRlbT0mc2VhcmNoX29yZGVyPSZvcmRlcl9saXN0PSZsaXN0X3NjYWxlPQ==&download=h&seq=2"}]}
{"dept": "교육학과", "detail": "대학원", "title": "2025학년도 2학기 재학생 등록금(분할납부, 차등납부 포함) 납부방법, 일정 등 총괄 안내", "date": "2025-08-07", "url": "https://home.knu.ac.kr/HOME/edu/sub.htm?mode=view&mv_data=aWR4PTEzNzgmc3RhcnRQYWdlPTQwJmxpc3RObz03NzUmdGFibGU9ZXhfYmJzX2RhdGFfZWR1Jm5hdl9jb2RlPWVkdTE2MjIxODE1MjEmY29kZT1ad0tKWGZOaWVvem8mc2VhcmNoX2l0ZW09JnNlYXJjaF9vcmRlcj0mb3JkZXJfbGlzdD0mbGlzdF9zY2FsZT0mdmlld19sZXZlbD0mdmlld19jYXRlPSZ2aWV3X2NhdGUyPQ==", "content": "2025학년도 2학기 재학생 등록금(분할납부, 차등납부 포함) 납부방법, 일정 등 총괄 안내\n등록일\n2025-08-07\n작성자\n교육학과\n조회수\n91\n<0. 기본사항>\n- 2025학년도 2학기 재학생 등록금은 2025. 8월 현재 각 대학(원) 재학생 및 2025. 8학기 복학(예정)생이 아래 3가지 방법으로 납부 가능\n- 아래 3가지 경우(납부방법)에 따라\n등록금 납부기간\n(☜클릭하기)이 달라지므로 링크를 접속하여 반드시 자신의 등록 일정을 반드시 확인(PC에서 chrome 브라우저 사용)\n[1] 재학생 등록(기본 방법, 분할/차등납부 대상자가 아닌 경우)\n- 고지서에 적힌 금액을 재학생 등록기간에 한 번에 납부\n- [본등록] 2025. 8. 25.(월)~8. 28.(목) 16:00(오후4시) 현금(계좌이체 등)/카드 가능\n- [추가1차 등록] 2025. 9. 2.(화)~9. 3.(수) 16:00(오후4시) 현금(계좌이체 등)/카드 가능\n- [추가2차 등록] 2025. 9. 22.(월)~9. 23.(화) 16:00(오후4시) 현금(계좌이체 등)가능, 카드 불가\n- [추가3차 등록] 2025. 10. 16.(목)~10. 17.(금) 16:00(오후4시) 현금(계좌이체 등)가능, 카드 불가\n- 현금납부는 고지서에 적힌 계좌로 이체 또는 고지서에 적힌 계좌 소속 은행 창구 방문으로 가능하며 카드납부에 대한 세부사항은\n“등록금 신용카드 납부제”참고\n(☜클릭하기)\n- 본등록, 추가1차, 추가2차, 추가3차 등록으로 4개 차수를 진행하므로 앞차수를 놓치더라도 뒷차수에 등록금 수납 가능\n[2] 분할납부(현금납부만 가능, 카드납부 불가)\n- 신청자에 한하여 등록금을 2~4차로 나누어 납부하는 방법\n- [신청기간] 2025. 8. 6.(수)~8. 11.(월) 통합정보시스템(등록-등록금관리-분납신청)에서 별도 신청\n- [분할 1차 등록] 2025. 8. 25.(월)~8. 28.(목) 16:00(오후4시) 현금(계좌이체 등)가능, 카드 불가\n- [분할 2차 등록] 2025. 9. 22.(월)~9. 23.(화) 16:00(오후4시) 현금(계좌이체 등)가능, 카드 불가\n- [분할 3차 등록] 2025. 10. 20.(월)~10. 21.(화) 16:00(오후4시) 현금(계좌이체 등)가능, 카드 불가\n- [분할 4차 등록] 2025. 11. 3.(월)~11. 4.(화) 16:00(오후4시) 현금(계좌이체 등)가능, 카드 불가\n- 분할납부의 경우 1차 납부 후에는 분할납부 취소가 불가능하며 반대로 1차 납부기간 중 미납 시 분할납부 신청이 취소됨. 이후 재학생 추가1차 등록으로 편입되어 등록금 수납하여야 함\n- 세부사항은\n“등록금 분할납부제”참고\n(☜클릭하기)\n[3] 차등납부(현금납부만 가능, 카드납부 불가)\n- 초과학기를 이수하는 학생 해당(일반적으로 9학기 등록부터 해당). 학점에 따라 차감된 등록금을 납부\n- 초과학기 대상자는 자동으로 차등납부 신청(8.5.)되나 취소신청(통합정보시스템-등록-등록금관리-차등납부신청) 가능. 취소 처리 후 차등납부 재신청자의 경우 9. 23.(화) 18:00까지 재신청(통합정보시스템-등록-등록금관리-차등납부신청) 필요\n- [차등납부 본등록] 2025. 10. 14.(화)~10. 15.(수) 16:00(오후4시) 현금(계좌이체 등)가능, 카드 불가\n- [차등납부 추가 1차 등록] 2025. 10. 20.(월)~10. 21.(화) 16:00(오후4시) 현금(계좌이체 등)가능, 카드 불가\n- 본등록, 추가1차 등록으로 2번 진행하므로 앞차수를 놓치더라도 뒷차수에 등록금 수납 가능\n- 세부사항은\n“등록금 차등납부제”참고\n(☜클릭하기)\n※ 신입생의 경우 입학 홈페이지 합격자 발표 안내문\n대학 입학 홈페이지\n(☜클릭하기),\n대학원 입학 홈페이지\n(☜클릭하기)을 참고하여 납부\n-\n등록금 납부기간\n(☜클릭하기) 접속하여 반드시 자신의 등록 일정을 반드시 확인(PC에서 chrome 브라우저 사용)\n※ 등록금 납부 “경북대학교 홈페이지→ 교육→ 학사행정→ 학사안내→ 등록 참고\n<1. 등록금 고지서 및 납부확인서 출력>\n-\n재학생 등록금 고지서 및 납입확인서 출력하기\n(☜클릭하기)\n- 개인별 납부방법에 따른 등록 기간에 등록금 고지서를 확인하고 납부\n- 등록금 고지서 및 납부 확인서 출력은 “[붙임] 통합정보시스템 등록금 고지서 및 납부확인서 출력방법”에서 확인\n- 등록금 납부 후 납부확인서가 출력되는 경우 정상 납부 처리\n- 고지서 출력 프로그램은 PC에서 chrome 브라우저 사용 권장\n<2. 문의전화>\n- 장학금 및 학자금 대출 관련: 학생과 053-950-2103~7\n- 의료공제회비 관련: 학생과 053-950-2098\n- 학생회비 관련: 총학생회 053-950-6961\n- 생활관(기숙사) 관련: 생활관 053-950-6681~2 (상주캠퍼스 생활관: 054-530-1666)\n- iM뱅크 비씨카드 결제관련: iM뱅크 경북대지점(053-944-1081, 1588-4000)\n- 농협 비씨카드 및 NH채움카드 결제관련: 농협 대현동 금융센터지점(053-956-0013)\n- 신한카드 결제관련: 신한카드 콜센터(1544-7000), 신한카드 대구지점(053-320-3700)\n- 등록금 납부 관련: 재무과 053-950-2623~5\n- 고지서출력 및 납부확인 등 등록시스템 관련: 정보화본부 053-950-8644\n- 학생본인이 전화‧문의해주시기 바랍니다. 본인이 아닐 시, 상담내용이 제한될 수 있습니다.", "images": [], "attachments": []}
{"dept": "교육학과", "detail": "대학원", "title": "2025학년도 2학기 사범대학 양현재 입실원 모집 공고", "date": "2025-08-07", "url": "https://home.knu.ac.kr/HOME/edu/sub.htm?mode=view&mv_data=aWR4PTEzNzcmc3RhcnRQYWdlPTQwJmxpc3RObz03NzQmdGFibGU9ZXhfYmJzX2RhdGFfZWR1Jm5hdl9jb2RlPWVkdTE2MjIxODE1MjEmY29kZT1ad0tKWGZOaWVvem8mc2VhcmNoX2l0ZW09JnNlYXJjaF9vcmRlcj0mb3JkZXJfbGlzdD0mbGlzdF9zY2FsZT0mdmlld19sZXZlbD0mdmlld19jYXRlPSZ2aWV3X2NhdGUyPQ==", "content": "2025학년도 2학기 사범대학 양현재 입실원 모집 공고\n등록일\n2025-08-07\n작성자\n교육학과\n조회수\n93\n2025\n학년도\n2\n학기 사범대학 양현재 입실원 모집 공고\n1.\n모집인원\n: 154\n명\n◦\n401\n호\n: 84\n석\n◦\n402\n호\n: 30\n석\n※\n독서대가 아닌 오픈형 테이블로 운영\n◦\n403\n호\n: 40\n석\n2.\n사용기간\n: 2025. 9. 1.(\n월\n) ~ 2026. 2. 26.(\n목\n)\n까지\n3.\n신청자격\no\n사범대학 재학생\n(\n학적에\n6\n학기 이상 등록\n: 2025.1\n학기 기준\n)\n또는 졸업생\no\n교육대학원 재학생\n(\n학적에\n3\n학기 이상 등록\n: 2025.1\n학기 기준\n)\n또는 졸업생\n4.\n신청기간\n:\n2025.8.14.(\n목\n)09:00 ~ 2025.8.22.(\n금\n)18:00\n(\n신청기간 내 신청자만 인정\n)\n5.\n신청서식 및 방법\n양식 작성하여\n담당자\n이메일\n(\nejukwon@knu.ac.kr\n)\n신청\n-\n한글파일\n(\n연락처\n: 950-3598)\n대학\n학과\n학번\n성  명\n휴대폰번호\n등록\n횟수\n신청호실 순위\n비 고\n401\n402\n403\n※\n희망하는 호실 순위를\n1,2,3\n으로 기재하되\n,\n만약\n2,3\n순위 희망 호실이 없는 경우\n1\n순위만 기재 바람\n6.\n선발방식\n:\n무작위 추첨\n(\n신청 인원이 희망하는 호실의 정원을 초과하는 경우 미선발 가능\n)\n7.\n선발공지\n:\n사범대학 홈페이지에\n2025. 8. 29(\n금\n) 17:00\n공지\n사범대학 양현재 입실원 모집공고 (2025.2학기).hwp", "images": [], "attachments": [{"name": "사범대학 양현재 입실원 모집공고 (2025.2학기).hwp", "url": "https://home.knu.ac.kr/HOME/bbs/bbs_download.php?mv_data=aWR4PTEzNzcmc3RhcnRQYWdlPTQwJmxpc3RObz03NzQmdGFibGU9ZXhfYmJzX2RhdGFfZWR1Jm5hdl9jb2RlPWVkdTE2MjIxODE1MjEmc2l0ZV9jb2RlPWVkdSZjb2RlPVp3S0pYZk5pZW96byZzZWFyY2hfaXRlbT0mc2VhcmNoX29yZGVyPSZvcmRlcl9saXN0PSZsaXN0X3NjYWxlPQ==&download=h&seq=0"}]}
{"dept": "교육학과", "detail": "대학원", "title": "* 2025학년도 2학기 교육대학원 종합시험 시행 안내(추가)", "date": "2025-08-07", "url": "https://home.knu.ac.kr/HOME/edu/sub.htm?mode=view&mv_data=aWR4PTEzNzYmc3RhcnRQYWdlPTQwJmxpc3RObz03NzMmdGFibGU9ZXhfYmJzX2RhdGFfZWR1Jm5hdl9jb2RlPWVkdTE2MjIxODE1MjEmY29kZT1ad0tKWGZOaWVvem8mc2VhcmNoX2l0ZW09JnNlYXJjaF9vcmRlcj0mb3JkZXJfbGlzdD0mbGlzdF9zY2FsZT0mdmlld19sZXZlbD0mdmlld19jYXRlPSZ2aWV3X2NhdGUyPQ==", "content": "* 2025학년도 2학기 교육대학원 종합시험 시행 안내(추가)\n등록일\n2025-08-07\n작성자\n교육학과\n조회수\n178\n교육대학원 「2025학년도 2학기 종합시험 시행 계획」을 다음과 같이 안내드립니다.\n가. 응시자격\n: 수료학점의 2/3 이상 이수하고, 지도교수의 추천을 받은 자\n- 논문졸업예정자 : 현재 수료학점(24학점)의 3분의 2 이상(=16학점 이상)을 이수하고 지도교수의 추천을 받은 자\n- 무논문졸업예정자 : 현재 수료학점(30학점)의 3분의 2 이상(=20학점 이상)을 이수하고 지도교수의 추천을 받은 자\n※\n선수과목은 수료학점에서 제외\n되니 착오 없으시기 바랍니다.\n※\n수료생이 종합시험 응시를 위해 수료생 등록을 할 필요는 없음\n※ 이번 학기에 신청한 수강과목 중 재이수를 하는 경우, 재이수 과목의 학점을 제외하고 수료학점의 3분의 2 이상 이수하여야 함\n(<예> 전공과목 18학점 이수한 석사과정 학생이 이번 학기에 3학점을 재이수 수강신청하였다면, 이수한 전공과목 학점은 15학점으로 응시응시자격 미달자가 됨)\n나. 합격기준\n: 과목별 70점 이상(100점 만점) 및 전과목 합격\n- 일부 과목 불합격(1과목 이상 70점 미만)인 경우 종합시험 불합격(다음 학기 불합격한 과목 수만큼만 재응시하면 됨)\n- 예) '1과목 70점 이상, 1과목 70점 미만'인 경우 종합시험 불합격, 다음 학기 불합격한 1과목만 재시험 (동일과목)\n다. 원서접수\n(1) 기간 :\n2025. 8. 20.(수) 9:00 ~ 8. 22.(금) 17:30\n까지 (기한 엄수) ​(* 점심시간 12~13시 제외)\n(2)\n방법:\n①차세대 통합정보시스템에서 온라인 신청 → ②신청서(원서) 출력 및 추가 기재 → ③지도교수 추천(날인) → ④학과 사무실로 대면 제출\n* 차세대 통합정보시스템 > 학사행정 > 졸업 > 졸업요건(대학원) > 종합시험신청\n(3) 장소: 교육학과 사무실(사범대학 823호)\n** 본인 수강과목 조회: 통합정보시스템 > 학적 > 학적정보관리 > 학적기본사항관리\n** 본인 수강과목을 조회하여 응시할\n시험과목명을 정확하게 작성\n하여 주십시오. (띄어쓰기, 1/Ⅰ 구분 등)\n※ '종합시험 지원서 작성 요령'을 반드시 확인할 것\n라. 시행방법\n1) 시험과목 :\n2과목\n실시 (단, 전년도에 합격한 과목이 있는 응시자는 불합격한 과목만 응시 가능)\n** 과목 선택과 관련하여서는 반드시 지도교수님과 상의\n바랍니다. (학과에서 관여하지 않음)\n2)\n동일 교수 과목만으로는 시행 불가\n(* 팀티칭도 동일 교수로 취급)\n3) 일시 및 장소 : 8. 27.(목) ~ 9. 2.(화) 중 각 전공에서 별도로 정함​ (과목당 1시간)\n**\n각 전공별 시험 날짜 및 장소는 반드시 전공주임 교수님과 상의\n하시기 바랍니다. (전공별 시험일자가 학과에 전달되면 추후 본 공지에 기재할 예정임)\n4)\n응시생에 대한 시험 시행 결과 통지\n:\n25. 9. 8.(월)\n학과 홈페이지에 안내\n(예정)\n** 지원과목 중 1과목이라도 70점 미만인 점수가 있는 경우 불합격 처리 (2과목 모두 합격한 학기에 합격 처리됨)\n[각 전공별 시험 일자 및 장소]\n- 상담심리전공: 9. 1.(월) 18:00~, 우당교육관 201호\n- 교육과정및교육공학전공: 9. 2.(화) 18:00~, 사범대학 801호(강현석 교수님 연구실)\n- 교육사회전공: 미정\n- 평생교육전공: 9. 1.(월) 20:00~, 사범대학 815호(현영섭 교수님 연구실)\n- 교육심리및교육평가전공: 9. 1.(월) 18:00~,\n사범대학 816호(손원숙 교수님 연구실)\n- 교육철학전공:\n8. 28.(목) 14:00~, 사범대학 615호(김상현 교수님 연구실)\n- 교육행정전공: 8. 28.(목) 18:00~, 사범대학 820호(강호수 교수님 연구실)\n첨부파일중 PDF미리보기\n파일 열람을 위해서는 아크로뱃 리더 설치가 필요합니다. 아래 링크를 클릭하여 리더를 다운로드 받으세요.\n(통합정보시스템)대학원 종합시험 신청 안내.hwp\n★종합시험 지원서 작성 요령.pdf", "images": ["http://www.adobe.com/images/shared/download_buttons/get_adobe_reader.png"], "attachments": [{"name": "(통합정보시스템)대학원 종합시험 신청 안내.hwp", "url": "https://home.knu.ac.kr/HOME/bbs/bbs_download.php?mv_data=aWR4PTEzNzYmc3RhcnRQYWdlPTQwJmxpc3RObz03NzMmdGFibGU9ZXhfYmJzX2RhdGFfZWR1Jm5hdl9jb2RlPWVkdTE2MjIxODE1MjEmc2l0ZV9jb2RlPWVkdSZjb2RlPVp3S0pYZk5pZW96byZzZWFyY2hfaXRlbT0mc2VhcmNoX29yZGVyPSZvcmRlcl9saXN0PSZsaXN0X3NjYWxlPQ==&download=h&seq=0"}, {"name": "★종합시험 지원서 작성 요령.pdf", "url": "https://home.knu.ac.kr/HOME/bbs/bbs_download.php?mv_data=aWR4PTEzNzYmc3RhcnRQYWdlPTQwJmxpc3RObz03NzMmdGFibGU9ZXhfYmJzX2RhdGFfZWR1Jm5hdl9jb2RlPWVkdTE2MjIxODE1MjEmc2l0ZV9jb2RlPWVkdSZjb2RlPVp3S0pYZk5pZW96byZzZWFyY2hfaXRlbT0mc2VhcmNoX29yZGVyPSZvcmRlcl9saXN0PSZsaXN0X3NjYWxlPQ==&download=h&seq=1"}]}
{"dept": "교육학과", "detail": "대학원", "title": "* 2025학년도 2학기 일반대학원 종합시험 시행 안내", "date": "2025-08-05", "url": "https://home.knu.ac.kr/HOME/edu/sub.htm?mode=view&mv_data=aWR4PTEzNzMmc3RhcnRQYWdlPTQwJmxpc3RObz03NzImdGFibGU9ZXhfYmJzX2RhdGFfZWR1Jm5hdl9jb2RlPWVkdTE2MjIxODE1MjEmY29kZT1ad0tKWGZOaWVvem8mc2VhcmNoX2l0ZW09JnNlYXJjaF9vcmRlcj0mb3JkZXJfbGlzdD0mbGlzdF9zY2FsZT0mdmlld19sZXZlbD0mdmlld19jYXRlPSZ2aWV3X2NhdGUyPQ==", "content": "* 2025학년도 2학기 일반대학원 종합시험 시행 안내\n등록일\n2025-08-05\n작성자\n교육학과\n조회수\n216\n1.\n주요 일정\n가\n. 신청(접수) 안내\n(1) 신청 기간\n:\n2025. 8. 20.(수) 9:00 ~ 8. 22.(금) 17:30\n(※ 점심시간 12시~13시 제외)\n(2) 신청 방법:\n①차세대 통합정보시스템에서 온라인 신청 → ②신청서(원서) 출력 및 추가 기재 → ③지도교수 추천(날인) → ④학과 사무실로 대면 제출\n* 차세대 통합정보시스템 > 학사행정 > 졸업 > 졸업요건(대학원) > 종합시험신청\n* 교육\n학과 사무실: 경북대학교 사범대학 823호\n※ 붙임의\n'종합시험 지원서 작성 요령' 반드시 확인할 것\n나\n.\n시험 시행\n(1) 일시 :\n2025. 8. 28.(목) 13:30\n~\n﻿\n(* 반드시 13:00까지 입실)\n(* 시험시간: 과목당 1시간)\n(2) 장소 : 사범대학 812호 (인원에 따라 변동 가능)\n다\n.\n응시생에 대한 시험 시행 결과 통지\n:\n25. 9. 8.(월)\n학과 홈페이지에 안내\n(예정)\n2.\n시험과목\n가\n.\n석사과정\n:\n학과장이 정한\n3\n과목 이상\n의 교과목\n나\n.\n박사과정\n:\n학과장이 정한\n4\n과목 이상\n의 교과목\n다\n.\n시험과목 선정 유의사항\n:\n지원자들에게 공통으로 이수한 과목을 선정할 수도 있지만\n,\n개인별로 다른 과목을 선정할 수 있음\n라.\n동일 교수의 과목만으로 종합시험을 부과할 수 없음\n​(*팀티칭이더라도 동일 교수로 취급)\n(예) 3과목을 시험과목으로 부과한다면 2과목까지 동일 교수의 과목으로 시행할 수 있음\n마.\n일부과목 합격자\n:\n반드시 지난 시험의 불합격 과목을 다시 응시\n바.\n시험과목 선정 등은 지도교수님에게 문의\n하시기 바랍니다.\n3.\n지원자격:\n수료학점의\n3\n분의\n2\n이상 이수\n​\n하고,\n지도교수의 추천\n을 받은 자\n※\n수료생이 종합시험 응시를 위해 수료생 등록을 할 필요는 없음\n※ 이번 학기에 신청한 수강과목 중 재이수를 하는 경우, 재이수 과목의 학점을 제외하고 수료학점의 3분의 2 이상 이수하여야 함\n(<예> 전공과목 18학점 이수한 석사과정 학생이 이번 학기에 3학점을 재이수 수강신청하였다면, 이수한 전공과목 학점은 15학점으로 응시응시자격 미달자가 됨)\n※\n지원자격 미달자가 응시할 경우, 합격 시 무효 처리\n되니\n본인의 지원자격을 반드시 확인\n한 후 지원할 것\n4.\n제출서류:\n종합시험 신청서(출력물)\n1\n부\n*\n통합정보시스템에서 수강과목을 조회하시고\n시험 과목명\n을\n정확하게 작성\n하여 주십시오\n. (띄어쓰기, 1/Ⅰ 구분 등)\n5.\n합격기준\n가. 과목당\n100\n점 만점에서\n70\n점 이상 얻어야 함.\n나. 일부 과목 불합격인 경우 종합시험 불합격 (다음 학기 불합격한 과목 수 만큼만 재응시하면 됨)\n첨부파일중 PDF미리보기\n파일 열람을 위해서는 아크로뱃 리더 설치가 필요합니다. 아래 링크를 클릭하여 리더를 다운로드 받으세요.\n(통합정보시스템)대학원 종합시험 신청 안내.hwp\n★종합시험 지원서 작성 요령.pdf", "images": ["http://www.adobe.com/images/shared/download_buttons/get_adobe_reader.png"], "attachments": [{"name": "(통합정보시스템)대학원 종합시험 신청 안내.hwp", "url": "https://home.knu.ac.kr/HOME/bbs/bbs_download.php?mv_data=aWR4PTEzNzMmc3RhcnRQYWdlPTQwJmxpc3RObz03NzImdGFibGU9ZXhfYmJzX2RhdGFfZWR1Jm5hdl9jb2RlPWVkdTE2MjIxODE1MjEmc2l0ZV9jb2RlPWVkdSZjb2RlPVp3S0pYZk5pZW96byZzZWFyY2hfaXRlbT0mc2VhcmNoX29yZGVyPSZvcmRlcl9saXN0PSZsaXN0X3NjYWxlPQ==&download=h&seq=0"}, {"name": "★종합시험 지원서 작성 요령.pdf", "url": "https://home.knu.ac.kr/HOME/bbs/bbs_download.php?mv_data=aWR4PTEzNzMmc3RhcnRQYWdlPTQwJmxpc3RObz03NzImdGFibGU9ZXhfYmJzX2RhdGFfZWR1Jm5hdl9jb2RlPWVkdTE2MjIxODE1MjEmc2l0ZV9jb2RlPWVkdSZjb2RlPVp3S0pYZk5pZW96byZzZWFyY2hfaXRlbT0mc2VhcmNoX29yZGVyPSZvcmRlcl9saXN0PSZsaXN0X3NjYWxlPQ==&download=h&seq=1"}]}
{"dept": "교육학과", "detail": "대학원", "title": "* 2025학년도 2학기 대학원 수료생 등록 안내", "date": "2025-08-05", "url": "https://home.knu.ac.kr/HOME/edu/sub.htm?mode=view&mv_data=aWR4PTEzNzImc3RhcnRQYWdlPTUwJmxpc3RObz03NzEmdGFibGU9ZXhfYmJzX2RhdGFfZWR1Jm5hdl9jb2RlPWVkdTE2MjIxODE1MjEmY29kZT1ad0tKWGZOaWVvem8mc2VhcmNoX2l0ZW09JnNlYXJjaF9vcmRlcj0mb3JkZXJfbGlzdD0mbGlzdF9zY2FsZT0mdmlld19sZXZlbD0mdmlld19jYXRlPSZ2aWV3X2NhdGUyPQ==", "content": "* 2025학년도 2학기 대학원 수료생 등록 안내\n등록일\n2025-08-05\n작성자\n교육학과\n조회수\n104\n「2025학년도 2학기 대학원 수료생 등록 계획」을 다음과 같이 알려드리니, 수료생 등록이 필요한 학생은 기한 내 신청 바랍니다.\n가. 신청 대상: 각 대학원 수료생\n※ 1. 2025학년도 2학기에 학위취득을 위한 논문을 제출하고자 하는 자 또는 논문 지도를 받고자 하는 자\n2. 연구 과제 참여로 산학협력단을 통해 인건비를 받고자 하는 자(과제에 따라 수료생 등록 필요 여부 확인 요망)\n◆\n연구 과제 참여로\n산학협력단을 통해 인건비를 받고자 하는 자\n는 과제에 따라 수료생\n등록 여부가 중요함으로\n반드시\n과제 담당자에게 확인 후 수료생 등록 여부 판단\n◆\n2025\n년도\n1\n학기\n수료생\n중\n학위논문심사에서\n“\n판정유보\n”\n및\n“\n완성논문 제출연기\n”\n로 결정된\n자는 수료생 등록을 하지 않아도 논문심사 및 완성논문 제출을 할 수 있음\n⤷\n대학원에서는 수료생 등록을 한 학기 면제해 주지만\n산학협력단을 통해 인건비를 받고자 하는 자\n는 수료생 등록을 해야하는 경우가 있으므로\n반드시 확인 요망\n◆\n2025\n년도\n1\n학기\n재학생\n중\n학위논문심사에서\n“\n판정유보\n”\n및\n“\n완성논문 제출연기\n”\n로 결정된\n자는\n이번 학기 수료생 등록을 하여야 함\n나. 신청 방법:\n신청기간 내에 아래의 ①~③을 모두 완료하여야 함\n①\n차세대 통합정보시스템\n에서 직접 전산 신청 후 신청서 출력\n(차세대 통합정보시스템 > 학사행정 > 졸업 > 졸업요건(대학원) > 수료생 등록신청 에서 신청)\n② 신청서에 지도교수님 날인을 받은 후 학과 사무실로\n대면 제출\n(※이메일/우편 제출 불가)\n​③ 신청자의 자격을 심사ㆍ확인 후 학과에서 승인\n다. 신청 및 등록 기간\n1) 신청 및 제출 기간: 2025. 8. 18.(월) 9:00 ~ 8. 20.(수) 17:00\n(※ 점심시간 1\n2:00~13:00 제외)\n2) 등록기간: 2025. 9. 3.(수) ~ 9. 4.(목)\n라. 유의사항\n○ 수료생 등록을 한 후 심사용 논문을 제출하지 않는 경우라도\n등록금을 환불하지 않으니\n등록금을 납부하기 전에 신중히 검토하여 등록\n* 이번 학기 논문심사 여부가 확정되지 않은 경우 추가 납부기간에 납부하기 바람\n○ 1차 신청자 중 미납자는 2차 신청기간 중 재신청하지 않아도 2차 납부기간 중 납부 가능\n○ 납부기간 중 학교 홈페이지 공지사항을 통해 출력 가능,\n등록금 환불은 없음에 유의\n(통합정보시스템)대학원 수료생 등록 신청안내(게시용).hwp", "images": [], "attachments": [{"name": "(통합정보시스템)대학원 수료생 등록 신청안내(게시용).hwp", "url": "https://home.knu.ac.kr/HOME/bbs/bbs_download.php?mv_data=aWR4PTEzNzImc3RhcnRQYWdlPTUwJmxpc3RObz03NzEmdGFibGU9ZXhfYmJzX2RhdGFfZWR1Jm5hdl9jb2RlPWVkdTE2MjIxODE1MjEmc2l0ZV9jb2RlPWVkdSZjb2RlPVp3S0pYZk5pZW96byZzZWFyY2hfaXRlbT0mc2VhcmNoX29yZGVyPSZvcmRlcl9saXN0PSZsaXN0X3NjYWxlPQ==&download=h&seq=0"}]}
{"dept": "교육학과", "detail": "대학원", "title": "* 2025학년도 2학기 대학원생 연구윤리교육 시행 안내", "date": "2025-07-29", "url": "https://home.knu.ac.kr/HOME/edu/sub.htm?mode=view&mv_data=aWR4PTEzNjkmc3RhcnRQYWdlPTUwJmxpc3RObz03NzAmdGFibGU9ZXhfYmJzX2RhdGFfZWR1Jm5hdl9jb2RlPWVkdTE2MjIxODE1MjEmY29kZT1ad0tKWGZOaWVvem8mc2VhcmNoX2l0ZW09JnNlYXJjaF9vcmRlcj0mb3JkZXJfbGlzdD0mbGlzdF9zY2FsZT0mdmlld19sZXZlbD0mdmlld19jYXRlPSZ2aWV3X2NhdGUyPQ==", "content": "* 2025학년도 2학기 대학원생 연구윤리교육 시행 안내\n등록일\n2025-07-29\n작성자\n교육학과\n조회수\n59\n대학원생 학위논문 제출 자격 요건인 「2025학년도 2학기 대학원생 연구윤리교육」을 아래와 같이 시행함을 알려드립니다.\n이번 학기 학위논문 제출예정자 등 해당 학생들은 빠짐없이 교육을 이수하여 주시기 바랍니다.\n(※이번 학기 학위논문 제출예정자가 아닌 학생도 수강 가능)\n가. 교육내용:「대학원생을 위한 연구윤리」온라인 강의 수강\n(4과목 중\n택1\n하여 수강)\n○ 대학원생을 위한 연구윤리(인문사회)\n○ 대학원생을 위한 연구윤리(이공)\n○ Research ehtics for graduate students(Humanities and Social Sciences)\n○ Research ehtics for graduate students(Science and Engineering)\n나.\n수강신청:\n2025. 8. 11.(월) ~ 8. 14.(목)\n다\n.\n교육대상\n(특수대학원 포함, 무논문 제외)\n1) 2025학년도 대학원 입학생\n2) 2016~2024학년도 입학생 중 미이수자\n3) 2015학년도 이전 입학생은 이수 '권장'\n※\n연구윤리교육\n미\n이수자 중\n이번 학기 학위논문 제출예정자는 2025. 10. 2.(목)까지 반드시 이수\n하여야 하며,\n이전 연구윤리교육 수강신청 후 미이수자 또한 재수강 신청 필요\n라. 수강신청방법: 붙임 파일 참고\n마. 교육 이수\n가) 학습관리시스템에 탑재된 연구윤리 강의 수강\n○ 경북대학교 포털사이트 접속하여 상단 메뉴 중 학습관리시스템 클릭, 또는 직접 주소(\nhttps://lms1.knu.ac.kr/\n)를  입력하여 접속 후 로그인(ID와 PW는 통합정보시스템과 동일)\n○ 마이페이지 → 수강과목 → 강의명 클릭\n나)\n교육기간: 2025. 9. 1.(월) ~ 12. 22.(월)\n다) 수료기준: 진도 100%\n※ 수료기준 충족(전체 교육 이수완료)시 연구윤리교육 이수 인정\n※ 이전에 연구윤리교육 수강 신청 후\n미이수\n하였을 경우, 이번 학기에\n다시 수강신청\n후 이수하여야 함\n라) 이수 확인: 교육기간 종료 후 2025. 12월말 경 확인가능\n※ 교육 이수 후 통합포털시스템 → 통합정보시스템 → 학적정보관리 → 학적기본사항 → 졸업 → 졸업자격인정에서 이수여부 확인\n바. 문의\n- 학위논문 제출자격 관련 연구윤리교육 이수 전반: 학사과 (☏053-950-2058)\n- 통합정보시스템 수강 신청 등 전산 장애:\n정보화본부 (☏053-950-8649)\n- 학습관리시스템(LMS) 강좌 수강 등 전산 장애:\n정보화본부 (☏053-950-8705)\n아울러 본 연구윤리교육은\n2016학년도\n대학원 석․박사(통합)과정 입학생부터 학위논문 제출 자격요건으로\n의무적으로 이수\n해야 함을 알려드립니다.\n(통합정보시스템)연구윤리교육 신청 프로그램  사용설명서(학생용).hwp", "images": [], "attachments": [{"name": "(통합정보시스템)연구윤리교육 신청 프로그램  사용설명서(학생용).hwp", "url": "https://home.knu.ac.kr/HOME/bbs/bbs_download.php?mv_data=aWR4PTEzNjkmc3RhcnRQYWdlPTUwJmxpc3RObz03NzAmdGFibGU9ZXhfYmJzX2RhdGFfZWR1Jm5hdl9jb2RlPWVkdTE2MjIxODE1MjEmc2l0ZV9jb2RlPWVkdSZjb2RlPVp3S0pYZk5pZW96byZzZWFyY2hfaXRlbT0mc2VhcmNoX29yZGVyPSZvcmRlcl9saXN0PSZsaXN0X3NjYWxlPQ==&download=h&seq=0"}]}
{"dept": "교육학과", "detail": "대학원", "title": "2025년 8월(2024학년도 후기) 대학원 수업연한단축[조기수료 또는 졸업] 신청 안내", "date": "2025-07-09", "url": "https://home.knu.ac.kr/HOME/edu/sub.htm?mode=view&mv_data=aWR4PTEzNTkmc3RhcnRQYWdlPTUwJmxpc3RObz03NjkmdGFibGU9ZXhfYmJzX2RhdGFfZWR1Jm5hdl9jb2RlPWVkdTE2MjIxODE1MjEmY29kZT1ad0tKWGZOaWVvem8mc2VhcmNoX2l0ZW09JnNlYXJjaF9vcmRlcj0mb3JkZXJfbGlzdD0mbGlzdF9zY2FsZT0mdmlld19sZXZlbD0mdmlld19jYXRlPSZ2aWV3X2NhdGUyPQ==", "content": "2025년 8월(2024학년도 후기) 대학원 수업연한단축[조기수료 또는 졸업] 신청 안내\n등록일\n2025-07-09\n작성자\n교육학과\n조회수\n99\n「경북대학교 학칙」제71조(수업연한)에 따라\n일반·전문·특수대학원 재학생 중 2025년 8월(2024학년도 후기)에 수업연한단축[조기수료 또는 졸업]을 신청하고자 하는 학생은 기한 내에 신청하여 주시기 바랍니다.\n가. 조기수료 및 졸업 요건: [붙임 1]참고\n나. 신청기한:\n2025. 7. 18.(금)까지\n​\n(※ 신청 전 학과사무실로 연락하여 가능 여부 확인할 것)\n다. 신청절차: 신청서[붙임 2] 작성 후 학과 사무실 제출\n라. 조기수료 후속조치\n※2025.2학기부터 본등록 하지 않음\n- (논문)수료생등록, 종합시험, 논문심사 등 학과별 요건 충족 시 졸업\n- (무논문)종합시험 등 학과별 요건 충족 시 졸업\n붙임 1. 각 대학원 조기수료 및 졸업 요건 1부.\n2. 신청서 1부.  끝.\n각 대학원 조기수료 및 졸업 요건.hwp\n수업연한단축 신청서.hwp", "images": [], "attachments": [{"name": "각 대학원 조기수료 및 졸업 요건.hwp", "url": "https://home.knu.ac.kr/HOME/bbs/bbs_download.php?mv_data=aWR4PTEzNTkmc3RhcnRQYWdlPTUwJmxpc3RObz03NjkmdGFibGU9ZXhfYmJzX2RhdGFfZWR1Jm5hdl9jb2RlPWVkdTE2MjIxODE1MjEmc2l0ZV9jb2RlPWVkdSZjb2RlPVp3S0pYZk5pZW96byZzZWFyY2hfaXRlbT0mc2VhcmNoX29yZGVyPSZvcmRlcl9saXN0PSZsaXN0X3NjYWxlPQ==&download=h&seq=0"}, {"name": "수업연한단축 신청서.hwp", "url": "https://home.knu.ac.kr/HOME/bbs/bbs_download.php?mv_data=aWR4PTEzNTkmc3RhcnRQYWdlPTUwJmxpc3RObz03NjkmdGFibGU9ZXhfYmJzX2RhdGFfZWR1Jm5hdl9jb2RlPWVkdTE2MjIxODE1MjEmc2l0ZV9jb2RlPWVkdSZjb2RlPVp3S0pYZk5pZW96byZzZWFyY2hfaXRlbT0mc2VhcmNoX29yZGVyPSZvcmRlcl9saXN0PSZsaXN0X3NjYWxlPQ==&download=h&seq=1"}]}
{"dept": "교육학과", "detail": "대학원", "title": "[글로컬대학사업] 2025학년도 2학기 G-KNU Scholarship 장학금 지원 안내", "date": "2025-07-09", "url": "https://home.knu.ac.kr/HOME/edu/sub.htm?mode=view&mv_data=aWR4PTEzNTgmc3RhcnRQYWdlPTUwJmxpc3RObz03NjgmdGFibGU9ZXhfYmJzX2RhdGFfZWR1Jm5hdl9jb2RlPWVkdTE2MjIxODE1MjEmY29kZT1ad0tKWGZOaWVvem8mc2VhcmNoX2l0ZW09JnNlYXJjaF9vcmRlcj0mb3JkZXJfbGlzdD0mbGlzdF9zY2FsZT0mdmlld19sZXZlbD0mdmlld19jYXRlPSZ2aWV3X2NhdGUyPQ==", "content": "[글로컬대학사업] 2025학년도 2학기 G-KNU Scholarship 장학금 지원 안내\n등록일\n2025-07-09\n작성자\n교육학과\n조회수\n89\n전일제 박사과정생의 안정적인 학업 및 연구환경 조성을 위해 아래와 같이 G-KNU Scholarship 장학금을 지원하고자 하니 참고하시기 바랍니다.\n가. 대상: 대학원(전문대학원 포함) 전일제 재학생으로\n전일제 과정 조사시스템에 등록\n한\n박사과정\n및\n석·박사통합과정생*\n* 3개 학기 이상을 이수하고 24학점(경영학부 30학점) 이상 취득하며, 평점평균 2.7이상인 자\n※ 제외자: 초과학기자, 휴학생, 수료자, 타 장학금으로 등록금 전액을 수혜받은 자\n나. 자격기준: 전일제 박사 또는 석·박사통합과정 재학생(2025. 2학기 한시적)\n※ 다만, 2026학년도 1학기부터 두 번째 학기 이상자에 한하여 직전학기 3학점 이상 이수, 평점 3.3점(백분위 89점) 이상인 경우 지원 예정\n다. 지원횟수: 수업연한 범위 내에서 박사과정생은 최대 4회(2년), 석·박사통합과정생은 최대 5회(2.5년) 지원\n라. 지원금액: 등록금 전액 또는 일부 지원 ※ 타 장학금으로 등록금 지원을 받은 경우, 차액만 지원함\n미. 지원시기: 2025학년도 2학기부터 지원\n바. 추진일정\n- 전일제과정 조사시스템* 등록: 2025. 9 ~ 10월\n* 등록 방법: 통합정보시스템 - 학적정보관리 - 전일제대학원생신청 (붙임 참고)\n- 장학생 선발 및 장학금 지급: 2025. 10월 말 ~ 11월.  끝.\n첨부파일중 PDF미리보기\n파일 열람을 위해서는 아크로뱃 리더 설치가 필요합니다. 아래 링크를 클릭하여 리더를 다운로드 받으세요.\n전일제 대학원생 학사정보 등록 안내.pdf", "images": ["http://www.adobe.com/images/shared/download_buttons/get_adobe_reader.png"], "attachments": [{"name": "전일제 대학원생 학사정보 등록 안내.pdf", "url": "https://home.knu.ac.kr/HOME/bbs/bbs_download.php?mv_data=aWR4PTEzNTgmc3RhcnRQYWdlPTUwJmxpc3RObz03NjgmdGFibGU9ZXhfYmJzX2RhdGFfZWR1Jm5hdl9jb2RlPWVkdTE2MjIxODE1MjEmc2l0ZV9jb2RlPWVkdSZjb2RlPVp3S0pYZk5pZW96byZzZWFyY2hfaXRlbT0mc2VhcmNoX29yZGVyPSZvcmRlcl9saXN0PSZsaXN0X3NjYWxlPQ==&download=h&seq=0"}]}
{"dept": "교육학과", "detail": "대학원", "title": "2025학년도 8월(2024학년도 후기) 졸업예정자에 대한 교원자격무시험검정 신청 안내", "date": "2025-07-08", "url": "https://home.knu.ac.kr/HOME/edu/sub.htm?mode=view&mv_data=aWR4PTEzNTcmc3RhcnRQYWdlPTUwJmxpc3RObz03NjcmdGFibGU9ZXhfYmJzX2RhdGFfZWR1Jm5hdl9jb2RlPWVkdTE2MjIxODE1MjEmY29kZT1ad0tKWGZOaWVvem8mc2VhcmNoX2l0ZW09JnNlYXJjaF9vcmRlcj0mb3JkZXJfbGlzdD0mbGlzdF9zY2FsZT0mdmlld19sZXZlbD0mdmlld19jYXRlPSZ2aWV3X2NhdGUyPQ==", "content": "2025학년도 8월(2024학년도 후기) 졸업예정자에 대한 교원자격무시험검정 신청 안내\n등록일\n2025-07-08\n작성자\n교육학과\n조회수\n150\n가. 신청 대상: 2024년 8월 졸업예정자 중 교직과정 이수예정자 (사범대학, 일반대학 교직과정, 교육대학원)\n나. 신청 방법: 온라인 신청 후, 학과사무실로 서류 제출\n1) 통합정보시스템(\nhttps://knuin.ac.kr/)에\n로그인 후 신청 (*신청 기간: 7. 15.(화) 10:00 ~ 7. 17.(목) 17:00)\n- 차세대 통합정보시스템 - 교직 - 교원자격무시험검정 - 교원자격무시험검정신청\n2)\n전문상담교사(2급)\n제출 서류\n① 교원자격무시험검정원서(통합정보시스템 출력물) 1부\n② 학사과정 성적증명서\n(원본)\n1부\n(지원 시 제출한 학사과정)\n③ 교육대학원 석사과정 성적증명서(7. 14.(월) 오전 10시 이후 발급본-최종 성적 반영)\n(원본)\n1부 (※ '전공필수' 등 교과구분 변경이 필요한 경우 변경 완료 후 제출)\n④ 의사진단서(또는 건강검진 결과통보서)(원본) [붙임 참조]\n⑤ (해당자만 제출) 교원자격증 사본 (원본대조필) 1부\n⑥ (해당자만 제출) 자격증 사본(원본대조필) 및 경력증명서(원본)1부\n3)\n전문상담교사(1급)\n① 석사과정 성적증명서(원본) 1부만 제출 (\n※\n통합정보시스템 신청 불요)\n다.\n신청 기간:\n2025. 7. 15.(화) ~ 7. 17.(목) 17시 30분까지 학과 사무실로 대면으로 서류 제출\n※ 교원자격증 발급일: 2025. 8. 22.(학위수여일)", "images": [], "attachments": []}
{"dept": "교육학과", "detail": "대학원", "title": "* 2025-1학기 박사 논문계획서 발표 (*대상자: 2025학년도 2학기 박사학위 청구논문 공개발표자)", "date": "2025-07-01", "url": "https://home.knu.ac.kr/HOME/edu/sub.htm?mode=view&mv_data=aWR4PTEzNTMmc3RhcnRQYWdlPTUwJmxpc3RObz03NjYmdGFibGU9ZXhfYmJzX2RhdGFfZWR1Jm5hdl9jb2RlPWVkdTE2MjIxODE1MjEmY29kZT1ad0tKWGZOaWVvem8mc2VhcmNoX2l0ZW09JnNlYXJjaF9vcmRlcj0mb3JkZXJfbGlzdD0mbGlzdF9zY2FsZT0mdmlld19sZXZlbD0mdmlld19jYXRlPSZ2aWV3X2NhdGUyPQ==", "content": "* 2025-1학기 박사 논문계획서 발표 (*대상자: 2025학년도 2학기 박사학위 청구논문 공개발표자)\n등록일\n2025-07-01\n작성자\n교육학과\n조회수\n148\n교육학과 내규\n에 따라\n교육학과\n박사\n과정\n학생들 가운데 2025학년도 2\n학기에 박사학위 청구논문 공개발표를 할 학생은\n2025\n년도 1\n학기 종료일 이전까지(~25. 8. 31.까지) 반드시\n논문계획서를 발표\n해야 합니다\n.\n이에 해당 학생은\n논문계획서 발표신청서\n를 작성하여\n​기한 내\n학과사무실에 제출\n하시기 바랍니다\n.\n가. 신청 및 발표기간\n: 2025. 7. 7.(월) ~ 2025. 8. 31.(금) (*전공별 진행)\n나. 참고사항\n1) 발표 일정은 전공별 별도 운영이 가능하므로\n구체적 일정은 반드시 지도교수님과 상의\n하시길 바랍니다.\n2) 발표 직후,\n지도교수님께 확인 받은\n결과보\n고서를 제출\n할 것\n대학원_(박사)논문계획서 발표 신청서.hwp\n대학원_(박사)논문계획서 발표 결과보고서.hwp", "images": [], "attachments": [{"name": "대학원_(박사)논문계획서 발표 신청서.hwp", "url": "https://home.knu.ac.kr/HOME/bbs/bbs_download.php?mv_data=aWR4PTEzNTMmc3RhcnRQYWdlPTUwJmxpc3RObz03NjYmdGFibGU9ZXhfYmJzX2RhdGFfZWR1Jm5hdl9jb2RlPWVkdTE2MjIxODE1MjEmc2l0ZV9jb2RlPWVkdSZjb2RlPVp3S0pYZk5pZW96byZzZWFyY2hfaXRlbT0mc2VhcmNoX29yZGVyPSZvcmRlcl9saXN0PSZsaXN0X3NjYWxlPQ==&download=h&seq=0"}, {"name": "대학원_(박사)논문계획서 발표 결과보고서.hwp", "url": "https://home.knu.ac.kr/HOME/bbs/bbs_download.php?mv_data=aWR4PTEzNTMmc3RhcnRQYWdlPTUwJmxpc3RObz03NjYmdGFibGU9ZXhfYmJzX2RhdGFfZWR1Jm5hdl9jb2RlPWVkdTE2MjIxODE1MjEmc2l0ZV9jb2RlPWVkdSZjb2RlPVp3S0pYZk5pZW96byZzZWFyY2hfaXRlbT0mc2VhcmNoX29yZGVyPSZvcmRlcl9saXN0PSZsaXN0X3NjYWxlPQ==&download=h&seq=1"}]}
{"dept": "교육학과", "detail": "대학원", "title": "2025학년도 2학기 특수대학원 수료생 대상 무논문 석사학위 신청 계획 안내", "date": "2025-06-18", "url": "https://home.knu.ac.kr/HOME/edu/sub.htm?mode=view&mv_data=aWR4PTEzNTAmc3RhcnRQYWdlPTUwJmxpc3RObz03NjUmdGFibGU9ZXhfYmJzX2RhdGFfZWR1Jm5hdl9jb2RlPWVkdTE2MjIxODE1MjEmY29kZT1ad0tKWGZOaWVvem8mc2VhcmNoX2l0ZW09JnNlYXJjaF9vcmRlcj0mb3JkZXJfbGlzdD0mbGlzdF9zY2FsZT0mdmlld19sZXZlbD0mdmlld19jYXRlPSZ2aWV3X2NhdGUyPQ==", "content": "2025학년도 2학기 특수대학원 수료생 대상 무논문 석사학위 신청 계획 안내\n등록일\n2025-06-18\n작성자\n교육학과\n조회수\n97\n가. 신청 대상:\n특수대학원 무논문 승인을 받은 학과(부) 및 전공 소속의 수료생 중 수료 후 2년 이상 경과된 자(2023년 8월 이전 수료생)\n나. 신청 기간 및 장소:\n2025. 7. 1.(화) 9:00 ~ 7. 10.(목) 17:30 (기한 엄수)\n, 교육학과 사무실(사범대학 823호)\n다.\n제출 서류\n① 신청원 (붙임파일 확인) (지도교수 날인 必)\n② 성적증명서\n(최근 3개월 이내 발급본)\n라. 안내사항\n1) 수강신청: 2025. 8. 12.(화) ~ 8. 14.(목)  ※ 수강변경, 수강정정 이용 가능\n2) 등록: 2025. 9월 말 ~ 10월 중 (추후 공지)  ※ 수강신청 학점에 따라 차등 납부\n3)\n해당 기간에 별도 개별 안내하지 않으니, 경북대학교 홈페이지 학사공지를 수시 확인할 것\n4) 무논문 석사학위 선발자는 30학점 이상을 이수하여야 함 (논문연구 제외)\n마.\n교육대학원 무논문 승인 학과\n교육대학원\n교육철학전공\n가능\n2015학년도 이전 입학생\r\n  신청 불가\n교육대학원\n교육행정전공\n가능\n2011학년도 이전 입학생 신청 불가\n교육대학원\n상담심리전공\n가능\n-\n바. 관련 안내 확인\n1) 학사 공지 확인(수강신청 일정 및 방법, 등록 일정 등): 경북대학교 홈페이지(knu.ac.kr) > 교육 > 학사행정 > 학사공지\n2) 등록금 관련 확인(등록금 납부 일정, 등록금액, 차등 납부 등): 경북대학교 홈페이지(knu.ac.kr) > 교육 > 학사행정 > 학사안내 > 등록 (※ 재무과: 053-950-2623)\n3) 기타 문의: 교육학과 사무실(053-950-5806)\n신청원.hwp", "images": [], "attachments": [{"name": "신청원.hwp", "url": "https://home.knu.ac.kr/HOME/bbs/bbs_download.php?mv_data=aWR4PTEzNTAmc3RhcnRQYWdlPTUwJmxpc3RObz03NjUmdGFibGU9ZXhfYmJzX2RhdGFfZWR1Jm5hdl9jb2RlPWVkdTE2MjIxODE1MjEmc2l0ZV9jb2RlPWVkdSZjb2RlPVp3S0pYZk5pZW96byZzZWFyY2hfaXRlbT0mc2VhcmNoX29yZGVyPSZvcmRlcl9saXN0PSZsaXN0X3NjYWxlPQ==&download=h&seq=0"}]}
{"dept": "교육학과", "detail": "대학원", "title": "2025학년도 1학기 졸업(수료) 예정자 도서관 대출중지 안내", "date": "2025-06-17", "url": "https://home.knu.ac.kr/HOME/edu/sub.htm?mode=view&mv_data=aWR4PTEzNDgmc3RhcnRQYWdlPTUwJmxpc3RObz03NjQmdGFibGU9ZXhfYmJzX2RhdGFfZWR1Jm5hdl9jb2RlPWVkdTE2MjIxODE1MjEmY29kZT1ad0tKWGZOaWVvem8mc2VhcmNoX2l0ZW09JnNlYXJjaF9vcmRlcj0mb3JkZXJfbGlzdD0mbGlzdF9zY2FsZT0mdmlld19sZXZlbD0mdmlld19jYXRlPSZ2aWV3X2NhdGUyPQ==", "content": "2025학년도 1학기 졸업(수료) 예정자 도서관 대출중지 안내\n등록일\n2025-06-17\n작성자\n교육학과\n조회수\n58\n도서관규정 제\n24\n조\n(\n대출자료의 반납 및 연장\n)\n및 제\n31\n조\n(\n연체자료 반납 또는 변상 불이행자 제재\n)\n에 따라 졸업\n(\n수료\n)\n예정자는\n대출도서\n를\n반드시 반납\n해야하며\n,\n미 반납시 졸업\n(\n수료\n)\n에\n제재\n가 부여됩니다\n.\n이와 관련하여\n2025\n학년도\n1\n학기 졸업\n(\n수료\n)\n예정자\n에 대한\n대출서비스\n를 다음과 같이\n운영하고자 하니\n협조 바랍니다\n.\n가\n.\n대    상\n: 2025\n학년도\n1\n학기 학부 및 대학원 졸업\n(\n수료\n)\n예정자\n※\n대학원\n(\n석사\n,\n박사과정\n)\n입학 예정자\n:\n신규학번 부여 전\n,\n대출내역 미연동으로\n반납 필수\n나\n.\n반납기한\n: 2025. 8. 7.(\n목\n)\n까지\n※\n2025. 8. 8.(\n금\n)\n이후 대출 중지\n다\n.\n대출 중지 후 이용가능 서비스\n구분\n이용기한\n이용 가능 서비스\n학부생\n수료\n한 학기\n∙\n신관 열람실 이용가능\n,\n대출불가\n졸업\n3\n년\n대학원생\n수료\n(\n미등록\n)\n2\n년\n∙\n신관 열람실 이용가능\n,\n학술\nDB\n이용가능\n,\n대출불가\n수료\n(\n등록예정\n)\n*\n한 학기\n∙\n(\n수료생등록 후\n)\n재학생과 동일한 서비스\n이용 가능\n졸업\n3\n년\n∙\n신관 열람실 이용가능\n,\n대출불가\n※\n2025\n년\n1\n학기 대학원 수료생 등록예정자\n:\n수료생 등록 전 도서대출을 원할 경우\n, [\n붙임\n1]\n「\n수료생 등록예정자 대출신청서\n」\n를 작성하여 도서관\n1\n층 대출데스크 또는\nlibdesk@knu.ac.kr\n로 제출\n라\n.\n기    타\n-\n동문회원 가입 시 대출 및 좌석\n·\n시설물 등 이용가능\n-\n문의사항\n:\n도서관 정보서비스팀\n(libdesk@knu.ac.kr\n☏\n4672~6)\n수료생 등록 예정자 대출신청서.hwp\n동문회원가입신청서.hwp", "images": [], "attachments": [{"name": "수료생 등록 예정자 대출신청서.hwp", "url": "https://home.knu.ac.kr/HOME/bbs/bbs_download.php?mv_data=aWR4PTEzNDgmc3RhcnRQYWdlPTUwJmxpc3RObz03NjQmdGFibGU9ZXhfYmJzX2RhdGFfZWR1Jm5hdl9jb2RlPWVkdTE2MjIxODE1MjEmc2l0ZV9jb2RlPWVkdSZjb2RlPVp3S0pYZk5pZW96byZzZWFyY2hfaXRlbT0mc2VhcmNoX29yZGVyPSZvcmRlcl9saXN0PSZsaXN0X3NjYWxlPQ==&download=h&seq=0"}, {"name": "동문회원가입신청서.hwp", "url": "https://home.knu.ac.kr/HOME/bbs/bbs_download.php?mv_data=aWR4PTEzNDgmc3RhcnRQYWdlPTUwJmxpc3RObz03NjQmdGFibGU9ZXhfYmJzX2RhdGFfZWR1Jm5hdl9jb2RlPWVkdTE2MjIxODE1MjEmc2l0ZV9jb2RlPWVkdSZjb2RlPVp3S0pYZk5pZW96byZzZWFyY2hfaXRlbT0mc2VhcmNoX29yZGVyPSZvcmRlcl9saXN0PSZsaXN0X3NjYWxlPQ==&download=h&seq=1"}]}
{"dept": "교육학과", "detail": "대학원", "title": "[교육대학원 상담심리전공 양성과정] 2025년 8월 교원자격증 취득예정자에 대한 마약·대마·향정신성의약품 중독여부 검사 안내", "date": "2025-06-16", "url": "https://home.knu.ac.kr/HOME/edu/sub.htm?mode=view&mv_data=aWR4PTEzNDEmc3RhcnRQYWdlPTUwJmxpc3RObz03NjMmdGFibGU9ZXhfYmJzX2RhdGFfZWR1Jm5hdl9jb2RlPWVkdTE2MjIxODE1MjEmY29kZT1ad0tKWGZOaWVvem8mc2VhcmNoX2l0ZW09JnNlYXJjaF9vcmRlcj0mb3JkZXJfbGlzdD0mbGlzdF9zY2FsZT0mdmlld19sZXZlbD0mdmlld19jYXRlPSZ2aWV3X2NhdGUyPQ==", "content": "[교육대학원 상담심리전공 양성과정] 2025년 8월 교원자격증 취득예정자에 대한 마약·대마·향정신성의약품 중독여부 검사 안내\n등록일\n2025-06-16\n작성자\n교육학과\n조회수\n125\n2025년 8월 교원자격증 취득예정자 중 마약‧대마‧향정신성의약품 중독자 여부 판별과 관련하여 다음과 같이 안내드립니다.\n해당 학생들은 교원자격무시험검정 신청 전에 검사를 완료할 수 있도록 사전에 준비하여 주시기 바랍니다. (관련:「유아교육법」제22조의2 및「초‧중등교육법」제21조의2)\n가. 대상: 2025년 8월 졸업예정자 중 교직과정 이수자(사범대학, 교육대학원 포함)\n나. 마약‧대마‧향정신성의약품 중독여부 검사: TBPE검사, 4대 마약 시약 검사 등\n다. 제출서류:\n검사결과통보서 또는 의사진단서\n라. 제출기간: 교원자격무시험검정 신청 시 제출(7월 초~중 예정) ※ ’25년 8월 교원자격무시험검정 신청 추후 안내\n마. 안내사항\n- 검사 후 결과(검사결과통보서 또는 진단서) 확인에 일정 기한(3~15일)이 소요되니 사전에 준비\n- 무시험검정 신청일 기준 1년 이내에 검진 발급한 서류 인정\n※ ’24. 8월∼ ’25. 8월 교원자격무시험검정 신청 시까지 검사 결과 인정\n붙임  마약 등 중독자 여부 판별 서류 안내 1부.  끝.\n마약 등 중독자 여부 판별 서류 안내(250616).hwp", "images": [], "attachments": [{"name": "마약 등 중독자 여부 판별 서류 안내(250616).hwp", "url": "https://home.knu.ac.kr/HOME/bbs/bbs_download.php?mv_data=aWR4PTEzNDEmc3RhcnRQYWdlPTUwJmxpc3RObz03NjMmdGFibGU9ZXhfYmJzX2RhdGFfZWR1Jm5hdl9jb2RlPWVkdTE2MjIxODE1MjEmc2l0ZV9jb2RlPWVkdSZjb2RlPVp3S0pYZk5pZW96byZzZWFyY2hfaXRlbT0mc2VhcmNoX29yZGVyPSZvcmRlcl9saXN0PSZsaXN0X3NjYWxlPQ==&download=h&seq=0"}]}
{"dept": "교육학과", "detail": "대학원", "title": "’25년 8월 및 ’26년 2월 졸업예정자에 대한 교직 적성 및 인성검사(추가) 수요 조사", "date": "2025-06-16", "url": "https://home.knu.ac.kr/HOME/edu/sub.htm?mode=view&mv_data=aWR4PTEzMzkmc3RhcnRQYWdlPTUwJmxpc3RObz03NjImdGFibGU9ZXhfYmJzX2RhdGFfZWR1Jm5hdl9jb2RlPWVkdTE2MjIxODE1MjEmY29kZT1ad0tKWGZOaWVvem8mc2VhcmNoX2l0ZW09JnNlYXJjaF9vcmRlcj0mb3JkZXJfbGlzdD0mbGlzdF9zY2FsZT0mdmlld19sZXZlbD0mdmlld19jYXRlPSZ2aWV3X2NhdGUyPQ==", "content": "’25년 8월 및 ’26년 2월 졸업예정자에 대한 교직 적성 및 인성검사(추가) 수요 조사\n등록일\n2025-06-16\n작성자\n교육학과\n조회수\n56\n2025년 8월 또는 2026년 2월 졸업예정자 중 교원자격증 발급을 위한 교직 적성 및 인성검사 이수 기준(2회)을 충족하지 못한 학생에 대하여 추가 검사를 진행하고자 하오니\n대상인 학생은 기간 내에 학과 사무실로 연락하여 주시기 바랍니다.\n가. 대상자\n- 2025년 8월 졸업예정자: 교직 적성 및 인성검사 1회 미충족\n- 2026년 2월 졸업예정자: 교직 적성 및 인성검사 2회 미충족\n나. 검사 일시: 2025년 6월 말 ~ 7월 초 예정\n- 검사는 신청자에 한하여 시행할 예정이며 통합정보시스템을 통한 별도의 신청은 없음\n다. 검사 신청:\n2025. 6. 19.(목) 17:00까지 교육학과 사무실로 연락 (053-950-5806 / edu5806@knu.ac.kr)", "images": [], "attachments": []}
{"dept": "교육학과", "detail": "대학원", "title": "[교육대학원 상담심리전공 양성과정] 2025학년도 1학기 교원양성과정 성인지 교육 특강 참석 신청 안내", "date": "2025-06-12", "url": "https://home.knu.ac.kr/HOME/edu/sub.htm?mode=view&mv_data=aWR4PTEzMzcmc3RhcnRQYWdlPTYwJmxpc3RObz03NjEmdGFibGU9ZXhfYmJzX2RhdGFfZWR1Jm5hdl9jb2RlPWVkdTE2MjIxODE1MjEmY29kZT1ad0tKWGZOaWVvem8mc2VhcmNoX2l0ZW09JnNlYXJjaF9vcmRlcj0mb3JkZXJfbGlzdD0mbGlzdF9zY2FsZT0mdmlld19sZXZlbD0mdmlld19jYXRlPSZ2aWV3X2NhdGUyPQ==", "content": "[교육대학원 상담심리전공 양성과정] 2025학년도 1학기 교원양성과정 성인지 교육 특강 참석 신청 안내\n등록일\n2025-06-12\n작성자\n교육학과\n조회수\n54\n1) 참석 대상자\n- ’25년 8월 또는 ’26년 2월 졸업예정자 중 성인지 교육 이수 기준 미충족자\n2)\n일시 및 장소: 2025. 6. 27.(금) 14:00 ~ 17:00(3시간)\n※ 상황에 따라 일시는 변경될 수 있으며, 장소 등 상세 안내는 추후 공문 발송 예정\n3) 신청 방법: 참석 희망자는\n6. 16.(월) 15시까지\n교육학과 사무실로 연락(053-950-5806)\n4) 기타: 교원자격증 발급 기준\n※ 미 이수 시 교원자격증 발급 및 졸업 불가\n- 2021학년도 이후 입학자: (교직과정 및 교육대학원) 2회 이수\n5) 유의사항: 2025. 1학기에 추가 특강은 없으므로 졸업예정자 등 특강 참석이 필수로 요구되는 학생들은 반드시 특강에 참석", "images": [], "attachments": []}
{"dept": "교육학과", "detail": "대학원", "title": "[글로컬대학사업] 2025학년도 2학기 G-KNU Scholarship 장학금 지원 안내", "date": "2025-06-12", "url": "https://home.knu.ac.kr/HOME/edu/sub.htm?mode=view&mv_data=aWR4PTEzMzYmc3RhcnRQYWdlPTYwJmxpc3RObz03NjAmdGFibGU9ZXhfYmJzX2RhdGFfZWR1Jm5hdl9jb2RlPWVkdTE2MjIxODE1MjEmY29kZT1ad0tKWGZOaWVvem8mc2VhcmNoX2l0ZW09JnNlYXJjaF9vcmRlcj0mb3JkZXJfbGlzdD0mbGlzdF9zY2FsZT0mdmlld19sZXZlbD0mdmlld19jYXRlPSZ2aWV3X2NhdGUyPQ==", "content": "[글로컬대학사업] 2025학년도 2학기 G-KNU Scholarship 장학금 지원 안내\n등록일\n2025-06-12\n작성자\n교육학과\n조회수\n71\n전일제 박사과정생의 안정적인 학업 및 연구환경 조성을 위해 아래와 같이\nG-KNU Scholarship\n장학금\n을 지원하고자 하오니\n참고하시기 바랍니다\n.\n가\n.\n대    상\n:\n대학원\n(\n전문대학원 포함\n)\n전일제 재학생\n으로 전일제 과정 조사시스템에 등록한\n박사과정\n및\n석\n·\n박사통합과정생\n*\n* 3\n개 학기 이상을 이수하고\n24\n학점\n(\n경영학부\n30\n학점\n)\n이상 취득하며\n,\n평점평균\n2.7\n이상인 자\n※ 제외자: 초과학기자, 휴학생, 수료자, 타 장학금으로 등록금 전액을 수혜받은 자\n나\n.\n자격기준\n:\n전일제 박사\n또는\n석\n·\n박사통합과정 재학생\n(2025. 2\n학기 한시적\n)\n※\n다만\n, 2026\n학년도\n1\n학기부터 두 번째 학기 이상자에 한하여 직전학기\n3\n학점 이상 이수\n,\n평점\n3.3\n점\n(\n백분위\n89\n점\n)\n이상인 경우 지원 예정\n다\n.\n지원횟수\n:\n수업연한 범위 내\n에서\n박사과정생\n은\n최대\n4\n회\n(2\n년\n)\n,\n석\n·\n박사통합과정생\n은\n최대\n5\n회\n(2.5\n년\n)\n지원\n라\n.\n지원금액\n:\n등록금 전액\n또는\n일부 지원\n※\n타 장학금으로 등록금 지원을 받은 경우\n,\n차액만 지원함\n마\n.\n지원시기\n:\n2025\n학년도\n2\n학기부터 지원\n바. 전일제 대학원생 신청 방법\n- 통합정보시스템 - 학적 - 학적정보관리 - 전일제대학원생신청\n- 학적 세부 상태가 '재학, 휴학(예정), 복학예정'인 학생만 신청 가능\n- 증빙서류 필수 업로드: 신청일로부터 7일 이내에 발급한 '4대 사회보험 가입내역 확인서'를 첨부하여 신청 (\n※\n발급일이 7일 초과된 서류일 경우 반려 처리되니 유의)\n사.\n추진일정\n-\n전일제과정 조사시스템\n*\n등록\n: 2025. 9 ~ 10\n월\n*\n통합정보시스템\n-\n학적정보관리\n-\n전일제대학원생신청\n-\n장학생 선발 및 장학금 지급\n: 2025. 10\n월 말\n~ 11\n월\n첨부파일중 PDF미리보기\n파일 열람을 위해서는 아크로뱃 리더 설치가 필요합니다. 아래 링크를 클릭하여 리더를 다운로드 받으세요.\n4대 사회보험 가입내역 확인서 발급 방법 및 미취업 여부 확인 방법.pdf", "images": ["http://www.adobe.com/images/shared/download_buttons/get_adobe_reader.png"], "attachments": [{"name": "4대 사회보험 가입내역 확인서 발급 방법 및 미취업 여부 확인 방법.pdf", "url": "https://home.knu.ac.kr/HOME/bbs/bbs_download.php?mv_data=aWR4PTEzMzYmc3RhcnRQYWdlPTYwJmxpc3RObz03NjAmdGFibGU9ZXhfYmJzX2RhdGFfZWR1Jm5hdl9jb2RlPWVkdTE2MjIxODE1MjEmc2l0ZV9jb2RlPWVkdSZjb2RlPVp3S0pYZk5pZW96byZzZWFyY2hfaXRlbT0mc2VhcmNoX29yZGVyPSZvcmRlcl9saXN0PSZsaXN0X3NjYWxlPQ==&download=h&seq=0"}]}
{"dept": "교육학과", "detail": "대학원", "title": "2025학년도 2학기 재학생 등록금 감면 우선선발대상자 신청 안내", "date": "2025-06-10", "url": "https://home.knu.ac.kr/HOME/edu/sub.htm?mode=view&mv_data=aWR4PTEzMzUmc3RhcnRQYWdlPTYwJmxpc3RObz03NTkmdGFibGU9ZXhfYmJzX2RhdGFfZWR1Jm5hdl9jb2RlPWVkdTE2MjIxODE1MjEmY29kZT1ad0tKWGZOaWVvem8mc2VhcmNoX2l0ZW09JnNlYXJjaF9vcmRlcj0mb3JkZXJfbGlzdD0mbGlzdF9zY2FsZT0mdmlld19sZXZlbD0mdmlld19jYXRlPSZ2aWV3X2NhdGUyPQ==", "content": "2025학년도 2학기 재학생 등록금 감면 우선선발대상자 신청 안내\n등록일\n2025-06-10\n작성자\n교육학과\n조회수\n58\n2025\n학년도\n2\n학기 등록금 감면장학금 우선선발대상자 신청을 아래와 같이 안내\n하오니\n해당 학생은 기한 내 신청하여 주시기 바랍니다\n.\n가\n.\n신청대상\n:\n학부 재학생\n(\n복학예정자 포함\n)\n❍\n교육지원대상자\n(\n국가유공자\n,\n북한이탈주민 등\n)\n신규 신청자\n※\n북한이탈주민 본인 및 자녀는\n‘\n북한이탈주민지원재단\n’\n에서 주관하는 법정교육을 반드시 이수하여야 장학금 지원 가능\n❍\n보호\n(\n연장\n)\n아동\n,\n복지시설생활자 및 자립준비청년\n(\n보호종료아동\n)\n❍\n장애 학생\n❍\n장애인 자녀\n(\n기초생활수급자에 한함\n)\n나\n.\n신청자격\n:\n【\n붙임\n】\n안내문 참고\n다\n.\n신청기간\n:\n2025. 6.\n12.(\n목\n) 9:00 ~ 2025. 7. 11.(\n금\n) 18:00\n까지\n라\n.\n신청방법\n:\n통합정보시스템 온라인 신청 및 첨부서류 온라인 등록\n※\n통합정보시스템\n→\n학사행정\n/\n장학\n→\n학생신청장학\n→\n장학금신청서\n→\n해당 장학 신청\n붙임\n2025\n학년도\n2\n학기 등록금감면 우선선발대상자 장학금 신청 안내\n1\n부\n.\n끝\n.\n(붙임) 2025학년도 2학기 학부 재학생 등록금 감면 우선선발대상자 장학금 신청 안내.hwp", "images": [], "attachments": [{"name": "(붙임) 2025학년도 2학기 학부 재학생 등록금 감면 우선선발대상자 장학금 신청 안내.hwp", "url": "https://home.knu.ac.kr/HOME/bbs/bbs_download.php?mv_data=aWR4PTEzMzUmc3RhcnRQYWdlPTYwJmxpc3RObz03NTkmdGFibGU9ZXhfYmJzX2RhdGFfZWR1Jm5hdl9jb2RlPWVkdTE2MjIxODE1MjEmc2l0ZV9jb2RlPWVkdSZjb2RlPVp3S0pYZk5pZW96byZzZWFyY2hfaXRlbT0mc2VhcmNoX29yZGVyPSZvcmRlcl9saXN0PSZsaXN0X3NjYWxlPQ==&download=h&seq=0"}]}
{"dept": "교육학과", "detail": "대학원", "title": "2025학년도 2학기 대학원 재학생 나눔장학금(장애학생) 신청 안내", "date": "2025-06-10", "url": "https://home.knu.ac.kr/HOME/edu/sub.htm?mode=view&mv_data=aWR4PTEzMzQmc3RhcnRQYWdlPTYwJmxpc3RObz03NTgmdGFibGU9ZXhfYmJzX2RhdGFfZWR1Jm5hdl9jb2RlPWVkdTE2MjIxODE1MjEmY29kZT1ad0tKWGZOaWVvem8mc2VhcmNoX2l0ZW09JnNlYXJjaF9vcmRlcj0mb3JkZXJfbGlzdD0mbGlzdF9zY2FsZT0mdmlld19sZXZlbD0mdmlld19jYXRlPSZ2aWV3X2NhdGUyPQ==", "content": "2025학년도 2학기 대학원 재학생 나눔장학금(장애학생) 신청 안내\n등록일\n2025-06-10\n작성자\n교육학과\n조회수\n24\n2025\n학년도\n2\n학기 대학원 재학생 나눔장학금\n(\n장애학생\n)\n신청\n을 아래와 같이 안내하오니\n,\n해당 학생들은\n기간 내 신청하여 주시기 바랍니다\n.\n가\n.\n신청대상\n:\n대학원\n(\n일반\n,\n전문\n,\n특수\n)\n재학생\n(\n복학예정자 포함\n)\n중\n장애학생 본인\n※\n등록금 이월자\n,\n수업연한초과자\n,\n수료생 제외\n나\n.\n신청기간\n:\n2025. 6. 12.(\n목\n) ~ 2025. 7. 11.(\n금\n)\n다\n.\n신청방법\n:\n통합정보시스템\n(knuin.knu.ac.kr)\n온라인 신청\n※\n통합정보시스템\n→\n장학\n→\n학생신청장학\n→\n장학금신청서\n→\n해당 장학 신청\n(\n나눔장학금\nIII\n)\n라\n.\n신청자격\n:\n붙임파일 참고\n붙임\n2025\n학년도\n2\n학기 대학원 재학생 나눔장학금 신청 안내\n1\n부\n.\n끝\n.\n(붙임) 2025학년도 2학기 대학원 재학생 나눔장학금 신청 안내.hwp", "images": [], "attachments": [{"name": "(붙임) 2025학년도 2학기 대학원 재학생 나눔장학금 신청 안내.hwp", "url": "https://home.knu.ac.kr/HOME/bbs/bbs_download.php?mv_data=aWR4PTEzMzQmc3RhcnRQYWdlPTYwJmxpc3RObz03NTgmdGFibGU9ZXhfYmJzX2RhdGFfZWR1Jm5hdl9jb2RlPWVkdTE2MjIxODE1MjEmc2l0ZV9jb2RlPWVkdSZjb2RlPVp3S0pYZk5pZW96byZzZWFyY2hfaXRlbT0mc2VhcmNoX29yZGVyPSZvcmRlcl9saXN0PSZsaXN0X3NjYWxlPQ==&download=h&seq=0"}]}
{"dept": "교육학과", "detail": "대학원", "title": "2025학년도 2학기 대학원 재학생 비전장학금(가계곤란) 신청 안내", "date": "2025-06-10", "url": "https://home.knu.ac.kr/HOME/edu/sub.htm?mode=view&mv_data=aWR4PTEzMzMmc3RhcnRQYWdlPTYwJmxpc3RObz03NTcmdGFibGU9ZXhfYmJzX2RhdGFfZWR1Jm5hdl9jb2RlPWVkdTE2MjIxODE1MjEmY29kZT1ad0tKWGZOaWVvem8mc2VhcmNoX2l0ZW09JnNlYXJjaF9vcmRlcj0mb3JkZXJfbGlzdD0mbGlzdF9zY2FsZT0mdmlld19sZXZlbD0mdmlld19jYXRlPSZ2aWV3X2NhdGUyPQ==", "content": "2025학년도 2학기 대학원 재학생 비전장학금(가계곤란) 신청 안내\n등록일\n2025-06-10\n작성자\n교육학과\n조회수\n35\n2025\n학년도\n2\n학기 대학원 재학생 비전장학금\n(\n가계곤란\n)\n신청\n을 아래와 같이 안내하오니\n,\n해당 학생들은 기간 내 신청하여 주시기 바랍니다\n.\n가\n.\n신청대상\n:\n대학원 재학생\n(\n복학예정자 포함\n)\n중 가계곤란 학생\n(\n등록금 이월자\n,\n수업연한\n초과자\n,\n수료생 및 법학전문대학원생\n*\n제외\n)\n*\n법학전문대학원은 자체기준\n(\n학자금 지원구간 등\n)\n에 따라 별도 선발\n나\n.\n신청기간\n:\n2025. 6. 12.(\n목\n) ~ 2025. 7. 11.(\n금\n)\n다\n.\n신청방법\n:\n신청기간 내 관련서류를 구비\n,\n소속 학과 사무실에 제출\n※\n관련서류는\n【\n붙임\n】\n신청 안내문 참고\n붙임\n2025\n학년도\n2\n학기 대학원 재학생 비전장학금 신청 안내\n1\n부\n.\n끝\n.\n(붙임) 2025학년도 2학기 대학원 재학생 비전장학금 신청 안내.hwp", "images": [], "attachments": [{"name": "(붙임) 2025학년도 2학기 대학원 재학생 비전장학금 신청 안내.hwp", "url": "https://home.knu.ac.kr/HOME/bbs/bbs_download.php?mv_data=aWR4PTEzMzMmc3RhcnRQYWdlPTYwJmxpc3RObz03NTcmdGFibGU9ZXhfYmJzX2RhdGFfZWR1Jm5hdl9jb2RlPWVkdTE2MjIxODE1MjEmc2l0ZV9jb2RlPWVkdSZjb2RlPVp3S0pYZk5pZW96byZzZWFyY2hfaXRlbT0mc2VhcmNoX29yZGVyPSZvcmRlcl9saXN0PSZsaXN0X3NjYWxlPQ==&download=h&seq=0"}]}
{"dept": "교육학과", "detail": "대학원", "title": "[교육대학원] 2025학년도 1학기 교육대학원 완성논문 제출 안내", "date": "2025-06-04", "url": "https://home.knu.ac.kr/HOME/edu/sub.htm?mode=view&mv_data=aWR4PTEzMjcmc3RhcnRQYWdlPTYwJmxpc3RObz03NTYmdGFibGU9ZXhfYmJzX2RhdGFfZWR1Jm5hdl9jb2RlPWVkdTE2MjIxODE1MjEmY29kZT1ad0tKWGZOaWVvem8mc2VhcmNoX2l0ZW09JnNlYXJjaF9vcmRlcj0mb3JkZXJfbGlzdD0mbGlzdF9zY2FsZT0mdmlld19sZXZlbD0mdmlld19jYXRlPSZ2aWV3X2NhdGUyPQ==", "content": "[교육대학원] 2025학년도 1학기 교육대학원 완성논문 제출 안내\n등록일\n2025-06-04\n작성자\n교육학과\n조회수\n65\n「\n2025\n학년도\n1\n학기 교육대학원 학위논문 심사 합격자에 대한 완성논문 접수\n」\n일정을 아래와 같이 알려드리니\n,\n반드시\n계열별 제출일자를 엄수하여 제출\n하여 주시기 바랍니다\n.\n가\n.\n접수기간\n: 2025. 7. 9.(수) ~ 7. 10.(목) 09:30 ~ 17:30\n[2일간]\n※\n점심시간\n(12:00~13:00)\n제외\n나\n.\n접수장소\n: 교육대학원 행정실(사범대학 315호)\n※ 학과 사무실 제출 아닙니다!!!\n다.\n논문 제출부수\n:\n3\n부\n※\n심사위원이 직접 서명\n(\n날인\n)\n한 논문 제출 부수임\n(\n칼라 복사 또는 스캔 제출 시 접수 불가)\n※ 학과에서 서명(날인)해 주지 않음. 본인이 직접 서명(날인) 받은 후 제출하여야 함.\n라.\n첨부 제출서류\n:\n학위논문 저작권 동의서\n1\n부\n(\n완성논문 원문파일 제출 후 출력 가능\n,\n붙임\n2\n참조\n)\n마.\n완성논문 원문파일 접수\n(\n붙임\n2~5\n참조\n): 2025. 6. 23.(\n월\n)~6. 30.(\n월\n)\n바.\n논문 인쇄와 제본 형식\n(\n붙임\n3\n참조\n)\n※\n교육대학원 논문 표지가 일반대학원 표지와 동일한 색상\n(\n레자크\n#64)\n임\n사. 특히\n,\n아래와 같은 경우에는 사전에 충분히 지도하시기 바랍니다\n.\n1)\n원문파일을 접수하고\n제출내역 조회에서\n처리완료 단계임을 확인한 후 인쇄\n할 것\n(\n제출 파일과 인쇄본이 동일하여야 함\n,\n승인은\n3-4\n일 정도 소요)\n2)\n논문심사 합격자 중\n완성논문 제출 연기 신청\n:\n「\n본교 학위수여규정\n」\n제\n25\n조\n2\n항에 따라 다음학기에 심사과정을 따로 거치지 않고 완성논문 제출 가능\n(\n반드시 붙임\n6\n신청서 첨부하여 공문으로 신청할 것\n)\n붙임\n1.\n학위청구논문 작성방법\n1\n부\n.\n2.\n학위논문 원문파일 제출 안내문\n1\n부\n.\n3. 교육\n대학원 학위논문 규격 예시\n1\n부\n.\n4. dCollection\n제출매뉴얼\n(\n국문\n) 1\n부\n.\n5. dCollection\n제출매뉴얼\n(\n영문\n) 1\n부\n.\n6.\n완성논문 제출연기 신청서\n1\n부\n.\n끝\n.\n첨부파일중 PDF미리보기\n파일 열람을 위해서는 아크로뱃 리더 설치가 필요합니다. 아래 링크를 클릭하여 리더를 다운로드 받으세요.\n첨부파일중 PDF미리보기\n파일 열람을 위해서는 아크로뱃 리더 설치가 필요합니다. 아래 링크를 클릭하여 리더를 다운로드 받으세요.\n1. 학위청구논문 작성 방법.hwp\n2. 원문파일 제출안내.hwp\n3. 교육대학원 학위논문 규격예시(2025.1학기).zip\n4. dCollection 제출매뉴얼(국문).pdf\n5. dCollection 제출매뉴얼(영문).pdf\n6. 완성논문 제출연기 신청서.hwp", "images": ["http://www.adobe.com/images/shared/download_buttons/get_adobe_reader.png"], "attachments": [{"name": "1. 학위청구논문 작성 방법.hwp", "url": "https://home.knu.ac.kr/HOME/bbs/bbs_download.php?mv_data=aWR4PTEzMjcmc3RhcnRQYWdlPTYwJmxpc3RObz03NTYmdGFibGU9ZXhfYmJzX2RhdGFfZWR1Jm5hdl9jb2RlPWVkdTE2MjIxODE1MjEmc2l0ZV9jb2RlPWVkdSZjb2RlPVp3S0pYZk5pZW96byZzZWFyY2hfaXRlbT0mc2VhcmNoX29yZGVyPSZvcmRlcl9saXN0PSZsaXN0X3NjYWxlPQ==&download=h&seq=0"}, {"name": "2. 원문파일 제출안내.hwp", "url": "https://home.knu.ac.kr/HOME/bbs/bbs_download.php?mv_data=aWR4PTEzMjcmc3RhcnRQYWdlPTYwJmxpc3RObz03NTYmdGFibGU9ZXhfYmJzX2RhdGFfZWR1Jm5hdl9jb2RlPWVkdTE2MjIxODE1MjEmc2l0ZV9jb2RlPWVkdSZjb2RlPVp3S0pYZk5pZW96byZzZWFyY2hfaXRlbT0mc2VhcmNoX29yZGVyPSZvcmRlcl9saXN0PSZsaXN0X3NjYWxlPQ==&download=h&seq=1"}, {"name": "3. 교육대학원 학위논문 규격예시(2025.1학기).zip", "url": "https://home.knu.ac.kr/HOME/bbs/bbs_download.php?mv_data=aWR4PTEzMjcmc3RhcnRQYWdlPTYwJmxpc3RObz03NTYmdGFibGU9ZXhfYmJzX2RhdGFfZWR1Jm5hdl9jb2RlPWVkdTE2MjIxODE1MjEmc2l0ZV9jb2RlPWVkdSZjb2RlPVp3S0pYZk5pZW96byZzZWFyY2hfaXRlbT0mc2VhcmNoX29yZGVyPSZvcmRlcl9saXN0PSZsaXN0X3NjYWxlPQ==&download=h&seq=2"}, {"name": "4. dCollection 제출매뉴얼(국문).pdf", "url": "https://home.knu.ac.kr/HOME/bbs/bbs_download.php?mv_data=aWR4PTEzMjcmc3RhcnRQYWdlPTYwJmxpc3RObz03NTYmdGFibGU9ZXhfYmJzX2RhdGFfZWR1Jm5hdl9jb2RlPWVkdTE2MjIxODE1MjEmc2l0ZV9jb2RlPWVkdSZjb2RlPVp3S0pYZk5pZW96byZzZWFyY2hfaXRlbT0mc2VhcmNoX29yZGVyPSZvcmRlcl9saXN0PSZsaXN0X3NjYWxlPQ==&download=h&seq=3"}, {"name": "5. dCollection 제출매뉴얼(영문).pdf", "url": "https://home.knu.ac.kr/HOME/bbs/bbs_download.php?mv_data=aWR4PTEzMjcmc3RhcnRQYWdlPTYwJmxpc3RObz03NTYmdGFibGU9ZXhfYmJzX2RhdGFfZWR1Jm5hdl9jb2RlPWVkdTE2MjIxODE1MjEmc2l0ZV9jb2RlPWVkdSZjb2RlPVp3S0pYZk5pZW96byZzZWFyY2hfaXRlbT0mc2VhcmNoX29yZGVyPSZvcmRlcl9saXN0PSZsaXN0X3NjYWxlPQ==&download=h&seq=4"}, {"name": "6. 완성논문 제출연기 신청서.hwp", "url": "https://home.knu.ac.kr/HOME/bbs/bbs_download.php?mv_data=aWR4PTEzMjcmc3RhcnRQYWdlPTYwJmxpc3RObz03NTYmdGFibGU9ZXhfYmJzX2RhdGFfZWR1Jm5hdl9jb2RlPWVkdTE2MjIxODE1MjEmc2l0ZV9jb2RlPWVkdSZjb2RlPVp3S0pYZk5pZW96byZzZWFyY2hfaXRlbT0mc2VhcmNoX29yZGVyPSZvcmRlcl9saXN0PSZsaXN0X3NjYWxlPQ==&download=h&seq=5"}]}
{"dept": "교육학과", "detail": "대학원", "title": "[일반대학원] 2025학년도 1학기 대학원 완성논문 제출 안내", "date": "2025-06-04", "url": "https://home.knu.ac.kr/HOME/edu/sub.htm?mode=view&mv_data=aWR4PTEzMjYmc3RhcnRQYWdlPTYwJmxpc3RObz03NTUmdGFibGU9ZXhfYmJzX2RhdGFfZWR1Jm5hdl9jb2RlPWVkdTE2MjIxODE1MjEmY29kZT1ad0tKWGZOaWVvem8mc2VhcmNoX2l0ZW09JnNlYXJjaF9vcmRlcj0mb3JkZXJfbGlzdD0mbGlzdF9zY2FsZT0mdmlld19sZXZlbD0mdmlld19jYXRlPSZ2aWV3X2NhdGUyPQ==", "content": "[일반대학원] 2025학년도 1학기 대학원 완성논문 제출 안내\n등록일\n2025-06-04\n작성자\n교육학과\n조회수\n122\n「\n2025\n학년도\n1\n학기 일반대학원 및 전문대학원 학위논문 심사 합격자에 대한 완성논문 접수\n」\n일정을 아래와 같이 알려드리니\n,\n반드시\n계열별 제출일자를 엄수하여 제출\n하여 주시기 바랍니다\n.\n가\n.\n접수기간\n: 아래 참고\n※\n점심시간\n(12:00~13:00)\n제외\n일  자\n제출시간\n계열별 접수대상 논문\n비고\n7. 10.(\n목\n)\n오후\n13:00~17:30\n사범계열\n,\n공학\n2(IT\n계열\n,\n융합계열\n),\n의학\n/\n치의학\n/\n수의학\n/\n간호학\n/\n약학\n,\n이학논문\n이학논문\n(\n의과학과\n,\n치의과학과\n)\n7. 11.(\n금\n)\n오전\n09:30~12:00\n7. 9.(\n수\n)~7. 10.(\n목\n)\n미제출자\n나\n.\n접수장소\n:\n본교\n중앙도서관\n1\n층 다목적실\n(\n주출입문\n:\n중앙도서관 구관 입구)\n※ 학과 사무실 제출 아닙니다!!!\n다\n.\n상주캠퍼스 소속 학생 제출 안내\n-\n제출일자\n: 7. 9.(\n수\n)~7. 10.(\n목\n) 09:30~17:30(\n점심시간\n12:00~13:00\n제외\n)\n-\n제출장소\n:\n상주캠퍼스 생태환경대\n,\n과학기술대 행정실\n(\n본인 소속대학 행정실\n)\n※\n대구캠퍼스로 제출하고자 하는 학생은 직접 제출해도 됨\n라\n.\n논문 제출부수\n:\n석사\n3\n부\n,\n박사\n3\n부\n※\n심사위원이 직접 서명\n(\n날인\n)\n한 논문 제출 부수임\n(\n칼라 복사 또는 스캔 제출 시 접수 불가)\n※ 학과에서 서명(날인)해 주지 않음. 본인이 직접 서명(날인) 받은 후 제출하여야 함.\n마\n.\n첨부 제출서류\n:\n학위논문 저작권 동의서\n1\n부\n(\n완성논문 원문파일 제출 후 출력 가능\n,\n붙임\n2\n참조\n)\n바\n.\n완성논문 원문파일 접수\n(\n붙임\n2~5\n참조\n): 2025. 6. 23.(\n월\n)~6. 30.(\n월\n)\n사\n.\n논문 인쇄와 제본 형식\n(\n붙임\n3\n참조\n): 각 전공별로 상이할 수 있으니 지도교수에게 문의\n아. 특히\n,\n아래와 같은 경우에는 사전에 충분히 지도하시기 바랍니다\n.\n1)\n2024. 2\n학기 완성논문 제출 연기 학생\n(\n붙임\n6):\n반드시 완성논문 제출\n(\n미제출시 불합격)\n2)\n원문파일을 접수하고\n최종 승인을 받은 후 인쇄\n할 것\n(\n제출 파일과 인쇄본이 동일하여야 함\n)\n3)\n논문심사 합격자 중\n완성논문 제출 연기 신청\n:\n「\n본교 학위수여규정\n」\n제\n25\n조\n2\n항에 따라 다음학기에 심사과정을 따로 거치지 않고 완성논문 제출 가능\n(\n반드시 붙임\n7\n신청서 첨부하여 공문으로 신청할 것\n)\n​자.\n특수대학원(교육대학원) 완성논문\n은 완성논문 제출기간에\n행정실에 제출\n붙임\n1.\n학위청구논문 작성방법\n1\n부\n.\n2.\n학위논문 원문파일 제출 안내문\n1\n부\n.\n3.\n일반대학원 학위논문 규격 예시\n1\n부\n.\n4. dCollection\n제출매뉴얼\n(\n국문\n) 1\n부\n.\n5. dCollection\n제출매뉴얼\n(\n영문\n) 1\n부\n.\n6.\n완성논문 제출연기 신청서\n1\n부\n.\n끝\n.\n첨부파일중 PDF미리보기\n파일 열람을 위해서는 아크로뱃 리더 설치가 필요합니다. 아래 링크를 클릭하여 리더를 다운로드 받으세요.\n첨부파일중 PDF미리보기\n파일 열람을 위해서는 아크로뱃 리더 설치가 필요합니다. 아래 링크를 클릭하여 리더를 다운로드 받으세요.\n1. 학위청구논문 작성 방법.hwp\n2. 원문파일 제출안내.hwp\n3. 학위논문 규격예시(2025.1학기).zip\n4. dCollection 제출매뉴얼(국문).pdf\n5. dCollection 제출매뉴얼(영문).pdf\n6. 완성논문 제출연기 신청서.hwp", "images": ["http://www.adobe.com/images/shared/download_buttons/get_adobe_reader.png"], "attachments": [{"name": "1. 학위청구논문 작성 방법.hwp", "url": "https://home.knu.ac.kr/HOME/bbs/bbs_download.php?mv_data=aWR4PTEzMjYmc3RhcnRQYWdlPTYwJmxpc3RObz03NTUmdGFibGU9ZXhfYmJzX2RhdGFfZWR1Jm5hdl9jb2RlPWVkdTE2MjIxODE1MjEmc2l0ZV9jb2RlPWVkdSZjb2RlPVp3S0pYZk5pZW96byZzZWFyY2hfaXRlbT0mc2VhcmNoX29yZGVyPSZvcmRlcl9saXN0PSZsaXN0X3NjYWxlPQ==&download=h&seq=0"}, {"name": "2. 원문파일 제출안내.hwp", "url": "https://home.knu.ac.kr/HOME/bbs/bbs_download.php?mv_data=aWR4PTEzMjYmc3RhcnRQYWdlPTYwJmxpc3RObz03NTUmdGFibGU9ZXhfYmJzX2RhdGFfZWR1Jm5hdl9jb2RlPWVkdTE2MjIxODE1MjEmc2l0ZV9jb2RlPWVkdSZjb2RlPVp3S0pYZk5pZW96byZzZWFyY2hfaXRlbT0mc2VhcmNoX29yZGVyPSZvcmRlcl9saXN0PSZsaXN0X3NjYWxlPQ==&download=h&seq=1"}, {"name": "3. 학위논문 규격예시(2025.1학기).zip", "url": "https://home.knu.ac.kr/HOME/bbs/bbs_download.php?mv_data=aWR4PTEzMjYmc3RhcnRQYWdlPTYwJmxpc3RObz03NTUmdGFibGU9ZXhfYmJzX2RhdGFfZWR1Jm5hdl9jb2RlPWVkdTE2MjIxODE1MjEmc2l0ZV9jb2RlPWVkdSZjb2RlPVp3S0pYZk5pZW96byZzZWFyY2hfaXRlbT0mc2VhcmNoX29yZGVyPSZvcmRlcl9saXN0PSZsaXN0X3NjYWxlPQ==&download=h&seq=2"}, {"name": "4. dCollection 제출매뉴얼(국문).pdf", "url": "https://home.knu.ac.kr/HOME/bbs/bbs_download.php?mv_data=aWR4PTEzMjYmc3RhcnRQYWdlPTYwJmxpc3RObz03NTUmdGFibGU9ZXhfYmJzX2RhdGFfZWR1Jm5hdl9jb2RlPWVkdTE2MjIxODE1MjEmc2l0ZV9jb2RlPWVkdSZjb2RlPVp3S0pYZk5pZW96byZzZWFyY2hfaXRlbT0mc2VhcmNoX29yZGVyPSZvcmRlcl9saXN0PSZsaXN0X3NjYWxlPQ==&download=h&seq=3"}, {"name": "5. dCollection 제출매뉴얼(영문).pdf", "url": "https://home.knu.ac.kr/HOME/bbs/bbs_download.php?mv_data=aWR4PTEzMjYmc3RhcnRQYWdlPTYwJmxpc3RObz03NTUmdGFibGU9ZXhfYmJzX2RhdGFfZWR1Jm5hdl9jb2RlPWVkdTE2MjIxODE1MjEmc2l0ZV9jb2RlPWVkdSZjb2RlPVp3S0pYZk5pZW96byZzZWFyY2hfaXRlbT0mc2VhcmNoX29yZGVyPSZvcmRlcl9saXN0PSZsaXN0X3NjYWxlPQ==&download=h&seq=4"}, {"name": "6. 완성논문 제출연기 신청서.hwp", "url": "https://home.knu.ac.kr/HOME/bbs/bbs_download.php?mv_data=aWR4PTEzMjYmc3RhcnRQYWdlPTYwJmxpc3RObz03NTUmdGFibGU9ZXhfYmJzX2RhdGFfZWR1Jm5hdl9jb2RlPWVkdTE2MjIxODE1MjEmc2l0ZV9jb2RlPWVkdSZjb2RlPVp3S0pYZk5pZW96byZzZWFyY2hfaXRlbT0mc2VhcmNoX29yZGVyPSZvcmRlcl9saXN0PSZsaXN0X3NjYWxlPQ==&download=h&seq=5"}]}
{"dept": "교육학과", "detail": "대학원", "title": "[교육대학원 상담심리전공 양성과정] 6주기 교원양성기관 역량진단 재학생 만족도 설문조사 안내", "date": "2025-05-28", "url": "https://home.knu.ac.kr/HOME/edu/sub.htm?mode=view&mv_data=aWR4PTEzMjMmc3RhcnRQYWdlPTYwJmxpc3RObz03NTQmdGFibGU9ZXhfYmJzX2RhdGFfZWR1Jm5hdl9jb2RlPWVkdTE2MjIxODE1MjEmY29kZT1ad0tKWGZOaWVvem8mc2VhcmNoX2l0ZW09JnNlYXJjaF9vcmRlcj0mb3JkZXJfbGlzdD0mbGlzdF9zY2FsZT0mdmlld19sZXZlbD0mdmlld19jYXRlPSZ2aWV3X2NhdGUyPQ==", "content": "[교육대학원 상담심리전공 양성과정] 6주기 교원양성기관 역량진단 재학생 만족도 설문조사 안내\n등록일\n2025-05-28\n작성자\n교육학과\n조회수\n35\n한국교육개발원에서 추진하고 있는 「6주기 교원양성기관 역량진단」과 관련하여 재학생 만족도 설문조사가 아래와 같이 진행될 예정입니다.\n이에 설문조사가 잘 이루어질 수 있도록 설문조사 예정 사실과\n발송 전화번호(043-530-9388)를 미리 확인하여 주시기 바랍니다.\n([붙임] 재학생 만족도 조사 문자 발송본 참고)\n가. 목적: ‘ⅶ-3. 재학생 만족도’지표 진단을 위해 역량진단 준거(기본, 교원, 교육과정, 실습형 교육 및 학생 지도, 적·인성, 교육환경, 교육성과)의 세부 내용을 바탕으로 재학생들의 교원양성기관 만족도를 조사\n나. 대상: 학부 3학년 이상,\n교육대학원 2학기 이상인 재학생의 50%를 표집 (※ 각 양성과정의 조사 대상이 50명 미만일 경우 전수조사 실시)\n다. 기간: 2025.6.9.(월) ~ 6.30.(월)\n※ 목표 응답자 수가 충족되지 않는 경우, 기간이 연장될 수 있음\n라. 방법: 표집된 재학생에게 휴대전화 문자 발송의 방법으로 설문조사 링크를 송부하여 설문조사 실시\n바. 기타사항\n- 목표 표집이 이루어지지 않을 경우, 미응답 재학생에 한해 문자가 재발송될 수 있음\n- “종료된 설문입니다.”라는 문구가 뜨는 경우 설문조사에 응할 필요 없음\n1.재학생 만족도 조사 문자 발송본.PNG", "images": [], "attachments": [{"name": "1.재학생 만족도 조사 문자 발송본.PNG", "url": "https://home.knu.ac.kr/HOME/bbs/bbs_download.php?mv_data=aWR4PTEzMjMmc3RhcnRQYWdlPTYwJmxpc3RObz03NTQmdGFibGU9ZXhfYmJzX2RhdGFfZWR1Jm5hdl9jb2RlPWVkdTE2MjIxODE1MjEmc2l0ZV9jb2RlPWVkdSZjb2RlPVp3S0pYZk5pZW96byZzZWFyY2hfaXRlbT0mc2VhcmNoX29yZGVyPSZvcmRlcl9saXN0PSZsaXN0X3NjYWxlPQ==&download=h&seq=0"}]}
{"dept": "교육학과", "detail": "대학원", "title": "[교육대학원 상담심리전공 양성과정] 2025학년도 1학기 교육봉사활동 확인서 제출 안내", "date": "2025-05-26", "url": "https://home.knu.ac.kr/HOME/edu/sub.htm?mode=view&mv_data=aWR4PTEzMTgmc3RhcnRQYWdlPTYwJmxpc3RObz03NTMmdGFibGU9ZXhfYmJzX2RhdGFfZWR1Jm5hdl9jb2RlPWVkdTE2MjIxODE1MjEmY29kZT1ad0tKWGZOaWVvem8mc2VhcmNoX2l0ZW09JnNlYXJjaF9vcmRlcj0mb3JkZXJfbGlzdD0mbGlzdF9zY2FsZT0mdmlld19sZXZlbD0mdmlld19jYXRlPSZ2aWV3X2NhdGUyPQ==", "content": "[교육대학원 상담심리전공 양성과정] 2025학년도 1학기 교육봉사활동 확인서 제출 안내\n등록일\n2025-05-26\n작성자\n교육학과\n조회수\n40\n<2025학년도 1학기 교육봉사활동 확인서 제출 안내>\n가. 대상: 2025\n학년도\n1\n학기\n교육봉사활동2\n수강신청자\n나. 제출방법:\n아래의\n①과 ②를 모두 완료\n하여야 함\n①\n봉사활동\n내용을\n차세대 통합정보시스템에 입력\n(\n학사행정-\n교직-\n교육봉사활동관리-\n교육봉사활동입력\n)\n※\n입력 시\n교육봉사활동\n1\n과\n2\n를 구분하여 정확히 입력하도록 유의\n(\n교육봉사활동\n1\n은 사범대학 일부 학생에게만 해당됨)\n②\n교육봉\n사활동 확인서\n원본\n을\n학과 사무실\n로\n직접 제출\n﻿\n※ 교육학과 사무실: 사범대학 823호 (9:00~17:30 방문 요망, 점심시간 12:00~13:00 제외)\n다. 제출기한:\n2025. 6. 4.(수)까지\n원본\n제출 (기한 엄수)\n라. 유의사항:\n​ 사전 확인 절차를 거치지 않은 경우, 제출기한보다 일찍 제출할 것을 권장함 (교육봉사활동으로 인정받지 못하는 경우 다수 발생함)\n※\n봉사 가능기관 및 내용 확인\n: 경북대학교 교육연수원 홈페이지 교육봉사활동 게시판 참조", "images": [], "attachments": []}
{"dept": "교육학과", "detail": "대학원", "title": "2025학년도 1학기 교육봉사활동 관련 프로그램 참가 희망자 신청 안내", "date": "2025-05-21", "url": "https://home.knu.ac.kr/HOME/edu/sub.htm?mode=view&mv_data=aWR4PTEzMTcmc3RhcnRQYWdlPTYwJmxpc3RObz03NTImdGFibGU9ZXhfYmJzX2RhdGFfZWR1Jm5hdl9jb2RlPWVkdTE2MjIxODE1MjEmY29kZT1ad0tKWGZOaWVvem8mc2VhcmNoX2l0ZW09JnNlYXJjaF9vcmRlcj0mb3JkZXJfbGlzdD0mbGlzdF9zY2FsZT0mdmlld19sZXZlbD0mdmlld19jYXRlPSZ2aWV3X2NhdGUyPQ==", "content": "2025학년도 1학기 교육봉사활동 관련 프로그램 참가 희망자 신청 안내\n등록일\n2025-05-21\n작성자\n교육학과\n조회수\n43\n우리 사범대학은 2012학년도 1학기부터 사범대학부설초등학교와 협력하여 교육봉사활동 프로그램을 실시하고 있습니다.\n2025학년도 1학기 교육봉사활동 프로그램을 아래와 같이 진행하고자 하니, 동 프로그램 참가 희망자는 아래의 서류를 5. 28.(수) 오전 9시까지 제출하여 주시기 바랍니다.\n가.\n프로그램 일정 : 2025. 6. 25.(수) ~ 7. 2.(화)〔5일간〕\n나. 신청대상 : 2025학년도 1학기 현재 사범대학 3학년 재학생, 교육대학원 재학생\n다. 교육봉사활동 인정시간 :\n30시간 인정\n라. 참가인원 : 38명(인원이 많을  시 선착순 모집)\n마.\n제출 서류\n① [붙임1] 교육봉사활동프로그램 참가 희망자 수요조사 서식(배부용)\n② [붙임2] 행정정보 공동이용 사전동의서 및 범죄전력동의서\n바.\n제출방법: 교육학과 이메일(edu5806@knu.ac.kr)\n사.\n제출기한:\n2025. 5. 28.(수) 9:00까지 (이후 제출건은 접수하지 않음)\n[붙임1] 교육봉사활동프로그램 참가 희망자 수요조사 서식(배부용).xls", "images": [], "attachments": [{"name": "[붙임1] 교육봉사활동프로그램 참가 희망자 수요조사 서식(배부용).xls", "url": "https://home.knu.ac.kr/HOME/bbs/bbs_download.php?mv_data=aWR4PTEzMTcmc3RhcnRQYWdlPTYwJmxpc3RObz03NTImdGFibGU9ZXhfYmJzX2RhdGFfZWR1Jm5hdl9jb2RlPWVkdTE2MjIxODE1MjEmc2l0ZV9jb2RlPWVkdSZjb2RlPVp3S0pYZk5pZW96byZzZWFyY2hfaXRlbT0mc2VhcmNoX29yZGVyPSZvcmRlcl9saXN0PSZsaXN0X3NjYWxlPQ==&download=h&seq=0"}]}
{"dept": "교육학과", "detail": "대학원", "title": "[교육대학원 상담심리전공 양성과정] 2025학년도 1학기 교직 적성 및 인성검사(3차) 시행 안내", "date": "2025-05-20", "url": "https://home.knu.ac.kr/HOME/edu/sub.htm?mode=view&mv_data=aWR4PTEzMTUmc3RhcnRQYWdlPTcwJmxpc3RObz03NTEmdGFibGU9ZXhfYmJzX2RhdGFfZWR1Jm5hdl9jb2RlPWVkdTE2MjIxODE1MjEmY29kZT1ad0tKWGZOaWVvem8mc2VhcmNoX2l0ZW09JnNlYXJjaF9vcmRlcj0mb3JkZXJfbGlzdD0mbGlzdF9zY2FsZT0mdmlld19sZXZlbD0mdmlld19jYXRlPSZ2aWV3X2NhdGUyPQ==", "content": "[교육대학원 상담심리전공 양성과정] 2025학년도 1학기 교직 적성 및 인성검사(3차) 시행 안내\n등록일\n2025-05-20\n작성자\n교육학과\n조회수\n36\n1) 검사 일시: 2025. 6. 2.(월) 19:00~19:50\n2) 결과 확정: 2025. 6. 10.(수) [예정] - 부적격자의 경우, 별도의 온라인 교육을 이수해야 함 (추후 별도 안내)\n3) 신청 기간: 2025. 5. 21.(수) ~ 5. 23.(금) 매일 10:00 ~ 17:00 (※ 등록횟수별 신청 가능 기간이 상이)\n신청 기간\n대상\n(\n등록횟수\n)\n비고\n5. 21.(\n수\n)\n∼\n5. 23.(\n금\n)\n매일\n10:00-17:00\n‧\n교육대학원\n: 4\n학기 이상\n5. 22.(\n목\n)\n～\n5. 23.(\n금\n)\n매일\n10:00-17:00\n‧\n학부\n: 6\n학기 이상\n‧\n교육대학원\n: 3\n학기 이상\n5. 23.(\n금\n) 10:00-17:00\n모두 가능\n4) 신청 방법: 통합정보시스템(\nhttp://knuin.knu.ac.kr)\n- 교직 - 교직적성및인성검사관리 - 교직적성및인성검사신청 (※ 신청 후 반드시 재접속하여 신청여부 확인)\n5) 교원자격증 발급을 위한 교직 적성 및 인성검사 충족 요건: 적격 판정 2회\n※ ’25. 8월 또는 ’26. 2월 졸업예정자 중 충족 기준을 만족하지 못한 학생들은 반드시 신청 및 참여\n첨부파일중 PDF미리보기\n파일 열람을 위해서는 아크로뱃 리더 설치가 필요합니다. 아래 링크를 클릭하여 리더를 다운로드 받으세요.\n교직 적성 및 인성검사 학생 신청.pdf\n2025학년도 1학기 교직 적성 및 인성검사(3차) 시행 계획.hwp", "images": ["http://www.adobe.com/images/shared/download_buttons/get_adobe_reader.png"], "attachments": [{"name": "교직 적성 및 인성검사 학생 신청.pdf", "url": "https://home.knu.ac.kr/HOME/bbs/bbs_download.php?mv_data=aWR4PTEzMTUmc3RhcnRQYWdlPTcwJmxpc3RObz03NTEmdGFibGU9ZXhfYmJzX2RhdGFfZWR1Jm5hdl9jb2RlPWVkdTE2MjIxODE1MjEmc2l0ZV9jb2RlPWVkdSZjb2RlPVp3S0pYZk5pZW96byZzZWFyY2hfaXRlbT0mc2VhcmNoX29yZGVyPSZvcmRlcl9saXN0PSZsaXN0X3NjYWxlPQ==&download=h&seq=0"}, {"name": "2025학년도 1학기 교직 적성 및 인성검사(3차) 시행 계획.hwp", "url": "https://home.knu.ac.kr/HOME/bbs/bbs_download.php?mv_data=aWR4PTEzMTUmc3RhcnRQYWdlPTcwJmxpc3RObz03NTEmdGFibGU9ZXhfYmJzX2RhdGFfZWR1Jm5hdl9jb2RlPWVkdTE2MjIxODE1MjEmc2l0ZV9jb2RlPWVkdSZjb2RlPVp3S0pYZk5pZW96byZzZWFyY2hfaXRlbT0mc2VhcmNoX29yZGVyPSZvcmRlcl9saXN0PSZsaXN0X3NjYWxlPQ==&download=h&seq=1"}]}
{"dept": "교육학과", "detail": "대학원", "title": "대학원 교육과정전공 석사 및 박사 학위논문 공개 발표 개최 안내", "date": "2025-05-15", "url": "https://home.knu.ac.kr/HOME/edu/sub.htm?mode=view&mv_data=aWR4PTEzMTMmc3RhcnRQYWdlPTcwJmxpc3RObz03NTAmdGFibGU9ZXhfYmJzX2RhdGFfZWR1Jm5hdl9jb2RlPWVkdTE2MjIxODE1MjEmY29kZT1ad0tKWGZOaWVvem8mc2VhcmNoX2l0ZW09JnNlYXJjaF9vcmRlcj0mb3JkZXJfbGlzdD0mbGlzdF9zY2FsZT0mdmlld19sZXZlbD0mdmlld19jYXRlPSZ2aWV3X2NhdGUyPQ==", "content": "대학원 교육과정전공 석사 및 박사 학위논문 공개 발표 개최 안내\n등록일\n2025-05-15\n작성자\n교육학과\n조회수\n105\n대학원 교육학과 교육과정전공 석사 및 박사 학위논문 공개발표를 다음과 같이 개최하고자 합니다.\n◆ 다 음 ◆\n가. 발표일시 : 2025. 5. 16.(금) 13:00~\n나. 발표장소 : 사범대학 812호\n다. 발표순서\n(1) 석사\n1. 니메샤(A Comparative Study of Narrative -Based Approaches in Grade 5 English Education: Analysing the Aspect of Communicative Dialogue in South Korea and Sri Lanka)\n2. 촤이쩌(백워드 설계 모형에 기반한 중국 중학교 수학과 단원 개발)\n3. 하가나(내러티브에 기반한 노인학습영량 개발을 위한  교육과정 연구)\n4. 안다인(글로벌 창의인재 양성을 위한 프로그램 개발의 전환: 백워드 설계를 중심으로)\n5. 서민정(대학교수법 혁신사례 탐구: SOLO분류학과 IB교육을 중심으로)\n6. 김바다(중등단계 직업교육에 IBCP 적용 가능성 연구)\n(2) 박사\n1. 전순정(내러티브를 활용한 개념기반 교육과정 적용 방안: 2022 개정 교육과정 중등 국어과를 중심으로)\n2. 왕영(다문화 수업 실천을 위한 백워드 설계와 내러티브 통합 기반 한국어 교육과정 단원 개발 연구 )\n3. 조웅민(내러티브 페다고지 기반 교과 통합 교육과정 모형 개발)\n※ 발표하시는 분들께\n- 발표시간은 석사 15분, 박사 20분 이내로 하시기 바랍니다.\n- 석사, 박사 모두 참석하시는 교수님들께는 논문을 드릴 수 있도록 준비하여 주시기 바랍니다.\n- 발표를 들으러 오는 다른 학생들을 위한 논문자료도 준비해주시면 좋을 것 같습니다.", "images": [], "attachments": []}
{"dept": "교육학과", "detail": "대학원", "title": "[교육대학원 상담심리전공 양성과정] 2025학년도 1학기 응급처치 및 심폐소생술 실습 신청자 명단 및 일정/장소 안내", "date": "2025-04-29", "url": "https://home.knu.ac.kr/HOME/edu/sub.htm?mode=view&mv_data=aWR4PTEzMDYmc3RhcnRQYWdlPTcwJmxpc3RObz03NDkmdGFibGU9ZXhfYmJzX2RhdGFfZWR1Jm5hdl9jb2RlPWVkdTE2MjIxODE1MjEmY29kZT1ad0tKWGZOaWVvem8mc2VhcmNoX2l0ZW09JnNlYXJjaF9vcmRlcj0mb3JkZXJfbGlzdD0mbGlzdF9zY2FsZT0mdmlld19sZXZlbD0mdmlld19jYXRlPSZ2aWV3X2NhdGUyPQ==", "content": "[교육대학원 상담심리전공 양성과정] 2025학년도 1학기 응급처치 및 심폐소생술 실습 신청자 명단 및 일정/장소 안내\n등록일\n2025-04-29\n작성자\n교육학과\n조회수\n76\n가. 신청 현황 확인: 통합정보시스템-교직-응급처치및심폐소생술실습-응급처치및심폐소생술실습결과조회-신청실습결과목록\n나. 실습 기간 및 장소: 2025. 5. 15.(목) ~ 5. 16.(금), 글로벌플라자 경하홀Ⅰ․Ⅱ (개별 상이하니 필수 확인)\n다. 소요 시간: 3시간\n라. 준비물: 운동화 착용, 신분증 지참[주민등록증, 운전면허증, (모바일)학생증 등]\n마. 유의사항: 불참할 경우 다음 회차 응급처치 및 심폐소생술 실습 신청 시 패널티 부여\n대학\n(\n원\n)\n학과\n학번\n자격종별\n기준연도\n실습차수\n실습일자\n시작시간\n종료시간\n실습장소\n교육대학원\n상담심리전공\n2023001303\n전문상담교사(2급)\n2023\n10\n2025-05-16\n18:30\n21:30\n글로벌플라자 경하홀Ⅱ\n교육대학원\n상담심리전공\n2023001510\n전문상담교사(2급)\n2023\n10\n2025-05-16\n18:30\n21:30\n글로벌플라자 경하홀Ⅱ\n교육대학원\n상담심리전공\n2024001381\n전문상담교사(2급)\n2024\n10\n2025-05-16\n18:30\n21:30\n글로벌플라자 경하홀Ⅱ\n교육대학원\n상담심리전공\n2024001404\n전문상담교사(2급)\n2024\n10\n2025-05-16\n18:30\n21:30\n글로벌플라자 경하홀Ⅱ\n교육대학원\n상담심리전공\n2024001438\n전문상담교사(2급)\n2024\n7\n2025-05-16\n13:30\n16:30\n글로벌플라자 경하홀Ⅰ\n교육대학원\n상담심리전공\n2024001467\n전문상담교사(2급)\n2024\n10\n2025-05-16\n18:30\n21:30\n글로벌플라자 경하홀Ⅱ\n교육대학원\n상담심리전공\n2024001551\n전문상담교사(2급)\n2024\n2\n2025-05-15\n13:30\n16:30\n글로벌플라자 경하홀Ⅱ\n교육대학원\n상담심리전공\n2024001559\n전문상담교사(2급)\n2024\n1\n2025-05-15\n13:30\n16:30\n글로벌플라자 경하홀Ⅰ\n교육대학원\n상담심리전공\n2024001565\n전문상담교사(2급)\n2024\n10\n2025-05-16\n18:30\n21:30\n글로벌플라자 경하홀Ⅱ\n교육대학원\n상담심리전공\n2024001570\n전문상담교사(2급)\n2024\n10\n2025-05-16\n18:30\n21:30\n글로벌플라자 경하홀Ⅱ\n교육대학원\n상담심리전공\n2025001249\n전문상담교사(2급)\n2025\n8\n2025-05-16\n13:30\n16:30\n글로벌플라자 경하홀Ⅱ", "images": [], "attachments": []}
{"dept": "교육학과", "detail": "대학원", "title": "[상담심리전공] 2025년 1학기 논문 공개 발표 일정 및 참가 신청 안내", "date": "2025-04-23", "url": "https://home.knu.ac.kr/HOME/edu/sub.htm?mode=view&mv_data=aWR4PTEyOTkmc3RhcnRQYWdlPTcwJmxpc3RObz03NDgmdGFibGU9ZXhfYmJzX2RhdGFfZWR1Jm5hdl9jb2RlPWVkdTE2MjIxODE1MjEmY29kZT1ad0tKWGZOaWVvem8mc2VhcmNoX2l0ZW09JnNlYXJjaF9vcmRlcj0mb3JkZXJfbGlzdD0mbGlzdF9zY2FsZT0mdmlld19sZXZlbD0mdmlld19jYXRlPSZ2aWV3X2NhdGUyPQ==", "content": "[상담심리전공] 2025년 1학기 논문 공개 발표 일정 및 참가 신청 안내\n등록일\n2025-04-23\n작성자\n교육학과\n조회수\n94\n2025\n년\n1\n학기 논문 공개 발표회 일정 및 참가 신청 안내드립니다\n.\n1.\n일시\n: 2025\n년\n4\n월\n30\n일\n(\n수\n), 9:30~12:45\n2.\n장소\n: ZOOM(\n링크 추후공지\n)\n3.\n발표인원\n: 6\n명\n(\n석사\n5\n명\n,\n박사\n1\n명\n)\n4.\n참가희망\n:\n구글폼 링크 신청\nhttps://docs.google.com/forms/d/e/1FAIpQLSdXOqFgJ452_eTwTU_uK6BVHUNzApPlH0Bvr442vNtP_zSjvw/viewform?usp=header\n*\n참가 신청은\n4\n월\n28\n일\n(\n월\n)\n오후\n12:00\n까지 부탁드립니다\n.\n5.\n발표회 세부일정\n※\n사정에 따라 진행 시간은 변동 될 수 있습니다\n.\n시 간\n진 행\n발표자\n소요시간\n(\n피드백 시간\n)\n연구방법\n비 고\n9:30\n~12:25\n개식사\n사회자\n9:30 ~ 9:35\n-\n*\n발표방법\n: PPT\n준비\n발표는\n1\n인당\n석사\n15\n분\n,\n박사\n20\n분\n발표\n이후\n주제별\n피드백\n예정\n발표\n1\n민채린\n(\n교\n23)\n9:35 ~ 10:20\n(10:20 ~ 10:50)\n메타분석\n정은지\n(\n일\n23)\n허수빈\n(\n일\n23)\n쉬는시간\n10:50 ~ 10:55\n발표\n2\n신지은\n(\n일\n20)\n10:55 ~ 11:25\n(11:25 ~ 11:45)\n양적연구\n황예진\n(\n교\n23)\n쉬는시간\n11:45 ~ 11:50\n발표\n3\n조소영\n(\n박사\n21)\n11:50 ~ 12:10\n(12:10 ~ 12:25)\n척도개발\n12:25\n~12:45\n마무리\n김진숙\n교수님\n김은영\n교수님\n12:25 ~ 12:45\n전체 총평\n6.\n발표자 정보\n구분\n발표자\n제목\n연구방법\n석사\n민채린\n(\n교\n23)\n아동 대상 감사 증진 집단상담 프로그램 효과 메타분석\n메타분석\n정은지\n(\n일\n23)\n집단상담 프로그램이 청소년의 자기통제력 증진에 미치는 효과에 대한 메타분석\n메타분석\n허수빈\n(\n일\n23)\n초기 성인기 사회불안 조절을 위한 심리치료 프로그램 효과 메타분석\n메타분석\n신지은\n(\n일\n20)\n경계선 지능 위험군 아동의 인지적 특성과 변산성에 관한 연구\n:\n맞춤형지지 개입 방안을 중심으로\n양적연구\n(\n기술통계\n)\n황예진\n(\n교\n23)\n경계선 지적 기능\n(BIF)\n아동\n·\n청소년의 인지 특성 이해\n:\n언어 이해 수행에 기반한 사회성 개입 방향 탐색\n양적연구\n(\n기술통계\n,\n집단 간 평균비교\n)\n박사\n조소영\n(\n박사\n21)\n청소년기 자녀를 둔 부모의 정신화 척도 개발 및 타당화\n척도개발\n문의사항 있으시면 아래 번호로 연락주십시오\n.\n감사합니다\n.\n문의\n:\n장정원\n​", "images": ["./data/images/58f115e5-857d-45ab-bf9c-b4e20e25392e.png"], "attachments": []}
{"dept": "교육학과", "detail": "대학원", "title": "[교육대학원 상담심리전공 양성과정] 2025학년도 1학기 응급처치 및 심폐소생술 실습 시행 안내", "date": "2025-04-17", "url": "https://home.knu.ac.kr/HOME/edu/sub.htm?mode=view&mv_data=aWR4PTEyOTcmc3RhcnRQYWdlPTcwJmxpc3RObz03NDcmdGFibGU9ZXhfYmJzX2RhdGFfZWR1Jm5hdl9jb2RlPWVkdTE2MjIxODE1MjEmY29kZT1ad0tKWGZOaWVvem8mc2VhcmNoX2l0ZW09JnNlYXJjaF9vcmRlcj0mb3JkZXJfbGlzdD0mbGlzdF9zY2FsZT0mdmlld19sZXZlbD0mdmlld19jYXRlPSZ2aWV3X2NhdGUyPQ==", "content": "[교육대학원 상담심리전공 양성과정] 2025학년도 1학기 응급처치 및 심폐소생술 실습 시행 안내\n등록일\n2025-04-17\n작성자\n교육학과\n조회수\n87\n「2025년도 1학기 응급처치 및 심폐소생술 실습 계획」을 다음과 같이 시행하고자 하오니 해당 학생들은 기간 내 신청하여 실습에 참여하여 주시기 바랍니다.\n※ [붙임1]의 실습 계획 안내문을 반드시 확인할 것\n가. 신청대상: 교직과정 이수예정자(사범대학, 교육대학원 포함)\n※ 휴학 및 수료생도 신청 가능\n나.\n신청\n기간:\n2025. 4. 18.(\n금\n), 4. 21.(\n월\n) ~ 4. 24.(\n목\n)\n※ 대상자 별\n신청 일시가 상이 [(붙임 1) 참조]\n신청 기간\n대상\n(\n등록횟수\n)\n비고\n2025. 4. 18.(\n금\n) 10:00\n～\n17:00\n상주캠퍼스 소속 학부생\n21\n일\n(\n월\n)\n부터는 등록 횟수에 따라 신청 가능\n2025. 4. 21.(\n월\n)\n～\n4\n. 24.(\n목\n)\n매일\n10:00\n～\n17:00\n-\n학부\n: 7\n학기 이상\n-\n교육대학원\n: 4\n학기 이상\n2025. 4. 22.(\n화\n)\n～\n4\n. 24.(\n목\n)\n매일\n10:00\n～\n17:00\n-\n학부\n: 6\n학기 이상\n-\n교육대학원\n: 3\n학기 이상\n2025. 4. 23.(\n수\n) 10:00\n～\n17:00\n모두 가능\n24. 10\n월 실습\n신청 후 무단 불참자 신청 불가\n2025. 4. 24.(\n목\n) 10:00\n～\n17:00\n모두 가능\n※\n2025. 8\n월\n, 2026. 2\n월 졸업예정자 중 충족 기준을 만족하지 못한 학생\n들은 반드시\n신청 및 참여\n다.\n신청방법: 통합정보시스템(\nhttps://knuin.knu.ac.kr)\n로그인 후 신청 >\n[통합정보시스템-교직-응급처치및심폐소생술실습-응급처치및심폐소생술실습신청]\n※ 출석 및 실습 이수 여부를 위해 반드시 개인정보활용 동의 필요 -  제공되는 개인정보 : 이름, 학번, 휴대폰번호, 생년월일, 성별, 학교명\n라. 실습내용 및 이수기준: 총 3시간 이수[응급처치 및 심폐소생술 이론 + 실습]\n※ 교원자격증 발급 기준: 졸업 전 2회 이수(학기 당 1회 이수 가능)\n마.\n실습일시 및 장소:\n2025. 5. 15.(목) ~ 5. 16.(금), 글로벌플라자 경하홀Ⅰ․Ⅱ\n바. 협조기관: 대구광역시 응급의료지원단\n사. 실습시간, 대상자 별 신청 일시, 유의사항 등 세부계획: [붙임 1]\n아. 추가 인정(대체실습) 방법\n❍\n외부기관(대구광역시 응급의료지원단, 대한적십자사, 대한심폐소생협회, 한국응급처치교육원 등)의 실습 내용을 검토한 후 이수기준에 적합한지 판단하여 인정 요청 ※ [붙임 2] 참조\n- 교육내용: 심폐소생술(성인‧소아‧영아), 기도폐쇄, AED(자동제세동기) 사용법 반드시 포함, 3시간 이상 이론 및 실습\n- 이수자 명단, 이수증 등을 첨부하여 학사과로 인정 요청(이수증 발급 즉시)\n※ 2025. 8월, 2026. 2월 졸업예정자(기 수료자 포함) 중 응급처치 및 심폐소생술 실습을 충족하지 못한 학생들은 반드시 신청 및 참여\n하여 주시기 바랍니다.\n2025학년도 1학기 응급처치 및 심폐소생술 실습 계획.hwp\n외부기관 대체 실습 프로그램.zip", "images": [], "attachments": [{"name": "2025학년도 1학기 응급처치 및 심폐소생술 실습 계획.hwp", "url": "https://home.knu.ac.kr/HOME/bbs/bbs_download.php?mv_data=aWR4PTEyOTcmc3RhcnRQYWdlPTcwJmxpc3RObz03NDcmdGFibGU9ZXhfYmJzX2RhdGFfZWR1Jm5hdl9jb2RlPWVkdTE2MjIxODE1MjEmc2l0ZV9jb2RlPWVkdSZjb2RlPVp3S0pYZk5pZW96byZzZWFyY2hfaXRlbT0mc2VhcmNoX29yZGVyPSZvcmRlcl9saXN0PSZsaXN0X3NjYWxlPQ==&download=h&seq=0"}, {"name": "외부기관 대체 실습 프로그램.zip", "url": "https://home.knu.ac.kr/HOME/bbs/bbs_download.php?mv_data=aWR4PTEyOTcmc3RhcnRQYWdlPTcwJmxpc3RObz03NDcmdGFibGU9ZXhfYmJzX2RhdGFfZWR1Jm5hdl9jb2RlPWVkdTE2MjIxODE1MjEmc2l0ZV9jb2RlPWVkdSZjb2RlPVp3S0pYZk5pZW96byZzZWFyY2hfaXRlbT0mc2VhcmNoX29yZGVyPSZvcmRlcl9saXN0PSZsaXN0X3NjYWxlPQ==&download=h&seq=1"}]}
{"dept": "교육학과", "detail": "대학원", "title": "[교육대학원 상담심리전공 양성과정] 2025학년도 1학기 교직 적성 및 인성검사(2차) 시행 안내", "date": "2025-04-16", "url": "https://home.knu.ac.kr/HOME/edu/sub.htm?mode=view&mv_data=aWR4PTEyOTYmc3RhcnRQYWdlPTcwJmxpc3RObz03NDYmdGFibGU9ZXhfYmJzX2RhdGFfZWR1Jm5hdl9jb2RlPWVkdTE2MjIxODE1MjEmY29kZT1ad0tKWGZOaWVvem8mc2VhcmNoX2l0ZW09JnNlYXJjaF9vcmRlcj0mb3JkZXJfbGlzdD0mbGlzdF9zY2FsZT0mdmlld19sZXZlbD0mdmlld19jYXRlPSZ2aWV3X2NhdGUyPQ==", "content": "[교육대학원 상담심리전공 양성과정] 2025학년도 1학기 교직 적성 및 인성검사(2차) 시행 안내\n등록일\n2025-04-16\n작성자\n교육학과\n조회수\n73\n1) 검사 일시: 2025. 5. 7.(수) 19:00 ~ 19:50\n2) 결과 확정: 2025. 5. 13.(화)[예정] - 부적격자의 경우, 별도의 온라인 교육을 이수해야 함 (추후 별도 안내)\n3) 신청 기간: 2025. 4. 21.(월) ~ 4. 23.(수) 매일 10:00 ~ 17:00 (※ 등록횟수별 신청 가능 기간이 상이하니 첨부파일(사진) 필수 확인)\n4) 신청 방법: 통합정보시스템(\nhttp://knuin.knu.ac.kr)\n- 교직 - 교직적성및인성검사관리 - 교직적성및인성검사신청 (※ 신청 후 반드시 재접속하여 신청여부 확인)\n5) 교원자격증 발급을 위한 교직 적성 및 인성검사 충족 요건: 적격 판정 2회\n※ ’25. 8월 또는 ’26. 2월 졸업예정자 중 충족 기준을 만족하지 못한 학생들은 반드시 신청 및 참여\n첨부파일중 PDF미리보기\n파일 열람을 위해서는 아크로뱃 리더 설치가 필요합니다. 아래 링크를 클릭하여 리더를 다운로드 받으세요.\n2025학년도 1학기 교직 적성 및 인성검사(2차) 시행 계획.hwp\n교직 적성 및 인성검사 학생 신청.pdf", "images": ["http://www.adobe.com/images/shared/download_buttons/get_adobe_reader.png"], "attachments": [{"name": "2025학년도 1학기 교직 적성 및 인성검사(2차) 시행 계획.hwp", "url": "https://home.knu.ac.kr/HOME/bbs/bbs_download.php?mv_data=aWR4PTEyOTYmc3RhcnRQYWdlPTcwJmxpc3RObz03NDYmdGFibGU9ZXhfYmJzX2RhdGFfZWR1Jm5hdl9jb2RlPWVkdTE2MjIxODE1MjEmc2l0ZV9jb2RlPWVkdSZjb2RlPVp3S0pYZk5pZW96byZzZWFyY2hfaXRlbT0mc2VhcmNoX29yZGVyPSZvcmRlcl9saXN0PSZsaXN0X3NjYWxlPQ==&download=h&seq=0"}, {"name": "교직 적성 및 인성검사 학생 신청.pdf", "url": "https://home.knu.ac.kr/HOME/bbs/bbs_download.php?mv_data=aWR4PTEyOTYmc3RhcnRQYWdlPTcwJmxpc3RObz03NDYmdGFibGU9ZXhfYmJzX2RhdGFfZWR1Jm5hdl9jb2RlPWVkdTE2MjIxODE1MjEmc2l0ZV9jb2RlPWVkdSZjb2RlPVp3S0pYZk5pZW96byZzZWFyY2hfaXRlbT0mc2VhcmNoX29yZGVyPSZvcmRlcl9saXN0PSZsaXN0X3NjYWxlPQ==&download=h&seq=1"}]}
{"dept": "교육학과", "detail": "대학원", "title": "[상담심리전공] 2025년 1학기 논문 공개 발표 일정 및 참가 신청 안내", "date": "2025-04-15", "url": "https://home.knu.ac.kr/HOME/edu/sub.htm?mode=view&mv_data=aWR4PTEyOTUmc3RhcnRQYWdlPTcwJmxpc3RObz03NDUmdGFibGU9ZXhfYmJzX2RhdGFfZWR1Jm5hdl9jb2RlPWVkdTE2MjIxODE1MjEmY29kZT1ad0tKWGZOaWVvem8mc2VhcmNoX2l0ZW09JnNlYXJjaF9vcmRlcj0mb3JkZXJfbGlzdD0mbGlzdF9zY2FsZT0mdmlld19sZXZlbD0mdmlld19jYXRlPSZ2aWV3X2NhdGUyPQ==", "content": "[상담심리전공] 2025년 1학기 논문 공개 발표 일정 및 참가 신청 안내\n등록일\n2025-04-15\n작성자\n교육학과\n조회수\n89\n2025년 1학기 논문계획서(프로포절) 발표회 일정 및 참가 신청 안내드립니다.\n1. 일시: 2025년 4월 19일 (토), 11:00~12:15\n2. 장소: ZOOM(링크 추후공지)\n3. 발표인원: 2명(석사 1명, 박사 1명)\n4. 참가희망: 구글폼 링크 신청\nhttps://docs.google.com/forms/d/e/1FAIpQLSdXOqFgJ452_eTwTU_uK6BVHUNzApPlH0Bvr442vNtP_zSjvw/viewform?usp=header\n* 참가 신청은 4월 18일(금) 오전12:00 까지\n제출 부탁드리겠습니다.\n문의사항 있으시면 연락주십시오. 감사합니다.\n문의사항: 장정원\n2025-01 논문 프로포절.jpg", "images": ["./data/images/62989020-8c0f-4592-b0a3-fb8e4229b507.png"], "attachments": [{"name": "2025-01 논문 프로포절.jpg", "url": "https://home.knu.ac.kr/HOME/bbs/bbs_download.php?mv_data=aWR4PTEyOTUmc3RhcnRQYWdlPTcwJmxpc3RObz03NDUmdGFibGU9ZXhfYmJzX2RhdGFfZWR1Jm5hdl9jb2RlPWVkdTE2MjIxODE1MjEmc2l0ZV9jb2RlPWVkdSZjb2RlPVp3S0pYZk5pZW96byZzZWFyY2hfaXRlbT0mc2VhcmNoX29yZGVyPSZvcmRlcl9saXN0PSZsaXN0X3NjYWxlPQ==&download=h&seq=0"}]}
{"dept": "교육학과", "detail": "대학원", "title": "◈ 2025학년도 대학원생 학술연구지원사업 계획 안내", "date": "2025-04-14", "url": "https://home.knu.ac.kr/HOME/edu/sub.htm?mode=view&mv_data=aWR4PTEyOTImc3RhcnRQYWdlPTcwJmxpc3RObz03NDQmdGFibGU9ZXhfYmJzX2RhdGFfZWR1Jm5hdl9jb2RlPWVkdTE2MjIxODE1MjEmY29kZT1ad0tKWGZOaWVvem8mc2VhcmNoX2l0ZW09JnNlYXJjaF9vcmRlcj0mb3JkZXJfbGlzdD0mbGlzdF9zY2FsZT0mdmlld19sZXZlbD0mdmlld19jYXRlPSZ2aWV3X2NhdGUyPQ==", "content": "◈ 2025학년도 대학원생 학술연구지원사업 계획 안내\n등록일\n2025-04-14\n작성자\n교육학과\n조회수\n348\n「\n2025\n학년도 학술연구\n지원사업 계획\n」\n1.\n사업기간\n:\n2025. 3. 1. ~ 2026. 2. 28.(1\n년\n)\n사업명\n담당자\n대학원생 국내 학술대회 참가 교통비 지원\n학술진흥팀(950-2235)\n대학원생 국제 학술대회 참가 경비 지원\n2.\n지원대상:\nFull-Time (전일제\n)\n석사 및 박사과정 재학생 또는 수료 후 등록생 (수료생 제외)\n3. 신청방법: 신청서 및 관련 증빙 서류 지참하여 학과 사무실로 제출\n(원본 제출 필수)\n4. 매월 15일까지 제출한 서류에 한해 익월 초 지출 처리\n5. 세부사항 참고\n[서식2] 2025학년도 대학원생 국내 학회참석 교통비 지원 신청서.hwp\n[서식3] 2025학년도 대학원생 국제학술대회 참가경비 지원 신청 및 결과보고서.hwp", "images": ["./data/images/c56dceb7-aa99-48bb-86c3-15b05843208f.png"], "attachments": [{"name": "[서식2] 2025학년도 대학원생 국내 학회참석 교통비 지원 신청서.hwp", "url": "https://home.knu.ac.kr/HOME/bbs/bbs_download.php?mv_data=aWR4PTEyOTImc3RhcnRQYWdlPTcwJmxpc3RObz03NDQmdGFibGU9ZXhfYmJzX2RhdGFfZWR1Jm5hdl9jb2RlPWVkdTE2MjIxODE1MjEmc2l0ZV9jb2RlPWVkdSZjb2RlPVp3S0pYZk5pZW96byZzZWFyY2hfaXRlbT0mc2VhcmNoX29yZGVyPSZvcmRlcl9saXN0PSZsaXN0X3NjYWxlPQ==&download=h&seq=0"}, {"name": "[서식3] 2025학년도 대학원생 국제학술대회 참가경비 지원 신청 및 결과보고서.hwp", "url": "https://home.knu.ac.kr/HOME/bbs/bbs_download.php?mv_data=aWR4PTEyOTImc3RhcnRQYWdlPTcwJmxpc3RObz03NDQmdGFibGU9ZXhfYmJzX2RhdGFfZWR1Jm5hdl9jb2RlPWVkdTE2MjIxODE1MjEmc2l0ZV9jb2RlPWVkdSZjb2RlPVp3S0pYZk5pZW96byZzZWFyY2hfaXRlbT0mc2VhcmNoX29yZGVyPSZvcmRlcl9saXN0PSZsaXN0X3NjYWxlPQ==&download=h&seq=1"}]}
{"dept": "교육학과", "detail": "대학원", "title": "* 2025학년도 1학기 대학원 학위논문 심사료 납부", "date": "2025-04-08", "url": "https://home.knu.ac.kr/HOME/edu/sub.htm?mode=view&mv_data=aWR4PTEyODcmc3RhcnRQYWdlPTcwJmxpc3RObz03NDMmdGFibGU9ZXhfYmJzX2RhdGFfZWR1Jm5hdl9jb2RlPWVkdTE2MjIxODE1MjEmY29kZT1ad0tKWGZOaWVvem8mc2VhcmNoX2l0ZW09JnNlYXJjaF9vcmRlcj0mb3JkZXJfbGlzdD0mbGlzdF9zY2FsZT0mdmlld19sZXZlbD0mdmlld19jYXRlPSZ2aWV3X2NhdGUyPQ==", "content": "* 2025학년도 1학기 대학원 학위논문 심사료 납부\n등록일\n2025-04-08\n작성자\n교육학과\n조회수\n109\n2025학년도 1학기 대학원 학위논문 제출예정자는 학위논문 심사료 납부기간에 빠짐없이 납부하여 주시기 바랍니다.\n가. 납부기간:\n2025. 4. 16.(수) 09:00~4. 17.(목) 16:00 [2일]\n(마감시간 종료 후 시스템 폐쇄로 납부 불가)\n(고지서는 납부기간 중 본교 홈페이지 공지사항에서 출력 가능함)\n나. 납부방법: 개인별 가상계좌 입금\n다. 심 사 료:\n석사 100,000원\n,\n박사 300,000원\n라. 문\n의전화\n- 대학원 학위논문 심사 전반: 학사과 053-950-2058\n- 등록금 납부 관련: 재무과 053-950-2623\n- 고지서출력 및 납부확인 등 등록시스템 관련: 정보화본부 053-950-8644", "images": [], "attachments": []}
{"dept": "교육학과", "detail": "대학원", "title": "교육방법(교육공학)전공 석사 및 박사 학위논문 공개발표 일정 및 장소 안내", "date": "2025-04-03", "url": "https://home.knu.ac.kr/HOME/edu/sub.htm?mode=view&mv_data=aWR4PTEyODUmc3RhcnRQYWdlPTcwJmxpc3RObz03NDImdGFibGU9ZXhfYmJzX2RhdGFfZWR1Jm5hdl9jb2RlPWVkdTE2MjIxODE1MjEmY29kZT1ad0tKWGZOaWVvem8mc2VhcmNoX2l0ZW09JnNlYXJjaF9vcmRlcj0mb3JkZXJfbGlzdD0mbGlzdF9zY2FsZT0mdmlld19sZXZlbD0mdmlld19jYXRlPSZ2aWV3X2NhdGUyPQ==", "content": "교육방법(교육공학)전공 석사 및 박사 학위논문 공개발표 일정 및 장소 안내\n등록일\n2025-04-03\n작성자\n교육학과\n조회수\n182\n대학원 교육학과 교육방법전공 및 교육대학원 교육공학전공\n석사 및 박사 학위논문 공개발표를 다음과 같이 개최하고자 합니다.\n◆ 다 음 ◆\n가. 발표일시 :\n2025. 5. 3.(토)\n(세부일정은 지도교수님께 문의)\n나. 발표장소 :\n사범대학 305호\n다. 발표순서\n(1) 석사 (오전)\n1. 김혜리\n외적 인출과 내적 인출의 파지 효과 비교\n2. 이지원\n성적예측과 학습전략 착각현상이 학업성취에 미치는 영향\n3. 박민정\n성취목표지향유형과 애매모호내성에 따른 학습전략 사용과 효과성 판단의 차이 분석\n4. 김혜림\n특성화고 학생의 학습전략의 실제 사용정도와 효과성 정도 판단의 차이 분석\n(2) 박사 (오후)\n1.\n이유락\n애매모호내성 유형에 따른 착각현상 분석\n2. 구윤정\n간호대학생의 학습판단 및 학습전략에서의 착각현상, 메타인지 및 학업적 자기효능감이 학업성취도에 미치는 영향\n3. 홍선연\n간호대학생의 학습전략착각, 학습판단착각, 메타인지, 자기주도적학습이 학업성취도에 미치는 영향: 한국대학생과 중국대학생 대상\n4. 김남희\n자아 평가 유형에 따른 학습판단과 대인관계 반응지수 및 성취목표지향유형의 차이 분석", "images": [], "attachments": []}
{"dept": "교육학과", "detail": "대학원", "title": "* 2025학년도 1학기 대학원 논문 공개발표 일정 안내", "date": "2025-04-03", "url": "https://home.knu.ac.kr/HOME/edu/sub.htm?mode=view&mv_data=aWR4PTEyODQmc3RhcnRQYWdlPTgwJmxpc3RObz03NDEmdGFibGU9ZXhfYmJzX2RhdGFfZWR1Jm5hdl9jb2RlPWVkdTE2MjIxODE1MjEmY29kZT1ad0tKWGZOaWVvem8mc2VhcmNoX2l0ZW09JnNlYXJjaF9vcmRlcj0mb3JkZXJfbGlzdD0mbGlzdF9zY2FsZT0mdmlld19sZXZlbD0mdmlld19jYXRlPSZ2aWV3X2NhdGUyPQ==", "content": "* 2025학년도 1학기 대학원 논문 공개발표 일정 안내\n등록일\n2025-04-03\n작성자\n교육학과\n조회수\n184\n2025학년도 1학기 일반대학원 및 교육대학원 학위논문 공개발표를 다음과 같이 개최하고자 합니다\n.\n1. 일시 :\n2025. 5. 2.(금)\n,\n전공별 진행\n2. 안내사항\n:\n전공에 따라 일정이 변경\n될 수 있으니 반드시\n지도교수님과 상의\n하셔서 공개발표 진행하시기 바랍니다.\n3.\n발표자\n(\n논문 제목\n)\n[일반대학원 석사]\n1. 윤승현\n교육철학과 교육실천, 그리고 실천들 -카 허스트 논쟁에 대한 고찰을 통해-\n2. 신지은\n경계선 지능 위험군 아동의 인지발달편차와 변동성에 관한 연구 -상담적 개입을 중심으로-\n3. 곽나림\n공과대학 이러닝 수강생의 교수실재감과 학업적 자기효능감의 영향관계에서 학습몰입의 매개효과\n4. 니메샤\nA Comparative Study of Narrative -Based Approaches in Grade 5 English Education: Analysing the Aspect of Communicative Dialogue in South Korea and Sri Lanka\n5. 촤이쩌\n백워드 설계 모형에 기반한 중국 중학교 수학과 단원 개발\n6. 김혜리\n외적 인출과 내적 인출의 파지 효과 비교\n7. 정은지\n집단상담 프로그램이 청소년의 자기통제력 증진에 미치는 효과에 대한 메타분석\n8. 허수빈\n초기 성인기 사회불안 조절을 위한 심리치료 프로그램 효과 메타분석\n9. 이재효\n무지와 지성의 평등에 관한 랑시에르의 사유: 『무지한 스승』의 독해를 중심으로\n10. 김미정\n부모의 자율성 지지와 심리적 통제, 학습동기와 친사회적 동기, 학습 및 또래관계의 구조적 관계\n11. 조인혜\n중학생의 자율동기, 통제동기와 학업열의, 학업소진의 관계:조화열정과 강박열정의 매개효과\n12. 이지원\n성적예측과 학습전략 착각현상이 학업성취에 미치는 영향\n13. 하가나\n내러티브에 기반한 노인학습영량 개발을 위한  교육과정 연구\n14. 박민정\n성취목표지향유형과 애매모호내성에 따른 학습전략 사용과 효과성 판단의 차이 분석\n15. 안다인\n글로벌 창의인재 양성을 위한 프로그램 개발의 전환: 백워드 설계를 중심으로\n16. 서민정\n대학교수법 혁신사례 탐구: SOLO분류학과 IB교육을 중심으로\n[일반대학원 박사]\n1. 이유락\n애매모호내성 유형에 따른 착각현상 분석\n2. 박나경\n상황적 기대 가치 비용에 따른 중학생의 수학 학업행동 변화양상: 잠재전이분석의 적용\n3. 박현인\n율곡의 정심론 연구\n4. 김미준\n다산 정약용의 두 아들에 대한 교육 연구\n5. 관티엔\n맹자의 교육사상이 현대 교육에\n미치는 가치에 관한 연구\n- 중국대학생 인격교육을 중심으로-\n6. 조소영\n청소년기 자녀를 둔 부모의 정신화 척도 개발 및 타당화\n7. 구윤정\n간호대학생의 학습판단 및 학습전략에서의 착각현상, 메타인지 및 학업적 자기효능감이 학업성취도에 미치는 영향\n8. 홍선연\n간호대학생의 학습전략착각, 학습판단착각, 메타인지, 자기주도적학습이 학업성취도에 미치는 영향: 한국대학생과 중국대학생 대상\n9. 이혜령\n교장 리더십과 교사 자율성, 교사 갈등, 교사 소진의 구조적 관계\n10. 전순정\n내러티브를 활용한 개념기반 교육과정 적용 방안: 2022 개정 교육과정 중등 국어과를 중심으로\n11. 김남희\n자아 평가 유형에 따른 학습판단과 대인관계 반응지수 및 성취목표지향유형의 차이 분석\n12. 왕영\n다문화 수업 실천을 위한 백워드 설계와 내러티브 통합 기반 한국어 교육과정 단원 개발 연구\n13. 조웅민\n내러티브 페다고지 기반 교과 통합 교육과정 모형 개발\n[교육대학원]\n1. 황예진\n느린학습자의 이해: 중학생의 학습상담 및 사회성 개입을 중심으로\n2. 민채린\n아동 대상 감사 증진 집단상담 프로그램 효과 메타분석\n3. 김혜림\n특성화고 학생의 학습전략의 실제 사용정도와 효과성 정도 판단의 차이 분석\n4. 김바다\n중등단계 직업교육에 IBCP 적용 가능성 연구\n5. 심명주\nKolb의 경험학습 모형을 적용한 학습동아리 구성원의 경험학습 과정 탐색: 대구 역사 탐방 학습동아리 대상으로\n6. 조은아\n특수교사의 직무자원과 직무소진의 관계에서 직무열의의 매개효과\n7. 장명옥\n경북의성미래교육지구 마을교육활동가의 역량 모델 탐색\n※\n발표하시는 분들께\n-\n발표시간은 석사\n15\n분\n,\n박사\n20\n분 이내로 하시기 바랍니다\n.\n-\n석사\n,\n박사 모두 참석하시는 교수님들께는 논문을 드릴 수 있도록 준비하여 주시기 바랍니다\n.\n-\n발표를 들으러 오는 다른 학생들을 위한 논문자료도 준비해주시면 좋을 것 같습니다\n.", "images": [], "attachments": []}
{"dept": "교육학과", "detail": "대학원", "title": "* 2025학년도 1학기 일대원 및 교대원 심사용 학위논문 접수 및 논문 심사료 납부 안내", "date": "2025-03-26", "url": "https://home.knu.ac.kr/HOME/edu/sub.htm?mode=view&mv_data=aWR4PTEyNzgmc3RhcnRQYWdlPTgwJmxpc3RObz03NDAmdGFibGU9ZXhfYmJzX2RhdGFfZWR1Jm5hdl9jb2RlPWVkdTE2MjIxODE1MjEmY29kZT1ad0tKWGZOaWVvem8mc2VhcmNoX2l0ZW09JnNlYXJjaF9vcmRlcj0mb3JkZXJfbGlzdD0mbGlzdF9zY2FsZT0mdmlld19sZXZlbD0mdmlld19jYXRlPSZ2aWV3X2NhdGUyPQ==", "content": "* 2025학년도 1학기 일대원 및 교대원 심사용 학위논문 접수 및 논문 심사료 납부 안내\n등록일\n2025-03-26\n작성자\n교육학과\n조회수\n238\n「\n2025\n학년도\n1\n학기 대학원 심사용 학위논문 접수\n」\n일정 안내\n1.\n심사용 학위논문 제출\n가\n.\n제출기간\n:\n2024. 4. 9.(수) 9:00 ~ 4. 11.(금\n) 17:50\n까지\n(\n※\n기\n간 엄수\n)\n(\n※\n12:00~13:00\n점심시간 제외\n)\n나\n.\n제출장소\n:\n교육학과 사무실\n(\n사범대학\n823\n호\n)\n다\n.\n제출서류\n(\n아래\n(1)~(4)\n의 서류 모두 제출\n)\n※\n일반대학원과 교육대학원 서식이 다르니 유의하여 작성\n(1)\n연구윤리준수확인서\n1\n부\n(2)\n지도교수추천서\n1\n부\n(3)\n심사용 학위논문\n:\n석사\n3\n부\n,\n박사\n5\n부\n​\n(4)\n논문표절예방프로그램 결과물\n(\n전문\n제출\n):\n석사\n3\n부\n,\n박사\n5\n부\n라\n.\n유의사항\n(1)\n심사용 학위논문\n(서식, 규격 등)\n및 논문표절예방프로그램 결과물(표절률 등)은 반드시\n지도교수의 지도를 받은 후 제출\n(2)\n심사용 학위논문\n은 심사하기에 적합한 형태로\n제본하여 제출\n(\n떡제본\n,\n스프링 등 무관\n)\n(3)\n논문표절예방프로그램\n(Turnitin)\n결과물\n은 요약이 아닌\n전문\n(\n全文\n)\n을 출력하여 제출\n(\n제본 불필요\n)\n2.\n유의사항\n가.\n2024\n학년도\n2\n학기 판정유보\n(\n심사연기\n)\n자\n:\n지도교수의 지도를 받아 수정 및 보완한 논문을\n심사위원에게 직접 제출\n할 것\n(학과 사무실 제출 서류 없음)\n나.\n2016~2024\n학년도 입학생 중 금번학기 논문제출 예정자는\n2025. 4. 11.(금\n)\n까지 연구윤리교육을 이수하여야 논문제출 자격이 있는 것으로 인정함\n(2015\n학년도 이전 입학생\n:\n연구윤리교육 이수 의무 아니며\n'\n권장'임\n)\n3.\n논문심사료 납부\n가\n.\n심 사 료\n:\n석사\n10\n만원\n,\n박사\n30\n만원\n나\n.\n납부기간\n:\n2025. 4. 16.(수) ~ 4. 17.(목) 16:00\n까지\n[\n은행 업무시간 준\n수\n]\n다\n.\n납부방법\n:\n납부기간 중\n통합정보시스템에서\n본인의 납부고지서 출력 후 지정된 가상계좌로 납부\n※\n2024\n학년도\n2\n학기 논문판정유보자 및 완성논문제출연기자는 납부하지 않아도 됨\n4.\n「\n논문표절예방프로그램 검증 결과물 제출 및 심사 의무화\n」\n관련\n1)\n표절예방 검증 프로그램\n:\n도서관 홈페이지에 게재된\nTurnitin(\n턴잇인\n)\n에 검증\n2)\n제출대상\n:\n석\n·\n박사 학위논문 제출예정자 전체\n(\n일반\n,\n전문\n,\n특수대학원 포함\n)\n3)\n제출자료\n:\n논문표절예방프로그램 결과물\n(\nTurnitin\n보고서 전체를 출력\n할 것\n) (\n석사\n3\n부\n,\n박사\n5\n부\n) (\n제본 불필요\n)\n4)\n제출시기\n: 2025\n학년도 1\n학기 심사용 논문 접수기간\n(4. 9.~4. 11.)\n5)\n2024학년도 2학기 판정유보자: 학과 사무실로 1부 제출\n▶\nTurnitin\n프로그램은 표절을 판가름 해주는 것이 아니며 본문과의 유사한 문장으로 체크된 객관적인 출처 및 데이터를 제시하여 표절이 의심되는지의 여부를 알려주기 때문에 체크된 부분은 반드시 심사위원의 심사를 통해 표절 여부를 판단함\n▶\nTurnitin\n이용방법\n□\n경북대학교 도서관 홈페이지 접속\n(\n상단메뉴에서 연구학습지원\n→\n표절예방\n/\n연구윤리 선택\n)\n-\n논문 및 과제에 대한 표절여부를 확인하고 관리하는 서비스\n-\n전세계\nWeb Page,\n학술저널\nArticle, turnitin\n에 저장된 논문과 과제와 실시간 비교\n-\n반드시\n1\n인\n1\n계정으로 이용\n, 1\n인\n2\n계정으로 이용시 유사율 높아짐\n-\n이메일 변경은 새로운 계정 생성하지 말고 기존 이메일로 로그인 후 사용자정보에서 변경\n-\n제출파일 유형\n: HWP, DOC, Text PDF, HTML, TXT, WordPerfect\n등 일반\nText\n□\n문의\n:\n중앙도서관\n5\n층 자료수집팀\n☎\n053-950-4624\n첨부파일중 PDF미리보기\n파일 열람을 위해서는 아크로뱃 리더 설치가 필요합니다. 아래 링크를 클릭하여 리더를 다운로드 받으세요.\n첨부파일중 PDF미리보기\n파일 열람을 위해서는 아크로뱃 리더 설치가 필요합니다. 아래 링크를 클릭하여 리더를 다운로드 받으세요.\n[붙임1] (일반대학원) 연구윤리준수확인서 및 지도교수추천서(서식).hwp\n[붙임2] (교육대학원) 연구윤리준수확인서 및 지도교수추천서(서식).hwp\n[붙임3-1] 논문표절예방프로그램(Turnitin)이용매뉴얼(국문).pdf\n[붙임3-2] (For Student) Turnitin Manual(Eng).pdf\n[붙임4] 학위논문 규격예시(2025.1학기).zip", "images": ["http://www.adobe.com/images/shared/download_buttons/get_adobe_reader.png"], "attachments": [{"name": "[붙임1] (일반대학원) 연구윤리준수확인서 및 지도교수추천서(서식).hwp", "url": "https://home.knu.ac.kr/HOME/bbs/bbs_download.php?mv_data=aWR4PTEyNzgmc3RhcnRQYWdlPTgwJmxpc3RObz03NDAmdGFibGU9ZXhfYmJzX2RhdGFfZWR1Jm5hdl9jb2RlPWVkdTE2MjIxODE1MjEmc2l0ZV9jb2RlPWVkdSZjb2RlPVp3S0pYZk5pZW96byZzZWFyY2hfaXRlbT0mc2VhcmNoX29yZGVyPSZvcmRlcl9saXN0PSZsaXN0X3NjYWxlPQ==&download=h&seq=0"}, {"name": "[붙임2] (교육대학원) 연구윤리준수확인서 및 지도교수추천서(서식).hwp", "url": "https://home.knu.ac.kr/HOME/bbs/bbs_download.php?mv_data=aWR4PTEyNzgmc3RhcnRQYWdlPTgwJmxpc3RObz03NDAmdGFibGU9ZXhfYmJzX2RhdGFfZWR1Jm5hdl9jb2RlPWVkdTE2MjIxODE1MjEmc2l0ZV9jb2RlPWVkdSZjb2RlPVp3S0pYZk5pZW96byZzZWFyY2hfaXRlbT0mc2VhcmNoX29yZGVyPSZvcmRlcl9saXN0PSZsaXN0X3NjYWxlPQ==&download=h&seq=1"}, {"name": "[붙임3-1] 논문표절예방프로그램(Turnitin)이용매뉴얼(국문).pdf", "url": "https://home.knu.ac.kr/HOME/bbs/bbs_download.php?mv_data=aWR4PTEyNzgmc3RhcnRQYWdlPTgwJmxpc3RObz03NDAmdGFibGU9ZXhfYmJzX2RhdGFfZWR1Jm5hdl9jb2RlPWVkdTE2MjIxODE1MjEmc2l0ZV9jb2RlPWVkdSZjb2RlPVp3S0pYZk5pZW96byZzZWFyY2hfaXRlbT0mc2VhcmNoX29yZGVyPSZvcmRlcl9saXN0PSZsaXN0X3NjYWxlPQ==&download=h&seq=2"}, {"name": "[붙임3-2] (For Student) Turnitin Manual(Eng).pdf", "url": "https://home.knu.ac.kr/HOME/bbs/bbs_download.php?mv_data=aWR4PTEyNzgmc3RhcnRQYWdlPTgwJmxpc3RObz03NDAmdGFibGU9ZXhfYmJzX2RhdGFfZWR1Jm5hdl9jb2RlPWVkdTE2MjIxODE1MjEmc2l0ZV9jb2RlPWVkdSZjb2RlPVp3S0pYZk5pZW96byZzZWFyY2hfaXRlbT0mc2VhcmNoX29yZGVyPSZvcmRlcl9saXN0PSZsaXN0X3NjYWxlPQ==&download=h&seq=3"}, {"name": "[붙임4] 학위논문 규격예시(2025.1학기).zip", "url": "https://home.knu.ac.kr/HOME/bbs/bbs_download.php?mv_data=aWR4PTEyNzgmc3RhcnRQYWdlPTgwJmxpc3RObz03NDAmdGFibGU9ZXhfYmJzX2RhdGFfZWR1Jm5hdl9jb2RlPWVkdTE2MjIxODE1MjEmc2l0ZV9jb2RlPWVkdSZjb2RlPVp3S0pYZk5pZW96byZzZWFyY2hfaXRlbT0mc2VhcmNoX29yZGVyPSZvcmRlcl9saXN0PSZsaXN0X3NjYWxlPQ==&download=h&seq=4"}]}
{"dept": "교육학과", "detail": "대학원", "title": "(일반·전문·특수)대학원 학점 인정 신청 관련 안내", "date": "2025-03-17", "url": "https://home.knu.ac.kr/HOME/edu/sub.htm?mode=view&mv_data=aWR4PTEyNzEmc3RhcnRQYWdlPTgwJmxpc3RObz03MzkmdGFibGU9ZXhfYmJzX2RhdGFfZWR1Jm5hdl9jb2RlPWVkdTE2MjIxODE1MjEmY29kZT1ad0tKWGZOaWVvem8mc2VhcmNoX2l0ZW09JnNlYXJjaF9vcmRlcj0mb3JkZXJfbGlzdD0mbGlzdF9zY2FsZT0mdmlld19sZXZlbD0mdmlld19jYXRlPSZ2aWV3X2NhdGUyPQ==", "content": "(일반·전문·특수)대학원 학점 인정 신청 관련 안내\n등록일\n2025-03-17\n작성자\n교육학과\n조회수\n151\n(일반‧전문‧특수)대학원 학생의 학점 인정 신청과 관련하여 다음과 같이 안내드립니다.\n해당 학생들은 수료(졸업) 사정 전에 신청하여 주시기 바랍니다.\n가. 입학 이전 이수학점 인정 신청[붙임 1]\n1)\n학사과정 재학 시\n본교 대학원에 개설된 교과목을 이수한 경우:\n최대 9학점\n※ 단, 학부 졸업 학점을 초과하여 이수한 학점에 대하여 인정\n2) 입학 이전\n동일한 과정으로\n국내‧외 대학원에서 개설된 교과목을 이수한 경우:\n최대 석사과정 9학점\n,\n박사 및 석‧박사통합과정 12학점\n3) 승인 완료 시 성적증명서에 교과목명, 학점, 평점 등록\n※ 본교 교과목 중 인정 교과목은 대학원에서 이수 불가(재이수 처리됨)\n나. 석사과정 초과 이수학점 인정 신청[붙임 2]\n1)\n일반대학원 석사과정 수료학점(24)\n을 초과하여 이수한 경우:\n최대 6학점\n※ 단,\n수료학점 중 ‘학위논문 및 연구윤리’ 교과목은 제외\n하고 24학점을 초과하여야 함\n2) 승인 완료 시 성적증명서에 (교과목명) 석사과정 초과 인정학점 / (교과목구분) 전공 / (학점) n / (등급) S으로 등록됨 (평점 없음)\n다. 신청 방법\n: 신청서 및 성적증명서를 학과 사무실로 제출\n라. 신청 시기\n: 상시 접수\n1) 반드시\n수료(졸업)사정 전\n에 신청 완료\n2) 수료 또는 졸업 결정 후 신청 시 성적 반영이 불가함\n입학 이전 이수학점 인정 신청서(서식).hwp\n석사과정 초과 이수학점 인정 신청서(서식).hwp", "images": [], "attachments": [{"name": "입학 이전 이수학점 인정 신청서(서식).hwp", "url": "https://home.knu.ac.kr/HOME/bbs/bbs_download.php?mv_data=aWR4PTEyNzEmc3RhcnRQYWdlPTgwJmxpc3RObz03MzkmdGFibGU9ZXhfYmJzX2RhdGFfZWR1Jm5hdl9jb2RlPWVkdTE2MjIxODE1MjEmc2l0ZV9jb2RlPWVkdSZjb2RlPVp3S0pYZk5pZW96byZzZWFyY2hfaXRlbT0mc2VhcmNoX29yZGVyPSZvcmRlcl9saXN0PSZsaXN0X3NjYWxlPQ==&download=h&seq=0"}, {"name": "석사과정 초과 이수학점 인정 신청서(서식).hwp", "url": "https://home.knu.ac.kr/HOME/bbs/bbs_download.php?mv_data=aWR4PTEyNzEmc3RhcnRQYWdlPTgwJmxpc3RObz03MzkmdGFibGU9ZXhfYmJzX2RhdGFfZWR1Jm5hdl9jb2RlPWVkdTE2MjIxODE1MjEmc2l0ZV9jb2RlPWVkdSZjb2RlPVp3S0pYZk5pZW96byZzZWFyY2hfaXRlbT0mc2VhcmNoX29yZGVyPSZvcmRlcl9saXN0PSZsaXN0X3NjYWxlPQ==&download=h&seq=1"}]}
{"dept": "교육학과", "detail": "대학원", "title": "* 2025학년도 1학기 대학원 종합시험 결과 안내", "date": "2025-03-13", "url": "https://home.knu.ac.kr/HOME/edu/sub.htm?mode=view&mv_data=aWR4PTEyNzAmc3RhcnRQYWdlPTgwJmxpc3RObz03MzgmdGFibGU9ZXhfYmJzX2RhdGFfZWR1Jm5hdl9jb2RlPWVkdTE2MjIxODE1MjEmY29kZT1ad0tKWGZOaWVvem8mc2VhcmNoX2l0ZW09JnNlYXJjaF9vcmRlcj0mb3JkZXJfbGlzdD0mbGlzdF9zY2FsZT0mdmlld19sZXZlbD0mdmlld19jYXRlPSZ2aWV3X2NhdGUyPQ==", "content": "* 2025학년도 1학기 대학원 종합시험 결과 안내\n등록일\n2025-03-13\n작성자\n교육학과\n조회수\n209\n2025학년도 1학기 대학원 종합시험 결과를 붙임과 같이 안내해 드립니다.\n시트가 2개로 나뉘어 있으니 확인 시 유의 바랍니다.\n점수는 공개하지 않습니다.\n※ 불합격하신 과목은 반드시\n동일 과목으로 재응시\n하셔야 합니다.\n(공지용) 2025학년도 1학기 교육대학원 종합시험 결과.xls\n(공지용) 2025학년도 1학기 일반대학원 종합시험 결과(수정).xls", "images": [], "attachments": [{"name": "(공지용) 2025학년도 1학기 교육대학원 종합시험 결과.xls", "url": "https://home.knu.ac.kr/HOME/bbs/bbs_download.php?mv_data=aWR4PTEyNzAmc3RhcnRQYWdlPTgwJmxpc3RObz03MzgmdGFibGU9ZXhfYmJzX2RhdGFfZWR1Jm5hdl9jb2RlPWVkdTE2MjIxODE1MjEmc2l0ZV9jb2RlPWVkdSZjb2RlPVp3S0pYZk5pZW96byZzZWFyY2hfaXRlbT0mc2VhcmNoX29yZGVyPSZvcmRlcl9saXN0PSZsaXN0X3NjYWxlPQ==&download=h&seq=0"}, {"name": "(공지용) 2025학년도 1학기 일반대학원 종합시험 결과(수정).xls", "url": "https://home.knu.ac.kr/HOME/bbs/bbs_download.php?mv_data=aWR4PTEyNzAmc3RhcnRQYWdlPTgwJmxpc3RObz03MzgmdGFibGU9ZXhfYmJzX2RhdGFfZWR1Jm5hdl9jb2RlPWVkdTE2MjIxODE1MjEmc2l0ZV9jb2RlPWVkdSZjb2RlPVp3S0pYZk5pZW96byZzZWFyY2hfaXRlbT0mc2VhcmNoX29yZGVyPSZvcmRlcl9saXN0PSZsaXN0X3NjYWxlPQ==&download=h&seq=1"}]}
{"dept": "교육학과", "detail": "대학원", "title": "* 2025학년도 1학기 대학원생 연구윤리교육 추가 수강신청 안내", "date": "2025-03-13", "url": "https://home.knu.ac.kr/HOME/edu/sub.htm?mode=view&mv_data=aWR4PTEyNjkmc3RhcnRQYWdlPTgwJmxpc3RObz03MzcmdGFibGU9ZXhfYmJzX2RhdGFfZWR1Jm5hdl9jb2RlPWVkdTE2MjIxODE1MjEmY29kZT1ad0tKWGZOaWVvem8mc2VhcmNoX2l0ZW09JnNlYXJjaF9vcmRlcj0mb3JkZXJfbGlzdD0mbGlzdF9zY2FsZT0mdmlld19sZXZlbD0mdmlld19jYXRlPSZ2aWV3X2NhdGUyPQ==", "content": "* 2025학년도 1학기 대학원생 연구윤리교육 추가 수강신청 안내\n등록일\n2025-03-13\n작성자\n교육학과\n조회수\n97\n대학원생 학위논문 제출 자격 요건인 「2025학년도 1학기 대학원생 연구윤리교육」 시행을 위한\n​추가 수강신청\n​ 일정을 알려드립니다.\n이번 학기 학위논문 제출예정자 등 해당 학생들은 빠짐없이 교육을 이수하여 주시기 바랍니다.\n가. 교육내용: 「대학원생을 위한 연구윤리」온라인 강의 수강\n(4과목 중\n택1\n하여 수강)\n○ 대학원생을 위한 연구윤리(인문사회)\n○ 대학원생을 위한 연구윤리(이공)\n○ Research ehtics for graduate students(Humanities and Social Sciences)\n○ Research ehtics for graduate students(Science and Engineering)\n나.\n수강신청:\n2025. 3. 21.(금) ~ 3. 25.(화)\n다\n.\n교육대상\n(특수대학원 포함, 무논문 제외)\n1) 2025학년도 대학원 입학생\n2) 2016~2024학년도 입학생 중 미이수자\n3) 2015학년도 이전 입학생은 이수 '권장'\n※ (유의사항)\n연구윤리교육\n미\n이수자 중\n이번 학기 학위논문 제출예정자는 2025. 4. 11.(금)까지 반드시 이수\n하여야 하며,\n​\n이전 연구윤리교육 수강신청 후 미이수자 또한 재수강 신청 필요\n라. 수강신청방법:\n경북대 통합정보시스템(\nhttps://knuin.knu.ac.kr/)에서\n수강 신청\n○ 통합정보시스템 좌측 메뉴의 「학사행정」→「졸업」→「졸업요건(대학원)」→「연구윤리교육신청」메뉴 선택\n○ 연구윤리교육신청 메뉴에서 아래의 4과목 중 한과목을 선택 후 (오른쪽) 「신청」버튼 클릭하여 수강신청 완료\n마. 교육 이수\n가) 학습관리시스템에 탑재된 연구윤리 강의 수강\n○ 경북대학교 포털사이트 접속하여 상단 메뉴 중 학습관리시스템 클릭, 또는 직접 주소(\nhttps://lms1.knu.ac.kr/)를\n입력하여 접속 후 로그인(ID와 PW는 통합정보시스템과 동일)\n○ 마이페이지 → 수강과목 → 강의명 클릭\n나)\n교육기간: 2025. 3. 27.(목) ~ 6. 23.(월)\n다) 수료기준: 진도 100%\n※ 수료기준 충족(전체 교육 이수완료)시 연구윤리교육 이수 인정\n※ 이전에 연구윤리교육 수강 신청 후\n미이수\n하였을 경우, 이번 학기에\n다시 수강신청\n후 이수하여야 함\n라) 이수 확인: 교육기간 종료 후 2025. 6월말 경 확인가능\n※ 교육 이수 후 통합포털시스템 → 통합정보시스템 → 학적정보관리 → 학적기본사항 → 졸업 → 졸업자격인정에서 이수여부 확인\n바. 문의\n- 학위논문 제출자격 관련 연구윤리교육 이수 전반: 학사과 (☏053-950-2058)\n- 통합정보시스템 수강 신청 등 전산 장애:\n정보화본부 (☏053-950-8649)\n- 학습관리시스템(LMS) 강좌 수강 등 전산 장애:\n정보화본부 (☏053-950-8705)\n아울러 본 연구윤리교육은\n2016학년도\n대학원 석․박사(통합)과정 입학생부터 학위논문 제출 자격요건으로\n의무적으로 이수\n해야 함을 알려드립니다.\n(통합정보시스템)연구윤리교육 신청 프로그램  사용설명서(학생용).hwp", "images": [], "attachments": [{"name": "(통합정보시스템)연구윤리교육 신청 프로그램  사용설명서(학생용).hwp", "url": "https://home.knu.ac.kr/HOME/bbs/bbs_download.php?mv_data=aWR4PTEyNjkmc3RhcnRQYWdlPTgwJmxpc3RObz03MzcmdGFibGU9ZXhfYmJzX2RhdGFfZWR1Jm5hdl9jb2RlPWVkdTE2MjIxODE1MjEmc2l0ZV9jb2RlPWVkdSZjb2RlPVp3S0pYZk5pZW96byZzZWFyY2hfaXRlbT0mc2VhcmNoX29yZGVyPSZvcmRlcl9saXN0PSZsaXN0X3NjYWxlPQ==&download=h&seq=0"}]}
{"dept": "교육학과", "detail": "대학원", "title": "* 2025학년도 1학기 대학원 수료생 등록(2차) 안내", "date": "2025-03-13", "url": "https://home.knu.ac.kr/HOME/edu/sub.htm?mode=view&mv_data=aWR4PTEyNjgmc3RhcnRQYWdlPTgwJmxpc3RObz03MzYmdGFibGU9ZXhfYmJzX2RhdGFfZWR1Jm5hdl9jb2RlPWVkdTE2MjIxODE1MjEmY29kZT1ad0tKWGZOaWVvem8mc2VhcmNoX2l0ZW09JnNlYXJjaF9vcmRlcj0mb3JkZXJfbGlzdD0mbGlzdF9zY2FsZT0mdmlld19sZXZlbD0mdmlld19jYXRlPSZ2aWV3X2NhdGUyPQ==", "content": "* 2025학년도 1학기 대학원 수료생 등록(2차) 안내\n등록일\n2025-03-13\n작성자\n교육학과\n조회수\n117\n「2025학년도 1학기 대학원 수료생 등록 계획」을 다음과 같이 알려드리니, 수료생 등록이 필요한 학생은 기한 내 신청 바랍니다.\n가. 신청 대상: 각 대학원 수료생\n※ 1. 2024학년도 2학기에 학위취득을 위한 논문을 제출하고자 하는 자 또는 논문 지도를 받고자 하는 자\n2. 연구 과제 참여로 산학협력단을 통해 인건비를 받고자 하는 자(과제에 따라 수료생 등록 필요 여부 확인 요망)\n◆\n연구 과제 참여로\n산학협력단을 통해 인건비를 받고자 하는 자\n는 과제에 따라 수료생\n등록 여부가 중요함으로\n반드시\n과제 담당자에게 확인 후 수료생 등록 여부 판단\n◆\n2024\n년도\n2\n학기\n수료생\n중\n학위논문심사에서\n“\n판정유보\n”\n및\n“\n완성논문 제출연기\n”\n로 결정된\n자는 수료생 등록을 하지 않아도 논문심사 및 완성논문 제출을 할 수 있음\n⤷\n대학원에서는 수료생 등록을 한 학기 면제해 주지만\n산학협력단을 통해 인건비를 받고자 하는 자\n는 수료생 등록을 해야하는 경우가 있으므로\n반드시 확인 요망\n◆\n2024\n년도\n2\n학기\n재학생\n중\n학위논문심사에서\n“\n판정유보\n”\n및\n“\n완성논문 제출연기\n”\n로 결정된\n자는 이번 학기 수료생 등록을 하여야 함\n나. 신청 방법:\n신청기간 내에 아래의 ①~③을\n★모두 완료\n★\n하여야 함\n①\n차세대 통합정보시스템\n에서 직접 전산 신청 후 신청서 출력\n(차세대 통합정보시스템 > 학사행정 > 졸업 > 졸업요건(대학원) > 수료생 등록신청 에서 신청)\n② 신청서에\n지도교수님 날인\n을 받은 후 학과 사무실로\n대면 제출\n​③ 신청자의 자격을 심사ㆍ확인 후 학과에서 승인\n다. 신청 및 등록 기간\n1) 신청 및 제출 기간: 2025. 3. 18.(화) ~ 3. 19.(수) 17:30\n[2일간] (※ 점심시간 1\n2:00~13:00 제외)\n2) 등록기간: 2025. 3. 27.(목) ~ 3. 28.(금) [2일간]\n(* 고지서:\n납부기간 중 학교 홈페이지 공지사항을 통해 출력 가능)\n라. 유의 사항\n○ 수료생 등록을 한 후 심사용 논문을 제출하지 않는 경우라도 등록금을 환불하지 않으니 등록금을 납부하기 전에 신중히 검토하여 등록\n○\n1차 신청자 중 미납자\n는 2차 신청기간 중\n재신청하지 않아도 2차 납부기간 중 납부 가능\n○ 납부기간 중 학교 홈페이지 공지사항을 통해 출력 가능,\n등록금 환불은 없음\n에 유의\n2025학년도 1학기 대학원 수료생 학위취득을 위한 등록금표.xls\n수료생등록 신청서.hwp", "images": [], "attachments": [{"name": "2025학년도 1학기 대학원 수료생 학위취득을 위한 등록금표.xls", "url": "https://home.knu.ac.kr/HOME/bbs/bbs_download.php?mv_data=aWR4PTEyNjgmc3RhcnRQYWdlPTgwJmxpc3RObz03MzYmdGFibGU9ZXhfYmJzX2RhdGFfZWR1Jm5hdl9jb2RlPWVkdTE2MjIxODE1MjEmc2l0ZV9jb2RlPWVkdSZjb2RlPVp3S0pYZk5pZW96byZzZWFyY2hfaXRlbT0mc2VhcmNoX29yZGVyPSZvcmRlcl9saXN0PSZsaXN0X3NjYWxlPQ==&download=h&seq=0"}, {"name": "수료생등록 신청서.hwp", "url": "https://home.knu.ac.kr/HOME/bbs/bbs_download.php?mv_data=aWR4PTEyNjgmc3RhcnRQYWdlPTgwJmxpc3RObz03MzYmdGFibGU9ZXhfYmJzX2RhdGFfZWR1Jm5hdl9jb2RlPWVkdTE2MjIxODE1MjEmc2l0ZV9jb2RlPWVkdSZjb2RlPVp3S0pYZk5pZW96byZzZWFyY2hfaXRlbT0mc2VhcmNoX29yZGVyPSZvcmRlcl9saXN0PSZsaXN0X3NjYWxlPQ==&download=h&seq=1"}]}
{"dept": "교육학과", "detail": "대학원", "title": "2025학년도 1학기 수강정정 안내", "date": "2025-03-12", "url": "https://home.knu.ac.kr/HOME/edu/sub.htm?mode=view&mv_data=aWR4PTEyNjcmc3RhcnRQYWdlPTgwJmxpc3RObz03MzUmdGFibGU9ZXhfYmJzX2RhdGFfZWR1Jm5hdl9jb2RlPWVkdTE2MjIxODE1MjEmY29kZT1ad0tKWGZOaWVvem8mc2VhcmNoX2l0ZW09JnNlYXJjaF9vcmRlcj0mb3JkZXJfbGlzdD0mbGlzdF9zY2FsZT0mdmlld19sZXZlbD0mdmlld19jYXRlPSZ2aWV3X2NhdGUyPQ==", "content": "2025학년도 1학기 수강정정 안내\n등록일\n2025-03-12\n작성자\n교육학과\n조회수\n45\n첨부파일중 PDF미리보기\n파일 열람을 위해서는 아크로뱃 리더 설치가 필요합니다. 아래 링크를 클릭하여 리더를 다운로드 받으세요.\n2025.1 수강정정 안내(공지용)_1.png\n수강정정 프로그램 사용설명서(학생용).pdf", "images": ["http://www.adobe.com/images/shared/download_buttons/get_adobe_reader.png"], "attachments": [{"name": "2025.1 수강정정 안내(공지용)_1.png", "url": "https://home.knu.ac.kr/HOME/bbs/bbs_download.php?mv_data=aWR4PTEyNjcmc3RhcnRQYWdlPTgwJmxpc3RObz03MzUmdGFibGU9ZXhfYmJzX2RhdGFfZWR1Jm5hdl9jb2RlPWVkdTE2MjIxODE1MjEmc2l0ZV9jb2RlPWVkdSZjb2RlPVp3S0pYZk5pZW96byZzZWFyY2hfaXRlbT0mc2VhcmNoX29yZGVyPSZvcmRlcl9saXN0PSZsaXN0X3NjYWxlPQ==&download=h&seq=0"}, {"name": "수강정정 프로그램 사용설명서(학생용).pdf", "url": "https://home.knu.ac.kr/HOME/bbs/bbs_download.php?mv_data=aWR4PTEyNjcmc3RhcnRQYWdlPTgwJmxpc3RObz03MzUmdGFibGU9ZXhfYmJzX2RhdGFfZWR1Jm5hdl9jb2RlPWVkdTE2MjIxODE1MjEmc2l0ZV9jb2RlPWVkdSZjb2RlPVp3S0pYZk5pZW96byZzZWFyY2hfaXRlbT0mc2VhcmNoX29yZGVyPSZvcmRlcl9saXN0PSZsaXN0X3NjYWxlPQ==&download=h&seq=1"}]}
{"dept": "교육학과", "detail": "대학원", "title": "[교육대학원 상담심리전공 양성과정] 2025학년도 1학기 교직 적성 및 인성검사(1차) 시행 안내", "date": "2025-03-10", "url": "https://home.knu.ac.kr/HOME/edu/sub.htm?mode=view&mv_data=aWR4PTEyNjYmc3RhcnRQYWdlPTgwJmxpc3RObz03MzQmdGFibGU9ZXhfYmJzX2RhdGFfZWR1Jm5hdl9jb2RlPWVkdTE2MjIxODE1MjEmY29kZT1ad0tKWGZOaWVvem8mc2VhcmNoX2l0ZW09JnNlYXJjaF9vcmRlcj0mb3JkZXJfbGlzdD0mbGlzdF9zY2FsZT0mdmlld19sZXZlbD0mdmlld19jYXRlPSZ2aWV3X2NhdGUyPQ==", "content": "[교육대학원 상담심리전공 양성과정] 2025학년도 1학기 교직 적성 및 인성검사(1차) 시행 안내\n등록일\n2025-03-10\n작성자\n교육학과\n조회수\n91\n1) 검사 일시: 2025. 3. 20.(목) 19:00 ~ 19:50\n2) 결과 확정: 2025. 3. 26.(수)[예정] - 부적격자의 경우, 별도의 온라인 교육을 이수해야 함 (추후 별도 안내)\n3) 신청 기간: 2025. 3. 12.(수) ∼ 3. 14.(금) 매일 10:00 ~ 17:00 (※ 등록횟수별 신청 가능 기간이 상이하니 첨부파일(사진) 필수 확인)\n4) 신청 방법: 통합정보시스템(\nhttp://knuin.knu.ac.kr)\n- 교직 - 교직적성및인성검사관리 - 교직적성및인성검사신청 (※ 신청 후 반드시 재접속하여 신청여부 확인)\n5) 교원자격증 발급을 위한 교직 적성 및 인성검사 충족 요건: 적격 판정 2회\n※ ’25. 8월 또는 ’26. 2월 졸업예정자 중 충족 기준을 만족하지 못한 학생들은 반드시 신청 및 참여\n첨부파일중 PDF미리보기\n파일 열람을 위해서는 아크로뱃 리더 설치가 필요합니다. 아래 링크를 클릭하여 리더를 다운로드 받으세요.\n2025학년도 1학기 교직 적성 및 인성검사(1차) 시행 계획001.jpg\n통합정보시스템 학생 신청 방법 안내.pdf", "images": ["http://www.adobe.com/images/shared/download_buttons/get_adobe_reader.png"], "attachments": [{"name": "2025학년도 1학기 교직 적성 및 인성검사(1차) 시행 계획001.jpg", "url": "https://home.knu.ac.kr/HOME/bbs/bbs_download.php?mv_data=aWR4PTEyNjYmc3RhcnRQYWdlPTgwJmxpc3RObz03MzQmdGFibGU9ZXhfYmJzX2RhdGFfZWR1Jm5hdl9jb2RlPWVkdTE2MjIxODE1MjEmc2l0ZV9jb2RlPWVkdSZjb2RlPVp3S0pYZk5pZW96byZzZWFyY2hfaXRlbT0mc2VhcmNoX29yZGVyPSZvcmRlcl9saXN0PSZsaXN0X3NjYWxlPQ==&download=h&seq=0"}, {"name": "통합정보시스템 학생 신청 방법 안내.pdf", "url": "https://home.knu.ac.kr/HOME/bbs/bbs_download.php?mv_data=aWR4PTEyNjYmc3RhcnRQYWdlPTgwJmxpc3RObz03MzQmdGFibGU9ZXhfYmJzX2RhdGFfZWR1Jm5hdl9jb2RlPWVkdTE2MjIxODE1MjEmc2l0ZV9jb2RlPWVkdSZjb2RlPVp3S0pYZk5pZW96byZzZWFyY2hfaXRlbT0mc2VhcmNoX29yZGVyPSZvcmRlcl9saXN0PSZsaXN0X3NjYWxlPQ==&download=h&seq=1"}]}
{"dept": "교육학과", "detail": "대학원", "title": "* [교육대학원] 2025학년도 1학기 교육대학원 학위논문 제출예정자 신청 안내", "date": "2025-02-28", "url": "https://home.knu.ac.kr/HOME/edu/sub.htm?mode=view&mv_data=aWR4PTEyNjEmc3RhcnRQYWdlPTgwJmxpc3RObz03MzMmdGFibGU9ZXhfYmJzX2RhdGFfZWR1Jm5hdl9jb2RlPWVkdTE2MjIxODE1MjEmY29kZT1ad0tKWGZOaWVvem8mc2VhcmNoX2l0ZW09JnNlYXJjaF9vcmRlcj0mb3JkZXJfbGlzdD0mbGlzdF9zY2FsZT0mdmlld19sZXZlbD0mdmlld19jYXRlPSZ2aWV3X2NhdGUyPQ==", "content": "* [교육대학원] 2025학년도 1학기 교육대학원 학위논문 제출예정자 신청 안내\n등록일\n2025-02-28\n작성자\n교육학과\n조회수\n126\n** 공지사항을 자세히 읽지 않고 문의하시는 분이 많습니다.\n자세히 설명되어있으니 공지사항 본문 및 첨부파일을 반드시 숙지하신 후에 신청 및 문의하여 주시기 바랍니다.\n가\n.\n논문 제출자격\n:\n아래의\n5\n가지 요건을 모두 충족해야 함\n① 이번 학기 등록금 납부자(수료생은 수료생 등록금 납부 예정자)\n② 수료학점(평점평균 2.7 이상) 이수자 또는 이수예정자\n③ 종합시험 합격자\n④ 연구윤리를 준수하여 지도교수의 추천을 받은 자\n※ 2016~2024학년도 입학생으로 이번 학기 논문 제출 예정자는\n4. 11.(금)까지 연구윤리교육을 이수\n하여야 함\n※ 통합정보시스템에서 2025. 3. 31.(월)부터 이수 여부 조회 가능\n(통합정보시스템 > 학적정보관리 > 학적기본사항 > 졸업 > 졸업자격인정)\n⑤ 기타 학과(부)에서 정한 졸업자격 요건을 충족한 자\n나. 논문제출 예정자 신청\n○ 신청 기간: 2025. 3. 17.(월) ~ 3. 19.(수) [3일간] (※기한 엄수)\n○ 신청 방법\n①\n통합정보시스템\n좌측 메뉴 > 학사행정 > 졸업 > 졸업요건(대학원) >\n논문제출 예정자 신청\n②\n신청서 출력\n및\n지도교수 서명\n을 받아\n교육학과 사무실로 대면 제출\n﻿\n​ (※반드시 기한 내 제출할 것)\n○\n제출 이후 논문제출예정 취소 신청 시 [붙임4]의 취소신청서를 작성하여 과사에 제출하십시오.\n○\n신청 제외대상: 2024학년도 2학기 논문판정유보자 및 논문제출연기자\n다. 「논문표절예방프로그램 검증 결과물 제출 및 심사 의무화」와 관련하여 논문제출예정자는 빠짐 없이 [붙임2]의 내용을 확인하여 주시기 바랍니다.\n- 표절예방 검증 프로그램: 도서관 홈페이지에 게재된 Turnitin(턴잇인)에 검증\n-\n제출대상: 석사 및 박사 학위논문제출예정자(일반․전문․특수대학원 포함)\n-\n제출자료: 논문표절예방프로그램 결과물(Turnitin 보고서)\n-\n심사의무: 지도교수 및 심사위원은 턴잇인 보고서 심사 의무\n-\n제출시기: 2025학년도 1학기 심사용 논문 접수기간(4. 9.~4. 11.)\n첨부파일중 PDF미리보기\n파일 열람을 위해서는 아크로뱃 리더 설치가 필요합니다. 아래 링크를 클릭하여 리더를 다운로드 받으세요.\n첨부파일중 PDF미리보기\n파일 열람을 위해서는 아크로뱃 리더 설치가 필요합니다. 아래 링크를 클릭하여 리더를 다운로드 받으세요.\n첨부파일중 PDF미리보기\n파일 열람을 위해서는 아크로뱃 리더 설치가 필요합니다. 아래 링크를 클릭하여 리더를 다운로드 받으세요.\n[붙임2-1] 논문표절예방프로그램(Turnitin)이용매뉴얼(국문).pdf\n[붙임2-2] (For Student) Turnitin Manual(Eng).pdf\n[붙임1] (통합정보시스템) 대학원 학위논문 제출예정자 신청 방법 안내.pdf\n[붙임3] 학위논문 제출취소 신청서.hwp", "images": ["http://www.adobe.com/images/shared/download_buttons/get_adobe_reader.png"], "attachments": [{"name": "[붙임2-1] 논문표절예방프로그램(Turnitin)이용매뉴얼(국문).pdf", "url": "https://home.knu.ac.kr/HOME/bbs/bbs_download.php?mv_data=aWR4PTEyNjEmc3RhcnRQYWdlPTgwJmxpc3RObz03MzMmdGFibGU9ZXhfYmJzX2RhdGFfZWR1Jm5hdl9jb2RlPWVkdTE2MjIxODE1MjEmc2l0ZV9jb2RlPWVkdSZjb2RlPVp3S0pYZk5pZW96byZzZWFyY2hfaXRlbT0mc2VhcmNoX29yZGVyPSZvcmRlcl9saXN0PSZsaXN0X3NjYWxlPQ==&download=h&seq=0"}, {"name": "[붙임2-2] (For Student) Turnitin Manual(Eng).pdf", "url": "https://home.knu.ac.kr/HOME/bbs/bbs_download.php?mv_data=aWR4PTEyNjEmc3RhcnRQYWdlPTgwJmxpc3RObz03MzMmdGFibGU9ZXhfYmJzX2RhdGFfZWR1Jm5hdl9jb2RlPWVkdTE2MjIxODE1MjEmc2l0ZV9jb2RlPWVkdSZjb2RlPVp3S0pYZk5pZW96byZzZWFyY2hfaXRlbT0mc2VhcmNoX29yZGVyPSZvcmRlcl9saXN0PSZsaXN0X3NjYWxlPQ==&download=h&seq=1"}, {"name": "[붙임1] (통합정보시스템) 대학원 학위논문 제출예정자 신청 방법 안내.pdf", "url": "https://home.knu.ac.kr/HOME/bbs/bbs_download.php?mv_data=aWR4PTEyNjEmc3RhcnRQYWdlPTgwJmxpc3RObz03MzMmdGFibGU9ZXhfYmJzX2RhdGFfZWR1Jm5hdl9jb2RlPWVkdTE2MjIxODE1MjEmc2l0ZV9jb2RlPWVkdSZjb2RlPVp3S0pYZk5pZW96byZzZWFyY2hfaXRlbT0mc2VhcmNoX29yZGVyPSZvcmRlcl9saXN0PSZsaXN0X3NjYWxlPQ==&download=h&seq=2"}, {"name": "[붙임3] 학위논문 제출취소 신청서.hwp", "url": "https://home.knu.ac.kr/HOME/bbs/bbs_download.php?mv_data=aWR4PTEyNjEmc3RhcnRQYWdlPTgwJmxpc3RObz03MzMmdGFibGU9ZXhfYmJzX2RhdGFfZWR1Jm5hdl9jb2RlPWVkdTE2MjIxODE1MjEmc2l0ZV9jb2RlPWVkdSZjb2RlPVp3S0pYZk5pZW96byZzZWFyY2hfaXRlbT0mc2VhcmNoX29yZGVyPSZvcmRlcl9saXN0PSZsaXN0X3NjYWxlPQ==&download=h&seq=3"}]}
{"dept": "교육학과", "detail": "대학원", "title": "* [일반대학원] 2025학년도 1학기 일반대학원 학위논문 제출예정자 신청 안내", "date": "2025-02-28", "url": "https://home.knu.ac.kr/HOME/edu/sub.htm?mode=view&mv_data=aWR4PTEyNjAmc3RhcnRQYWdlPTgwJmxpc3RObz03MzImdGFibGU9ZXhfYmJzX2RhdGFfZWR1Jm5hdl9jb2RlPWVkdTE2MjIxODE1MjEmY29kZT1ad0tKWGZOaWVvem8mc2VhcmNoX2l0ZW09JnNlYXJjaF9vcmRlcj0mb3JkZXJfbGlzdD0mbGlzdF9zY2FsZT0mdmlld19sZXZlbD0mdmlld19jYXRlPSZ2aWV3X2NhdGUyPQ==", "content": "* [일반대학원] 2025학년도 1학기 일반대학원 학위논문 제출예정자 신청 안내\n등록일\n2025-02-28\n작성자\n교육학과\n조회수\n214\n** 공지사항을 자세히 읽지 않고 문의하시는 분이 많습니다.\n자세히 설명되어있으니 공지사항 본문 및 첨부파일을 반드시 숙지하신 후에 신청 및 문의하여 주시기 바랍니다.\n**\n박사 신청자\n는 내규에 따라\n1) 논문계획서 발표 결과보고서,\n2) 학회발표 증빙자료, 3) 학술지 게재 증빙자료\n함께 제출하시기 바랍니다.\n(이전에 제출한 경우에는 제출하지 않아도 됨)\n가\n.\n논문 제출자격\n:\n아래의\n5\n가지 요건을 모두 충족해야 함\n① 이번 학기 등록금 납부자(수료생은 수료생 등록금 납부 예정자)\n② 수료학점(평점평균 2.7 이상) 이수자 또는 이수예정자\n③ 종합시험 합격자\n④ 연구윤리를 준수하여 지도교수의 추천을 받은 자\n※ 2016~2024학년도 입학생으로 이번 학기 논문 제출 예정자는\n4. 11.(금)까지 연구윤리교육을 이수\n하여야 함\n※ 통합정보시스템에서 2025. 3. 31.(월)부터 이수 여부 조회 가능\n(통합정보시스템 > 학적정보관리 > 학적기본사항 > 졸업 > 졸업자격인정)\n⑤ 기타 학과(부)에서 정한 졸업자격 요건을 충족한 자\n나. 논문제출 예정자 신청\n○ 신청 기간: 2025. 3. 17.(월) ~ 3. 19.(수) [3일간] (※기한 엄수)\n○ 신청 방법\n①\n통합정보시스템\n좌측 메뉴 > 학사행정 > 졸업 > 졸업요건(대학원) >\n논문제출 예정자 신청\n②\n신청서 출력\n및\n지도교수 서명\n을 받아\n교육학과 사무실로 대면 제출\n﻿\n​ (※반드시 기한 내 제출할 것)\n○\n제출 이후 논문제출예정 취소 신청 시 [붙임4]의 취소신청서를 작성하여 과사에 제출하십시오.\n○\n신청 제외대상: 2024학년도 2학기 논문판정유보자 및 논문제출연기자\n다. 「논문표절예방프로그램 검증 결과물 제출 및 심사 의무화」와 관련하여 논문제출예정자는 빠짐 없이 [붙임2]의 내용을 확인하여 주시기 바랍니다.\n- 표절예방 검증 프로그램: 도서관 홈페이지에 게재된 Turnitin(턴잇인)에 검증\n-\n제출대상: 석사 및 박사 학위논문제출예정자(일반․전문․특수대학원 포함)\n-\n제출자료: 논문표절예방프로그램 결과물(Turnitin 보고서)\n-\n심사의무: 지도교수 및 심사위원은 턴잇인 보고서 심사 의무\n-\n제출시기: 2025학년도 1학기 심사용 논문 접수기간(4. 9.~4. 11.)\n첨부파일중 PDF미리보기\n파일 열람을 위해서는 아크로뱃 리더 설치가 필요합니다. 아래 링크를 클릭하여 리더를 다운로드 받으세요.\n첨부파일중 PDF미리보기\n파일 열람을 위해서는 아크로뱃 리더 설치가 필요합니다. 아래 링크를 클릭하여 리더를 다운로드 받으세요.\n첨부파일중 PDF미리보기\n파일 열람을 위해서는 아크로뱃 리더 설치가 필요합니다. 아래 링크를 클릭하여 리더를 다운로드 받으세요.\n[붙임1] (통합정보시스템) 대학원 학위논문 제출예정자 신청 방법 안내.pdf\n[붙임2-1] 논문표절예방프로그램(Turnitin)이용매뉴얼(국문).pdf\n[붙임2-2] (For Student) Turnitin Manual(Eng).pdf\n[붙임3] 학위논문 제출취소 신청서.hwp", "images": ["http://www.adobe.com/images/shared/download_buttons/get_adobe_reader.png"], "attachments": [{"name": "[붙임1] (통합정보시스템) 대학원 학위논문 제출예정자 신청 방법 안내.pdf", "url": "https://home.knu.ac.kr/HOME/bbs/bbs_download.php?mv_data=aWR4PTEyNjAmc3RhcnRQYWdlPTgwJmxpc3RObz03MzImdGFibGU9ZXhfYmJzX2RhdGFfZWR1Jm5hdl9jb2RlPWVkdTE2MjIxODE1MjEmc2l0ZV9jb2RlPWVkdSZjb2RlPVp3S0pYZk5pZW96byZzZWFyY2hfaXRlbT0mc2VhcmNoX29yZGVyPSZvcmRlcl9saXN0PSZsaXN0X3NjYWxlPQ==&download=h&seq=0"}, {"name": "[붙임2-1] 논문표절예방프로그램(Turnitin)이용매뉴얼(국문).pdf", "url": "https://home.knu.ac.kr/HOME/bbs/bbs_download.php?mv_data=aWR4PTEyNjAmc3RhcnRQYWdlPTgwJmxpc3RObz03MzImdGFibGU9ZXhfYmJzX2RhdGFfZWR1Jm5hdl9jb2RlPWVkdTE2MjIxODE1MjEmc2l0ZV9jb2RlPWVkdSZjb2RlPVp3S0pYZk5pZW96byZzZWFyY2hfaXRlbT0mc2VhcmNoX29yZGVyPSZvcmRlcl9saXN0PSZsaXN0X3NjYWxlPQ==&download=h&seq=1"}, {"name": "[붙임2-2] (For Student) Turnitin Manual(Eng).pdf", "url": "https://home.knu.ac.kr/HOME/bbs/bbs_download.php?mv_data=aWR4PTEyNjAmc3RhcnRQYWdlPTgwJmxpc3RObz03MzImdGFibGU9ZXhfYmJzX2RhdGFfZWR1Jm5hdl9jb2RlPWVkdTE2MjIxODE1MjEmc2l0ZV9jb2RlPWVkdSZjb2RlPVp3S0pYZk5pZW96byZzZWFyY2hfaXRlbT0mc2VhcmNoX29yZGVyPSZvcmRlcl9saXN0PSZsaXN0X3NjYWxlPQ==&download=h&seq=2"}, {"name": "[붙임3] 학위논문 제출취소 신청서.hwp", "url": "https://home.knu.ac.kr/HOME/bbs/bbs_download.php?mv_data=aWR4PTEyNjAmc3RhcnRQYWdlPTgwJmxpc3RObz03MzImdGFibGU9ZXhfYmJzX2RhdGFfZWR1Jm5hdl9jb2RlPWVkdTE2MjIxODE1MjEmc2l0ZV9jb2RlPWVkdSZjb2RlPVp3S0pYZk5pZW96byZzZWFyY2hfaXRlbT0mc2VhcmNoX29yZGVyPSZvcmRlcl9saXN0PSZsaXN0X3NjYWxlPQ==&download=h&seq=3"}]}
{"dept": "교육학과", "detail": "대학원", "title": "* 2025학년도 1학기 교육대학원 '재학생' 대상 무논문 석사학위 신청 안내", "date": "2025-02-25", "url": "https://home.knu.ac.kr/HOME/edu/sub.htm?mode=view&mv_data=aWR4PTEyNTkmc3RhcnRQYWdlPTkwJmxpc3RObz03MzEmdGFibGU9ZXhfYmJzX2RhdGFfZWR1Jm5hdl9jb2RlPWVkdTE2MjIxODE1MjEmY29kZT1ad0tKWGZOaWVvem8mc2VhcmNoX2l0ZW09JnNlYXJjaF9vcmRlcj0mb3JkZXJfbGlzdD0mbGlzdF9zY2FsZT0mdmlld19sZXZlbD0mdmlld19jYXRlPSZ2aWV3X2NhdGUyPQ==", "content": "* 2025학년도 1학기 교육대학원 '재학생' 대상 무논문 석사학위 신청 안내\n등록일\n2025-02-25\n작성자\n교육학과\n조회수\n93\n2025\n학년도\n1\n학기 특수대학원\n재학생\n무논문 석사학위 신청을 아래와 같이 안내합니다\n.\n가\n.\n신청대상\n:\n학위 수여를 위하여 무논문 승인을 받은 교육대학원 소속 재학생 (1개 학기 이상 이수한 학생)\n나\n.\n신청 기한\n:\n2025. 3. 4.(화) 9:00 ~ 3. 14.(금) 17:30\n까지 (기한 엄수)\n다\n.\n신청 방법:\n학생이\n①통합정보시스템에서 신청\n후,\n②아래의 제출서류(3부)를 학과 사무실로 직접 제출\n[첨부 파일 참조]\n라. 제출 서류\n(①~③ 모두 제출하여야 함)\n① 무논문 학위 신청원 (통합정보시스템 신청 출력물)  1부.\n② 무논문 석사 학위 수여 신청 사유서 및 지도교수 확인서  1부. (지도교수 서명 必)\n③\n성적증명서  1부.\n※\n신청 기한 내 제출 서류(4부)를\n반드시 과사로 제출\n하여야만 무논문 학위 신청이 완료됨\n(미제출 시 신청 접수되지 않음)\n※ 지도교수 및 전공주임 교수님 날인이 필요한 서류에는 반드시\n직접 날인\n을 받아야 함.\n라\n.\n유의 사항\n:\n신청 기간 종료 후 추가 접수 없음\n(\n다음 학기에 신청 가능\n)\n대학원\n학과 및 전공\n전공주임\n비고\n교육대학원\n교육철학전공\n박균섭\n2015학년도 이전 입학생 신청 불가\n교육대학원\n교육행정전공\n강호수\n2011학년도 이전 입학생 신청 불가\n교육대학원\n상담심리전공\n김은영\n-\n붙임  1. 통합정보시스템 무논문 석사학위 신청 매뉴얼\n1\n부.\n2. 무논문 석사 학위 수여 신청 사유서 및 지도교수 확인서 1부.\n끝\n.\n[붙임2] 통합정보시스템 무논문 학위 신청 매뉴얼.hwp\n[붙임1] 교육대학원_무논문 석사 학위 수여 신청 사유서 및 지도교수 확인서.hwp", "images": [], "attachments": [{"name": "[붙임2] 통합정보시스템 무논문 학위 신청 매뉴얼.hwp", "url": "https://home.knu.ac.kr/HOME/bbs/bbs_download.php?mv_data=aWR4PTEyNTkmc3RhcnRQYWdlPTkwJmxpc3RObz03MzEmdGFibGU9ZXhfYmJzX2RhdGFfZWR1Jm5hdl9jb2RlPWVkdTE2MjIxODE1MjEmc2l0ZV9jb2RlPWVkdSZjb2RlPVp3S0pYZk5pZW96byZzZWFyY2hfaXRlbT0mc2VhcmNoX29yZGVyPSZvcmRlcl9saXN0PSZsaXN0X3NjYWxlPQ==&download=h&seq=0"}, {"name": "[붙임1] 교육대학원_무논문 석사 학위 수여 신청 사유서 및 지도교수 확인서.hwp", "url": "https://home.knu.ac.kr/HOME/bbs/bbs_download.php?mv_data=aWR4PTEyNTkmc3RhcnRQYWdlPTkwJmxpc3RObz03MzEmdGFibGU9ZXhfYmJzX2RhdGFfZWR1Jm5hdl9jb2RlPWVkdTE2MjIxODE1MjEmc2l0ZV9jb2RlPWVkdSZjb2RlPVp3S0pYZk5pZW96byZzZWFyY2hfaXRlbT0mc2VhcmNoX29yZGVyPSZvcmRlcl9saXN0PSZsaXN0X3NjYWxlPQ==&download=h&seq=1"}]}
{"dept": "교육학과", "detail": "대학원", "title": "* 2025학년도 1학기 대학원생 연구윤리교육 시행 안내", "date": "2025-02-14", "url": "https://home.knu.ac.kr/HOME/edu/sub.htm?mode=view&mv_data=aWR4PTEyNTgmc3RhcnRQYWdlPTkwJmxpc3RObz03MzAmdGFibGU9ZXhfYmJzX2RhdGFfZWR1Jm5hdl9jb2RlPWVkdTE2MjIxODE1MjEmY29kZT1ad0tKWGZOaWVvem8mc2VhcmNoX2l0ZW09JnNlYXJjaF9vcmRlcj0mb3JkZXJfbGlzdD0mbGlzdF9zY2FsZT0mdmlld19sZXZlbD0mdmlld19jYXRlPSZ2aWV3X2NhdGUyPQ==", "content": "* 2025학년도 1학기 대학원생 연구윤리교육 시행 안내\n등록일\n2025-02-14\n작성자\n교육학과\n조회수\n120\n대학원생 학위논문 제출 자격 요건인 「2025학년도 1학기 대학원생 연구윤리교육」을 아래와 같이 시행함을 알려드립니다.\n이번 학기 학위논문 제출예정자 등 해당 학생들은 빠짐없이 교육을 이수하여 주시기 바랍니다.\n가. 교육내용:「대학원생을 위한 연구윤리」온라인 강의 수강\n(4과목 중\n택1\n하여 수강)\n○ 대학원생을 위한 연구윤리(인문사회)\n○ 대학원생을 위한 연구윤리(이공)\n○ Research ehtics for graduate students(Humanities and Social Sciences)\n○ Research ehtics for graduate students(Science and Engineering)\n나.\n수강신청:\n2025. 3. 5.(수) ~ 3. 10.(월)\n다\n.\n교육대상\n(특수대학원 포함, 무논문 제외)\n1) 2025학년도 대학원 입학생\n2) 2016~2024학년도 입학생 중 미이수자\n3) 2015학년도 이전 입학생은 이수 '권장'\n※ (유의사항)\n연구윤리교육\n미\n이수자 중\n이번 학기 학위논문 제출예정자는 2025. 4. 11.(금)까지 반드시 이수\n하여야 하며,\n​\n이전 연구윤리교육 수강신청 후 미이수자 또한 재수강 신청 필요\n라. 수강신청방법: 붙임 파일 참고\n마. 교육 이수\n가) 학습관리시스템에 탑재된 연구윤리 강의 수강\n○ 경북대학교 포털사이트 접속하여 상단 메뉴 중 학습관리시스템 클릭, 또는 직접 주소(\nhttps://lms1.knu.ac.kr/)를\n입력하여 접속 후 로그인(ID와 PW는 통합정보시스템과 동일)\n○ 마이페이지 → 수강과목 → 강의명 클릭\n나)\n교육기간: 2025. 3. 12.(수) ~ 6. 23.(월)\n다) 수료기준: 진도 100%\n※ 수료기준 충족(전체 교육 이수완료)시 연구윤리교육 이수 인정\n※ 이전에 연구윤리교육 수강 신청 후\n미이수\n하였을 경우, 이번 학기에\n다시 수강신청\n후 이수하여야 함\n라) 이수 확인: 교육기간 종료 후 2025. 6월말 경 확인가능\n※ 교육 이수 후 통합포털시스템 → 통합정보시스템 → 학적정보관리 → 학적기본사항 → 졸업 → 졸업자격인정에서 이수여부 확인\n바. 문의\n- 학위논문 제출자격 관련 연구윤리교육 이수 전반: 학사과 (☏053-950-2058)\n- 통합정보시스템 수강 신청 등 전산 장애:\n정보화본부 (☏053-950-8649)\n- 학습관리시스템(LMS) 강좌 수강 등 전산 장애:\n정보화본부 (☏053-950-8705)\n아울러 본 연구윤리교육은\n2016학년도\n대학원 석․박사(통합)과정 입학생부터 학위논문 제출 자격요건으로\n의무적으로 이수\n해야 함을 알려드립니다.\n(통합정보시스템)연구윤리교육 신청 프로그램  사용설명서(학생용).hwp", "images": [], "attachments": [{"name": "(통합정보시스템)연구윤리교육 신청 프로그램  사용설명서(학생용).hwp", "url": "https://home.knu.ac.kr/HOME/bbs/bbs_download.php?mv_data=aWR4PTEyNTgmc3RhcnRQYWdlPTkwJmxpc3RObz03MzAmdGFibGU9ZXhfYmJzX2RhdGFfZWR1Jm5hdl9jb2RlPWVkdTE2MjIxODE1MjEmc2l0ZV9jb2RlPWVkdSZjb2RlPVp3S0pYZk5pZW96byZzZWFyY2hfaXRlbT0mc2VhcmNoX29yZGVyPSZvcmRlcl9saXN0PSZsaXN0X3NjYWxlPQ==&download=h&seq=0"}]}
{"dept": "교육학과", "detail": "대학원", "title": "* 2025학년도 1학기 교육대학원 종합시험 시행 안내(추가)", "date": "2025-02-13", "url": "https://home.knu.ac.kr/HOME/edu/sub.htm?mode=view&mv_data=aWR4PTEyNTcmc3RhcnRQYWdlPTkwJmxpc3RObz03MjkmdGFibGU9ZXhfYmJzX2RhdGFfZWR1Jm5hdl9jb2RlPWVkdTE2MjIxODE1MjEmY29kZT1ad0tKWGZOaWVvem8mc2VhcmNoX2l0ZW09JnNlYXJjaF9vcmRlcj0mb3JkZXJfbGlzdD0mbGlzdF9zY2FsZT0mdmlld19sZXZlbD0mdmlld19jYXRlPSZ2aWV3X2NhdGUyPQ==", "content": "* 2025학년도 1학기 교육대학원 종합시험 시행 안내(추가)\n등록일\n2025-02-13\n작성자\n교육학과\n조회수\n213\n교육대학원 「2025학년도 1학기 종합시험 시행 계획」을 다음과 같이 안내드립니다.\n가. 응시자격\n: 수료학점의 2/3이상 이수하고, 지도교수의 추천을 받은 자\n- 논문졸업예정자 : 현재 수료학점(24학점)의 3분의 2이상(=16학점 이상)을 이수하고 지도교수의 추천을 받은 자\n- 무논문졸업예정자 : 현재 수료학점(30학점)의 3분의 2이상(=20학점 이상)을 이수하고 지도교수의 추천을 받은 자\n※\n선수과목은 수료학점에서 제외\n되니 착오 없으시기 바랍니다.\n※\n수료생이 종합시험 응시를 위해 수료생 등록을 할 필요는 없음\n※ 이번 학기에 신청한 수강과목 중 재이수를 하는 경우, 재이수 과목의 학점을 제외하고 수료학점의 3분의 2 이상 이수하여야 함\n(<예> 전공과목 18학점 이수한 석사과정 학생이 이번 학기에 3학점을 재이수 수강신청하였다면, 이수한 전공과목 학점은 15학점으로 응시응시자격 미달자가 됨)\n나. 합격기준\n: 과목별 70점 이상(100점 만점) 및 전과목 합격\n- 일부 과목 불합격(1과목 이상 70점 미만)인 경우 종합시험 불합격(다음 학기 불합격한 과목 수만큼만 재응시하면 됨)\n- 예) '1과목 70점 이상, 1과목 70점 미만'인 경우 종합시험 불합격, 다음 학기 불합격한 1과목만 재시험 (동일과목)\n다. 원서접수\n(1) 기간 :\n2025. 2. 25.(화) ~ 2. 27.(목) 17:00\n까지 (기한 엄수) ​(* 점심시간 12~13시 제외)\n(2)\n방법:\n①차세대 통합정보시스템에서 온라인 신청 → ②신청서(원서) 출력 및 추가 기재 → ③지도교수 추천(날인) → ④학과 사무실로 대면 제출\n* 차세대 통합정보시스템 > 학사행정 > 졸업 > 졸업요건(대학원) > 종합시험신청)\n(3) 장소: 교육학과 사무실(사범대학 823호)\n** 본인 수강과목 조회: 통합정보시스템 > 학적 > 학적정보관리 > 학적기본사항관리\n** 본인 수강과목을 조회하여 응시할\n시험과목명을 정확하게 작성\n하여 주십시오. (띄어쓰기, 1/Ⅰ 구분 등)\n※ '종합시험 지원서 작성 요령'을 반드시 확인할 것\n라. 시행방법\n1) 시험과목 :\n2과목\n이상 실시 (단, 전년도에 합격한 과목이 있는 응시자는 불합격한 과목만 응시 가능)\n** 과목 선택과 관련하여서는 반드시 지도교수님과 상의\n바랍니다. (학과에서 관여하지 않음)\n2)\n동일 교수 과목만으로는 시행 불가\n(*팀티칭도 동일 교수로 취급)\n3) 일시·장소 : 3. 5.(수) ~ 3. 11.(화) 중 각 전공에서 별도로 정함​ (과목당 1시간)\n**\n각 전공별 시험 날짜 및 장소는 반드시 전공주임 교수님과 상의\n하시기 바랍니다. (전공별 시험일자가 학과에 전달되면 추후 본 공지에 기재할 예정임)\n4)\n응시생에 대한 시험 시행 결과 통지\n:\n25. 3. 17.(월)\n학과 홈페이지에 안내\n(예정)\n[각 전공별 시험 일자 및 장소]\n- 상담심리전공: 3/10(월) 18~20시 / 교육대학원 203호\n- 교육과정및교육공학전공:\n미정\n- 교육사회전공: 미정\n- 평생교육전공: 3/6(목) 17~19시 / 사범대학 815호\n- 교육심리및교육평가전공:\n미정\n- 교육철학전공:\n미정\n- 교육행정전공:\n3/5(수) 18~20시 / 사범대학 820호\n첨부파일중 PDF미리보기\n파일 열람을 위해서는 아크로뱃 리더 설치가 필요합니다. 아래 링크를 클릭하여 리더를 다운로드 받으세요.\n첨부파일중 PDF미리보기\n파일 열람을 위해서는 아크로뱃 리더 설치가 필요합니다. 아래 링크를 클릭하여 리더를 다운로드 받으세요.\n(배부용) (통합정보시스템) 대학원 종합시험 신청 안내.pdf\n(배부용) 종합시험 지원서 작성 요령.pdf", "images": ["http://www.adobe.com/images/shared/download_buttons/get_adobe_reader.png"], "attachments": [{"name": "(배부용) (통합정보시스템) 대학원 종합시험 신청 안내.pdf", "url": "https://home.knu.ac.kr/HOME/bbs/bbs_download.php?mv_data=aWR4PTEyNTcmc3RhcnRQYWdlPTkwJmxpc3RObz03MjkmdGFibGU9ZXhfYmJzX2RhdGFfZWR1Jm5hdl9jb2RlPWVkdTE2MjIxODE1MjEmc2l0ZV9jb2RlPWVkdSZjb2RlPVp3S0pYZk5pZW96byZzZWFyY2hfaXRlbT0mc2VhcmNoX29yZGVyPSZvcmRlcl9saXN0PSZsaXN0X3NjYWxlPQ==&download=h&seq=0"}, {"name": "(배부용) 종합시험 지원서 작성 요령.pdf", "url": "https://home.knu.ac.kr/HOME/bbs/bbs_download.php?mv_data=aWR4PTEyNTcmc3RhcnRQYWdlPTkwJmxpc3RObz03MjkmdGFibGU9ZXhfYmJzX2RhdGFfZWR1Jm5hdl9jb2RlPWVkdTE2MjIxODE1MjEmc2l0ZV9jb2RlPWVkdSZjb2RlPVp3S0pYZk5pZW96byZzZWFyY2hfaXRlbT0mc2VhcmNoX29yZGVyPSZvcmRlcl9saXN0PSZsaXN0X3NjYWxlPQ==&download=h&seq=1"}]}
{"dept": "교육학과", "detail": "대학원", "title": "* 2025학년도 1학기 일반대학원 종합시험 시행 안내", "date": "2025-02-11", "url": "https://home.knu.ac.kr/HOME/edu/sub.htm?mode=view&mv_data=aWR4PTEyNTYmc3RhcnRQYWdlPTkwJmxpc3RObz03MjgmdGFibGU9ZXhfYmJzX2RhdGFfZWR1Jm5hdl9jb2RlPWVkdTE2MjIxODE1MjEmY29kZT1ad0tKWGZOaWVvem8mc2VhcmNoX2l0ZW09JnNlYXJjaF9vcmRlcj0mb3JkZXJfbGlzdD0mbGlzdF9zY2FsZT0mdmlld19sZXZlbD0mdmlld19jYXRlPSZ2aWV3X2NhdGUyPQ==", "content": "* 2025학년도 1학기 일반대학원 종합시험 시행 안내\n등록일\n2025-02-11\n작성자\n교육학과\n조회수\n256\n1.\n주요 일정\n가\n. 신청(접수) 안내\n(1) 신청 기간\n:\n2024. 2. 25.(화) ~ 2. 27.(목) 1\n7:00까지 (기한 엄수)\n(※ 점심시간 12시~13시 제외)\n(2) 신청 방법:\n①차세대 통합정보시스템에서 온라인 신청 → ②신청서(원서) 출력 및 추가 기재 → ③지도교수 추천(날인) → ④학과 사무실로 대면 제출\n* 차세대 통합정보시스템 > 학사행정 > 졸업 > 졸업요건(대학원) > 종합시험신청)\n* 교육\n학과 사무실: 경북대학교 사범대학 823호\n※ 붙임의\n'종합시험 지원서 작성 요령' 반드시 확인할 것\n나\n.\n시험 시행\n(1) 일시 :\n2025. 3. 6.(목) 13:00\n~\n﻿\n(* 반드시 12:30까지 입실)\n(* 시험시간: 과목당 1시간)\n(2) 장소 : 사범대학 812호 (인원에 따라 변동 가능)\n다\n.\n응시생에 대한 시험 시행 결과 통지\n:\n25. 3. 17.(월)\n학과 홈페이지에 안내\n(예정)\n2.\n시험과목\n가\n.\n석사과정\n:\n학과장이 정한\n3\n과목 이상\n의 교과목\n나\n.\n박사과정\n:\n학과장이 정한\n4\n과목 이상\n의 교과목\n다\n.\n시험과목 선정 유의사항\n:\n지원자들에게 공통으로 이수한 과목을 선정할 수도 있지만\n,\n개인별로 다른 과목을 선정할 수 있음\n라.\n동일 교수의 과목만으로 종합시험을 부과할 수 없음\n​(*팀티칭이더라도 동일 교수로 취급)\n(예) 3과목을 시험과목으로 부과한다면 2과목까지 동일 교수의 과목으로 시행할 수 있음\n마.\n일부과목 합격자\n:\n반드시 지난 시험의 불합격 과목을 다시 응시\n바. 시험과목 선정 등은 지도교수님에게 문의하시기 바랍니다.\n3.\n지원자격:\n수료학점의\n3\n분의\n2\n이상 이수\n​\n하고,\n지도교수의 추천\n을 받은 자\n※\n수료생이 종합시험 응시를 위해 수료생 등록을 할 필요는 없음\n※ 이번 학기에 신청한 수강과목 중 재이수를 하는 경우, 재이수 과목의 학점을 제외하고 수료학점의 3분의 2 이상 이수하여야 함\n(<예> 전공과목 18학점 이수한 석사과정 학생이 이번 학기에 3학점을 재이수 수강신청하였다면, 이수한 전공과목 학점은 15학점으로 응시응시자격 미달자가 됨)\n※\n지원자격 미달자가 응시할 경우, 합격 시 무효 처리\n되니\n본인의 지원자격을 반드시 확인\n한 후 지원할 것\n4.\n제출서류:\n종합시험 신청서(출력물)\n1\n부\n*\n통합정보시스템에서 수강과목을 조회하시고\n시험 과목명\n을\n정확하게 작성\n하여 주십시오\n. (띄어쓰기, 1/Ⅰ 구분 등)\n5.\n합격기준\n가. 과목당\n100\n점 만점에서\n70\n점 이상 얻어야 함.\n나. 일부 과목 불합격인 경우 종합시험 불합격 (다음 학기 불합격한 과목 수 만큼만 재응시하면 됨)\n첨부파일중 PDF미리보기\n파일 열람을 위해서는 아크로뱃 리더 설치가 필요합니다. 아래 링크를 클릭하여 리더를 다운로드 받으세요.\n첨부파일중 PDF미리보기\n파일 열람을 위해서는 아크로뱃 리더 설치가 필요합니다. 아래 링크를 클릭하여 리더를 다운로드 받으세요.\n(통합정보시스템) 대학원 종합시험 신청 안내.pdf\n종합시험 지원서 작성 요령.pdf", "images": ["http://www.adobe.com/images/shared/download_buttons/get_adobe_reader.png"], "attachments": [{"name": "(통합정보시스템) 대학원 종합시험 신청 안내.pdf", "url": "https://home.knu.ac.kr/HOME/bbs/bbs_download.php?mv_data=aWR4PTEyNTYmc3RhcnRQYWdlPTkwJmxpc3RObz03MjgmdGFibGU9ZXhfYmJzX2RhdGFfZWR1Jm5hdl9jb2RlPWVkdTE2MjIxODE1MjEmc2l0ZV9jb2RlPWVkdSZjb2RlPVp3S0pYZk5pZW96byZzZWFyY2hfaXRlbT0mc2VhcmNoX29yZGVyPSZvcmRlcl9saXN0PSZsaXN0X3NjYWxlPQ==&download=h&seq=0"}, {"name": "종합시험 지원서 작성 요령.pdf", "url": "https://home.knu.ac.kr/HOME/bbs/bbs_download.php?mv_data=aWR4PTEyNTYmc3RhcnRQYWdlPTkwJmxpc3RObz03MjgmdGFibGU9ZXhfYmJzX2RhdGFfZWR1Jm5hdl9jb2RlPWVkdTE2MjIxODE1MjEmc2l0ZV9jb2RlPWVkdSZjb2RlPVp3S0pYZk5pZW96byZzZWFyY2hfaXRlbT0mc2VhcmNoX29yZGVyPSZvcmRlcl9saXN0PSZsaXN0X3NjYWxlPQ==&download=h&seq=1"}]}
{"dept": "교육학과", "detail": "대학원", "title": "* 2025학년도 1학기 대학원 수료생 등록 안내", "date": "2025-02-06", "url": "https://home.knu.ac.kr/HOME/edu/sub.htm?mode=view&mv_data=aWR4PTEyNTUmc3RhcnRQYWdlPTkwJmxpc3RObz03MjcmdGFibGU9ZXhfYmJzX2RhdGFfZWR1Jm5hdl9jb2RlPWVkdTE2MjIxODE1MjEmY29kZT1ad0tKWGZOaWVvem8mc2VhcmNoX2l0ZW09JnNlYXJjaF9vcmRlcj0mb3JkZXJfbGlzdD0mbGlzdF9zY2FsZT0mdmlld19sZXZlbD0mdmlld19jYXRlPSZ2aWV3X2NhdGUyPQ==", "content": "* 2025학년도 1학기 대학원 수료생 등록 안내\n등록일\n2025-02-06\n작성자\n교육학과\n조회수\n216\n「2025학년도 1학기 대학원 수료생 등록 계획」을 다음과 같이 알려드리니, 수료생 등록이 필요한 학생은 기한 내 신청 바랍니다.\n가. 신청 대상: 각 대학원 수료생\n※ 1. 2024학년도 2학기에 학위취득을 위한 논문을 제출하고자 하는 자 또는 논문 지도를 받고자 하는 자\n2. 연구 과제 참여로 산학협력단을 통해 인건비를 받고자 하는 자(과제에 따라 수료생 등록 필요 여부 확인 요망)\n◆\n연구 과제 참여로\n산학협력단을 통해 인건비를 받고자 하는 자\n는 과제에 따라 수료생\n등록 여부가 중요함으로\n반드시\n과제 담당자에게 확인 후 수료생 등록 여부 판단\n◆\n2024\n년도\n2\n학기\n수료생\n중\n학위논문심사에서\n“\n판정유보\n”\n및\n“\n완성논문 제출연기\n”\n로 결정된\n자는 수료생 등록을 하지 않아도 논문심사 및 완성논문 제출을 할 수 있음\n⤷\n대학원에서는 수료생 등록을 한 학기 면제해 주지만\n산학협력단을 통해 인건비를 받고자 하는 자\n는 수료생 등록을 해야하는 경우가 있으므로\n반드시 확인 요망\n◆\n2024\n년도\n2\n학기\n재학생\n중\n학위논문심사에서\n“\n판정유보\n”\n및\n“\n완성논문 제출연기\n”\n로 결정된\n자는 이번 학기 수료생 등록을 하여야 함\n나. 신청 방법:\n신청기간 내에 아래의 ①~③을 모두 완료하여야 함\n①\n차세대 통합정보시스템\n에서 직접 전산 신청 후 신청서 출력\n(차세대 통합정보시스템 > 학사행정 > 졸업 > 졸업요건(대학원) > 수료생 등록신청 에서 신청)\n② 신청서에 지도교수님 날인을 받은 후 학과 사무실로\n대면 제출\n(※이메일/우편 제출 불가)\n​③ 신청자의 자격을 심사ㆍ확인 후 학과에서 승인\n다. 신청 및 등록 기간\n1) 신청 및 제출 기간: 2025. 2. 24.(월) ~ 2. 26.(수) 17:00\n(※ 점심시간 1\n2:00~13:00 제외)\n2) 등록기간: 2025. 3. 10.(월) ~ 3. 11.(화)\n라. 유의사항\n○ 수료생 등록을 한 후 심사용 논문을 제출하지 않는 경우라도\n등록금을 환불하지 않으니\n등록금을 납부하기 전에 신중히 검토하여 등록\n* 이번 학기 논문심사 여부가 확정되지 않은 경우 추가 납부기간에 납부하기 바람\n○ 1차 신청자 중 미납자는 2차 신청기간 중 재신청하지 않아도 2차 납부기간 중 납부 가능\n○ 납부기간 중 학교 홈페이지 공지사항을 통해 출력 가능,\n등록금 환불은 없음에 유의\n첨부파일중 PDF미리보기\n파일 열람을 위해서는 아크로뱃 리더 설치가 필요합니다. 아래 링크를 클릭하여 리더를 다운로드 받으세요.\n(통합정보시스템) 대학원 수료생 등록 신청안내.pdf", "images": ["http://www.adobe.com/images/shared/download_buttons/get_adobe_reader.png"], "attachments": [{"name": "(통합정보시스템) 대학원 수료생 등록 신청안내.pdf", "url": "https://home.knu.ac.kr/HOME/bbs/bbs_download.php?mv_data=aWR4PTEyNTUmc3RhcnRQYWdlPTkwJmxpc3RObz03MjcmdGFibGU9ZXhfYmJzX2RhdGFfZWR1Jm5hdl9jb2RlPWVkdTE2MjIxODE1MjEmc2l0ZV9jb2RlPWVkdSZjb2RlPVp3S0pYZk5pZW96byZzZWFyY2hfaXRlbT0mc2VhcmNoX29yZGVyPSZvcmRlcl9saXN0PSZsaXN0X3NjYWxlPQ==&download=h&seq=0"}]}
{"dept": "교육학과", "detail": "대학원", "title": "외국인 수료생 비자 연장 조건 변경 안내 (적용 시기: 2025. 2. 1.~)", "date": "2025-01-13", "url": "https://home.knu.ac.kr/HOME/edu/sub.htm?mode=view&mv_data=aWR4PTEyNTMmc3RhcnRQYWdlPTkwJmxpc3RObz03MjYmdGFibGU9ZXhfYmJzX2RhdGFfZWR1Jm5hdl9jb2RlPWVkdTE2MjIxODE1MjEmY29kZT1ad0tKWGZOaWVvem8mc2VhcmNoX2l0ZW09JnNlYXJjaF9vcmRlcj0mb3JkZXJfbGlzdD0mbGlzdF9zY2FsZT0mdmlld19sZXZlbD0mdmlld19jYXRlPSZ2aWV3X2NhdGUyPQ==", "content": "외국인 수료생 비자 연장 조건 변경 안내 (적용 시기: 2025. 2. 1.~)\n등록일\n2025-01-13\n작성자\n교육학과\n조회수\n42\n체계적이고 효율적인 유학생 관리를 위하여 외국인 수료생 비자연장 조건을 다음과 같이    변경되었음을 알려드립니다.\n1.\n변경사유\n:\n체류관리 효율 증대\n,\n교육국제화역량 인증제 지표관리\n,\n시설물 사용 규정 준수 유도\n2.\n안내대상\n:\n외국인 학위과정생\n(\n수료생에 한함\n)\n3.\n실시일자\n: 2025. 2. 1.(\n토\n)\n부터 적용\n4.\n변경내용\n:\n수료생 비자연장 조건\n현황\n개정\n1.\n수료생 등록 여부와 관계없이\n논문지도확인서 제출 시 비자 연장 가능\n2.\n수료생 비자연장 준비서류\n가\n.\n통합신청서\n나\n.\n여권\n다\n.\n외국인등록증\n라\n.\n성적증명서\n마\n.\n재정입증서류\n바\n.\n체류지 입증서류\n사\n.\n논문 지도교수 확인서\n아\n.\n수료증명서\n(\n수료예정증명서\n)\n자\n. 60,000\n원\n1.\n수료생 등록 후\n논문지도확인서 및 수료생 등록 확인서 제출 시 비자 연장 가능\n2.\n수료생 비자연장 준비서류\n가\n.\n통합신청서\n나\n.\n여권\n다\n.\n외국인등록증\n라\n.\n성적증명서\n마\n.\n재정입증서류\n바\n.\n체류지 입증서류\n사\n.\n논문 지도교수 확인서\n아\n.\n수료생 등록금 납입 확인서\n자\n. 60,000\n원\n※\nD-2\n비자 소지자는 체류 기간 만료 시 동일 비자 재발급이 불가\n※\n만료일로부터\n15\n일 이내 출국해야 하며\n,\n재입국 시 다른 비자로 입국해야 함\n※\n비자 만료가 수료생 등록금 납부 기간 이전인 경우\n,\n온라인으로 비자 연장을 먼저 신청하고\n,\n등록금 납입 후 납입 확인서를 제출해야 함\n.\n끝\n.", "images": [], "attachments": []}
{"dept": "교육학과", "detail": "대학원", "title": "2025년 2월(2024학년도 전기) 대학원 수업연한단축[조기수료 또는 졸업] 신청 안내", "date": "2025-01-06", "url": "https://home.knu.ac.kr/HOME/edu/sub.htm?mode=view&mv_data=aWR4PTEyNTEmc3RhcnRQYWdlPTkwJmxpc3RObz03MjUmdGFibGU9ZXhfYmJzX2RhdGFfZWR1Jm5hdl9jb2RlPWVkdTE2MjIxODE1MjEmY29kZT1ad0tKWGZOaWVvem8mc2VhcmNoX2l0ZW09JnNlYXJjaF9vcmRlcj0mb3JkZXJfbGlzdD0mbGlzdF9zY2FsZT0mdmlld19sZXZlbD0mdmlld19jYXRlPSZ2aWV3X2NhdGUyPQ==", "content": "2025년 2월(2024학년도 전기) 대학원 수업연한단축[조기수료 또는 졸업] 신청 안내\n등록일\n2025-01-06\n작성자\n교육학과\n조회수\n150\n1.\n관련\n:\n「\n경북대학교 학칙\n」\n제\n71\n조\n(\n수업연한\n)\n2.\n일반\n‧\n전문\n‧\n특수대학원 재학생 중\n2025\n년\n2\n월\n(2024\n학년도 전기\n)\n에 수업연한단축\n[\n조기\n수료 또는 졸업\n]\n을 신청\n하고자 하는 학생은\n기한 내에 신청\n하여 주시기 바랍니다.\n가\n.\n조기수료 및 졸업 요건\n: [\n붙임\n1]\n참고\n나\n.\n신청기한\n:\n2025. 1. 16.(목\n) 18:00\n까지\n다\n.\n신청절차\n:\n신청서\n[\n붙임\n2]\n작성 후\n학과\n(\n부\n)\n사무실 제출\n라\n.\n조기수료 후속조치\n※\n2025.1\n학기부터 본등록 하지 않음\n- (\n논  문\n)\n수료생등록\n,\n종합시험\n,\n논문심사 등 학과별 요건 충족 시 졸업\n- (\n무논문\n)\n종합시험 등 학과별 요건 충족 시 졸업\n붙임\n1.\n각 대학원 조기수료 및 졸업 요건\n1\n부\n2.\n신청서\n1\n부\n.\n끝\n.\n각 대학원 조기수료 및 졸업 요건.hwp\n수업연한단축 신청서.hwp", "images": [], "attachments": [{"name": "각 대학원 조기수료 및 졸업 요건.hwp", "url": "https://home.knu.ac.kr/HOME/bbs/bbs_download.php?mv_data=aWR4PTEyNTEmc3RhcnRQYWdlPTkwJmxpc3RObz03MjUmdGFibGU9ZXhfYmJzX2RhdGFfZWR1Jm5hdl9jb2RlPWVkdTE2MjIxODE1MjEmc2l0ZV9jb2RlPWVkdSZjb2RlPVp3S0pYZk5pZW96byZzZWFyY2hfaXRlbT0mc2VhcmNoX29yZGVyPSZvcmRlcl9saXN0PSZsaXN0X3NjYWxlPQ==&download=h&seq=0"}, {"name": "수업연한단축 신청서.hwp", "url": "https://home.knu.ac.kr/HOME/bbs/bbs_download.php?mv_data=aWR4PTEyNTEmc3RhcnRQYWdlPTkwJmxpc3RObz03MjUmdGFibGU9ZXhfYmJzX2RhdGFfZWR1Jm5hdl9jb2RlPWVkdTE2MjIxODE1MjEmc2l0ZV9jb2RlPWVkdSZjb2RlPVp3S0pYZk5pZW96byZzZWFyY2hfaXRlbT0mc2VhcmNoX29yZGVyPSZvcmRlcl9saXN0PSZsaXN0X3NjYWxlPQ==&download=h&seq=1"}]}
{"dept": "교육학과", "detail": "대학원", "title": "* 2024-2학기 박사 논문계획서 발표 (*대상자: 2025학년도 1학기 박사학위 청구논문 공개발표자)", "date": "2025-01-02", "url": "https://home.knu.ac.kr/HOME/edu/sub.htm?mode=view&mv_data=aWR4PTEyNTAmc3RhcnRQYWdlPTkwJmxpc3RObz03MjQmdGFibGU9ZXhfYmJzX2RhdGFfZWR1Jm5hdl9jb2RlPWVkdTE2MjIxODE1MjEmY29kZT1ad0tKWGZOaWVvem8mc2VhcmNoX2l0ZW09JnNlYXJjaF9vcmRlcj0mb3JkZXJfbGlzdD0mbGlzdF9zY2FsZT0mdmlld19sZXZlbD0mdmlld19jYXRlPSZ2aWV3X2NhdGUyPQ==", "content": "* 2024-2학기 박사 논문계획서 발표 (*대상자: 2025학년도 1학기 박사학위 청구논문 공개발표자)\n등록일\n2025-01-02\n작성자\n교육학과\n조회수\n203\n교육학과 내규\n에 따라\n교육학과\n박사\n과정\n학생들 가운데 2025학년도 1\n학기에 박사학위 청구논문 공개발표를 할 학생은\n2024\n년도 2\n학기 종료일 이전까지(~25. 2. 28.까지) 반드시\n논문계획서를 발표\n해야 합니다\n.\n이에 해당 학생은\n논문계획서 발표신청서\n를 작성하여\n​기한 내\n학과사무실에 제출\n하시기 바랍니다\n.\n가. 신청 기간\n: 2025. 1. 6.(월) ~ 2025. 2. 7.(금)\n나. 발표 기간\n: 2025. 1. 21.(월) ~ 2025. 2. 28.(금) (*전공별 진행)\n다. 참고사항\n1) 발표 일정은 전공별 별도 운영이 가능하므로 구체적 일정은 반드시 지도교수님과 상의하시길 바랍니다.\n2) 발표 직후, 지도교수님과 상의하여\n결과보고서 제출\n할 것\n대학원_(박사)논문계획서 발표 신청서.hwp\n대학원_(박사)논문계획서 발표 결과보고서.hwp", "images": [], "attachments": [{"name": "대학원_(박사)논문계획서 발표 신청서.hwp", "url": "https://home.knu.ac.kr/HOME/bbs/bbs_download.php?mv_data=aWR4PTEyNTAmc3RhcnRQYWdlPTkwJmxpc3RObz03MjQmdGFibGU9ZXhfYmJzX2RhdGFfZWR1Jm5hdl9jb2RlPWVkdTE2MjIxODE1MjEmc2l0ZV9jb2RlPWVkdSZjb2RlPVp3S0pYZk5pZW96byZzZWFyY2hfaXRlbT0mc2VhcmNoX29yZGVyPSZvcmRlcl9saXN0PSZsaXN0X3NjYWxlPQ==&download=h&seq=0"}, {"name": "대학원_(박사)논문계획서 발표 결과보고서.hwp", "url": "https://home.knu.ac.kr/HOME/bbs/bbs_download.php?mv_data=aWR4PTEyNTAmc3RhcnRQYWdlPTkwJmxpc3RObz03MjQmdGFibGU9ZXhfYmJzX2RhdGFfZWR1Jm5hdl9jb2RlPWVkdTE2MjIxODE1MjEmc2l0ZV9jb2RlPWVkdSZjb2RlPVp3S0pYZk5pZW96byZzZWFyY2hfaXRlbT0mc2VhcmNoX29yZGVyPSZvcmRlcl9saXN0PSZsaXN0X3NjYWxlPQ==&download=h&seq=1"}]}
